paragraphs,tokens
"CHAPTER VIII. PASSING THE OUBLIETTE  WHO can describe the dreariness of being snowed-up all the winter with such a mother-in-law as Freiherrinn Kunigunde? Yet it was well that the snow came early, for it was the best defence of the lonely castle from any attack on the part of the Schlangenwaldern, the Swabian League, or the next heir, Freiherr Kasimir von Adlerstein Wildschloss.  The elder Baroness had, at least, the merit of a stout heart, and, even with her sadly-reduced garrison, feared none of them. She had been brought up in the faith that Adlerstein was impregnable, and so she still believed; and, if the disaster that had cut off her husband and son was to happen at all, she was glad that it had befallen before the homage had been paid.  Probably the Schlangenwald Count knew how tough a morsel the castle was like to prove, and Wildschloss was serving at a distance, for nothing was heard of either during the short interval while the roads were still open.  During this time an attempt had been made through Father Norbert to ascertain what had become of the corpses of the two Barons and their followers, and it had appeared that the Count had carried them all off from the inn, no doubt to adorn his castle with their limbs, or to present them to the Emperor in evidence of his zeal for order.  The old Baron could not indeed have been buried in consecrated ground, nor have masses said for him; but for the weal of her son’s soul Dame Kunigunde gave some of her few ornaments, and Christina added her gold earrings, and all her scanty purse, that both her husband and father might be joined in the prayers of the Church—trying with all her might to put confidence in Hugh Sorel’s Loretto relic, and the Indulgence he had bought, and trusting with more consolatory thoughts to the ever stronger dawnings of good she had watched in her own Eberhard. She had some consoling intercourse with the priest while all this was pending; but throughout the winter she was entirely cut off from every creature save the inmates of the castle, where, as far as the old lady was concerned, she only existed on sufferance, and all her meekness and gentleness could not win for her more than the barest toleration. That Eberhard had for a few hours survived his father, and that thus the Freiherrinn Christina was as much the Dowager Baroness as Kunigunde herself, was often insisted on in the kitchen by Ursel, Hatto, and the Schneiderlein, whom Christina had unconsciously rendered her most devoted servant, not only by her daily care of his wound, but by her kind courteous words, and by her giving him his proper name of Heinz, dropping the absurd _nom de guerre_ of the Schneiderlein, or little tailor, which had been originally conferred on him in allusion to the valiant Tailorling who boasted of having killed seven flies at a blow, and had been carried on chiefly because of the contradiction between such a title and his huge brawny strength and fierce courage.  Poor Eberhard, with his undaunted bravery and free reckless good-nature, a ruffian far more by education than by nature, had been much loved by his followers.  His widow would have reaped the benefit of that affection even if her exceeding sweetness had not gained it on her own account; and this giant was completely gained over to her, when, amid all her sorrow and feebleness, she never failed to minister to his sufferings to the utmost, while her questions about his original home, and revival of the name of his childhood, softened him, and awoke in him better feelings.  He would have died to serve her, and she might have headed an opposition party in the castle, had she not been quite indifferent to all save her grief; and, except by sitting above the salt at the empty table, she laid no claim to any honours or authority, and was more seldom than ever seen beyond what was now called her own room. At last, when for the second time she was seeing the snow wreaths dwindle, and the drops shine forth in moisture again, while the mountain paths were set free by the might of the springtide sun, she spoke almost for the first time with authority, as she desired Heinz to saddle her mule, and escort her to join in the Easter mass at the Blessed Friedmund’s Chapel.  Ursel heaped up objections; but so urgent was Christina for confession and for mass, that the old woman had not the heart to stop her by a warning to the elder Baroness, and took the alternative of accompanying her.  It was a glorious sparkling Easter Day, lovely blue sky above, herbage and flowers glistening below, snow dazzling in the hollows, peasants assembling in holiday garb, and all rejoicing.  Even the lonely widow, in her heavy veil and black mufflings, took hope back to her heart, and smiled when at the church door a little child came timidly up to her with a madder-tinted Easter egg—a gift once again like the happy home customs of Ulm.  She gave the child a kiss—she had nothing else to give, but the sweet face sent it away strangely glad. The festival mass in all its exultation was not fully over, when anxious faces began to be seen at the door, and whisperings went round and many passed out.  Nobody at Adlerstein was particular about silence in church, and, when the service was not in progress, voices were not even lowered, and, after many attempts on the part of the Schneiderlein to attract the attention of his mistress, his voice immediately succeeded the _Ite missa est_, “Gracious lady, we must begone.  Your mule is ready.  There is a party at the Debateable Ford, whether Schlangenwald or Wildschloss we know not yet, but either way you must be the first thing placed in safety.” Christina turned deadly pale.  She had long been ready to welcome death as a peaceful friend; but, sheltered as her girlhood had been in the quiet city, she had never been brought in contact with warfare, and her nervous, timid temperament made the thought most appalling and frightful to her, certain as she was that the old Baroness would resist to the uttermost.  Father Norbert saw her extreme terror, and, with the thought that he might comfort and support her, perhaps mediate between the contending parties, plead that it was holy-tide, and proclaim the peace of the church, or at the worst protect the lady herself, he offered his company; but, though she thanked him, it was as if she scarcely understood his kindness, and a shudder passed over her whenever the serfs, hastily summoned to augment the garrison, came hurrying down the path, or turned aside into the more rugged and shorter descents.  It was strange, the good father thought, that so timorous and fragile a being should have her lot cast amid these rugged places and scenes of violence, with no one to give her the care and cherishing she so much required. ",pass describe dreariness snow winter mother law snow defence lonely castle attack part swabian next heir elder least merit stout heart reduce garrison fear bring faith impregnable believe disaster cut husband son happen glad befall homage pay tough morsel castle prove serve distance hear short interval road open time attempt ascertain become corpse follower appear count carry inn doubt adorn castle limb present emperor evidence zeal order old bury consecrate ground mass weal son soul give few ornament add gold earring scanty purse husband father join prayer try put confidence relic buy trust more consolatory thought strong dawning watch own consol intercourse priest pend winter cut creature save inmate castle old lady concerned exist sufferance meekness gentleness win more barest toleration few hour survive father much insist kitchen render devoted servant daily care wound kind courteous word give proper name drop absurd tailor confer allusion valiant boast kill fly blow carry contradiction title huge brawny strength fierce courage poor undaunted bravery free reckless nature ruffian more education nature love follower widow reap benefit affection exceed sweetness gain own account giant gain sorrow feebleness fail minister suffering utmost question original home revival name childhood soften awoke feeling die serve head opposition party castle indifferent save grief sit salt empty table lay claim honour authority seldom call own room last second time snow wreath dwindle drop shine moisture mountain path set free might springtide sun speak first time authority desire saddle mule escort join mass blessed heap objection urgent confession mass old woman heart stop warning elder alternative accompany glorious sparkling lovely blue sky herbage flower glisten snow dazzle hollow peasant assemble holiday garb rejoicing lonely widow heavy veil black muffling hope heart smile church door child madder tint egg gift happy home custom give child kiss else give sweet face send glad festival mass exultation anxious face begin door whispering many pass particular silence church service progress voice lower many attempt part attract attention mistress voice succeed gracious lady begine mule ready party debateable way first thing place safety turn deadly pale ready welcome death peaceful friend shelter girlhood quiet city bring contact warfare nervous timid temperament thought appalling frightful certain old resist uttermost extreme terror thought comfort support mediate contend party plead holy tide proclaim peace church bad protect lady offer company thank understand kindness shudder pass serf summon augment garrison hurry path turn rugged short descent strange father timorous fragile being lot cast rugged place scene violence give care cherishing require 
"Even when she crept up the castle stairs, she was met with an angry rebuke, not so much for the peril she had incurred as for having taken away the Schneiderlein, by far the most availing among the scanty remnant of the retainers of Adlerstein.  Attempting no answer, and not even daring to ask from what quarter came the alarm, Christina made her way out of the turmoil to that chamber of her own, the scene of so much fear and sorrow, and yet of some share of peace and happiness.  But from the window, near the fast subsiding waters of the Debateable Ford, could plainly be seen the small troop of warriors, of whom Jobst the Kohler had brought immediate intelligence.  The sun glistened on their armour, and a banner floated gaily on the wind; but they were a fearful sight to the inmates of the lonely castle. A stout heart was however Kunigunde’s best endowment; and, with the steadiness and precision of a general, her commands rang out, as she arranged and armed her garrison, perfectly resolved against any submission, and confident in the strength of her castle; nay, not without a hope of revenge either against Schlangenwald or Wildschloss, whom, as a degenerate Adlerstein, she hated only less than the slayer of her husband and son. The afternoon of Easter Day however passed away without any movement on the part of the enemy, and it was not till the following day that they could be seen struggling through the ford, and preparing to ascend the mountain.  Attacks had sometimes been disconcerted by posting men in the most dangerous passes; but, in the lack of numbers, and of trustworthy commanders, the Freiherrinn had judged it wiser to trust entirely to her walls, and keep her whole force within them. The new comers could hardly have had any hostile intentions, for, though well armed and accoutred, their numbers did not exceed twenty-five.  The banner borne at their head was an azure one, with a white eagle, and their leader could be observed looking with amazement at the top of the watch-tower, where the same eagle had that morning been hoisted for the first time since the fall of the two Freiherren. So soon as the ascent had been made, the leader wound his horn, and, before the echoes had died away among the hills, Hatto, acting as seneschal, was demanding his purpose. “I am Kasimir von Adlerstein Wildschloss,” was the reply.  “I have hitherto been hindered by stress of weather from coming to take possession of my inheritance.  Admit me, that I may arrange with the widowed Frau Freiherrinn as to her dower and residence.” “The widowed Frau Freiherrinn, born of Adlerstein,” returned Hatto, “thanks the Freiherr von Adlerstein Wildschloss; but she holds the castle as guardian to the present head of the family, the Freiherr von Adlerstein.” “It is false, old man,” exclaimed the Wildschloss; “the Freiherr had no other son.” “No,” said Hatto, “but Freiherr Eberhard hath left us twin heirs, our young lords, for whom we hold this castle.” “This trifling will not serve!” sternly spoke the knight.  “Eberhard von Adlerstein died unmarried.” “Not so,” returned Hatto, “our gracious Frau Freiherrinn, the younger, was wedded to him at the last Friedmund Wake, by the special blessing of our good patron, who would not see our house extinct.” “I must see thy lady, old man,” said Sir Kasimir, impatiently, not in the least crediting the story, and believing his cousin Kunigunde quite capable of any measure that could preserve to her the rule in Schloss Adlerstein, even to erecting some passing love affair of her son’s into a marriage.  And he hardly did her injustice, for she had never made any inquiry beyond the castle into the validity of Christina’s espousals, nor sought after the friar who had performed the ceremony.  She consented to an interview with the claimant of the inheritance, and descended to the gateway for the purpose.  The court was at its cleanest, the thawing snow having newly washed away its impurities, and her proud figure, under her black hood and veil, made an imposing appearance as she stood tall and defiant in the archway. Sir Kasimir was a handsome man of about thirty, of partly Polish descent, and endowed with Slavonic grace and courtesy, and he had likewise been employed in negotiations with Burgundy, and had acquired much polish and knowledge of the world. “Lady,” he said, “I regret to disturb and intrude on a mourning family, but I am much amazed at the tidings I have heard; and I must pray of you to confirm them.” “I thought they would confound you,” composedly replied Kunigunde. “And pardon me, lady, but the Diet is very nice in requiring full proofs. I would be glad to learn what lady was chosen by my deceased cousin Eberhard.” “The lady is Christina, daughter of his esquire, Hugh Sorel, of an honourable family at Ulm.” “Ha!  I know who and what Sorel was!” exclaimed Wildschloss.  “Lady cousin, thou wouldst not stain the shield of Adlerstein with owning aught that cannot bear the examination of the Diet!” “Sir Kasimir,” said Kunigunde proudly, “had I known the truth ere my son’s death, I had strangled the girl with mine own hands!  But I learnt it only by his dying confession; and, had she been a beggar’s child, she was his wedded wife, and her babes are his lawful heirs.” “Knowest thou time—place—witnesses?” inquired Sir Kasimir. “The time, the Friedmund Wake; the place, the Friedmund Chapel,” replied the Baroness.  “Come hither, Schneiderlein.  Tell the knight thy young lord’s confession.” He bore emphatic testimony to poor Eberhard’s last words; but as to the point of who had performed the ceremony, he knew not,—his mind had not retained the name. “I must see the Frau herself,” said Wildschloss, feeling certain that such a being as he expected in a daughter of the dissolute lanzknecht Sorel would soon, by dexterous questioning, be made to expose the futility of her pretensions so flagrantly that even Kunigunde could not attempt to maintain them. For one moment Kunigunde hesitated, but suddenly a look of malignant satisfaction crossed her face.  She spoke a few words to Squinting Mätz, and then replied that Sir Kasimir should be allowed to satisfy himself, but that she could admit no one else into the castle; hers was a widow’s household, the twins were only a few hours old, and she could not open her gates to admit any person besides himself. So resolved on judging for himself was Adlerstein Wildschloss that all this did not stagger him; for, even if he had believed more than he did of the old lady’s story, there would have been no sense of intrusion or impropriety in such a visit to the mother.  Indeed, had Christina been living in the civilized world, her chamber would have been hung with black cloth, black velvet would have enveloped her up to the eyes, and the blackest of cradles would have stood ready for her fatherless babe; two steps, in honour of her baronial rank, would have led to her bed, and a beaufet with the due baronial amount of gold and silver plate would have held the comfits and caudle to be dispensed to all visitors.  As it was, the two steps built into the floor of the room, and the black hood that Ursel tied over her young mistress’s head, were the only traces that such etiquette had ever been heard of. ",creep castle stair meet angry rebuke much peril incur avail scanty remnant retainer attempt answer dare ask quarter alarm way turmoil chamber own scene much fear sorrow share peace happiness window fast subsiding water debateable small troop warrior bring immediate intelligence sun glisten armour banner float wind fearful sight inmate lonely castle stout heart endowment steadiness precision general command ring arrange arm garrison resolve submission confident strength castle hope revenge degenerate hate less slayer husband son afternoon pass movement part enemy follow day struggle ford prepare ascend mountain attack disconcert post man dangerous pass lack number trustworthy commander judge wise trust wall keep whole force new comer hostile intention armed accoutr number exceed banner borne head azure one white eagle leader observe amazement top watch tower same eagle morning hoist first time fall ascent leader wind horn echo die hill act seneschal demand purpose reply hinder stress weather possession inheritance admit arrange widow dower residence widow bear return thanks hold castle guardian present head family false old man exclaim other son leave twin heir young lord hold castle trifling serve speak knight die unmarried return gracious young wedd last special blessing patron house extinct lady old man least credit story believe cousin capable measure preserve rule erect pass love affair son marriage injustice inquiry castle validity espousal seek friar perform ceremony consent interview claimant inheritance descend gateway purpose court clean thawing snow wash impurity proud figure black hood veil impose appearance stand tall defiant archway handsome man polish descent endow slavonic grace courtesy employ negotiation acquire much polish knowledge world regret disturb intrude mourn family amazed tiding hear pray confirm confound reply pardon lady diet nice require full proof glad learn lady choose decease cousin lady daughter esquire honourable family exclaim lady cousin stain shield own aught bear examination diet truth son death strangle girl own hand learn die confession beggar child wedd wife babe lawful heir knowest time place witness inquire time place reply knight young lord confession bear emphatic testimony poor last word point perform ceremony mind retain name feel certain being expect daughter dissolute lanzknecht dexterous question expose futility pretension attempt maintain moment hesitate malignant satisfaction cross face speak few word reply allow satisfy admit else castle widow household twin few hour old open gate admit person resolve judge stagger believe more old lady story sense intrusion impropriety visit mother live civilized world chamber hang black cloth black velvet envelop eye blackest cradle stand ready fatherless babe step honour baronial rank lead bed beaufet due baronial amount gold silver plate hold comfit caudle dispens visitor step build floor room black hood tie young mistress head only trace such etiquette hear 
