paragraphs,tokens
"CHAPTER 5. ITS WALLS WERE AS OF JASPER  IN the long winter evenings, when we had the picture-books out on the floor, and sprawled together over them with elbows deep in the hearth-rug, the first business to be gone through was the process of allotment. All the characters in the pictures had to be assigned and dealt out among us, according to seniority, as far as they would go. When once that had been satisfactorily completed, the story was allowed to proceed; and thereafter, in addition to the excitement of the plot, one always possessed a personal interest in some particular member of the cast, whose successes or rebuffs one took as so much private gain or loss. For Edward this was satisfactory enough. Claiming his right of the eldest, he would annex the hero in the very frontispiece, and for the rest of the story his career, if chequered at intervals, was sure of heroic episodes and a glorious close. But his juniors, who had to put up with characters of a clay more mixed--nay, sometimes with undiluted villany--were hard put to it on occasion to defend their other selves (as it was strict etiquette to do) from ignominy perhaps only too justly merited. Edward was indeed a hopeless grabber. In the ""Buffalo-book,"" for instance (so named from the subject of its principal picture, though indeed it dealt with varied slaughter in every zone), Edward was the stalwart, bearded figure, with yellow leggings and a powder-horn, who undauntedly discharged the fatal bullet into the shoulder of the great bull bison, charging home to within a yard of his muzzle. To me was allotted the subsidiary character of the friend who had succeeded in bringing down a cow; while Harold had to be content to hold Edward's spare rifle in the background, with evident signs of uneasiness. Farther on, again, where the magnificent chamois sprang rigid into mid-air, Edward, crouched dizzily against the precipice-face, was the sportsman from whose weapon a puff of white smoke was floating away. A bare-kneed guide was all that fell to my share, while poor Harold had to take the boy with the haversack, or abandon, for this occasion at least, all Alpine ambitions. Of course the girls fared badly in this book, and it was not surprising that they preferred the ""Pilgrim's Progress"" (for instance), where women had a fair show, and there was generally enough of 'em to go round; or a good fairy story, wherein princesses met with a healthy appreciation. But indeed we were all best pleased with a picture wherein the characters just fitted us, in number, sex, and qualifications; and this, to us, stood for artistic merit. All the Christmas numbers, in their gilt frames on the nursery-wall, had been gone through and allotted long ago; and in these, sooner or later, each one of us got a chance to figure in some satisfactory and brightly coloured situation. Few of the other pictures about the house afforded equal facilities. They were generally wanting in figures, and even when these were present they lacked dramatic interest. In this picture that I have to speak about, although the characters had a stupid way of not doing anything, and apparently not wanting to do anything, there was at least a sufficiency of them; so in due course they were allotted, too. In itself the picture, which--in its ebony and tortoise-shell frame--hung in a corner of the dining-room, had hitherto possessed no special interest for us, and would probably never have been dealt with at all but for a revolt of the girls against a succession of books on sport, in which the illustrator seemed to have forgotten that there were such things as women in the world. Selina accordingly made for it one rainy morning, and announced that she was the lady seated in the centre, whose gown of rich, flowered brocade fell in such straight, severe lines to her feet, whose cloak of dark blue was held by a jewelled clasp, and whose long, fair hair was crowned with a diadem of gold and pearl. Well, we had no objection to that; it seemed fair enough, especially to Edward, who promptly proceeded to ""grab"" the armour-man who stood leaning on his shield at the lady's right hand. A dainty and delicate armour-man this! And I confess, though I knew it was all right and fair and orderly, I felt a slight pang when he passed out of my reach into Edward's possession. His armour was just the sort I wanted myself--scalloped and fluted and shimmering and spotless; and, though he was but a boy by his beardless face and golden hair, the shattered spear-shaft in his grasp proclaimed him a genuine fighter and fresh from some such agreeable work. Yes, I grudged Edward the armour-man, and when he said I could have the fellow on the other side, I hung back and said I'd think about it. This fellow had no armour nor weapons, but wore a plain jerkin with a leather pouch--a mere civilian--and with one hand he pointed to a wound in his thigh. I didn't care about him, and when Harold eagerly put in his claim I gave way and let him have the man. The cause of Harold's anxiety only came out later. It was the wound he coveted, it seemed. He wanted to have a big, sore wound of his very own, and go about and show it to people, and excite their envy or win their respect. Charlotte was only too pleased to take the child-angel seated at the lady's feet, grappling with a musical instrument much too big for her. Charlotte wanted wings badly, and, next to those, a guitar or a banjo. The angel, besides, wore an amber necklace, which took her fancy immensely. This left the picture allotted, with the exception of two or three more angels, who peeped or perched behind the main figures with a certain subdued drollery in their faces, as if the thing had gone on long enough, and it was now time to upset something or kick up a row of some sort. We knew these good folk to be saints and angels, because we had been told they were; otherwise we should never have guessed it. Angels, as we knew them in our Sunday books, were vapid, colourless, uninteresting characters, with straight up-and-down sort of figures, white nightgowns, white wings, and the same straight yellow hair parted in the middle. They were serious, even melancholy; and we had no desire to have any traffic with them. These bright bejewelled little persons, however, piquant of face and radiant of feather, were evidently hatched from quite a different egg, and we felt we might have interests in common with them. Short-nosed, shock-headed, with mouths that went up at the corners and with an evident disregard for all their fine clothes, they would be the best of good company, we felt sure, if only we could manage to get at them. One doubt alone disturbed my mind. In games requiring agility, those wings of theirs would give them a tremendous pull. Could they be trusted to play fair? I asked Selina, who replied scornfully that angels _always_ played fair. But I went back and had another look at the brown-faced one peeping over the back of the lady's chair, and still I had my doubts. ",chapter walls long winter evening picture book floor sprawl elbow deep hearth rug first business process allotment character picture assign deal accord seniority complete story allow proceed addition excitement plot possess personal interest particular member cast success rebuff much private gain loss satisfactory claim right old annex hero very frontispiece rest story career chequer interval sure heroic episode glorious close junior put character clay mix undiluted villany hard put occasion defend other selve strict etiquette ignominy merite hopeless grabber book instance name subject principal picture deal varied slaughter zone stalwart bearded figure yellow legging powder horn discharge fatal bullet shoulder great bull bison charge yard muzzle allot subsidiary character friend succeed bring cow content hold spare rifle background evident sign uneasiness magnificent chamois spring rigid crouch precipice face sportsman weapon puff white smoke float bare kneed guide fall share poor boy haversack abandon occasion least ambition course girl fare book surprising prefer instance woman fair show enough fairy story princess meet healthy appreciation pleased picture character fit number sex qualification stand artistic merit number gilt frame nursery wall allot one chance figure satisfactory coloured situation few other picture house afford equal facility want figure present lack dramatic interest picture speak character stupid way want least sufficiency due course allot picture ebony tortoise shell frame hang corner dining room possess special interest deal revolt girl succession book sport illustrator seem forget such thing woman world rainy morning announce lady seat centre gown rich flower brocade fall such straight severe line foot cloak dark blue hold jewell clasp long fair hair crown diadem gold pearl objection seem fair proceed grab armour man stand lean shield lady right hand dainty delicate armour man confess right fair orderly feel slight pang pass reach possession armour sort want scallop flute shimmer spotless boy beardless face golden hair shattered spear shaft grasp proclaim genuine fighter fresh such agreeable work grudge armour man fellow other side hang fellow armour weapon wear plain jerkin leather pouch mere civilian hand point wound thigh care put claim give way let man cause anxiety wound covete seem want big sore wound own show person excite envy win respect pleased child angel seat lady foot grapple musical instrument big want wing guitar banjo angel wear amber necklace fancy leave picture allot exception more angel peep perch main figure certain subdued drollery face thing time upset kick row sort folk saint angel guess angel book vapid colourless uninteresting character straight sort figure white nightgown white wing same straight yellow hair part middle serious melancholy desire traffic bright bejewell person piquant face radiant feather hatch different egg feel interest common short nosed shock headed mouth corner evident disregard fine clothes company feel sure manage doubt disturb mind game require agility wing give tremendous pull trust play fair ask reply angel play fair brown face one peep back lady chair doubt 
"When Edward went off to school a great deal of adjustment and re-allotment took place, and all the heroes of illustrated literature were at my call, did I choose to possess them. In this particular case, however, I made no haste to seize upon the armour-man. Perhaps it was because I wanted a _fresh_ saint of my own, not a stale saint that Edward had been for so long a time. Perhaps it was rather that, ever since I had elected to be saintless, I had got into the habit of strolling off into the background, and amusing myself with what I found there. A very fascinating background it was, and held a great deal, though so tiny. Meadowland came first, set with flowers, blue and red, like gems. Then a white road ran, with wilful, uncalled-for loops, up a steep, conical hill, crowned with towers, bastioned walls, and belfries; and down the road the little knights came riding, two and two. The hill on one side descended to water, tranquil, far-reaching, and blue; and a very curly ship lay at anchor, with one mast having an odd sort of crow's-nest at the top of it. There was plenty to do in this pleasant land. The annoying thing about it was, one could never penetrate beyond a certain point. I might wander up that road as often as I liked, I was bound to be brought up at the gateway, the funny galleried, top-heavy gateway, of the little walled town. Inside, doubtless, there were high jinks going on; but the password was denied to me. I could get on board a boat and row up as far as the curly ship, but around the headland I might not go. On the other side, of a surety, the shipping lay thick. The merchants walked on the quay, and the sailors sang as they swung out the corded bales. But as for me, I must stay down in the meadow, and imagine it all as best I could. Once I broached the subject to Charlotte, and found, to my surprise, that she had had the same joys and encountered the same disappointments in this delectable country. She, too, had walked up that road and flattened her nose against that portcullis; and she pointed out something that I had overlooked--to wit, that if you rowed off in a boat to the curly ship, and got hold of a rope, and clambered aboard of her, and swarmed up the mast, and got into the crow's-nest, you could just see over the headland, and take in at your ease the life and bustle of the port. She proceeded to describe all the fun that was going on there, at such length and with so much particularity that I looked at her suspiciously. ""Why, you talk as if you'd been in that crow's-nest yourself!"" I said. Charlotte answered nothing, but pursed her mouth up and nodded violently for some minutes; and I could get nothing more out of her. I felt rather hurt. Evidently she had managed, somehow or other, to get up into that crow's-nest. Charlotte had got ahead of me on this occasion. It was necessary, no doubt, that grown-up people should dress themselves up and go forth to pay calls. I don't mean that we saw any sense in the practice. It would have been so much more reasonable to stay at home in your old clothes and play. But we recognised that these folk had to do many unaccountable things, and after all it was _their_ life, and not ours, and we were not in a position to criticise. Besides, they had many habits more objectionable than this one, which to us generally meant a free and untrammelled afternoon, wherein to play the devil in our own way. The case was different, however, when the press-gang was abroad, when prayers and excuses were alike disregarded, and we were forced into the service, like native levies impelled toward the foe less by the inherent righteousness of the cause than by the indisputable rifles of their white allies. This was unpardonable and altogether detestable. Still, the thing happened, now and again; and when it did, there was no arguing about it. The order was for the front, and we just had to shut up and march. Selina, to be sure, had a sneaking fondness for dressing up and paying calls, though she pretended to dislike it, just to keep on the soft side of public opinion. So I thought it extremely mean in her to have the earache on that particular afternoon when Aunt Eliza ordered the pony-carriage and went on the war-path. I was ordered also, in the same breath as the pony-carriage; and, as we eventually trundled off, it seemed to me that the utter waste of that afternoon, for which I had planned so much, could never be made up nor atoned for in all the tremendous stretch of years that still lay before me. The house that we were bound for on this occasion was a ""big house;"" a generic title applied by us to the class of residence that had a long carriage-drive through rhododendrons; and a portico propped by fluted pillars; and a grave butler who bolted back swing-doors, and came down steps, and pretended to have entirely forgotten his familiar intercourse with you at less serious moments; and a big hall, where no boots or shoes or upper garments were allowed to lie about frankly and easily, as with us; and where, finally, people were apt to sit about dressed up as if they were going on to a party. The lady who received us was effusive to Aunt Eliza and hollowly gracious to me. In ten seconds they had their heads together and were hard at it talking _clothes_. I was left high and dry on a straight-backed chair, longing to kick the legs of it, yet not daring. For a time I was content to stare; there was lots to stare at, high and low and around. Then the inevitable fidgets came on, and scratching one's legs mitigated slightly, but did not entirely disperse them. My two warders were still deep in clothes; I slipped off my chair and edged cautiously around the room, exploring, examining, recording. Many strange, fine things lay along my route--pictures and gimcracks on the walls, trinkets and globular old watches and snuff-boxes on the tables; and I took good care to finger everything within reach thoroughly and conscientiously. Some articles, in addition, I smelt. At last in my orbit I happened on an open door, half concealed by the folds of a curtain. I glanced carefully around. They were still deep in clothes, both talking together, and I slipped through. ",school great deal adjustment place hero illustrate literature call choose possess particular case haste seize armour man want saint own stale saint long time elect saintless habit stroll background amusing find fascinating background hold great deal tiny set flower blue red gem white road run wilful uncalled loop steep conical hill crown tower bastion wall belfry road knight ride hill side descend water tranquil reach blue curly ship lay anchor mast odd sort crow nest top plenty pleasant land annoying thing penetrate certain point wander road like bind bring gateway funny galleried top heavy gateway wall town high jink password deny board boat row curly ship headland other side surety shipping lay thick merchant walk quay sailor sing swing cord bale stay meadow imagine broach subject find surprise same joy encounter same disappointment delectable country walk road flateen nose portcullis point overlook wit row boat curly ship hold rope clamber swarm mast crow nest headland ease life bustle port proceed describe fun such length much particularity talk crow nest answer purse mouth nod minute feel hurt manage other crow nest occasion necessary grow person dress pay call mean sense practice reasonable stay home old clothes play recognise folk many unaccountable thing life position criticise many habit objectionable one mean free untrammelled afternoon play devil own way case different press gang prayer excuse disregard force service native levy impell foe less inherent righteousness cause indisputable rifle white ally unpardonable detestable thing happen argue order front shut march sure sneak fondness dress pay call pretend dislike keep soft side public opinion mean earache particular afternoon order pony carriage war path order same breath pony carriage trundle seem utter waste afternoon plan much aton tremendous stretch year lay house bind occasion big house generic title apply class residence long carriage drive rhododendron portico proppe flute pillar grave butler bolt swing door step pretend forget familiar intercourse serious moment big hall boot shoe upper garment allow lie person apt sit dress party lady receive effusive gracious second head hard talk leave high dry straight back chair long kick leg dare time content stare lot stare high low inevitable fidget scratch leg mitigate disperse warder deep clothes slip chair edged room explore examine record many strange fine thing lay route picture gimcrack wall trinket globular old watch snuff box table care finger reach article addition smell last orbit happen open door half conceal fold curtain glance deep clothes talk slip 
