paragraphs,tokens
"CHAPTER II. THE GRAND FEAST.   She gave them some tea without any bread,   She whipp'd them all soundly, and sent them to bed.                                          Nursery Rhymes.  Lady Harriet Graham was an extremely thin, delicate, old lady, with a very pale face, and a sweet gentle voice, which the children delighted to hear, for it always spoke kindly to them, and sounded like music, after the loud, rough tones of Mrs. Crabtree. She wore her own grey hair, which had become almost as white as the widow's cap which covered her head. The rest of her dress was generally black velvet, and she usually sat in a comfortable arm-chair by the fire-side, watching her grandchildren at play, with a large work-bag by her side, and a prodigious Bible open on the table before her. Lady Harriet often said that it made her young again to see the joyous gambols of Harry and Laura; and when unable any longer to bear their noise, she sometimes kept them quiet, by telling the most delightful stories about what had happened to herself when she was young. Once upon a time, however, Lady Harriet suddenly became so very ill, that Dr. Bell said she must spend a few days in the country, for change of air, and accordingly she determined on passing a quiet week at Holiday House with her relations, Lord and Lady Rockville. Meanwhile, Harry and Laura were to be left under the sole care of Mrs. Crabtree, so it might have been expected that they would both feel more frightened for her, now that she was reigning monarch of the house, than ever. Harry would obey those he loved, if they only held up a little finger; but all the terrors of Mrs. Crabtree, and her cat-o'-nine-tails, were generally forgotten soon after she left the room; therefore he thought little at first about the many threats she held out, if he behaved ill, but he listened most seriously when his dear sick grandmama told him, in a faint weak voice, on the day of her departure from home, how very well he ought to behave in her absence, as no one remained but the maids to keep him in order, and that she hoped Mrs. Crabtree would write her a letter full of good news about his excellent conduct. Harry felt as if he would gladly sit still without stirring, till his grandmama came back, if that could only please her; and there never was any one more determined to be a good boy than he, at the moment when Lady Harriet's carriage came round to the door. Laura, Frank, and Harry helped to carry all the pillows, boxes, books, and baskets which were necessary for the journey, of which there seemed to be about fifty; then they arranged the cushions as comfortably as possible, and watched very sorrowfully when their grandmama, after kindly embracing them both, was carefully supported by Major Graham and her maid Harrison, into the chariot. Uncle David gave each of the children a pretty picture-book before taking leave, and said, as he was stepping into the carriage, ""Now, children! I have only one piece of serious, important advice to give you all, so attend to me!--never crack nuts with your teeth!"" When the carriage had driven off, Mrs. Crabtree became so busy scolding Betty, and storming at Jack the foot-boy, for not cleaning her shoes well enough, that she left Harry and Laura standing in the passage, not knowing exactly what they ought to do first, and Frank, seeing them looking rather melancholy and bewildered at the loss of their grandmama, stopped a moment as he passed on the way to school, and said in a very kind, affectionate voice, ""Now, Harry and Laura, listen both of you!--here is a grand opportunity to show everybody, that we can be trusted to ourselves, without getting into any scrapes, so that if grandmama is ever ill again, and obliged to go away, she need not feel so sad and anxious as she did to-day. I mean to become nine times more attentive to my lessons than usual this morning, to show how trust-worthy we are, and if you are wise, pray march straight up to the nursery yourselves. I have arranged a gown and cap of Mrs. Crabtree's on the large arm-chair, to look as like herself as possible, that you may be reminded how soon she will come back, and you must not behave like the mice when the cat is out. Good bye! Say the alphabet backward, and count your fingers for half-an-hour, but when Mrs. Crabtree appears again, pray do not jump out of the window for joy."" Harry and Laura were proceeding directly towards the nursery, as Frank had recommended, when unluckily they observed in passing the drawing-room door, that it was wide open; so Harry peeped in, and they began idly wandering round the tables and cabinets. Not ten minutes elapsed before they both commenced racing about as if they were mad, perfectly screaming with joy, and laughing so loudly at their own funny tricks, that an old gentleman who lived next door, very nearly sent in a message to ask what the joke was. Presently Harry and Laura ran up and down stairs till the housemaid was quite fatigued with running after them. They jumped upon the fine damask sofas in the drawing-room, stirred the fire till it was in a blaze, and rushed out on the balcony, upsetting one or two geraniums and a myrtle. They spilt Lady Harriet's perfumes over their handkerchiefs,--they looked into all the beautiful books of pictures,--they tumbled many of the pretty Dresden china figures on the floor,--they wound up the little French clock till it was broken,--they made the musical work-box play its tunes, and set the Chinese mandarins nodding, till they very nearly nodded their heads off. In short, so much mischief has seldom been done in so short a time, till at last Harry, perfectly worn out with laughing and running, threw himself into a large arm-chair, and Laura, with her ringlets tumbling in frightful confusion over her face, and the beads of her coral necklace rolling on the floor, tossed herself into a sofa beside him. ""Oh! what fun!"" cried Harry, in an ecstacy of delight; ""I wish Frank had been here, and crowds of little boys and girls, to play with us all day! It would be a good joke, Laura, to write and ask all our little cousins and companions to drink tea here to-morrow evening! Their mamas could never guess we had not leave from grandmama to invite everybody, so I dare say we might gather quite a large party! oh! how enchanting!"" Laura laughed heartily when she heard this proposal of Harry's, and without hesitating a moment about it, she joyously placed herself before Lady Harriet's writing-table, and scribbled a multitude of little notes, in large text, to more than twenty young friends, all of whom had at other times been asked by Lady Harriet to spend the evening with her. ",grand feast give tea bread would send bed nursery rhymes thin delicate old lady pale face sweet gentle voice child delight hear speak sound music loud rough tone wear own grey hair become white widow cap cover head rest dress black velvet sit comfortable arm chair fire side watch grandchild play large work bag side prodigious open table young joyous gambol unable bear noise keep quiet delightful story happen young time become ill spend few day country change air determine pass quiet week relation leave sole care expect feel frighten reign monarch house obey love hold finger terror cat tail forget leave room first many threat hold behave ill listen dear sick grandmama faint weak voice day departure home behave absence remain maid keep order hope write letter full news excellent conduct feel sit stir grandmama please one determined boy moment carriage door help carry pillow box book basket necessary journey seem arrange cushion possible watch grandmama embrace support maid chariot give child pretty picture book leave step carriage child piece serious important advice give attend crack nut tooth carriage drive become busy scold storm foot boy clean shoe leave stand passage melancholy bewilder loss grandmama stop moment pass way school kind affectionate voice listen grand opportunity show trust scrape grandmama ill oblige feel sad anxious day mean become time attentive lesson usual morning show trust worthy wise pray nursery arrange gown cap large arm chair possible remind behave mouse cat bye alphabet count finger half hour appear pray jump window joy proceed nursery recommend observe pass draw room door wide open peep begin wonder table cabinet minute elapse commence racing mad scream joy laugh own funny trick old gentleman live next door send message ask joke run stair housemaid fatigued run jump fine damask sofa draw room stirr fire blaze rush balcony upsetting geranium myrtle spilt perfume handkerchief beautiful book picture tumble many pretty china figure floor wind french clock break musical work box play tune set chinese mandarin nodd nod head short much mischief short time last wear laugh run throw large arm chair ringlet tumble frightful confusion face bead coral necklace roll floor toss sofa fun cry ecstacy delight wish crowd boy girl play day joke write ask cousin companion drink tea evening mama guess leave grandmama invite gather large party enchanting laugh hear proposal hesitate moment place writing table scribble multitude note large text more young friend other time ask spend evening 
"Laura felt very much puzzled to know what was usually said in a card of invitation, but after many consultations, she and Harry thought at last, that it was very nicely expressed, for they wrote these words upon a large sheet of paper to each of their friends:-- Master Harry Graham and Miss Laura wish you to have the honour of drinking tea with us to-morrow, at six o'clock.     (Signed) Harry and Laura. Laura afterwards singed a hole in her muslin frock, while lighting one of the Vesta matches to seal these numerous notes; and Harry dropped some burning sealing-wax on his hand, in the hurry of assisting her; but he thought that little accident no matter, and ran away to see if the cards could be sent off immediately. Now, there lived in the house a very old footman, called Andrew, who remembered Harry and Laura since they were quite little babies; and he often looked exceedingly sad and sorry when they suffered punishment from Mrs. Crabtree. He was ready to do anything in the world when it pleased the children, and would have carried a message to the moon, if they had only shown him the way. Many odd jobs and private messages he had already been employed in by Harry, who now called Andrew up stairs, entreating him to carry out all those absurd notes as fast as possible, and to deliver them immediately, as they were of the greatest consequence. Upon hearing this, old Andrew lost not a moment, but threw on his hat, and instantly started off, looking like the twopenny postman, he carried such a prodigious parcel of invitations, while Harry and Laura stood at the drawing-room window, almost screaming with joy when they saw him set out, and when they observed that, to oblige them, he actually ran along the street at a sort of trot, which was as fast as he could possibly go. Presently, however, he certainly did stop for a single minute, and Laura saw that it was in order to take a peep into one of the notes, that he might ascertain what they were all about; but as he never carried any letters without doing so, she thought that quite natural, and was only very glad when he had finished, and rapidly pursued his way again. Next morning, Mrs. Crabtree and Betty became very much surprised to observe what a number of smart livery servants knocked at the street door, and gave in cards, but their astonishment became still greater, when old Andrew brought up a whole parcel of them to Harry and Laura, who immediately broke the seals, and read the contents in a corner together. ""What are you about there, Master Graham?"" cried Mrs. Crabtree, angrily, ""how dare any body venture to touch your grandmama's letters?"" ""They are not for grandmama!--they are all for us!--every one of them!"" answered Harry, dancing about the room with joy, and waving the notes over his head. ""Look at this direction! For Master and Miss Graham! put on your spectacles, and read it yourself, Mrs. Crabtree! What delightful fun! the house will be as full as an egg!"" Mrs. Crabtree seemed completely puzzled what to think of all this, and looked so much as if she did not know exactly what to be angry at, and so ready to be in a passion if possible, that Harry burst out a laughing, while he said, ""Only think Mrs. Crabtree! here is every body coming to tea with us!--all my cousins, besides Peter Grey, Robert Stewart, Charles Forrester, Adelaide Cunninghame, Diana Wentworth, John Fordyce, Edmund Ashford, Frank Abercromby, Ned Russel, and Tom ----"" ""The boy is distracted!"" exclaimed Betty, staring with astonishment. ""What does all this mean, Master Harry?"" ""And who gave you leave to invite company into your grandmama's house?"" cried Mrs. Crabtree, snatching up all the notes, and angrily thrusting them into the fire. ""I never heard of such things in all my life before, Master Harry! but as sure as eggs is eggs, you shall repent of this, for not one morsel of cake, or anything else shall you have to give any of the party; no! not so much as a crust of bread, or a thimbleful of tea!"" Harry and Laura had never thought of such a catastrophe as this before; they always saw a great table covered with every thing that could be named for tea, whenever their little friends came to visit them, and whether it rose out of the floor, or was brought by Aladdin's lamp, they never considered it possible that the table would not be provided as usual on such occasions, so this terrible speech of Mrs. Crabtree's frightened them out of their wits. What was to be done! They both knew by experience that she always did whatever she threatened, or something a great deal worse, so they began by bursting into tears, and begging Mrs. Crabtree for this once to excuse them, and to give some cakes and tea to their little visitors, but they might as well have spoken to one of the Chinese mandarins, for she only shook her head, with a positive look, declaring over and over again that nothing should appear upon the table except what was always brought up for their own supper--two biscuits and two cups of milk. ""Therefore say no more about it!"" added she, sternly. ""I am your best friend, Master Harry, trying to teach you and Miss Laura your duty, so save your breath to cool your porridge."" Poor Harry and Laura looked perfectly ill with fright and vexation when they thought of what was to happen next, while Mrs. Crabtree sat down to her knitting, grumbling to herself, and dropping her stitches every minute with rage and irritation. Old Andrew felt exceedingly sorry after he heard what distress and difficulty Harry was in, and when the hour for the party approached, he very good-naturedly spread out a large table in the dining-room, where he put down as many cups, saucers, plates, and spoons as Laura chose to direct; but in spite of all his trouble, though it looked very grand, there was nothing whatever to eat or drink, except the two dry biscuits, and the two miserable cups of milk, which seemed to become smaller every time that Harry looked at them. Presently the clock struck six, and Harry listened to the hour very much as a prisoner would do in the condemned cell in Newgate, feeling that the dreaded time was at last arrived. Soon afterwards, several handsome carriages drove up to the door filled with little Masters and Misses, who hurried joyfully into the house, talking and laughing all the way up stairs, being evidently quite happy at coming out to tea, while poor Harry and Laura almost wished the floor would open and swallow them up, so they shrunk into a distant corner of the room, quite ashamed to show their faces. The young ladies were all dressed in their best frocks, with pink sashes, and pink shoes; while the little boys appeared in their holiday clothes, with their hair newly brushed, and their faces washed. The whole party had dined at two o'clock, so they were as hungry as hawks, looking eagerly round, whenever they entered, to see what was on the tea-table, and evidently surprised that nothing had yet been put down. Laura and Harry soon afterwards heard their visitors whispering to each other about Norwich buns, rice cakes, spunge biscuits, and maccaroons; while Peter Grey was loud in praise of a party at George Lorraine's the night before, where an immense plum-cake had been sugared over like a snow storm, and covered with crowds of beautiful amusing mottoes; not to mention a quantity of noisy crackers, that exploded like pistols; besides which, a glass of hot jelly had been handed to each little guest before he was sent home. ",feel puzzled card invitation many consultation last express write word large sheet paper friend master wish honour drink tea sign sing hole muslin frock light match seal numerous note drop burning sealing wax hand hurry assist accident matter run card send live house old footman call remember baby sad sorry suffer punishment ready world pleased child carry message moon show way many odd job private message employ call stair entreat carry absurd note possible deliver great consequence hear old lose moment throw hat start twopenny postman carry prodigious parcel invitation stand draw room window scream joy set observe oblige run street sort trot fast stop single minute order peep note ascertain carry letter natural glad finish pursue way next morning become surprised observe number smart livery servant knock street door give card astonishment become great old bring whole parcel break seal read content corner cry dare body venture touch grandmama letter grandmama answer dance room joy wave note head direction master put spectacle read delightful fun house full egg seem puzzled angry ready passion possible burst laugh body tea cousin boy distract exclaim stare astonishment mean give leave invite company grandmama house cry snatch note thrust fire hear such thing life sure egg egg repent morsel cake else give party much crust bread thimbleful tea catastrophe great table cover thing name tea friend visit rise floor bring lamp consider possible table provide usual such occasion terrible speech frighten wit experience threaten great deal bad begin burst tear begg excuse give cake tea visitor speak chinese mandarin shake head positive declare appear table bring own supper biscuit cup milk more add friend try teach miss duty save breath cool porridge poor ill fright vexation happen sit knitting grumble drop stitche minute rage irritation old feel sorry hear distress difficulty hour party approach spread large table dining room put many cup saucer plate spoon choose direct spite trouble grand eat drink dry biscuit miserable cup milk seem become small time clock strike listen hour prisoner condemn cell feel dread time last arrive several handsome carriage drive door fill hurry house talk laugh way stair happy tea poor wish floor open swallow shrink distant corner room ashamed show face young lady dress frock pink sashe pink shoe boy appear holiday clothes hair brush face wash whole party dine hungry hawk enter tea table surprise put hear visitor whisper other bun rice cake spunge biscuit maccaroon loud praise party night immense plum cake sugare snow storm cover crowd beautiful amusing mottoe mention quantity noisy cracker explode pistol glass hot jelly hand guest send 
