paragraphs,tokens
"CHAPTER VIII. MADAM HOW'S TWO GRANDSONS  You want to know, then, what chalk is?  I suppose you mean what chalk is made of? That we can only help by calling in the help of a very great giant whose name is Analysis. A giant? Yes.  And before we call for him I will tell you a very curious story about him and his younger brother, which is every word of it true. Once upon a time, certainly as long ago as the first man, or perhaps the first rational being of any kind, was created, Madam How had two grandsons.  The elder is called Analysis, and the younger Synthesis.  As for who their father and mother were, there have been so many disputes on that question that I think children may leave it alone for the present. For my part, I believe that they are both, like St. Patrick, ""gentlemen, and come of decent people;"" and I have a great respect and affection for them both, as long as each keeps in his own place and minds his own business. Now you must understand that, as soon as these two baby giants were born, Lady Why, who sets everything to do that work for which it is exactly fitted, set both of them their work.  Analysis was to take to pieces everything he found, and find out how it was made.  Synthesis was to put the pieces together again, and make something fresh out of them.  In a word, Analysis was to teach men Science; and Synthesis to teach them Art. But because Analysis was the elder, Madam How commanded Synthesis never to put the pieces together till Analysis had taken them completely apart. And, my child, if Synthesis had obeyed that rule of his good old grandmother's, the world would have been far happier, wealthier, wiser, and better than it is now. But Synthesis would not.  He grew up a very noble boy.  He could carve, he could paint, he could build, he could make music, and write poems: but he was full of conceit and haste.  Whenever his elder brother tried to do a little patient work in taking things to pieces, Synthesis snatched the work out of his hands before it was a quarter done, and began putting it together again to suit his own fancy, and, of course, put it together wrong.  Then he went on to bully his elder brother, and locked him up in prison, and starved him, till for many hundred years poor Analysis never grew at all, but remained dwarfed, and stupid, and all but blind for want of light; while Synthesis, and all the hasty conceited people who followed him, grew stout and strong and tyrannous, and overspread the whole world, and ruled it at their will.  But the fault of all the work of Synthesis was just this: that it would not work.  His watches would not keep time, his soldiers would not fight, his ships would not sail, his houses would not keep the rain out.  So every time he failed in his work he had to go to poor Analysis in his dungeon, and bully him into taking a thing or two to pieces, and giving him a few sound facts out of them, just to go on with till he came to grief again, boasting in the meantime that he and not Analysis had found out the facts.  And at last he grew so conceited that he fancied he knew all that Madam How could teach him, or Lady Why either, and that he understood all things in heaven and earth; while it was not the real heaven and earth that he was thinking of, but a sham heaven and a sham earth, which he had built up out of his guesses and his own fancies. And the more Synthesis waxed in pride, and the more he trampled upon his poor brother, the more reckless he grew, and the more willing to deceive himself.  If his real flowers would not grow, he cut out paper flowers, and painted them and said that they would do just as well as natural ones.  If his dolls would not work, he put strings and wires behind them to make them nod their heads and open their eyes, and then persuaded other people, and perhaps half-persuaded himself, that they were alive. If the hand of his weather-glass went down, he nailed it up to insure a fine day, and tortured, burnt, or murdered every one who said it did not keep up of itself.  And many other foolish and wicked things he did, which little boys need not hear of yet. But at last his punishment came, according to the laws of his grandmother, Madam How, which are like the laws of the Medes and Persians, and alter not, as you and all mankind will sooner or later find; for he grew so rich and powerful that he grew careless and lazy, and thought about nothing but eating and drinking, till people began to despise him more and more.  And one day he left the dungeon of Analysis so ill guarded, that Analysis got out and ran away.  Great was the hue and cry after him; and terribly would he have been punished had he been caught.  But, lo and behold, folks had grown so disgusted with Synthesis that they began to take the part of Analysis.  Poor men hid him in their cottages, and scholars in their studies.  And when war arose about him,--and terrible wars did arise,--good kings, wise statesmen, gallant soldiers, spent their treasure and their lives in fighting for him.  All honest folk welcomed him, because he was honest; and all wise folk used him, for, instead of being a conceited tyrant like Synthesis, he showed himself the most faithful, diligent, humble of servants, ready to do every man's work, and answer every man's questions.  And among them all he got so well fed that he grew very shortly into the giant that he ought to have been all along; and was, and will be for many a year to come, perfectly able to take care of himself. As for poor Synthesis, he really has fallen so low in these days, that one cannot but pity him.  He now goes about humbly after his brother, feeding on any scraps that are thrown to him, and is snubbed and rapped over the knuckles, and told one minute to hold his tongue and mind his own business, and the next that he has no business at all to mind, till he has got into such a poor way that some folks fancy he will die, and are actually digging his grave already, and composing his epitaph.  But they are trying to wear the bear's skin before the bear is killed; for Synthesis is not dead, nor anything like it; and he will rise up again some day, to make good friends with his brother Analysis, and by his help do nobler and more beautiful work than he has ever yet done in the world. So now Analysis has got the upper hand; so much so that he is in danger of being spoilt by too much prosperity, as his brother was before him; in which case he too will have his fall; and a great deal of good it will do him.  And that is the end of my story, and a true story it is. ",madam grandson want chalk suppose mean chalk help call help great giant name analysis giant call curious story young brother word true time first man first rational being kind create grandson elder call young synthesis father mother many dispute question child leave present part believe gentleman decent person great respect affection keep own place mind own business understand baby giant bear set work fit set work analysis piece find find synthesis put piece fresh word analysis teach man synthesis teach art analysis elder command put piece analysis child obey rule old grandmother world happy wealthy wise synthesis grow noble boy carve paint build music write poem full conceit haste elder brother try patient work thing piece snatch work hand quarter begin put suit own fancy course put wrong bully elder brother lock prison starve many year poor analysis grow remain dwarf stupid blind want light hasty conceited person follow grow stout strong tyrannous overspread whole world rule will fault work work watch keep time soldier fight ship sail house keep rain time fail work poor analysis dungeon bully thing piece give few sound fact grief boast meantime analysis find fact last grow conceited fancy teach understand thing heaven earth real heaven earth sham heaven sham earth build guesse own fancy more synthesis wax pride trample poor brother reckless grow willing deceive real flower grow cut paper flower paint natural one doll work put string wire nod head open eye persuade other person half persuade alive hand weather glass nail insure fine day torture burn murder one keep many other foolish wicked thing boy hear last punishment accord law grandmother law alter mankind find grow rich powerful grow careless lazy eat drinking person begin despise more more day leave dungeon ill guard run great hue cry punish catch folk grow disgusted synthesis begin part analysis poor man hide cottage scholar study war arise terrible war arise king wise statesmen gallant soldier spend treasure life fight honest folk welcome honest wise folk use conceited tyrant show faithful diligent humble servant ready man work answer man question feed grow giant many year able care poor synthesis fall low day pity brother feed scrap throw snubb rapp knuckle minute hold tongue mind own business next business mind poor way folk fancy die digg grave compose epitaph try wear bear skin bear kill synthesis dead rise day friend brother help noble beautiful work world analysis upper hand danger spoil much prosperity brother case fall great deal end story true story 
"Now you must remember, whenever you have to do with him, that Analysis, like fire, is a very good servant, but a very bad master.  For, having got his freedom only of late years or so, he is, like young men when they come suddenly to be their own masters, apt to be conceited, and to fancy that he knows everything, when really he knows nothing, and can never know anything, but only knows about things, which is a very different matter.  Indeed, nowadays he pretends that he can teach his old grandmother, Madam How, not only how to suck eggs, but to make eggs into the bargain; while the good old lady just laughs at him kindly, and lets him run on, because she knows he will grow wiser in time, and learn humility by his mistakes and failures, as I hope you will from yours. However, Analysis is a very clever young giant, and can do wonderful work as long as he meddles only with dead things, like this bit of lime.  He can take it to pieces, and tell you of what things it is made, or seems to be made; and take them to pieces again, and tell you what each of them is made of; and so on, till he gets conceited, and fancies that he can find out some one Thing of all things (which he calls matter), of which all other things are made; and some Way of all ways (which he calls force), by which all things are made: but when he boasts in that way, old Madam How smiles, and says, ""My child, before you can say that, you must remember a hundred things which you are forgetting, and learn a hundred thousand things which you do not know;"" and then she just puts her hand over his eyes, and Master Analysis begins groping in the dark, and talking the saddest nonsense.  So beware of him, and keep him in his own place, and to his own work, or he will flatter you, and get the mastery of you, and persuade you that he can teach you a thousand things of which he knows no more than he does why a duck's egg never hatches into a chicken.  And remember, if Master Analysis ever grows saucy and conceited with you, just ask him that last riddle, and you will shut him up at once. Because Analysis can only explain to you a little about dead things, like stones--inorganic things as they are called.  Living things--organisms, as they are called--he cannot explain to you at all.  When he meddles with them, he always ends like the man who killed his goose to get the golden eggs.  He has to kill his goose, or his flower, or his insect, before he can analyse it; and then it is not a goose, but only the corpse of a goose; not a flower, but only the dead stuff of the flower. And therefore he will never do anything but fail, when he tries to find out the life in things.  How can he, when he has to take the life out of them first?  He could not even find out how a plum-pudding is made by merely analysing it.  He might part the sugar, and the flour, and the suet; he might even (for he is very clever, and very patient too, the more honour to him) take every atom of sugar out of the flour with which it had got mixed, and every atom of brown colour which had got out of the plums and currants into the body of the pudding, and then, for aught I know, put the colouring matter back again into the plums and currants; and then, for aught I know, turn the boiled pudding into a raw one again,--for he is a great conjurer, as Madam How's grandson is bound to be: but yet he would never find out how the pudding was made, unless some one told him the great secret which the sailors in the old story forgot--that the cook boiled it in a cloth. This is Analysis's weak point--don't let it be yours--that in all his calculations he is apt to forget the cloth, and indeed the cook likewise. No doubt he can analyse the matter of things: but he will keep forgetting that he cannot analyse their form. Do I mean their shape? No, my child; no.  I mean something which makes the shape of things, and the matter of them likewise, but which folks have lost sight of nowadays, and do not seem likely to get sight of again for a few hundred years.  So I suppose that you need not trouble your head about it, but may just follow the fashions as long as they last. About this piece of lime, however, Analysis can tell us a great deal.  And we may trust what he says, and believe that he understands what he says. Think now.  If you took your watch to pieces, you would probably spoil it for ever; you would have perhaps broken, and certainly mislaid, some of the bits; and not even a watchmaker could put it together again.  You would have analysed the watch wrongly.  But if a watchmaker took it to pieces then any other watchmaker could put it together again to go as well as ever, because they both understand the works, how they fit into each other, and what the use and the power of each is.  Its being put together again rightly would be a proof that it had been taken to pieces rightly. And so with Master Analysis.  If he can take a thing to pieces so that his brother Synthesis can put it together again, you may be sure that he has done his work rightly. Now he can take a bit of chalk to pieces, so that it shall become several different things, none of which is chalk, or like chalk at all.  And then his brother Synthesis can put them together again, so that they shall become chalk, as they were before.  He can do that very nearly, but not quite.  There is, in every average piece of chalk, something which he cannot make into chalk again when he has once unmade it. What that is I will show you presently; and a wonderful tale hangs thereby.  But first we will let Analysis tell us what chalk is made of, as far as he knows. He will say--Chalk is carbonate of lime. But what is carbonate of lime made of? Lime and carbonic acid. And what is lime? The oxide of a certain metal, called calcium. What do you mean? That quicklime is a certain metal mixed with oxygen gas; and slacked lime is the same, mixed with water. So lime is a metal.  What is a metal?  Nobody knows. And what is oxygen gas?  Nobody knows. Well, Analysis, stops short very soon.  He does not seem to know much about the matter. Nay, nay, you are wrong there.  It is just ""about the matter"" that he does know, and knows a great deal, and very accurately; what he does not know is the matter itself.  He will tell you wonderful things about oxygen gas--how the air is full of it, the water full of it, every living thing full of it; how it changes hard bright steel into soft, foul rust; how a candle cannot burn without it, or you live without it.  But what it is he knows not. Will he ever know? That is Lady Why's concern, and not ours.  Meanwhile he has a right to find out if he can.  But what do you want to ask him next? What?  Oh!  What carbonic acid is.  He can tell you that.  Carbon and oxygen gas. But what is carbon? Nobody knows. Why, here is this stupid Analysis at fault again. Nay, nay, again.  Be patient with him.  If he cannot tell you what carbon is, he can tell you what is carbon, which is well worth knowing.  He will tell you, for instance, that every time you breathe or speak, what comes out of your mouth is carbonic acid; and that, if your breath comes on a bit of slacked lime, it will begin to turn it back into the chalk from which it was made; and that, if your breath comes on the leaves of a growing plant, that leaf will take the carbon out of it, and turn it into wood.  And surely that is worth knowing,--that you may be helping to make chalk, or to make wood, every time you breathe. ",remember analysis fire servant bad master freedom late year young man own master apt conceited fancy thing different matter pretend teach old grandmother suck egg egg bargain old lady laugh let run grow wise time learn humility mistake failure hope analysis clever young giant wonderful work meddle dead thing bit lime piece thing seem piece conceited fancy find thing thing call matter other thing way way call force thing boast way old smile child remember thing forget learn thing put hand eye master begin grope dark talk saddest nonsense beware keep own place own work flatter mastery persuade teach thing more duck egg hatch chicken remember master analysis grow saucy conceited ask last riddle shut analysis explain dead thing stone inorganic thing call live thing organism call explain meddle end man kill goose golden egg kill goose flower insect analyse goose corpse goose flower dead stuff flower fail try find life thing life find plum pudding analyse part sugar flour suet clever patient more honour atom sugar flour mix atom brown colour plum currant body pudding aught put colouring matter plum currant aught turn boil pudding raw one great conjurer grandson bound find pudding one great secret sailor old story forget cook boil cloth analysis weak point let calculation apt forget cloth cook doubt analyse matter thing keep forget analyse form mean shape child mean shape thing matter folk lose sight seem likely sight few year suppose trouble head follow fashion last piece lime analysis great deal trust believe understand watch piece spoil break mislaid bit watchmaker put analyse watch watchmaker piece other watchmaker put understand work fit other use power put proof piece master analysis thing piece brother put sure work bit chalk piece become several different thing chalk chalk brother put become chalk average piece chalk chalk unmade show wonderful tale hang let analysis chalk chalk carbonate lime carbonate lime lime carbonic acid lime oxide certain metal call calcium mean quicklime certain metal mix oxygen gas slack lime same mix water lime metal metal oxygen gas analysis stop short seem much matter wrong matter great deal matter wonderful thing oxygen gas air full water full living thing full change hard bright steel soft foul rust candle burn live  concern right find want ask carbonic acid carbon oxygen gas carbon  stupid analysis fault patient carbon carbon worth instance time breathe speak mouth carbonic acid breath bit slack lime begin turn chalk breath leave grow plant leaf carbon turn wood worth help chalk wood time breathe 
