paragraphs,tokens
"CHAPTER VI. THE TRUE FAIRY TALE  You asked if there were men in England when the country was covered with ice and snow.  Look at this, and judge for yourself. What is it? a piece of old mortar?  Yes.  But mortar which was made Madam How herself, and not by any man.  And what is in it?  A piece of flint and some bits of bone.  But look at that piece of flint.  It is narrow, thin, sharp-edged: quite different in shape from any bit of flint which you or I ever saw among the hundreds of thousands of broken bits of gravel which we tread on here all day long; and here are some more bits like it, which came from the same place--all very much the same shape, like rough knives or razor blades; and here is a core of flint, the remaining part of a large flint, from which, as you may see, blades like those have been split off.  Those flakes of flint, my child, were split off by men; even your young eyes ought to be able to see that.  And here are other pieces of flint--pear-shaped, but flattened, sharp at one end and left rounded at the other, which look like spear-heads, or arrow-heads, or pointed axes, or pointed hatchets--even your young eyes can see that these must have been made by man.  And they are, I may tell you, just like the tools of flint, or of obsidian, which is volcanic glass, and which savages use still where they have not iron.  There is a great obsidian knife, you know, in a house in this very parish, which came from Mexico; and your eye can tell you how like it is to these flint ones.  But these flint tools are very old.  If you crack a fresh flint, you will see that its surface is gray, and somewhat rough, so that it sticks to your tongue.  These tools are smooth and shiny: and the edges of some of them are a little rubbed from being washed about in gravel; while the iron in the gravel has stained them reddish, which it would take hundreds and perhaps thousands of years to do.  There are little rough markings, too, upon some of them, which, if you look at through a magnifying glass, are iron, crystallised into the shape of little sea- weeds and trees--another sign that they are very very old.  And what is more, near the place where these flint flakes come from there are no flints in the ground for hundreds of miles; so that men must have brought them there ages and ages since.  And to tell you plainly, these are scrapers such as the Esquimaux in North America still use to scrape the flesh off bones, and to clean the insides of skins. But did these people (savages perhaps) live when the country was icy cold?  Look at the bits of bone.  They have been split, you see, lengthways; that, I suppose, was to suck the marrow out of them, as savages do still.  But to what animal do the bones belong?  That is the question, and one which I could not have answered you, if wiser men than I am could not have told me. They are the bones of reindeer--such reindeer as are now found only in Lapland and the half-frozen parts of North America, close to the Arctic circle, where they have six months day and six months night.  You have read of Laplanders, and how they drive reindeer in their sledges, and live upon reindeer milk; and you have read of Esquimaux, who hunt seals and walrus, and live in houses of ice, lighted by lamps fed with the same blubber on which they feed themselves.  I need not tell you about them. Now comes the question--Whence did these flints and bones come?  They came out of a cave in Dordogne, in the heart of sunny France,--far away to the south, where it is hotter every summer than it was here even this summer, from among woods of box and evergreen oak, and vineyards of rich red wine.  In that warm land once lived savages, who hunted amid ice and snow the reindeer, and with the reindeer animals stranger still. And now I will tell you a fairy tale: to make you understand it at all I must put it in the shape of a tale.  I call it a fairy tale, because it is so strange; indeed I think I ought to call it the fairy tale of all fairy tales, for by the time we get to the end of it I think it will explain to you how our forefathers got to believe in fairies, and trolls, and elves, and scratlings, and all strange little people who were said to haunt the mountains and the caves. Well, once upon a time, so long ago that no man can tell when, the land was so much higher, that between England and Ireland, and, what is more, between England and Norway, was firm dry land.  The country then must have looked--at least we know it looked so in Norfolk--very like what our moors look like here.  There were forests of Scotch fir, and of spruce too, which is not wild in England now, though you may see plenty in every plantation.  There were oaks and alders, yews and sloes, just as there are in our woods now.  There was buck-bean in the bogs, as there is in Larmer's and Heath pond; and white and yellow water-lilies, horn-wort, and pond-weeds, just as there are now in our ponds.  There were wild horses, wild deer, and wild oxen, those last of an enormous size.  There were little yellow roe-deer, which will not surprise you, for there are hundreds and thousands in Scotland to this day; and, as you know, they will thrive well enough in our woods now.  There were beavers too: but that must not surprise you, for there were beavers in South Wales long after the Norman Conquest, and there are beavers still in the mountain glens of the south-east of France.  There were honest little water-rats too, who I dare say sat up on their hind legs like monkeys, nibbling the water-lily pods, thousands of years ago, as they do in our ponds now. Well, so far we have come to nothing strange: but now begins the fairy tale.  Mixed with all these animals, there wandered about great herds of elephants and rhinoceroses; not smooth-skinned, mind, but covered with hair and wool, like those which are still found sticking out of the everlasting ice cliffs, at the mouth of the Lena and other Siberian rivers, with the flesh, and skin, and hair so fresh upon them, that the wild wolves tear it off, and snarl and growl over the carcase of monsters who were frozen up thousands of years ago.  And with them, stranger still, were great hippopotamuses; who came, perhaps, northward in summer time along the sea-shore and down the rivers, having spread hither all the way from Africa; for in those days, you must understand, Sicily, and Italy, and Malta--look at your map--were joined to the coast of Africa: and so it may be was the rock of Gibraltar itself; and over the sea where the Straits of Gibraltar now flow was firm dry land, over which hyaenas and leopards, elephants and rhinoceroses ranged into Spain; for their bones are found at this day in the Gibraltar caves.  And this is the first chapter of my fairy tale. ",true tale ask man country cover ice snow judge piece old mortar mortar man piece flint bit bone piece flint narrow thin sharp edged different shape bit flint hundred thousand break bit gravel tread day more bit same place same shape rough knife razor blade core flint remain part large flint blade split flake flint child split man young eye able other piece flint pear shape flateen sharp end leave round other spear head arrow head point axe point hatchet young eye man tool flint obsidian volcanic glass savage use iron great obsidian knife house very parish eye flint one flint tool old crack fresh flint surface gray rough stick tongue tool smooth shiny edge rub wash gravel iron gravel stain reddish hundred thousand year rough marking magnify glass iron crystallise shape weed tree sign old more place flint flake flint ground hundred mile man bring age age scraper such use scrape flesh bone clean inside skin person savage live country icy cold bit bone split lengthway suppose suck marrow savage animal bone belong question answer wise man bone reindeer such reindeer find half freeze part close arctic circle month day month night read drive reindeer sledge live reindeer milk read hunt seal walrus live house ice light lamp feed same blubber feed question flint bone cave heart sunny south hot summer summer wood box evergreen oak vineyard rich red wine warm land live savage hunt ice snow reindeer reindeer animal stranger fairy tale understand put shape tale call fairy tale strange call fairy tale fairy tale time end explain forefather believe fairy troll elve scratling strange person haunt mountain cave time man land high more firm dry land country least moor forest fir spruce wild plenty plantation oak alder yew sloe wood buck bean bog pond white yellow water lilie horn wort pond weed pond wild horse wild deer wild oxen last enormous size yellow roe deer surprise hundred thousand day thrive wood beaver surprise beaver beaver mountain glen south honest water rat dare sit hind leg monkey nibble water lily pod thousand year pond strange begin fairy tale mix animal wander great herd elephant rhinocerose smooth skinned mind cover hair wool find stick everlast ice cliff mouth other siberian river flesh skin hair fresh wild wolf tear snarl grow carcase monster freeze thousand year stranger great hippopotamuse summer time sea shore river spread way day understand map join coast rock sea flow firm dry land hyaena leopard elephant rhinocerose rang bone find day cave first chapter fairy tale 
"Now while all this was going on, and perhaps before this began, the climate was getting colder year by year--we do not know how; and, what is more, the land was sinking; and it sank so deep that at last nothing was left out of the water but the tops of the mountains in Ireland, and Scotland, and Wales.  It sank so deep that it left beds of shells belonging to the Arctic regions nearly two thousand feet high upon the mountain side.  And so       ""It grew wondrous cold,    And ice mast-high came floating by,       As green as emerald."" But there were no masts then to measure the icebergs by, nor any ship nor human being there.  All we know is that the icebergs brought with them vast quantities of mud, which sank to the bottom, and covered up that pleasant old forest-land in what is called boulder-clay; clay full of bits of broken rock, and of blocks of stone so enormous, that nothing but an iceberg could have carried them.  So all the animals were drowned or driven away, and nothing was left alive perhaps, except a few little hardy plants which clung about cracks and gullies in the mountain tops; and whose descendants live there still.  That was a dreadful time; the worst, perhaps, of all the age of Ice; and so ends the second chapter of my fairy tale. Now for my third chapter.  ""When things come to the worst,"" says the proverb, ""they commonly mend;"" and so did this poor frozen and drowned land of England and France and Germany, though it mended very slowly.  The land began to rise out of the sea once more, and rose till it was perhaps as high as it had been at first, and hundreds of feet higher than it is now: but still it was very cold, covered, in Scotland at least, with one great sea of ice and glaciers descending down into the sea, as I said when I spoke to you about the Ice-Plough.  But as the land rose, and grew warmer too, while it rose, the wild beasts who had been driven out by the great drowning came gradually back again.  As the bottom of the old icy sea turned into dry land, and got covered with grasses, and weeds, and shrubs once more, elephants, rhinoceroses, hippopotamuses, oxen--sometimes the same species, sometimes slightly different ones--returned to France, and then to England (for there was no British Channel then to stop them); and with them came other strange animals, especially the great Irish elk, as he is called, as large as the largest horse, with horns sometimes ten feet across.  A pair of those horns with the skull you have seen yourself, and can judge what a noble animal he must have been.  Enormous bears came too, and hyaenas, and a tiger or lion (I cannot say which), as large as the largest Bengal tiger now to be seen in India. And in those days--we cannot, of course, exactly say when--there came--first I suppose into the south and east of France, and then gradually onward into England and Scotland and Ireland--creatures without any hair to keep them warm, or scales to defend them, without horns or tusks to fight with, or teeth to worry and bite; the weakest you would have thought of the beasts, and yet stronger than all the animals, because they were Men, with reasonable souls.  Whence they came we cannot tell, nor why; perhaps from mere hunting after food, and love of wandering and being independent and alone.  Perhaps they came into that icy land for fear of stronger and cleverer people than themselves; for we have no proof, my child, none at all, that they were the first men that trod this earth.  But be that as it may, they came; and so cunning were these savage men, and so brave likewise, though they had no iron among them, only flint and sharpened bones, yet they contrived to kill and eat the mammoths, and the giant oxen, and the wild horses, and the reindeer, and to hold their own against the hyaenas, and tigers, and bears, simply because they had wits, and the dumb animals had none.  And that is the strangest part to me of all my fairy tale.  For what a man's wits are, and why he has them, and therefore is able to invent and to improve, while even the cleverest ape has none, and therefore can invent and improve nothing, and therefore cannot better himself, but must remain from father to son, and father to son again, a stupid, pitiful, ridiculous ape, while men can go on civilising themselves, and growing richer and more comfortable, wiser and happier, year by year--how that comes to pass, I say, is to me a wonder and a prodigy and a miracle, stranger than all the most fantastic marvels you ever read in fairy tales. You may find the flint weapons which these old savages used buried in many a gravel-pit up and down France and the south of England; but you will find none here, for the gravel here was made (I am told) at the beginning of the ice-time, before the north of England sunk into the sea, and therefore long, long before men came into this land.  But most of their remains are found in caves which water has eaten out of the limestone rocks, like that famous cave of Kent's Hole at Torquay.  In it, and in many another cave, lie the bones of animals which the savages ate, and cracked to get the marrow out of them, mixed up with their flint-weapons and bone harpoons, and sometimes with burnt ashes and with round stones, used perhaps to heat water, as savages do now, all baked together into a hard paste or breccia by the lime.  These are in the water, and are often covered with a floor of stalagmite which has dripped from the roof above and hardened into stone.  Of these caves and their beautiful wonders I must tell you another day.  We must keep now to our fairy tale.  But in these caves, no doubt, the savages lived; for not only have weapons been found in them, but actually drawings scratched (I suppose with flint) on bone or mammoth ivory--drawings of elk, and bull, and horse, and ibex--and one, which was found in France, of the great mammoth himself, the woolly elephant, with a mane on his shoulders like a lion's mane.  So you see that one of the earliest fancies of this strange creature, called man, was to draw, as you and your schoolfellows love to draw, and copy what you see, you know not why.  Remember that.  You like to draw; but why you like it neither you nor any man can tell.  It is one of the mysteries of human nature; and that poor savage clothed in skins, dirty it may be, and more ignorant than you (happily) can conceive, when he sat scratching on ivory in the cave the figures of the animals he hunted, was proving thereby that he had the same wonderful and mysterious human nature as you--that he was the kinsman of every painter and sculptor who ever felt it a delight and duty to copy the beautiful works of God. ",begin climate cold year year more land sink sink deep last leave water top mountain sink deep leave bed shell belong arctic region foot high mountain side grow wondrous cold ice mast high float green emerald mast measure iceberg ship human iceberg bring vast quantity mud sink bottom cover pleasant old forest land call boulder clay clay full bit break rock block stone enormous iceberg carry animal drown drive leave alive few hardy plant cling crack gully mountain top descendant live dreadful time bad age end second chapter fairy tale third chapter thing bad proverb mend poor freeze drown land mend land begin rise sea more rise high first hundred foot high cold cover least great sea ice glacier descend sea speak land rise grow warm rise wild beast drive great drown bottom old icy sea turn dry land cover grasse weed shrub more elephant rhinocerose hippopotamuse oxen same species different one return british stop other strange animal great irish elk call large large horse horn foot pair horn skull judge noble animal enormous bear hyaena tiger lion large large bengal tiger day course suppose south creature hair keep warm scale defend horn tusk fight tooth worry bite weak beast strong animal reasonable soul mere hunting food love wonder independent alone icy land fear strong cleverer person proof child first man trod earth cunning savage man brave iron flint sharpen bone contrive kill eat mammoth giant oxen wild horse reindeer hold own hyaena tiger bear wit dumb animal strangest part fairy tale man wit able invent improve cleverest ape invent improve remain father son father son stupid pitiful ridiculous ape man civilise grow richer comfortable wise happy year year pass wonder prodigy miracle stranger fantastic marvel read fairy tale find flint weapon old savage use bury many gravel pit south find gravel beginning ice time north sink sea long man land most remains find cave water eat limestone rock famous cave many cave lie bone animal savage eat crack marrow mix flint weapon bone harpoon burnt ash round stone use heat water savage bake hard paste breccia lime water cover floor stalagmite dripp roof harden stone cave beautiful wonder day keep fairy tale cave doubt savage live weapon find drawing scratch suppose flint bone mammoth ivory drawing elk bull horse ibex find great mammoth woolly elephant mane shoulder lion mane early fancy strange creature call man draw schoolfellow love draw copy remember like draw like man mystery human nature poor savage cloth skin dirty ignorant conceive sit scratch ivory cave figure animal hunt prove same wonderful mysterious human nature kinsman painter sculptor feel delight duty copy beautiful work 
