paragraphs,tokens
" Weeks and months glided on. Spring, with its soft, tender, green, and many blossoms, was spreading life and gladness over the earth, and Leila thought Woodlands a second Eden. The conservatory bloomed with plants of the richest fragrance, and the balcony was gay with flowers of the brightest hue; various beautiful creepers, with the sweet-scented honeysuckle, forming arches over head; and Leila herself looked as fresh and blooming as the flowers, and as joyful as the skylark, as it soared with its glad song into the blue vault of Heaven. She was never weary of admiring the beautiful scenery by which she was surrounded, for early habit had made the beauties of nature to her as a continual feast. Several of her birds were now in full song, and she spent many of her spare minutes in the conservatory. The precious seeds had come up all but one, and she had now three thriving plants of Clara’s flower. Charles had not returned at Easter to mark their progress--he had gone into a distant country to visit an uncle, a brother of Mr. Herbert’s, but by Midsummer he would surely visit home, and she hoped they would be in full flower by that time, which would be for him a still greater pleasure. Leila had, besides all this, other interests to occupy her. She frequently visited the school with her Aunt Stanley and her cousins, and assisted the younger girls in the preparation of their tasks, and she paid frequent visits to Peggy Dobie’s cottage, and to the village, where she made herself acquainted with all the wishes and wants of its various inmates. The Saturdays were generally spent by Selina and Matilda at Woodlands, when, during part of the morning, they assisted Leila in giving instruction to many of the village children in church music, for though Selina’s voice was not yet strong, her knowledge in music made her a most useful assistant. They also now took daily walks with Mrs. Roberts in the fields, and generally returned loaded with wild flowers. Leila had become most successful in drying flowers so as to preserve their bright colours. The field flowers, assisted by her papa, she arranged in books in botanical order; but with the flowers from the conservatory and the garden she often ornamented screens, producing a wonderfully fine effect, superior to any painting, fixing them on with gum, and grouping them together in a most beautiful manner. Matilda often tried to imitate Leila in this, but she did not succeed, her flowers always lost their bright tints, they grew white, or they grew black, but they never grew beautiful; the stalks never would bend gracefully, they would always stick straight up; the gum would always go on in patches, never smoothly, and she complained that though she put on a great deal of gum, some of the leaves would not stick at all, so she generally ended by getting into a rage, and dashing her hair pencil all over the paper. “Do tell me, Leila, how you manage so well,” she said one morning, as she stood admiring a couple of fine screens which Leila had just finished for Mrs. Herbert. “Those different coloured geraniums seem to me to look brighter even than when they were in the conservatory; and how gracefully the stalks are bent, and the flowers hanging down so nicely, just as if they were still growing; and those leaves and ferns are of such a beautiful green, and look so well mixed with the bright colour of the flowers. My green leaves always turn a dull yellow, or brown, or something abominable; and as to the blue convolvulus, that provokes me more than any thing. Look at yours, they are as bright as when they grew in the garden, and when I try to dry them, the colour goes away altogether, and they get to be a dirty white. I cannot get any thing to do well but yellow buttercups, and that is such a common flower. All this provokes me so, I have no patience for it. No one will ever give me a sovereign for the poor,[B] for a couple of screens, as they did to you, and I wish so much that they would.”  [B] A fact. “But you know,” Leila answered, “that was only because it was a sale of ladies’ work for the poor. My screens were not worth that.” “I don’t know; they were most beautiful, and I heard every one saying so, for I stood near the counter where they were that I might hear them praised; and when that gentleman with the nice face took them up and the lady told them they were done by a little girl, he said that little girl deserved to be encouraged, and he paid down the sovereign in a minute. Oh! I was so glad; but though I cannot earn a sovereign, I might earn something if you would only tell me what I must do to dry them as you do.” “Yes, I will tell you every thing I can; but I think the great matter is being very patient.” “But, Cousin Leila, I am sure you are not very patient.” “Yes, I know that; papa often says I am too impetuous.” “Well,” Matilda observed, “and does not that just mean that you have no patience?” Leila coloured. “I suppose it does,” she said; “but in some things I have patience, I am always very patient about flowers; to be sure, that is not wonderful, for in the island they were like friends to me. I used to visit them two or three times in the day to see how they were getting on, and to talk to them, as if they were alive, and I often knew the hour of the day by their opening and shutting.” “And do any of the flowers here open and shut at certain hours?” Matilda inquired. “Yes, some of them do; but I don’t know the flowers here so well; one kind of evening primrose opens its flowers every day a quarter of an hour before sunset; and the chickweed, which you see me so often gathering for my birds, seems to me to open both leaves and flowers every morning at nine o’clock, and closes its flowers again for some time at twelve, and will not open them at all if it rains; then in the evening it always seems to be making itself comfortable for the night, for the leaves all down the stalk shut up to cover the young shoots, just as if it were putting a great many night-caps on them to keep them warm.” “How very curious,” Matilda said; “but, Leila, we are forgetting that you were to tell me more about drying flowers. I know I need never try to gain a sovereign like you; but if I could even gain half-a-crown or even a shilling sometimes, it would be such a comfort, for I am always getting into such scrapes about my money for the poor; somehow it always melts away; both you and Selina contrive to save a little every week.” “But I have more pocket-money than you have.” “Yes, you have; but still I know I ought to save something, and often I cannot; it is all the fault of those trumpery shops. When I go to Richmond there are so many pretty things which I wish for; and then I am so often hungry and must have some bunns, you know,--how do you manage so well?” “I don’t manage very well--I often buy bunns also; but when I wish for pretty things which cost much, I remember that Nurse says ‘I should turn away mine eyes from beholding vanity,’ and then I try not to look at them, but very often I do. You know the other day when I saw that beautiful basket I did not turn away. I looked at it so long, and then I took it in my hand and turned it round and round, and thought it so beautiful, that I could not resist buying it. And now I don’t like it at all; for it cost so much that I shall not be able to save any of my pocket-money this week.” ",week month glide spring soft tender green many blossom spread life gladness earth second conservatory bloom plant rich fragrance balcony gay flower brightest hue various beautiful creeper sweet scent honeysuckle form arche head fresh bloom flower joyful skylark soar glad song blue vault weary admire beautiful scenery surround early habit beauty nature continual feast several bird full song spend many spare minute conservatory precious seed thriving plant flower return mark progress distant country visit uncle brother visit home hope full flower time great pleasure other interest occupy visit school cousin assist young girl preparation task pay frequent visit cottage village acquainted wish want various inmate spend part morning assist give instruction many village child church music voice strong knowledge music useful assistant daily walk field return load wild flower become successful drying flower preserve bright colour field flower assist papa arrange book botanical order flower conservatory garden ornament screen produce fine effect superior painting fix gum grouping beautiful manner try imitate succeed flower lose bright tint grow white grow black grow beautiful stalk bend stick gum patch complain put great deal gum leave stick end rage dash hair pencil paper manage morning stand admire couple fine screen finish different coloured geranium seem bright conservatory stalk bend flower hang grow leave fern beautiful green mix bright colour flower green leave turn dull yellow brown abominable blue convolvulus provoke more thing bright grow garden try dry colour dirty white thing yellow buttercup common flower provoke patience give sovereign poor couple screen wish much fact answer sale lady work poor screen worth beautiful hear one stand counter hear praise gentleman nice face lady girl girl deserve encourage pay sovereign minute glad earn sovereign earn dry thing great matter patient cousin sure patient impetuous observe mean patience coloured suppose thing patience patient flower sure wonderful island friend use visit time day talk alive hour day opening shut flower open shut certain hour inquire flower kind evening primrose open flower day quarter hour sunset chickweed gather bird seem open leave flower morning close flower time open rain evening seem comfortable night leave stalk shut cover young shoot put great many night cap keep warm curious forget more drying flower try gain sovereign gain half crown shilling comfort such scrape money poor melt contrive save week more pocket money save fault trumpery shop many pretty thing wish hungry bunn manage manage buy bunn wish pretty thing cost much remember turn eye behold vanity try other day beautiful basket turn hand turn beautiful resist buy like cost much able save pocket money week 
"“Well, that was wrong, to be sure, and just what I should have done myself; but don’t be melancholy about it now, for you have always money beforehand, so it does not much signify for one week; so do tell me how I am to earn half-a-crown, and how I am to dry flowers in a most beautiful manner; you say patience is the chief thing. Will patience make them keep their colour? now do tell me that.” “Yes,” Leila answered, “it will; and I will tell you how. Very often when it clears up after rain, and the flowers look very bright, you wish to gather them for drying--I always tell you that it is a bad time, but still you often try to do it--and they get quite dim and discoloured, and you are obliged to throw them away. Now when I wish to dry them, I wait till it has been quite fair for several days, and when it is bright and sunny, and there is no damp in the air, I gather the flowers. I always choose those that are very bright and fully blown, but before they have begun to fade in the slightest degree. If they have a decayed speck no bigger than the head of a pin, do not gather them, for they will not be bright when dried.” “And what more do you do?” “I put them between folds of close smooth writing-paper, never into blotting-paper.” “But Lydia told me it should be blotting-paper.” “No, I have tried that; but the blotting-paper seems to suck the colour out of them. Well, I place those papers between the leaves of a book, and tie it tight up with a ribbon, and put it under a weight; if it is a very tender flower, such as the blue convolvulus, for instance, then you must not put a very heavy weight, the weight must be in proportion to the tenderness of the flower. Next day I change the papers that there may be no damp about them, for nothing spoils their colour so much as damp. Now all this, you see, takes patience; for sometimes I have to change the papers more than once.” “Yes,” Matilda observed, “and such patience, that I am sure I shall never be able to do it. And this is all then?” “No; in putting the flowers into dry bits of paper you must do it very gently, that they may lie quite smooth; for much of their beauty depends on their looking smooth, and not shrivelled up in any way; and I forgot to tell you that sometimes before putting them in at all, I bend the stalks a little to make them lie gracefully. The stalks of the geraniums are so stiff and straight, that I am obliged to take off the flower-heads, and put them in papers by themselves, and then I flatten the stalks and bend them a little before I begin to dry them. The ferns, which you like so much, grow so gracefully, that I seldom have to bend them at all, but just to lay them on paper as they grow. The young ferns of a bright tender green do best: indeed, all green leaves should be dried when they first come out, before they have got to be a deep colour, for green is a very difficult colour to dry well; most yellow flowers do very well, the yellow crocus keeps very bright; indeed, some scarlet and rose-coloured geraniums dry beautifully, and other scarlets won’t dry at all,--you must just get acquainted with those that do well, and with those that don’t.” Matilda groaned. “My hopes are quite dying away; half-a-crown!--I don’t think I shall be able to earn sixpence even;--but it is sunny and bright now, we might go into the garden, and you could gather some of the flowers which do best, and show me how you lay them on the paper--I think I have seen you working away with a long pin; but if I were to take a pin in my hand, I should be sure to run it through the flowers if they would not lie the right way, for I should be so provoked. “Well, that is why I say that the chief thing is patience; you would quite spoil the flower if you even scratched it with the pin. I take the pin to help me to guide the leaves to lie right; for sometimes when I lay down the branch on the paper, all the leaves get crowded together, and I have to separate them, and sometimes to pluck off one or two.” “It is most horribly difficult, I can see that; however, let us go into the garden; perhaps, if I see you do it, I might still try.” “But, Matilda, it won’t do to gather flowers to dry to-day; you forget that it rained in the night, and that this morning even there was a slight shower.” Matilda shrugged her shoulders. “What a business! better give it up altogether, and especially if I am to bear in mind every time it rains. When the rain is over, I am too glad to forget it,--who ever thinks of rain when the sun is shining? not _I_--I always feel sure it is never to rain again; and so all my little plans for goodness must be given up, and I must just go on buying bunns till I am older, and then perhaps I shall not be so hungry, and shall not care for them so much.” Leila smiled but shook her head. “Now don’t talk in that way, Matilda, for you know very well it is not right, and you do not mean to go on spending all your money on bunns; you could not be happy if you did; you only say so to make me laugh; but come, let us go into the garden, and I can show you what flowers do best for drying, and then when it is fine we can gather them, and I will help you to put them in paper. I am sure _you_ also could make money by it.” “Oh, you are a darling!” Matilda exclaimed; “and again my hopes are rising, _rising_--sixpence--a shilling--half-a-crown. Oh! there will be no counting the money I shall make. I shall have quite too much for the poor, and be able to treat you all with bunns into the bargain; now that is what I call generous.” They found Mrs. Roberts and Alfred in the garden, Alfred flying at full speed as if in pursuit of something. “Don’t stop me, Matilda, don’t. Now it is going to settle on that rosebush--no, it is not--yes, it is hovering--now don’t move, don’t make a noise; now I have him;”--and he held up a large dragon-fly between his fingers. Matilda screamed. “Oh! let him go, Alfred--do let him go--he will sting you; only see how he is putting out that long frightful sting. I see his sting quite plain.” “No, Matilda, you need not be afraid, he cannot hurt me, for he has no sting. Mrs. Roberts told me that was a vulgar error.” “Did you tell Alfred that?” Matilda inquired, turning to Mrs. Roberts; “but how can that be when I see it? and he is pushing it out every moment in a most frightful manner; only look, Mrs. Roberts.” “Yes, I see what you mean, Matilda; but that movement in its body is only the effort the poor dragon-fly is making to escape; it is a perfectly harmless insect, for it has no instrument with which it can sting.” “Then if you are quite sure of that,” Matilda said, eagerly, “I should like to look at him nearer. Stop, Alfred, and let me see. Oh! what a beautiful creature he is, and with four such lovely wings; when the sun shines upon them they seem to change colour like mother-of-pearl. Now that I know he has no sting I think him a perfect beauty, and before I used to run away from a dragon-fly as if it had been a wild beast; and they do look rather fierce though they are beautiful, for they have such a way of darting down so suddenly. Sometimes I have watched them flying across the pond at the bottom of the garden, and they dart down so low, they seem as if they were dropping into the water.” ",wrong sure melancholy money signify week earn half crown dry flower beautiful manner patience chief thing patience keep colour answer clear rain flower bright wish gather drying bad time try dim discoloured oblige throw wish dry wait fair several day bright sunny damp air gather flower choose bright blow begin fade slight degree decay speck big head pin gather bright dry more put fold close smooth writing paper blotting paper blot paper try blotting paper seem suck colour place paper leave book tie ribbon put weight tender flower such blue convolvulus instance put heavy weight weight proportion tenderness flower next day change paper damp spoil colour damp patience change paper more observe such patience sure able put flower dry bit paper lie smooth much beauty depend smooth shrivell way forget put bend stalk lie stalk geranium stiff straight oblige flower head put paper flatten stalk bend begin dry fern like grow bend lay paper grow young fern bright tender green green leave dry deep colour green difficult colour dry most yellow flower yellow crocus keep bright scarlet rose coloured geranium dry other scarlet dry acquainted groan hope die half crown able earn sixpence sunny bright garden gather flower show lay paper work long pin pin hand sure run flower lie right way provoke chief thing patience spoil flower scratch pin pin help guide leave lie lay branch paper leave crowd separate pluck difficult let garden try gather flower dry day forget rain night morning slight shower shrugg shoulder business give bear mind time rain rain glad forget rain sun shine feel sure rain plan goodness give buy bunn old hungry care smile shake head talk way right mean spend money bunn happy laugh let garden show flower drying fine gather help put paper sure money darling exclaim hope rise sixpence shilling half crown count money much poor able treat bunn bargain call generous find garden fly full speed pursuit stop settle rosebush hover move noise hold large dragon fly finger scream let let sting put long frightful sting sting plain afraid hurt sting vulgar error inquire turn push moment frightful manner mean movement body effort poor dragon fly escape harmless insect instrument sting sure like stop let beautiful creature such lovely wing sun shine seem change colour mother pearl sting perfect beauty use run dragon fly wild beast fierce beautiful way dart watch fly pond bottom garden dart low seem drop water 
