paragraphs,tokens
"... ""Thou shall not lack     The flower that's like thy face, pale Primrose."" The little old lady lived over the way, through a green gate that shut with a click, and up three white steps. Every morning at eight o'clock the church bell chimed for Morning Prayer--chim! chime! chim! chime!--and every morning at eight o'clock the little old lady came down the white steps, and opened the gate with a click, and went where the bells were calling. About this time also little Ida would kneel on a chair at her nursery window in the opposite house to watch the old lady come out and go. The old lady was one of those people who look always the same. Every morning her cheeks looked like faded rose-leaves, and her white hair like a snow-wreath in a garden laughing at the last tea-rose. Every morning she wore the same black satin bonnet, and the same white shawl; had delicate gloves on the smallest of hands, and gathered her skirt daintily up from the smallest of feet. Every morning she carried a clean pocket-handkerchief, and a fresh rose in the same hand with her Prayer-book; and as the Prayer-book, being bound up with the Bible, was very thick, she seemed to have some difficulty in so doing. Every morning, whatever the weather might be, she stood outside the green gate, and looked up at the sky to see if this were clear, and down at the ground to see if that were dry; and so went where the bells were calling. Ida knew the little old lady quite well by sight, but she did not know her name. Perhaps Ida's great-uncle knew it; but he was a grave, unsociable man, who saw very little of his neighbours, so perhaps he did not; and Ida stood too much in awe of him to trouble him with idle questions. She had once asked Nurse, but Nurse did not know; so the quiet orphan child asked no more. She made up a name for the little old lady herself, however, after the manner of Mr. John Bunyan, and called her Mrs. Overtheway; and morning after morning, though the bread-and-milk breakfast smoked upon the table, she would linger at the window, beseeching-- ""One minute more, dear Nurse! Please let me wait till Mrs. Overtheway has gone to church."" And when the little old lady had come out and gone, Ida would creep from her perch, and begin her breakfast. Then, if the chimes went on till half the basinful was eaten, little Ida would nod her head contentedly, and whisper-- ""Mrs. Overtheway was in time."" Little Ida's history was a sad one. Her troubles began when she was but a year old, with the greatest of earthly losses--for then her mother died, leaving a sailor husband and their infant child. The sea-captain could face danger, but not an empty home; so he went back to the winds and the waves, leaving his little daughter with relations. Six long years had he been away, and Ida had had many homes, and yet, somehow, no home, when one day the postman brought her a large letter, with her own name written upon it in a large hand. This was no old envelope sealed up again--no make-believe epistle to be put into the post through the nursery door: it was a real letter, with a real seal, real stamps, and a great many post-marks; and when Ida opened it there were two sheets written by the Captain's very own hand, in round fat characters, easy to read, with a sketch of the Captain's very own ship at the top, and--most welcome above all!--the news that the Captain's very own self was coming home. ""I shall have a papa all to myself very soon, Nurse,"" said Ida. ""He has written a letter to me, and made me a picture of his ship; it is the 'Bonne Esperance,' which he says means Good Hope. I love this letter better than anything he has ever sent me."" Nevertheless, Ida took out the carved fans and workboxes, the beads, and handkerchiefs, and feathers, the dainty foreign treasures the sailor-father had sent to her from time to time; dusted them, kissed them, and told them that the Captain was coming home. But the letter she wore in her pocket by day, and kept under her pillow by night. ""Why don't you put your letter into one of your boxes, like a tidy young lady, Miss Ida?"" said Nurse. ""You'll wear it all to bits doing as you do."" ""It will last till the ship comes home,"" said Miss Ida. It had need then to have been written on the rock, graven with an iron pen for ever; for the ""Bonne Esperance"" (like other earthly hopes) had perished to return no more. She foundered on her homeward voyage, and went down into the great waters, whilst Ida slept through the stormy night, with the Captain's letter beneath her pillow. Two or three months had now passed away since Ida became an orphan. She had become accustomed to the crape-hung frock; she had learnt to read the Captain's letter as the memorial of a good hope which it had pleased God to disappoint; she was fairly happy again. It was in the midst of that new desolation in her lonely life that she had come to stay with her great-uncle, and had begun to watch the doings of the little old lady who lived over the way. When dolls seemed vanity, and Noah's Ark a burden, it had been a quiet amusement, demanding no exertion, to see what little she could see of the old lady's life, and to speculate about what she could not; to wonder and fancy what Mrs. Overtheway looked like without her bonnet, and what she did with herself when she was not at church. Ida's imagination did not carry her far. She believed her friend to be old, immeasurably old, indefinitely old; and had a secret faith that she had never been otherwise. She felt sure that she wore a cap indoors, and that it was a nicer one than Nurse's; that she had real tea, with sugar and cream, instead of milk-and-water, and hot toast rather than bread-and-treacle for tea; that she helped herself at meals, and went to bed according to her own pleasure and convenience; was--perhaps on these very grounds--utterly happy, and had always been so. ""I am only a little girl,"" said Ida, as she pressed her face sadly to the cold window-pane. ""I am only a little girl, and very sad, you know, because Papa was drowned at sea; but Mrs. Overtheway is very old, and always happy, and so I love her."" And in this there was both philosophy and truth. ",lack flower face pale old lady live way green gate shut click white step morning church bell chime chim chime chime morning old lady white step open gate click bell call time kneel chair nursery window opposite house watch old lady old lady person same morning cheek fade rose leave white hair snow wreath garden laugh last morning wear same black satin bonnet same white shawl delicate glove small hand gather skirt small foot morning carry clean pocket handkerchief fresh rose same hand prayer book book bind thick seem difficulty morning weather stand green gate sky clear ground dry bell call old lady sight name great uncle grave unsociable man neighbour stand much awe trouble idle question ask quiet orphan child ask more name old lady manner call morning morning bread milk breakfast smoke table linger window beseech minute more dear nurse let wait church old lady creep perch begin breakfast chime basinful eat nod head whisper time history sad one trouble begin year old great earthly loss mother die leave sailor husband infant child sea captain face danger empty home wind wave leave daughter relation long year many home home day postman bring large letter own name write large hand old envelope seal believe epistle put post nursery door real letter real seal real stamp great many post mark open sheet write very own hand round fat character easy read sketch own ship top welcome news own self papa write letter picture ship mean love letter send carve fan workboxe bead handkerchief feather dainty foreign treasure sailor father send time time dust kiss letter wear pocket day keep pillow night put letter box tidy young lady wear bit last ship need write rock graven iron pen other earthly hope perish return more founder homeward voyage great water sleep stormy night letter pillow month pass become orphan become accustom crape hang frock learn read letter memorial hope pleased disappoint happy midst new desolation lonely life stay great uncle begin watch doing old lady live way doll seem vanity burden quiet amusement demand exertion old lady life speculate wonder fancy bonnet church imagination carry believe friend old old old secret faith feel sure wear cap nice one real tea sugar cream milk water hot toast bread treacle tea help meal bed accord own pleasure convenience very grounds happy girl press face cold window pane girl sad drown sea old happy love philosophy truth 
"It is a mistake to suppose that the happiness of others is always a distasteful sight to the sad at heart. There are times in which life seems shorn of interests and bereaved of pleasure, when it is a relief, almost amounting to consolation, to believe that any one is happy. It is some feeling of this nature, perhaps, which makes the young so attractive to the old. It soothes like the sound of harmonious music, the sight of harmonious beauty. It witnesses to a conviction lying deep even in the most afflicted souls that (come what may), all things were created good, and man made to be blessed; before which sorrow and sighing flee away. This was one of many things which formed the attraction for Ida in the little old lady who lived over the way. That green gate shut in a life of which the child knew nothing, and which might be one of mysterious delights; to believe that such things could be was consoling, and to imagine them was real entertainment. Ida would sometimes draw a chair quietly to the table beside her own, and fancy that Mrs. Overtheway was having tea with her. She would ask the old lady if she had been in time for church that morning, beg her to take off her bonnet, and apologise politely for the want of hot tea and toast. So far all was well, for Ida could answer any of these remarks on Mrs. Overtheway's behalf; but it may be believed that after a certain point this one-sided conversation flagged. One day Nurse overheard Ida's low murmurs. ""What are you talking about, Miss Ida?"" said she. ""I am pretending to have Mrs. Overtheway to tea,"" said Ida. ""Little girls shouldn't pretend what's not true,"" replied Nurse, in whose philosophy fancy and falsehood were not distinguished. ""Play with your dolls, my dear, and don't move the chairs out of their places."" With which Nurse carried off the chair into a corner as if it had been a naughty child, and Ida gave up her day-dream with a sigh; since to have prolonged the fancy that Mrs. Overtheway was present, she must have imagined her borne off at the crisis of the meal after a fashion not altogether consistent with an old lady's dignity. Summer passed, and winter came on. There were days when the white steps looked whiter than usual; when the snowdrift came halfway up the little green gate, and the snowflakes came softly down with a persistency which threatened to bury the whole town. Ida knew that on such days Mrs. Overtheway could not go out; but whenever it was tolerably fine the old lady appeared as usual, came daintily down the steps, and went where the bells were calling. Chim! chime! chim! chime! They sounded so near through the frosty air, that Ida could almost have fancied that the church was coming round through the snowy streets to pick up the congregation. Mrs. Overtheway looked much the same in winter as in summer. She seemed as fresh and lively as ever, carried her Prayer-book and handkerchief in the same hand, was only more warmly wrapped up, and wore fur-lined boots, which were charming. There was one change, however, which went to Ida's heart. The little old lady had no longer a flower to take to church with her. At Christmas she took a sprig of holly, and after that a spray of myrtle, but Ida felt that these were poor substitutes for a rose. She knew that Mrs. Overtheway had flowers somewhere, it is true, for certain pots of forced hyacinths had passed through the little green gate to the Christmas church decorations; but one's winter garden is too precious to be cropped as recklessly as summer rose-bushes, and the old lady went flowerless to church and enjoyed her bulbs at home. But the change went to Ida's heart. Spring was early that year. At the beginning of February there was a good deal of snow on the ground, it is true, but the air became milder and milder, and towards the end of the month there came a real spring day, and all the snow was gone. ""You may go and play in the garden, Miss Ida,"" said Nurse, and Ida went. She had been kept indoors for a long time by the weather and by a cold, and it was very pleasant to get out again, even when the only amusement was to run up and down the shingly walks and wonder how soon she might begin to garden, and whether the gardener could be induced to give her a piece of ground sufficiently extensive to grow a crop of mustard-and-cress in the form of a capital I. It was the kitchen garden into which Ida had been sent. At the far end it was cut off from the world by an overgrown hedge with large gaps at the bottom, through which Ida could see the high road, a trough for watering horses, and beyond this a wood. The hedge was very thin in February, and Ida had a good view in consequence, and sitting on a stump in the sunshine she peered through the gap to see if any horses came to drink. It was as good as a peep-show, and indeed much better. ""The snow has melted,"" gurgled the water, ""here I am."" It was everywhere. The sunshine made the rich green mosses look dry, but in reality they were wet, and so was everything else. Slish! slosh! Put your feet where you would, the water was everywhere. It filled the stone trough, which, being old and grey and steady, kept it still, and bade it reflect the blue sky and the gorgeous mosses; but the trough soon overflowed, and then the water slipped over the side, and ran off in a wayside stream. ""Winter is gone!"" it spluttered as it ran. ""Winter is gone, winter-is-gone, winterisgone!"" And, on the principle that a good thing cannot be said too often, it went on with this all through the summer, till the next winter came and stopped its mouth with icicles. As the stream chattered, so the birds in the wood sang--Tweet! tweet! chirrup! throstle! Spring! Spring! Spring!--and they twittered from tree to tree, and shook the bare twigs with melody; whilst a single blackbird sitting still upon a bough below, sang ""Life!"" ""Life!"" ""Life!"" with the loudest pipe of his throat, because on such a day it was happiness only to be alive. It was like a wonderful fairy-tale, to which Ida listened with clasped hands. ",mistake suppose happiness other distasteful sight sad heart time life seem shorn interest bereaved pleasure relief amount consolation believe one happy feeling nature young attractive old soothe sound harmonious music sight harmonious beauty witness conviction lie afflict soul thing create man bless sorrow sighing flee many thing form attraction old lady live way green gate shut life child mysterious delight believe such thing consol imagine real entertainment draw chair table own fancy tea ask old lady time church morning beg bonnet apologise want hot tea toast well answer remark behalf believe certain point one sided conversation flagge day overhear low murmur talk pretend tea girl pretend true reply philosophy fancy falsehood distinguished play doll dear move chair place carry chair corner naughty child give day dream sigh prolong fancy present imagine borne crisis meal fashion consistent old lady dignity summer pass winter day white step whit usual snowdrift green gate snowflake persistency threaten bury whole town such day fine old lady appear usual step bell call chime chime sound frosty air fancy church snowy street pick congregation same winter summer seem fresh lively carry prayer book handkerchief same hand wrap wear fur line boot charming change heart old lady flower church sprig holly spray myrtle feel poor substitute rose flower true certain pot force hyacinth pass green gate church decoration winter garden precious croppe summer rise bush old lady church enjoy bulb home change heart spring early year beginning deal snow ground true air become mild mild end month real spring day snow gone play garden keep long time weather cold pleasant only amusement run shingly walk wonder begin garden gardener induce give piece ground extensive grow crop mustard cress form capital kitchen garden send far end cut world overgrown hedge large gap bottom high road trough water horse wood hedge thin view consequence sit stump sunshine peer gap horse drink peep show snow melt gurgle water sunshine rich green mosse dry reality wet else slosh put foot water fill stone trough old grey steady keep bid reflect blue sky gorgeous mosse trough overflow water slip side run wayside stream gone splutter run winter gone winter gone principle thing summer next winter stop mouth icicle stream chatter bird wood sing tweet chirrup spring spring spring twitter tree tree shake bare twig melody single blackbird sit bough sing life life life loudest pipe throat day happiness alive wonderful fairy tale listen clasp hand 
