paragraphs,tokens
"    ""It did not move my grief, to see       The trace of human step departed,       Because the garden was deserted,      The blither place for me!     ""Friends, blame me not! a narrow ken       Hath childhood 'twixt the sun and sward:       We draw the moral afterward--      We feel the gladness then.""  ""I remember,"" said Mrs. Overtheway, ""old as I am, I remember distinctly many of the unrecognized vexations, longings, and disappointments of childhood. By unrecognized, I mean those vexations, longings, and disappointments which could not be understood by nurses, are not confided even to mothers, and through which, even in our cradles, we become subject to that law of humanity which gives to every heart its own secret bitterness to be endured alone. These are they which sometimes outlive weightier memories, and produce life-long impressions disproportionate to their value; but oftener, perhaps, are washed away by the advancing tide of time--the vexations, longings, and disappointments of the next period of our lives. These are they which are apt to be forgotten too soon to benefit our children, and which in the forgetting make childhood all bright to look back upon, and foster that happy fancy that there is one division of mortal life in which greedy desire, unfulfilled purpose, envy, sorrow, weariness and satiety, have no part, by which every man believes himself at least to have been happy as a child. ""My childhood, on the whole, was a very happy one. The story that I am about to relate is only a fragment of it. ""As I look into the fire, and the hot coals shape themselves into a thousand memories of the past, I seem to be staring with childish eyes at a board that stares back at me out of a larch plantation, and gives notice that 'This House is to Let.' Then, again, I seem to peep through rusty iron gates at the house itself--an old red house, with large windows, through which one could see the white shutters that were always closed. To look at this house, though only with my mind's eye, recalls the feeling of mysterious interest with which I looked at it fifty years ago, and brings back the almost oppressive happiness of a certain day, when Sarah, having business with the couple who kept the empty manor, took me with her, and left me to explore the grounds whilst she visited her friends. ""Next to a companion with that rare sympathy of mind to mind, that exceptional coincidence of tastes, which binds some few friendships in a chain of mesmeric links, supplanting all the complacencies of love by intuition, is a companion whose desires and occupations are in harmony, if not in unison, with one's own. That friend whom the long patience of the angler does not chafe, the protracted pleasures of the sketcher do not weary, because time flies as swiftly with him whilst he pores over his book, or devoutly seeks botanical specimens through the artist's middle distance; that friend, in short--that valuable friend--who is blessed with the great and good quality of riding a hobby of his own, and the greater and better quality of allowing other people to ride theirs. ""I did not think out all this fifty years ago, neither were the tastes of that excellent housemaid, Sarah, quite on a level with those of which I have spoken; but I remember feeling the full comfort of the fact that Sarah's love for friendly gossip was quite as ardent as mine for romantic discovery; that she was disposed to linger quite as long to chat as I to explore; and that she no more expected me to sit wearily through her kitchen confidences, than I imagined that she would give a long afternoon to sharing my day-dreams in the gardens of the deserted manor. ""We had ridden our respective hobbies till nearly tea-time before she appeared. ""'I'm afraid you must be tired of waiting, Miss Mary,' said she. ""'Tired!' I exclaimed, 'not in the least. I have been so happy, and I am so much obliged to you, Sarah.' ""Need I say why I was so happy that afternoon? Surely most people have felt--at least in childhood--the fascination of deserted gardens, uninhabited houses, ruined churches. They have that advantage over what is familiar and in use that undiscovered regions have over the comfortable one that the traveller leaves to explore them, that the secret which does not concern me has over the facts which do, that what we wish for has over what we possess. ""If you, my dear, were to open one of those drawers, and find Nurse's Sunday dress folded up in the corner, it would hardly amuse you; but if, instead thereof, you found a dress with a long stiff bodice, square at the neck, and ruffled round the sleeves, such as you have seen in old pictures, no matter how old or useless it might be, it would shed round it an atmosphere of delightful and mysterious speculations. This curiosity, these fancies, roused by the ancient dress, whose wearer has passed away, are awakened equally by empty houses where someone must once have lived, though his place knows him no more. It was so with the manor. How often had I peeped through the gates, catching sight of garden walks, and wondering whither they led, and who had walked in them; seeing that the shutters behind one window were partly open, and longing to look in. ""To-day I had been in the walks and peeped through the window. This was the happiness. ""Through the window I had seen a large hall with a marble floor and broad stone stairs winding upwards into unknown regions. By the walks I had arrived at the locked door of the kitchen garden, at a small wood or wilderness of endless delights (including a broken swing), and at a dilapidated summer-house. I had wandered over the spongy lawn, which was cut into a long green promenade by high clipt yew-hedges, walking between which, in olden times, the ladies grew erect and stately, as plants among brushwood stretch up to air and light. ",move grief trace human step depart garden desert blither place friend blame narrow ken childhood twixt sun sward draw moral feel gladness remember old remember many unrecognized vexation longing disappointment childhood unrecognized mean vexation longing disappointment understand nurse confide mother cradle become subject law humanity give heart own secret bitterness endure outlive weighty memory produce life long impression disproportionate value wash advance tide time vexation longing disappointment next period life apt forget benefit child forget childhood bright foster happy fancy division mortal life greedy desire unfulfilled purpose envy sorrow weariness satiety part man believe least happy child childhood whole happy one story about relate fragment fire hot coal shape memory past seem stare childish eye board stare larch plantation give notice let seem peep rusty iron gate house old red house large window white shutter close house mind eye recall feeling mysterious interest year bring oppressive happiness certain day business couple keep empty manor leave explore grounds visit friend companion rare sympathy mind mind exceptional coincidence taste bind few friendship chain mesmeric link supplant complacency love intuition companion desire occupation harmony unison own friend long patience angler chafe protracted pleasure sketcher weary time fly pore book seek botanical specimen artist middle distance friend short valuable friend bless great quality ride hobby own great quality allow other person ride year taste excellent housemaid level speak remember feel full comfort fact love friendly gossip ardent romantic discovery dispose linger chat explore expect sit kitchen confidence imagine give long afternoon share day dream garden desert manor ride respective hobby tea time appear afraid tired wait tired exclaim least happy oblige happy afternoon most person feel least childhood fascination desert garden uninhabited house ruin church advantage familiar use undiscovered region comfortable one traveller leave explore secret concern fact wish possess dear open drawer find dress fold corner amuse find dress long stiff bodice square neck ruffle sleeve such old picture matter old useless shed atmosphere delightful mysterious speculation curiosity fancy rouse ancient dress wearer pass awaken empty house live place more manor peep gate catching sight garden walk wonder lead walk shutter window open long day walk peep window happiness window large hall marble floor broad stone stair wind unknown region walk arrive lock door kitchen garden small wood wilderness endless delight include break swing dilapidated summer house wander spongy lawn cut long green promenade high clipt yew hedge walk olden time lady grow erect stately plant brushwood stretch air light 
"""Finally, I had brought away such relics as it seemed to me that honesty would allow. I had found half a rusty pair of scissors in the summer-house. Perhaps some fair lady of former days had lost them here, and swept distractedly up and down the long walks seeking them. Perhaps they were a present, and she had given a luck-penny for them, lest they should cut love. Sarah said the housekeeper might have dropped them there; but Sarah was not a person of sentiment. I did not show her the marble I found by the hedge, the acorn I picked up in the park, nor a puny pansy which, half way back to a wild heartsease, had touched me as a pathetic memorial of better days. When I got home, I put the scissors, the marble, and the pansy into a box. The acorn I hung in a bottle of water--it was to be an oak tree. ""Properly speaking, I was not at home just then, but on a visit to my grandmother and a married aunt without children who lived with her. A fever had broken out in my own home, and my visit here had been prolonged to keep me out of the way of infection. I was very happy and comfortable except for one single vexation, which was this: ""I slept on a little bed in what had once been the nursery, a large room which was now used as a workroom. A great deal of sewing was done in my grandmother's house, and the sewing-maid and at least one other of the servants sat there every evening. A red silk screen was put before my bed to shield me from the candlelight, and I was supposed to be asleep when they came upstairs. But I never remember to have been otherwise than wide awake, nervously awake, wearily awake. This was the vexation. I was not a strong child, and had a very excitable brain; and the torture that it was to hear those maids gossiping on the other side of the dim red light of my screen I cannot well describe, but I do most distinctly remember. I tossed till the clothes got hot, and threw them off till I got cold, and stopped my ears, and pulled the sheet over my face, and tried not to listen, and listened in spite of all. They told long stories, and made many jokes that I couldn't understand; sometimes I heard names that I knew, and fancied I had learnt some wonderful secret. Sometimes, on the contrary, I made noises to intimate that I was awake, when one of them would rearrange my glaring screen, and advise me to go to sleep; and then they talked in whispers, which was more distracting still. ""One evening--some months after my ramble round the manor--the maids went out to tea, and I lay in peaceful silence watching the shadows which crept noiselessly about the room as the fire blazed, and wishing Sarah and her colleagues nothing less than a month of uninterrupted tea-parties. I was almost asleep when Aunt Harriet came into the room. She brought a candle, put up my screen (the red screen again!), and went to the work-table. She had not been rustling with the work things for many minutes when my grandmother followed her, and shut the door with an air which seemed to promise a long stay. She also gave a shove to my screen, and then the following conversation began: ""'I have been to Lady Sutfield's to-day, Harriet.' ""'Indeed, ma'am.' But my aunt respectfully continued her work, as I could hear by the scraping of the scissors along the table. ""'I heard some news there. The manor is let.' ""I almost jumped in my bed, and Aunt Harriet's scissors paused. ""'Let, ma'am! To whom!' ""'To a Mrs. Moss. You must have heard me speak of her. I knew her years ago, when we were both young women. Anastatia Eden, she was then.' ""I could hear my aunt move to the fire, and sit down. ""'The beautiful Miss Eden? Whom did she marry at last? Was there not some love-affair of hers that you knew about?' ""'Her love-affairs were endless. But you mean Mr. Sandford. She treated him very ill--very ill.' ""There was a pause, while the fire crackled in the silence; and then, to the infinite satisfaction of my curiosity, Aunt Harriet said: ""'I've forgotten the story, ma'am. He was poor, was he not?' ""'He had quite enough to marry on,' my grandmother answered, energetically; 'but he was not a great match. It was an old story, my dear. The world! The world! The world! I remember sitting up with Anastatia after a ball, where he had been at her side all the evening. We sipped hot posset, and talked of our partners. Ah, dear!' and here my grandmother heaved a sigh; partly, perhaps, because of the follies of youth, and partly, perhaps, because youth had gone, and could come back no more. ""'Anastatia talked of him,' she continued. 'I remember her asking me if “her man” were not a pretty fellow, and if he had not sweet blue eyes and the greatest simplicity I ever knew but in a child. It was true enough; and he was a great deal more than that--a great deal more than she ever understood. Poor Anastatia! I advised her to marry him, but she seemed to look on that as impossible. I remember her saying that it would be different if she were not an acknowledged beauty; but it was expected that she would marry well, and he was comparatively poor, and not even singular. He was accomplished, and the soul of honour, but simple, provokingly simple, with no pretensions to carry off the toast of a county. My dear, if he had been notorious in any way--for dissipation, for brawling, for extravagance--I believe it would have satisfied the gaping world, and he would have had a chance. But there was nothing to talk about, and Anastatia had not the courage to take him for himself. She had the world at her feet, and paid for it by being bound by its opinion.' ""Here my grandmother, who was apt to moralize, especially when relating biographies of young ladies, gave another sigh. ""'Then why did she encourage him?' inquired Aunt Harriet; who also moralized, but with more of indignation and less of philosophy. ""'I believe she loved him in spite of herself; but at the last, when he offered, she turned prudent and refused him.' ""'Poor man! Did he ever marry?' ""'Yes, and very happily--a charming woman. But the strange part of the story is, that he came quite unexpectedly into a large property that was in his family.' ""'Did he? Then he would have been as good a match as most of her admirers?' ""'Better. It was a fine estate. Poor Anastatia!' ""'Serve her right,' said my aunt, shortly. ",bring such relic seem honesty allow find rusty pair scissors summer house fair lady former day lose sweep long walk seek present give luck penny cut love housekeeper drop person sentiment show marble find hedge acorn pick park puny pansy wild heartsease touch pathetic memorial day put scissors marble pansy box acorn hang bottle water oak tree speak home visit grandmother married aunt child live fever break own home visit prolong keep way infection happy comfortable single vexation sleep bed nursery large room use workroom great deal sewing grandmother house sewing maid least other servant sit evening red silk screen put bed shield candlelight suppose asleep remember wide awake awake awake vexation strong child excitable brain torture hear maid gossipe other side dim red light screen describe remember toss clothes hot throw cold stop ear pull sheet face try listen listen spite long story many joke understand hear name fancy learn wonderful secret contrary noise intimate awake rearrange glaring screen advise sleep talk whisper distracting evening month ramble manor maid tea lay peaceful silence watch shadow creep room fire blaze wish colleague less month uninterrupted party asleep room bring candle put screen red screen work table rustle work thing many minute grandmother follow shut door air seem promise long stay give shove screen follow conversation begin day aunt continue work hear scraping scissors table hear news manor let jump bed scissors pause let hear speak year young woman hear aunt move fire sit beautiful marry last love affair love affair endless mean treat ill ill pause fire crackle silence infinite satisfaction curiosity forget story poor enough marry grandmother answer great match old story dear world world world remember sit ball side evening sipp hot posset talk partner dear grandmother heave sigh follie youth youth more talk continue remember ask man pretty fellow sweet blue eye great simplicity child true great deal more great deal more understand poor anastatia advise marry seem impossible remember different acknowledge beauty expect marry poor singular accomplish soul honour simple simple pretension carry toast county dear notorious way dissipation brawling extravagance believe satisfy gape world chance talk courage world foot pay bind opinion grandmother apt moralize relate biography young lady give sigh encourage inquire moralize more indignation less philosophy believe love spite last offer turn prudent refuse poor man marry charming woman strange part story large property family match most admirer fine estate poor anastatia serve right aunt 
