paragraphs,tokens
"BOOK 1. _THE COCKATOUCAN_ _OR GREAT AUNT WILLOUGHBY_  MATILDA’S ears were red and shiny. So were her cheeks. Her hands were red too. This was because Pridmore had washed her. It was not the usual washing, which makes you clean and comfortable, but the “thorough good wash,” which makes you burn and smart till you wish you could be like the poor little savages who do not know anything, and run about bare in the sun, and only go into the water when they are hot. Matilda wished she could have been born in a savage tribe instead of at Brixton. “Little savages,” she said, “don’t have their ears washed thoroughly, and they don’t have new dresses that are prickly in the insides round their arms, and cut them round the neck. Do they, Pridmore?” But Pridmore only said, “Stuff and nonsense,” and then she said, “don’t wriggle so, child, for goodness’ sake.” Pridmore was Matilda’s nursemaid. Matilda sometimes found her trying. Matilda was quite right in believing that savage children do not wear frocks that hurt. It is also true that savage children are not over-washed, over-brushed, over-combed, gloved, booted, and hatted and taken in an omnibus to Streatham to see their Great-aunt Willoughby. This was intended to be Matilda’s fate. Her mother had arranged it. Pridmore had prepared her for it. Matilda, knowing resistance to be vain, had submitted to it. But Destiny had not been consulted, and Destiny had plans of its own for Matilda. When the last button of Matilda’s boots had been fastened (the button-hook always had a nasty temper, especially when it was hurried, and that day it bit a little piece of Matilda’s leg quite spitefully) the wretched child was taken downstairs and put on a chair in the hall to wait while Pridmore popped her own things on. “I shan’t be a minute,” said Pridmore. Matilda knew better. She seated herself to wait, and swung her legs miserably. She had been to her Great-aunt Willoughby’s before, and she knew exactly what to expect. She would be asked about her lessons, and how many marks she had, and whether she had been a good girl. I can’t think why grown-up people don’t see how impertinent these questions are. Suppose you were to answer, “I’m top of my class, Auntie, thank you, and I’m very good. And now let’s have a little talk about you. Aunt, dear, how much money have you got, and have you been scolding the servants again, or have you tried to be good and patient as a properly brought up aunt should be, eh, dear?” [MATILDA SWUNG HER LEGS MISERABLY.] Try this method with one of your aunts next time she begins asking you questions, and write and tell me what she says. Matilda knew exactly what the Aunt Willoughby’s questions would be, and she knew how, when they were answered, her aunt would give her a small biscuit with carraway seeds in it, and then tell her to go with Pridmore and have her hands and face washed again. Then she would be sent to walk in the garden—the garden had a gritty path, and geraniums and calceolarias and lobelias in the beds. You might not pick anything. There would be minced veal at dinner, with three-cornered bits of toast round the dish, and a tapioca pudding. Then the long afternoon with a book, a bound volume of the “Potterer’s Saturday Night”—nasty small print—and all the stories about children who died young because they were too good for this world. Matilda wriggled wretchedly. If she had been a little less uncomfortable she would have cried, but her new frock was too tight and prickly to let her forget it for a moment, even in tears. When Pridmore came down at last, she said, “Fie, for shame! What a sulky face!” And Matilda said, “I’m not.” “Oh, yes you are,” said Pridmore, “you know you are, you don’t appreciate your blessings.” “I wish it was your Aunt Willoughby,” said Matilda. “Nasty, spiteful little thing!” said Pridmore, and she shook Matilda. Then Matilda tried to slap Pridmore, and the two went down the steps not at all pleased with each other. They went down the dull road to the dull omnibus, and Matilda was crying a little. Now Pridmore was a very careful person, though cross, but even the most careful persons make mistakes sometimes—and she must have taken the wrong omnibus, or this story could never have happened, and where should we all have been then? This shows you that even mistakes are sometimes valuable, so do not be hard on grown-up people if they are wrong sometimes. You know after all, it hardly ever happens. It was a very bright green and gold omnibus, and inside the cushions were green and very soft. Matilda and her nursemaid had it all to themselves, and Matilda began to feel more comfortable, especially as she had wriggled till she had burst one of her shoulder-seams and got more room for herself inside her frock. So she said, “I’m sorry I was cross, Priddy dear.” Pridmore said, “So you ought to be.” But she never said _she_ was sorry for being cross. But you must not expect grown-up people to say that. It was certainly the wrong omnibus because instead of jolting slowly along dusty streets, it went quickly and smoothly down a green lane, with flowers in the hedges, and green trees overhead. Matilda was so delighted that she sat quite still, a very rare thing with her. Pridmore was reading a penny story called “The Vengeance of the Lady Constantia,” so she did not notice anything. “I don’t care. I shan’t tell her,” said Matilda, “she’d stop the ’bus as likely as not.” At last the ’bus stopped of its own accord. Pridmore put her story in her pocket and began to get out. “Well, I never!” she said, and got out very quickly and ran round to where the horses were. They were white horses with green harness, and their tails were very long indeed. “Hi, young man!” said Pridmore to the omnibus driver, “you’ve brought us to the wrong place. This isn’t Streatham Common, this isn’t.” The driver was the most beautiful omnibus driver you ever saw, and his clothes were like him in beauty. He had white silk stockings and a ruffled silk shirt of white, and his coat and breeches were green and gold. So was the three-cornered hat which he lifted very politely when Pridmore spoke to him. [HE WAVED AWAY THE EIGHTPENCE.] “I fear,” he said kindly, “that you must have taken, by some unfortunate misunderstanding, the wrong omnibus.” “When does the next go back?” “The omnibus does not go back. It runs from Brixton here once a month, but it doesn’t go back.” “But how does it get to Brixton again, to start again, I mean,” asked Matilda. “We start a new one every time,” said the driver, raising his three-cornered hat once more. “And what becomes of the old ones?” Matilda asked. “Ah,” said the driver, smiling, “that depends. One never knows beforehand, things change so nowadays. Good morning. Thank you so much for your patronage. No, on no account, Madam.” He waved away the eightpence which Pridmore was trying to offer him for the fare from Brixton, and drove quickly off. When they looked round them, no, this was certainly not Streatham Common. The wrong omnibus had brought them to a strange village—the neatest, sweetest, reddest, greenest, cleanest, prettiest village in the world. The houses were grouped round a village green, on which children in pretty loose frocks or smocks were playing happily. ",great aunt ear red shiny cheek hand red wash usual washing clean comfortable thorough wash burn smart wish poor savage run bare sun water hot wish bear savage tribe savage ear wash new dress prickly inside arm cut neck stuff nonsense wriggle child goodness sake nursemaid find try right believe savage child wear frock hurt true savage child wash brush comb glove boot hatt omnibus great aunt intend fate mother arrange prepare resistance vain submit consult plan own last button boot fasten button hook nasty temper hurry day bite piece leg wretched child put chair hall wait pop own thing minute seat wait swing leg great aunt expect ask lesson many mark girl grow person impertinent question suppose answer top class thank let talk aunt dear much money scold servant try patient bring aunt dear swung legs miserably try method aunt next time begin ask question write question answer aunt give small biscuit carraway seed hand face wash send walk garden garden gritty path geranium calceolarias lobelia bed pick mince veal dinner corner bit toast dish tapioca pudding long afternoon book bound volume night nasty small print story child die young world wriggle uncomfortable cry new frock tight prickly let forget moment tear last shame sulky face  appreciate blessing wish nasty spiteful thing shake try slap step pleased other dull road dull omnibus cry careful person cross careful person mistake wrong omnibus story happen show mistake valuable hard grow person wrong happen bright green gold omnibus cushion green soft nursemaid begin feel comfortable wriggle burst shoulder seam more room frock sorry cross dear sorry cross expect grow person wrong omnibus jolt dusty street green lane flower hedge green tree delighted sit rare thing read penny story call notice care stop bus likely last bus stop own accord put story pocket begin run horse white horse green harness tail long young man omnibus driver bring wrong place driver beautiful omnibus driver clothes beauty white silk stocking ruffle silk shirt white coat breeche green gold corner hat lift speak waved fear unfortunate misunderstanding wrong omnibus next omnibus run month start mean ask start new one time driver raise corner hat more become old one ask driver smile depend thing change morning thank much patronage account wave eightpence try offer fare drive wrong omnibus bring strange village neatest sweetest reddest greenest clean prettiest village world house group village green child loose frock smock play 
"Not a tight armhole was to be seen, or even imagined in that happy spot. Matilda swelled herself out and burst three hooks and a bit more of the shoulder seam. The shops seemed a little queer, Matilda thought. The names somehow did not match the things that were to be sold. For instance, where it said “Elias Groves, Tinsmith,” there were loaves and buns in the window, and the shop that had “Baker” over the door, was full of perambulators—the grocer and the wheelwright seemed to have changed names, or shops, or something—and Miss Skimpling, Dressmaker or Milliner, had her shop window full of pork and sausage meat. “What a funny, nice place,” said Matilda. “I am glad we took the wrong omnibus.” A little boy in a yellow smock had come up close to them. “I beg your pardon,” he said very politely, “but all strangers are brought before the king at once. Please follow me.” “Well, of all the impudence,” said Pridmore. “Strangers, indeed! And who may you be, I should like to know?” “I,” said the little boy, bowing very low, “am the Prime Minister. I know I do not look it, but appearances are deceitful. It’s only for a short time. I shall probably be myself again by to-morrow.” Pridmore muttered something which the little boy did not hear. Matilda caught a few words. “Smacked,” “bed,” “bread and water”—familiar words all of them. “If it’s a game,” said Matilda to the boy, “I should like to play.” He frowned. “I advise you to come at once,” he said, so sternly that even Pridmore was a little frightened. “His Majesty’s Palace is in this direction.” He walked away, and Matilda made a sudden jump, dragged her hand out of Pridmore’s, and ran after him. So Pridmore had to follow, still grumbling. The Palace stood in a great green park dotted with white-flowered may-bushes. It was not at all like an English palace, St. James’s or Buckingham Palace, for instance, because it was very beautiful and very clean. When they got in they saw that the Palace was hung with green silk. The footmen had green and gold liveries, and all the courtiers’ clothes were the same colours. Matilda and Pridmore had to wait a few moments while the King changed his sceptre and put on a clean crown, and then they were shown into the Audience Chamber. The King came to meet them. “It is kind of you to have come so far,” he said. “Of _course_ you’ll stay at the Palace?” He looked anxiously at Matilda. “Are you _quite_ comfortable, my dear?” he asked doubtfully. Matilda was very truthful—for a girl. “No,” she said, “my frock cuts me round the arms——” “Ah,” said he, “and you brought no luggage—some of the Princess’s frocks—her old ones perhaps—yes—yes—this person—your maid, no doubt?” A loud laugh rang suddenly through the hall. The King looked uneasily round, as though he expected something to happen. But nothing seemed likely to occur. “Yes,” said Matilda, “Pridmore is—Oh, dear!” For before her eyes she saw an awful change taking place in Pridmore. In an instant all that was left of the original Pridmore were the boots and the hem of her skirt—the top part of her had changed into painted iron and glass, and even as Matilda looked the bit of skirt that was left got flat and hard and square. The two feet turned into four feet, and they were iron feet, and there was no more Pridmore. [THE TOP PART OF PRIDMORE TURNED INTO PAINTED IRON AND GLASS.] “Oh, my poor child,” said the King, “your maid has turned into an Automatic Machine.” It was too true. The maid had turned into a machine such as those which you see in a railway station—greedy, grasping things which take your pennies and give you next to nothing in chocolate and no change. But there was no chocolate to be seen through the glass of the machine that once had been Pridmore. Only little rolls of paper. The King silently handed some pennies to Matilda. She dropped one into the machine and pulled out the little drawer. There was a scroll of paper. Matilda opened it and read— “Don’t be tiresome.” She tried again. This time it was— “If you don’t give over I’ll tell your Ma first thing when she comes home.” The next was— “Go along with you do—always worrying;” so then Matilda _knew_. “Yes,” said the King sadly, “I fear there’s no doubt about it. Your maid has turned into an Automatic Nagging Machine. Never mind, my dear, she’ll be all right to-morrow.” “I like her best like this, thank you,” said Matilda quickly. “I needn’t put in any more pennies, you see.” “Oh, we mustn’t be unkind and neglectful,” said the King gently, and he dropped in a penny. _He_ got— “You tiresome boy, you. Leave me be this minute.” “I can’t help it,” said the King wearily; “you’ve no idea how suddenly things change here. It’s because—but I’ll tell you all about it at tea-time. Go with nurse now, my dear, and see if any of the Princess’s frocks will fit you.” Then a nice, kind, cuddly nurse led Matilda away to the Princess’s apartments, and took off the stiff frock that hurt, and put on a green silk gown, as soft as birds’ breasts, and Matilda kissed her for sheer joy at being so comfortable. “And now, dearie,” said the nurse, “you’d like to see the Princess, wouldn’t you? Take care you don’t hurt yourself with her. She’s rather sharp.” Matilda did not understand this then. Afterwards she did. [THE PRINCESS WAS LIKE A YARD AND A HALF OF WHITE TAPE.] The nurse took her through many marble corridors and up and down many marble steps, and at last they came to a garden full of white roses, and in the middle of it, on a green satin-covered eiderdown, as big as a feather bed, sat the Princess in a white gown. She got up when Matilda came towards her, and it was like seeing a yard and a half of white tape stand up on one end and bow—a yard and a half of broad white tape, of course; but what is considered broad for tape is very narrow indeed for princesses. “How are you?” said Matilda, who had been taught manners. “Very slim indeed, thank you,” said the Princess. And she was. Her face was so white and thin that it looked as though it were made of an oyster-shell. Her hands were thin and white, and her fingers reminded Matilda of fish-bones. Her hair and eyes were black, and Matilda thought she might have been pretty if she had been fatter. When she shook hands with Matilda her bony fingers hurt quite hard. The Princess seemed pleased to see her visitor, and invited her to sit with Her Highness on the satin cushion. “I have to be very careful or I should break,” said she; “that’s why the cushion is so soft, and I can’t play many games for fear of accidents. Do you know any sitting-down games?” The only thing Matilda could think of was Cat’s-cradle, so they played that with the Princess’s green hair-ribbon. Her fish-bony fingers were much cleverer than Matilda’s little fat, pink paws. Matilda looked about her between the games and admired everything very much, and asked questions, of course. There was a very large bird chained to a perch in the middle of a very large cage. Indeed the cage was so big that it took up all one side of the rose-garden. The bird had a yellow crest like a cockatoo and a very large bill like a toucan. (If you do not know what a toucan is you do not deserve ever to go to the Zoological Gardens again.) ",tight armhole imagine happy spot swell burst hook bit more shoulder seam shop seem queer name match thing sell instance loaf bun window shop door full perambulator grocer wheelwright seem change name shop shop window full pork sausage meat funny nice place glad wrong omnibus boy yellow smock beg pardon stranger bring king follow impudence stranger like boy bow low prime appearance deceitful short time mutter boy hear catch few word smack bed bread water familiar word game boy like play frown advise frighten direction walk sudden jump drag hand run follow grumble stand great green park dot white flower bush english palace instance beautiful clean hang green silk footmen green gold livery courtier clothes same colour wait few moment change sceptre put clean crown show meet kind stay comfortable dear ask truthful girl frock cut arm bring luggage frock old one person maid doubt loud laugh ring hall expect happen seem likely occur dear eye awful change place instant leave original boot hem skirt top part change paint iron glass bit skirt leave flat hard square foot turn foot iron foot more top part turned paint poor child maid turn automatic machine true maid turn machine such railway station greedy grasp thing penny give chocolate change chocolate glass machine roll paper hand penny drop machine pull drawer scroll paper open read tiresome try time give first thing next worry fear doubt maid turn automatic nagging machine mind dear right like thank put more penny unkind neglectful drop penny tiresome leave minute help idea thing change tea time nurse dear frock fit nice kind cuddly nurse lead apartment stiff frock hurt put green silk gown soft bird breast kiss sheer joy comfortable nurse like care hurt sharp understand princess yard half white tape nurse many marble corridor many marble step last garden full white rose middle green satin cover eiderdown big feather bed sit white gown yard half white tape stand end bow yard half broad white tape course consider broad tape narrow princess teach manners slim thank face white thin oyster shell hand thin white finger remind fish bone hair eye black fatter shake hand bony finger hurt seem pleased visitor invite sit satin cushion careful break cushion soft play many game fear accident sit game only thing cat cradle play green hair ribbon fish bony finger cleverer fat pink paw game admire ask question course large bird chain perch middle large cage cage big side rose garden bird yellow crest cockatoo large bill toucan toucan deserve zoological 
