id,paragraph,tokens
106,"The Psammead shook its head and answered, ‘I don’t think it’s likely.’",shake head answer think likely 
107,‘Do you?’,
108,‘No.’,
109,"‘Then,’ said Robert, ‘we might as well look for a needle in a bottle of hay. Yes--it IS bottle, and not bundle, Father said so.’",say look needle bottle hay bottle bundle say 
110,"‘Not at all,’ said the Psammead briskly-, ‘you think you know everything, but you are quite mistaken. The first thing is to get the thing to talk.’",say think know mistaken first thing get thing talk 
111,"‘Can it?’ Jane questioned. Jane’s question did not mean that she thought it couldn’t, for in spite of the parlour furniture the feeling of magic was growing deeper and thicker, and seemed to fill the room like a dream of a scented fog.",question question mean think spite parlour furniture feeling magic grow deep thick seem fill room dream scent fog 
112,‘Of course it can. I suppose you can read.’,course suppose read 
113,‘Oh yes!’ Everyone was rather hurt at the question.,hurt question 
114,"‘Well, then--all you’ve got to do is to read the name that’s written on the part of the charm that you’ve got. And as soon as you say the name out loud the thing will have power to do--well, several things.’",get do read name write part charm get say name thing have power do several thing 
115,There was a silence. The red charm was passed from hand to hand.,be silence red charm pass hand hand 
116,"‘There’s no name on it,’ said Cyril at last.",be name say last 
117,"‘Nonsense,’ said the Psammead; ‘what’s that?’",nonsense say 
118,"‘Oh, THAT!’ said Cyril, ‘it’s not reading. It looks like pictures of chickens and snakes and things.’",say read look picture chicken snake thing 
119,This was what was on the charm: [Hieroglyphics omitted.],charm omit 
120,"‘I’ve no patience with you,’ said the Psammead; ‘if you can’t read you must find some one who can. A priest now?’",have patience say read find one priest 
121,"‘We don’t know any priests,’ said Anthea; ‘we know a clergyman--he’s called a priest in the prayer-book, you know--but he only knows Greek and Latin and Hebrew, and this isn’t any of those--I know.’",know priest say know clergyman call priest prayer book know know greek know 
122,The Psammead stamped a furry foot angrily.,stamp furry foot 
123,"‘I wish I’d never seen you,’ it said; ‘you aren’t any more good than so many stone images. Not so much, if I’m to tell the truth. Is there no wise man in your Babylon who can pronounce the names of the Great Ones?’",wish see say good many stone image much tell truth be wise man pronounce name great 
124,"‘There’s a poor learned gentleman upstairs,’ said Anthea, ‘we might try him. He has a lot of stone images in his room, and iron-looking ones too--we peeped in once when he was out. Old Nurse says he doesn’t eat enough to keep a canary alive. He spends it all on stones and things.’",be poor learn gentleman say try have lot stone image room iron look one peep old say eat keep canary alive spend stone thing 
125,"‘Try him,’ said the Psammead, ‘only be careful. If he knows a greater name than this and uses it against you, your charm will be of no use. Bind him first with the chains of honour and upright dealing. And then ask his aid--oh, yes, you’d better all go; you can put me to sand as you go upstairs. I must have a few minutes’ peace and quietness.’",try say careful know great name use charm use bind chain honour upright deal ask aid go put sand go have few minute peace quietness 
126,"So the four children hastily washed their hands and brushed their hair--this was Anthea’s idea--and went up to knock at the door of the ‘poor learned gentleman’, and to ‘bind him with the chains of honour and upright dealing’.",child wash hand brush hair idea go knock door poor learn gentleman bind chain honour upright deal 
127,,
128,,
