id,paragraph,tokens
77,"He was half ashamed of himself for feeling so glad, for Fakrash was a good-natured old thing enough in his way. Only he _would_ overdo things: he had no sense of proportion. ""Why,"" thought Horace, ""if a fellow expressed a modest wish for a canary in a cage he's just the sort of old Jinnee to bring him a whole covey of rocs in an aviary about ten times the size of the Crystal Palace. However, he _does_ understand now that I can't take anything more from him, and he isn't offended either, so _that's_ all settled. Now I can set to work and knock off these plans in peace and quietness.""",half ashamed feel glad good natured old thing way overdo thing have sense proportion think fellow express modest wish canary cage sort old bring whole covey roc aviary time size understand take more offend settle set work knock plan peace quietness 
78,"But he had not done much before he heard sounds in the next room which told him that Beevor had returned at last. He had been expected back from the country for the last day or two, and it was fortunate that he had delayed so long, thought Ventimore, as he went in to see him and to tell him the unexpected piece of good fortune that he himself had met with since they last met. It is needless to say that, in giving his account, he abstained from any mention of the brass bottle or the Jinnee, as unessential elements in his story.",do much hear sound next room tell return last expect country last day fortunate delay think go see tell unexpected piece good fortune meet meet needless say give account abstain mention brass bottle unessential element story 
79,"Beevor's congratulations were quite as cordial as could be expected, as soon as he fully understood that no hoax was intended. ""Well, old man,"" he said, ""I _am_ glad. I really am, you know. To think of a prize like that coming to you the very first time! And you don't even know how this Mr. Wackerbath came to hear of you--just happened to see your name up outside and came in, I expect. Why, I dare say, if I hadn't chanced to go away as I did--and about a couple of paltry two thousand pound houses, too! Ah, well, I don't grudge you your luck, though it _does_ seem rather---- It was worth waiting for; you'll be cutting _me_ out before long--if you don't make a mess of this job. I mean, you know, old chap, if you don't go and give your City man a Gothic castle when what he wants is something with plenty of plate-glass windows and a Corinthian portico. That's the rock I see ahead of _you_. You mustn't mind my giving you a word of warning!""",congratulation cordial expect understand hoax intend old man say glad know think prize come very first time know come hear happen see name come expect say chance go couple paltry pound house grudge luck seem worth wait cut make mess job mean know old chap go give man gothic castle want plenty plate glass window corinthian portico rock see mind give word warning 
80,"""Oh no,"" said Ventimore; ""but I shan't give him either a Gothic castle or plenty of plate-glass. I venture to think he'll be pleased with the general idea as I'm working it out.""",say give gothic castle plenty plate glass venture think pleased general idea work 
81,"""Let's hope so,"" said Beevor. ""If you get into any difficulty, you know,"" he added, with a touch of patronage, ""just you come to me.""",let hope say get difficulty know add touch patronage come 
82,"""Thanks,"" said Horace, ""I will. But I'm getting on very fairly at present.""",thanks say get present 
83,"""I should rather like to see what you've made of it. I might be able to give you a wrinkle here and there.""",like see make able give wrinkle 
84,"""It's awfully good of you, but I think I'd rather you didn't see the plans till they're quite finished,"" said Horace. The truth was that he was perfectly aware that the other would not be in sympathy with his ideas; and Horace, who had just been suffering from a cold fit of depression about his work, rather shrank from any kind of criticism.",good think rather see plan finish say truth aware other sympathy idea suffer cold fit depression work shrank kind criticism 
85,"""Oh, just as you please!"" said Beevor, a little stiffly; ""you always _were_ an obstinate beggar. I've had a certain amount of experience, you know, in my poor little pottering way, and I thought I might possibly have saved you a cropper or two. But if you think you can manage better alone--only don't get bolted with by one of those architectural hobbies of yours, that's all.""",say little obstinate beggar have certain amount experience know poor little potter way think save cropper think manage bolt architectural hobby 
86,"""All right, old fellow. I'll ride my hobby on the curb,"" said Horace, laughing, as he went back to his own office, where he found that all his former certainty and enjoyment of his work had returned to him, and by the end of the day he had made so much progress that his designs needed only a few finishing touches to be complete enough for his client's inspection.",right old fellow ride hobby curb say laugh go own office find former certainty enjoyment work return end day make much progress design need few finish touch complete client inspection 
87,"Better still, on returning to his rooms that evening to change before going to Kensington, he found that the admirable Fakrash had kept his promise--every chest, sack, and bale had been cleared away.",return room evening change go find admirable keep promise chest sack bale clear 
88,"""Them camels come back for the things this afternoon, sir,"" said Mrs. Rapkin, ""and it put me in a fluster at first, for I made sure you'd locked your door and took the key. But I must have been mistook--leastways, them Arabs got in somehow. I hope you meant everything to go back?""",camel come thing afternoon sir say put fluster first make sure lock door take key mistake leastway get hope mean go 
89,"""Quite,"" said Horace; ""I saw the--the person who sent them this morning, and told him there was nothing I cared for enough to keep.""",say see person send morning tell be care keep 
90,"""And like his impidence sending you a lot o' rubbish like that on approval--and on camels, too!"" declared Mrs. Rapkin. ""I'm sure I don't know what them advertising firms will try next--pushing, _I_ call it.""",impidence send lot rubbish approval camel declare sure know advertising firm try push call 
91,"Now that everything was gone, Horace felt a little natural regret and doubt whether he need have been quite so uncompromising in his refusal of the treasures. ""I might have kept some of those tissues and things for Sylvia,"" he thought; ""and she loves pearls. And a prayer-carpet would have pleased the Professor tremendously. But no, after all, it wouldn't have done. Sylvia couldn't go about in pearls the size of new potatoes, and the Professor would only have ragged me for more reckless extravagance. Besides, if I'd taken any of the Jinnee's gifts, he might keep on pouring more in, till I should be just where I was before--or worse off, really, because I couldn't decently refuse them, then. So it's best as it is.""",gone feel little natural regret doubt need uncompromising refusal treasure keep tissue thing think love pearl prayer carpet pleased do go pearl size new potato ragge more reckless extravagance take gift keep pour more bad refuse good 
92,"And really, considering his temperament and the peculiar nature of his position, it is not easy to see how he could have arrived at any other conclusion.",consider temperament peculiar nature position easy see arrive other conclusion 
93,,
94, ,
