id,paragraph,tokens
65,"""I dare say it was, but I wished to speak to you on a much more important matter;"" and Horace briefly explained his object.",say wish speak important matter explain object 
66,"""Dear me,"" said the Professor, rubbing up his hair irritably, ""dear me! I'd no idea of this--no idea at all. I was under the impression that you volunteered to act as escort to my wife and daughter at St. Luc purely out of good nature to relieve me from what--to a man of my habits in that extreme heat--would have been an arduous and distasteful duty.""",say rub hair dear would idea idea impression volunteer act escort wife daughter good nature relieve man habit extreme heat arduous distasteful duty 
67,"""I was not wholly unselfish, I admit,"" said Horace. ""I fell in love with your daughter, sir, the first day I met her--only I felt I had no right, as a poor man with no prospects, to speak to her or you at that time.""",unselfish admit say fall love daughter sir first day meet feel have right poor man prospect speak time 
68,"""A very creditable feeling--but I've yet to learn why you should have overcome it.""",creditable feeling have learn overcome 
69,"So, for the third time, Ventimore told the story of the sudden turn in his fortunes.",third time tell story sudden turn fortune 
70,"""I know this Mr. Samuel Wackerbath by name,"" said the Professor; ""one of the chief partners in the firm of Akers and Coverdale, the great estate agents--a most influential man, if you can only succeed in satisfying him.""",know name say chief partner firm great estate agent influential man succeed satisfy 
71,"""Oh, I don't feel any misgivings about that, sir,"" said Horace. ""I mean to build him a house that will be beyond his wildest expectations, and you see that in a year I shall have earned several thousands, and I need not say that I will make any settlement you think proper when I marry----""",feel misgiving sir say mean build house wild expectation see year earn several thousand say make settlement think proper marry 
72,"""When you are in possession of those thousands,"" remarked the Professor, dryly, ""it will be time enough to talk of marrying and making settlements. Meanwhile, if you and Sylvia choose to consider yourselves engaged, I won't object--only I must insist on having your promise that you won't persuade her to marry you without her mother's and my consent.""",possession thousand remark time talk marry make settlement choose consider engage object insist have promise persuade marry mother consent 
73,"Ventimore gave this undertaking willingly enough, and they returned to the drawing-room. Mrs. Futvoye could hardly avoid asking Horace, in his new character of _fiancé_, to stay and dine, which it need not be said he was only too delighted to do.",give undertaking return draw room avoid ask new character stay dine say delighted do 
74,"""There is one thing, my dear--er--Horace,"" said the Professor, solemnly, after dinner, when the neat parlourmaid had left them at dessert, ""one thing on which I think it my duty to caution you. If you are to justify the confidence we have shown in sanctioning your engagement to Sylvia, you must curb this propensity of yours to needless extravagance.""",be thing dear say dinner neat parlourmaid leave dessert thing think duty caution justify confidence show sanction engagement curb propensity needless extravagance 
75,"""Papa!"" cried Sylvia. ""What _could_ have made you think Horace extravagant?""",cry _could_ make think extravagant 
76,"""Really,"" said Horace, ""I shouldn't have called myself particularly so.""",say call 
77,"""Nobody ever _does_ call himself particularly extravagant,"" retorted the Professor; ""but I observed at St. Luc that you habitually gave fifty centimes as a _pourboire_ when twopence, or even a penny, would have been handsome. And no one with any regard for the value of money would have given a guinea for a worthless brass vessel on the bare chance that it might contain manuscripts, which (as any one could have foreseen) it did not.""",call extravagant retort observe give centime _pourboire_ twopence penny handsome regard value money give guinea worthless brass vessel bare chance contain manuscript one forese 
78,"""But it's not a bad sort of bottle, sir,"" pleaded Horace. ""If you remember, you said yourself the shape was unusual. Why shouldn't it be worth all the money, and more?""",bad sort bottle sir plead remember say shape unusual worth money more 
79,"""To a collector, perhaps,"" said the Professor, with his wonted amiability, ""which you are not. No, I can only call it a senseless and reprehensible waste of money.""",collector say wont amiability call senseless reprehensible waste money 
80,"""Well, the truth is,"" said Horace, ""I bought it with some idea that it might interest _you_.""",truth say buy idea interest _you_ 
81,"""Then you were mistaken, sir. It does _not_ interest me. Why should I be interested in a metal jar which, for anything that appears to the contrary, may have been cast the other day at Birmingham?""",mistaken sir interest interested metal jar appear contrary cast other day 
82,"""But there _is_ something,"" said Horace; ""a seal or inscription of some sort engraved on the cap. Didn't I mention it?""",say seal inscription sort engrave cap mention 
83,"""You said nothing about an inscription before,"" replied the Professor, with rather more interest. ""What is the character--Arabic? Persian? Kufic?""",say inscription reply more interest character arabic persian kufic 
84,"""I really couldn't say--it's almost rubbed out--queer little triangular marks, something like birds' footprints.""",say rub queer little triangular mark bird footprint 
85,"""That sounds like Cuneiform,"" said the Professor, ""which would seem to point to a Phoenician origin. And, as I am acquainted with no Oriental brass earlier than the ninth century of our era, I should regard your description as, _à priori_, distinctly unlikely. However, I should certainly like to have an opportunity of examining the bottle for myself some day.""",sound say seem point phoenician origin acquainted oriental brass ninth century era regard description unlikely like have opportunity examine bottle day 
86,"""Whenever you please, Professor. When can you come?""",come 
87,"""Why, I'm so much occupied all day that I can't say for certain when I can get up to your office again.""",occupy day say certain get office 
88,"""My own days will be fairly full now,"" said Horace; ""and the thing's not at the office, but in my rooms at Vincent Square. Why shouldn't you all come and dine quietly there some evening next week, and then you could examine the inscription comfortably afterwards, you know, Professor, and find out what it really is? Do say you will."" He was eager to have the privilege of entertaining Sylvia in his own rooms for the first time.",own day full say thing office room come dine evening next week examine inscription know find say eager have privilege entertaining own room first time 
89,"""No, no,"" said the Professor; ""I see no reason why you should be troubled with the entire family. I may drop in alone some evening and take the luck of the pot, sir.""",say see reason trouble entire family drop evening take luck pot sir 
90,"""Thank you, papa,"" put in Sylvia; ""but _I_ should like to come too, please, and hear what you think of Horace's bottle. And I'm dying to see his rooms. I believe they're fearfully luxurious.""",thank put like come hear think bottle die see room believe luxurious 
91,"""I trust,"" observed her father, ""that they are far indeed from answering that description. If they did, I should consider it a most unsatisfactory indication of Horace's character.""",trust observe father answer description consider unsatisfactory indication character 
92,"""There's nothing magnificent about them, I assure you,"" said Horace. ""Though it's true I've had them done up, and all that sort of thing, at my own expense--but quite simply. I couldn't afford to spend much on them. But do come and see them. I must have a little dinner, to celebrate my good fortune--it will be so jolly if you'll all three come.""",be magnificent assure say true have do sort thing own expense afford spend much come see have little dinner celebrate good fortune jolly come 
93,"""If we do come,"" stipulated the Professor, ""it must be on the distinct understanding that you don't provide an elaborate banquet. Plain, simple, wholesome food, well cooked, such as we have had this evening, is all that is necessary. More would be ostentatious.""",come stipulate distinct understanding provide elaborate banquet plain simple wholesome food cook such have evening necessary more ostentatious 
94,"""My _dear_ dad!"" protested Sylvia, in distress at this somewhat dictatorial speech. ""Surely you can leave all that to Horace!""",_dear_ dad protest distress dictatorial speech leave 
95,"""Horace, my dear, understands that, in speaking as I did, I was simply treating him as a potential member of my family."" Here Sylvia made a private little grimace. ""No young man who contemplates marrying should allow himself to launch into extravagance on the strength of prospects which, for all he can tell,"" said the Professor, genially, ""may prove fallacious. On the contrary, if his affection is sincere, he will incur as little expense as possible, put by every penny he can save, rather than subject the girl he professes to love to the ordeal of a long engagement. In other words, the truest lover is the best economist.""",dear understand speak treat potential member family make private little grimace young man contemplate marry allow launch extravagance strength prospect tell say prove fallacious contrary affection sincere incur little expense possible put penny save subject girl profess love ordeal long engagement other word truest lover good economist 
96,"""I quite understand, sir,"" said Horace, good-temperedly; ""it would be foolish of me to attempt any ambitious form of entertainment--especially as my landlady, though an excellent plain cook, is not exactly a _cordon bleu_. So you can come to my modest board without misgivings.""",understand sir say good foolish attempt ambitious form entertainment landlady excellent plain cook bleu_ come modest board misgiving 
97,"Before he left, a provisional date for the dinner was fixed for an evening towards the end of the next week, and Horace walked home, treading on air rather than hard paving-stones, and ""striking the stars with his uplifted head.""",leave provisional date dinner fix evening end next week walk tread air hard pave stone strike star uplift head 
98,"The next day he went down to Lipsfield and made the acquaintance of the whole Wackerbath family, who were all enthusiastic about the proposed country house. The site was everything that the most exacting architect could desire, and he came back to town the same evening, having spent a pleasant day and learnt enough of his client's requirements, and--what was even more important--those of his client's wife and daughters, to enable him to begin work upon the sketch-plans the next morning.",next day go make acquaintance whole family enthusiastic propose country house site exacting architect desire come town same evening spend pleasant day learn enough client requirement important client wife daughter enable begin work sketch plan next morning 
99,"He had not been long in his rooms at Vincent Square, and was still agreeably engaged in recalling the docility and ready appreciation with which the Wackerbaths had received his suggestions and rough sketches, their compliments and absolute confidence in his skill, when he had a shock which was as disagreeable as it was certainly unexpected.",long room engage recall docility ready appreciation receive suggestion rough sketche compliment absolute confidence skill have shock disagreeable unexpected 
100,"For the wall before him parted like a film, and through it stepped, smiling benignantly, the green-robed figure of Fakrash-el-Aamash, the Jinnee.",wall part film step smile green robe figure 
101,,
102, ,
