id,paragraph,tokens
1,CHAPTER V. CARTE BLANCHE,
2," When Ventimore woke next morning his headache had gone, and with it the recollection of everything but the wondrous and delightful fact that Sylvia loved him and had promised to be his some day. Her mother, too, was on his side; why should he despair of anything after that? There was the Professor, to be sure--but even he might be brought to consent to an engagement, especially if it turned out that the brass bottle ... and here Horace began to recall an extraordinary dream in connection with that extremely speculative purchase of his. He had dreamed that he had forced the bottle open, and that it proved to contain, not manuscripts, but an elderly Jinnee who alleged that he had been imprisoned there by the order of King Solomon!",wake next morning headache go recollection wondrous delightful fact love promise day mother side despair be sure bring consent engagement turn brass bottle begin recall extraordinary dream connection speculative purchase dream force bottle open prove contain manuscript elderly allege imprison order 
3,"What, he wondered, could have put so grotesque a fancy into his head? and then he smiled as he traced it to Sylvia's playful suggestion that the bottle might contain a ""genie,"" as did the famous jar in the ""Arabian Nights,"" and to her father's pedantic correction of the word to ""Jinnee."" Upon that slight foundation his sleeping brain had built up all that elaborate fabric--a scene so vivid and a story so circumstantial and plausible that, in spite of its extravagance, he could hardly even now persuade himself that it was entirely imaginary. The psychology of dreams is a subject which has a fascinating mystery, even for the least serious student.",wonder put grotesque fancy head smile trace playful suggestion bottle contain genie do famous jar arabian father pedantic correction word slight foundation sleeping brain build elaborate fabric scene vivid story circumstantial plausible spite extravagance persuade imaginary psychology dream subject have fascinating mystery least serious student 
4,"As he entered the sitting-room, where his breakfast awaited him, he looked round, half expecting to find the bottle lying with its lid off in the corner, as he had last seen it in his dream.",enter sitting room breakfast await look half expect find bottle lie lid corner see dream 
5,"Of course, it was not there, and he felt an odd relief. The auction-room people had not delivered it yet, and so much the better, for he had still to ascertain if it had anything inside it; and who knew that it might not contain something more to his advantage than a maundering old Jinnee with a grievance several thousands of years old?",course feel odd relief auction room person deliver much good have ascertain have know contain more advantage maunder old grievance several thousand year old 
6,"Breakfast over, he rang for his landlady, who presently appeared. Mrs. Rapkin was a superior type of her much-abused class. She was scrupulously clean and neat in her person; her sandy hair was so smooth and tightly knotted that it gave her head the colour and shape of a Barcelona nut; she had sharp, beady eyes, nostrils that seemed to smell battle afar off, a wide, thin mouth that apparently closed with a snap, and a dry, whity-brown complexion suggestive of bran.",breakfast ring landlady appear superior type abuse class clean neat person sandy hair smooth knotted give head colour shape nut have sharp beady eye nostril seem smell battle wide thin mouth close snap dry whity brown complexion suggestive bran 
7,"But if somewhat grim of aspect, she was a good soul and devoted to Horace, in whom she took almost a maternal interest, while regretting that he was not what she called ""serious-minded enough"" to get on in the world. Rapkin had wooed and married her when they were both in service, and he still took occasional jobs as an outdoor butler, though Horace suspected that his more staple form of industry was the consumption of gin-and-water and remarkably full-flavoured cigars in the basement parlour.",grim aspect good soul devote take maternal interest regret call serious minded get world wooe marry service take occasional job outdoor butler suspect staple form industry consumption gin water full flavoure cigar basement parlour 
8,"""Shall you be dining in this evening, sir?"" inquired Mrs. Rapkin.",dine evening sir inquire 
9,"""I don't know. Don't get anything in for me; I shall most probably dine at the club,"" said Horace; and Mrs. Rapkin, who had a confirmed belief that all clubs were hotbeds of vice and extravagance, sniffed disapproval. ""By the way,"" he added, ""if a kind of brass pot is sent here, it's all right. I bought it at a sale yesterday. Be careful how you handle it--it's rather old.""",know get dine club say have confirm belief club hotbed vice extravagance sniff disapproval way add kind brass pot send right buy sale yesterday careful handle old 
10,"""There _was_ a vawse come late last night, sir; I don't know if it's that, it's old-fashioned enough.""",vawse come last night sir know old fashioned 
11,"""Then will you bring it up at once, please? I want to see it.""",bring want see 
12,"Mrs. Rapkin retired, to reappear presently with the brass bottle. ""I thought you'd have noticed it when you come in last night, sir,"" she explained, ""for I stood it in the corner, and when I see it this morning it was layin' o' one side and looking that dirty and disrespectable I took it down to give it a good clean, which it wanted it.""",retire reappear brass bottle think notice come last night sir explain stand corner see morning layin o' side look dirty disrespectable take give good clean want 
13,"It certainly looked rather the better for it, and the marks or scratches on the cap were more distinguishable, but Horace was somewhat disconcerted to find that part of his dream was true--the bottle had been there.",look good mark scratch cap distinguishable disconcert find part dream true bottle 
14,"""I hope I've done nothing wrong,"" said Mrs. Rapkin, observing his expression; ""I only used a little warm ale to it, which is a capital thing for brass-work, and gave it a scrub with 'Vitrolia' soap--but it would take more than that to get all the muck off of it.""",hope do wrong say observe expression use little warm ale capital thing brass work give scrub soap take more get muck 
15,"""It is all right, so long as you didn't try to get the top off,"" said Horace.",right try get top say 
16,"""Why, the top _was_ off it, sir. I thought you'd done it with the 'ammer and chisel when you got 'ome,"" said his landlady, staring. ""I found them 'ere on the carpet.""",top _was_ sir think do ammer chisel get ome say landlady stare find carpet 
17,"Horace started. Then _that_ part was true, too! ""Oh, ah,"" he said, ""I believe I did. I'd forgotten. That reminds me. Haven't you let the room above to--to an Oriental gentleman--a native, you know--wears a green turban?""",start part true say believe forget remind let room oriental gentleman native know wear green turban 
18,"""That I most certainly 'ave _not_, Mr. Ventimore,"" said Mrs. Rapkin, with emphasis, ""nor wouldn't. Not if his turbin was all the colours of the rainbow--for I don't 'old with such. Why, there was Rapkin's own sister-in-law let her parlour floor to a Horiental--a Parsee _he_ was, or _one_ o' them Hafrican tribes--and reason she 'ad to repent of it, for all his gold spectacles! Whatever made you fancy I should let to a blackamoor?""",ave say emphasis turbin colour rainbow old such be own sister law let parlour floor _he_ _one_ hafrican tribe reason ad repent gold spectacle make fancy let blackamoor 
19,"""Oh, I thought I saw somebody about--er--answering that description, and I wondered if----""",think see answer description wonder 
20,"""Never in _this_ 'ouse, sir. Mrs. Steggars, next door but one, might let to such, for all I can say to the contrary, not being what you might call particular, and her rooms more suitable to savage notions--but I've enough on _my_ hands, Mr. Ventimore, attending to you--not keeping a girl to do the waiting, as why should I while I'm well able to do it better myself?""",ouse sir next door let such say contrary call particular room suitable savage notion enough _my_ hand attend keep girl do waiting able do 
21,"As soon as she relieved him of her presence, he examined the bottle: there was nothing whatever inside it, which disposed of all the hopes he had entertained from that quarter.",relieve presence examine bottle be dispose hope entertain quarter 
22,It was not difficult to account for the visionary Oriental as an hallucination probably inspired by the heavy fumes (for he now believed in the fumes) which had doubtless resulted from the rapid decomposition of some long-buried spices or similar substances suddenly exposed to the air.,difficult account visionary hallucination inspire heavy fume believe fume result rapid decomposition long bury spice similar substance expose air 
23,"If any further explanation were needed, the accidental blow to the back of his head, together with the latent suggestion from the ""Arabian Nights,"" would amply provide it.",further explanation need accidental blow back head latent suggestion arabian provide 
24,"So, having settled these points to his entire satisfaction, he went to his office in Great Cloister Street, which he now had entirely to himself, and was soon engaged in drafting the specification for Beevor on which he had been working when so fortunately interrupted the day before by the Professor.",settle point entire satisfaction go office great have engage draft specification work interrupt day 
25,"The work was more or less mechanical, and could bring him no credit and little thanks, but Horace had the happy faculty of doing thoroughly whatever he undertook, and as he sat there by his wide-open window he soon became entirely oblivious of all but the task before him.",work more mechanical bring credit little thanks have happy faculty do undertake sit wide open window become oblivious task 
26,"So much so that, even when the light became obscured for a moment, as if by some large and opaque body in passing, he did not look up immediately, and, when he did, was surprised to find the only armchair occupied by a portly person, who seemed to be trying to recover his breath.",much light become obscure moment large opaque body passing look surprise find only armchair occupy portly person seem try recover breath 
27,"""I beg your pardon,"" said Ventimore; ""I never heard you come in.""",beg pardon say hear come 
28,"His visitor could only wave his head in courteous deprecation, under which there seemed a suspicion of bewildered embarrassment. He was a rosy-gilled, spotlessly clean, elderly gentleman, with white whiskers; his eyes, just then slightly protuberant, were shrewd, but genial; he had a wide, jolly mouth and a double chin. He was dressed like a man who is above disguising his prosperity; he wore a large, pear-shaped pearl in his crimson scarf, and had probably only lately discarded his summer white hat and white waistcoat.",visitor wave head courteous deprecation seem suspicion bewilder embarrassment rosy gilled clean elderly gentleman white whisker eye protuberant shrewd genial have wide jolly mouth double chin dress man disguise prosperity wear large pear shape pearl crimson scarf discard summer white hat white waistcoat 
29,"""My dear sir,"" he began, in a rich, throaty voice, as soon as he could speak; ""my dear sir, you must think this is a most unceremonious way of--ah!--dropping in on you--of invading your privacy.""",dear sir begin rich throaty voice speak dear sir think unceremonious way drop invade privacy 
30,"""Not at all,"" said Horace, wondering whether he could possibly intend him to understand that he had come in by the window. ""I'm afraid there was no one to show you in--my clerk is away just now.""",say wonder intend understand come window afraid be show clerk 
31,"""No matter, sir, no matter. I found my way up, as you perceive. The important, I may say the essential, fact is that I _am_ here.""",matter sir matter find way perceive important say essential fact 
32,"""Quite so,"" said Horace, ""and may I ask what brought you?""",say ask bring 
33,"""What brought----"" The stranger's eyes grew fish-like for the moment. ""Allow me, I--I shall come to that--in good time. I am still a little--as you can see."" He glanced round the room. ""You are, I think, an architect, Mr. ah--Mr. um----?""",bring stranger eye grow fish moment allow come good time little see glance room think architect 
34,"""Ventimore is my name,"" said Horace, ""and I _am_ an architect.""",name say architect 
35,"""Ventimore, to be sure!"" he put his hand in his pocket and produced a card: ""Yes, it's all quite correct: I see I have the name here. And an architect, Mr. Ventimore, so I--I am given to understand, of immense ability.""",sure put hand pocket produce card correct see have name architect give understand immense ability 
36,"""I'm afraid I can't claim to be that,"" said Horace, ""but I may call myself fairly competent.""",afraid claim say call competent 
37,"""Competent? Why, of _course_ you're competent. Do you suppose, sir, that I, a practical business man, should come to any one who was _not_ competent?"" he said, with exactly the air of a man trying to convince himself--against his own judgment--that he was acting with the utmost prudence.",competent _course_ competent suppose sir practical business man come one competent say air man try convince own judgment act utmost prudence 
38,"""Am I to understand that some one has been good enough to recommend me to you?"" inquired Horace.",understand one good recommend inquire 
39,"""Certainly not, sir, certainly not. _I_ need no recommendation but my own judgment. I--ah--have a tolerable acquaintance with all that is going on in the art world, and I have come to the conclusion, Mr.--eh--ah--Ventimore, I repeat, the deliberate and unassisted conclusion, that you are the one man living who can do what I want.""",sir need recommendation own judgment have tolerable acquaintance go art world come conclusion repeat deliberate unassist conclusion man live do want 
40,"""Delighted to hear it,"" said Horace, genuinely gratified. ""When did you see any of my designs?""",delight hear say gratified see design 
41,"""Never mind, sir. I don't decide without very good grounds. It doesn't take me long to make up my mind, and when my mind is made up, I act, sir, I act. And, to come to the point, I have a small commission--unworthy, I am quite aware, of your--ah--distinguished talent--which I should like to put in your hands.""",mind sir decide good grounds take make mind mind make act sir act come point have small commission unworthy aware distinguished talent like put hand 
42,"""Is _he_ going to ask me to attend a sale for him?"" thought Horace. ""I'm hanged if I do.""",go ask attend sale think hang 
43,"""I'm rather busy at present,"" he said dubiously, ""as you may see. I'm not sure whether----""",busy present say see sure 
44,"""I'll put the matter in a nutshell, sir--in a nutshell. My name is Wackerbath, Samuel Wackerbath--tolerably well known, if I may say so, in City circles."" Horace, of course, concealed the fact that his visitor's name and fame were unfamiliar to him. ""I've lately bought a few acres on the Hampshire border, near the house I'm living in just now; and I've been thinking--as I was saying to a friend only just now, as we were crossing Westminster Bridge--I've been thinking of building myself a little place there, just a humble, unpretentious home, where I could run down for the weekend and entertain a friend or two in a quiet way, and perhaps live some part of the year. Hitherto I've rented places as I wanted 'em--old family seats and ancestral mansions and so forth: very nice in their way, but I want to feel under a roof of my own. I want to surround myself with the simple comforts, the--ah--unassuming elegance of an English country home. And you're the man--I feel more convinced of it with every word you say--you're the man to do the job in style--ah--to execute the work as it should be done.""",put matter nutshell sir nutshell name know say circle course conceal fact visitor name fame unfamiliar buy few acre border house live think say friend cross think build little place humble unpretentious home run weekend entertain friend quiet way live part year rent place want old family seat ancestral mansion nice way want feel roof own want surround simple comfort unassuming elegance english country home man feel convinced word say man do job style execute work do 
45,"Here was the long-wished-for client at last! And it was satisfactory to feel that he had arrived in the most ordinary and commonplace course, for no one could look at Mr. Samuel Wackerbath and believe for a moment that he was capable of floating through an upper window; he was not in the least that kind of person.",long wish client last satisfactory feel arrive ordinary commonplace course look believe moment capable float upper window least kind person 
46,"""I shall be happy to do my best,"" said Horace, with a calmness that surprised himself. ""Could you give me some idea of the amount you are prepared to spend?""",happy do good say calmness surprise give idea amount prepare spend 
47,"""Well, I'm no Croesus--though I won't say I'm a pauper precisely--and, as I remarked before, I prefer comfort to splendour. I don't think I should be justified in going beyond--well, say sixty thousand.""",say pauper remark prefer comfort splendour think justify go say 
48,"""Sixty thousand!"" exclaimed Horace, who had expected about a tenth of that sum. ""Oh, not _more_ than sixty thousand? I see.""",exclaim expect tenth sum _more_ see 
49,"""I mean, on the house itself,"" explained Mr. Wackerbath; ""there will be outbuildings, lodges, cottages, and so forth, and then some of the rooms I should want specially decorated. Altogether, before we are finished, it may work out at about a hundred thousand. I take it that, with such a margin, you could--ah--run me up something that in a modest way would take the shine out of--I mean to say eclipse--anything in the adjoining counties?""",mean house explain be outbuilding lodge cottage room want decorate finish work take margin run modest way take shine mean say eclipse adjoin county 
50,"""I certainly think,"" said Horace, ""that for such a sum as that I can undertake that you shall have a home which will satisfy you."" And he proceeded to put the usual questions as to site, soil, available building materials, the accommodation that would be required, and so on.",think say sum undertake have home satisfy proceed put usual question site soil available building material accommodation require 
51,"""You're young, sir,"" said Mr. Wackerbath, at the end of the interview, ""but I perceive you are up to all the tricks of the--I _should_ say, versed in the _minutiæ_ of your profession. You would like to run down and look at the ground, eh? Well, that's only reasonable; and my wife and daughters will want to have _their_ say in the matter--no getting on without pleasing the ladies, hey? Now, let me see. To-morrow's Sunday. Why not come down by the 8.45 a.m. to Lipsfield? I'll have a trap, or a brougham and pair, or something, waiting for you--take you over the ground myself, bring you back to lunch with us at Oriel Court, and talk the whole thing thoroughly over. Then we'll send you up to town in the evening, and you can start work the first thing on Monday. That suit you? Very well, then. We'll expect you to-morrow.""",young sir say end interview perceive trick say vers _minutiæ_ profession like run look ground reasonable wife daughter want have say matter get pleasing lady let see come a.m. have trap brougham pair wait take ground bring lunch talk whole thing send town evening start work first thing suit expect 
52,"With this Mr. Wackerbath departed, leaving Horace, as may be imagined, absolutely overwhelmed by the suddenness and completeness of his good fortune. He was no longer one of the unemployed: he had work to do, and, better still, work that would interest him, give him all the scope and opportunity he could wish for. With a client who seemed tractable, and to whom money was clearly no object, he might carry out some of his most ambitious ideas.",depart leave imagine overwhelm suddenness completeness good fortune unemployed have work do work interest give scope opportunity wish client seem tractable money object carry ambitious idea 
53,"Moreover, he would now be in a position to speak to Sylvia's father without fear of a repulse. His commission on £60,000 would be £3,000, and that on the decorations and other work at least as much again--probably more. In a year he could marry without imprudence; in two or three years he might be making a handsome income, for he felt confident that, with such a start, he would soon have as much work as he could undertake.",position speak father fear repulse commission decoration other work least much more year marry imprudence year make handsome income feel confident start have much work undertake 
54,"He was ashamed of himself for ever having lost heart. What were the last few years of weary waiting but probation and preparation for this splendid chance, which had come just when he really needed it, and in the most simple and natural manner?",ashamed lose heart last few year weary waiting probation preparation splendid chance come need simple natural manner 
55,"He loyally completed the work he had promised to do for Beevor, who would have to dispense with his assistance in future, and then he felt too excited and restless to stay in the office, and, after lunching at his club as usual, he promised himself the pleasure of going to Cottesmore Gardens and telling Sylvia his good news.",complete work promise do have dispense assistance future feel excited restless stay office lunch club usual promise pleasure go tell good news 
56,"It was still early, and he walked the whole way, as some vent for his high spirits, enjoying everything with a new zest--the dappled grey and salmon sky before him, the amber, russet, and yellow of the scanty foliage in Kensington Gardens, the pungent scent of fallen chestnuts and acorns and burning leaves, the blue-grey mist stealing between the distant tree-trunks, and then the cheery bustle and brilliancy of the High Street. Finally came the joy of finding Sylvia all alone, and witnessing her frank delight at what he had come to tell her, of feeling her hands on his shoulders, and holding her in his arms, as their lips met for the first time. If on that Saturday afternoon there was a happier man than Horace Ventimore, he would have done well to dissemble his felicity, for fear of incurring the jealousy of the high gods.",early walk whole way vent high spirit enjoy new zest dappled grey salmon sky amber russet yellow scanty foliage pungent scent fall chestnut acorn burning leave blue grey mist steal distant tree trunk cheery bustle brilliancy high come joy find witness frank delight come tell feel hand shoulder hold arm lip meet first time afternoon be happy man do dissemble felicity fear incurr jealousy high god 
57,"When Mrs. Futvoye returned, as she did only too soon, to find her daughter and Horace seated on the same sofa, she did not pretend to be gratified. ""This is taking a most unfair advantage of what I was weak enough to say last night, Mr. Ventimore,"" she began. ""I thought I could have trusted you!""",return find daughter seat same sofa pretend gratified take unfair advantage weak say last night begin think trust 
58,"""I shouldn't have come so soon,"" he said, ""if my position were what it was only yesterday. But it's changed since then, and I venture to hope that even the Professor won't object now to our being regularly engaged."" And he told her of the sudden alteration in his prospects.",come say position yesterday change venture hope object engage tell sudden alteration prospect 
59,"""Well,"" said Mrs. Futvoye, ""you had better speak to my husband about it.""",say speak husband 
60,"The Professor came in shortly afterwards, and Horace immediately requested a few minutes' conversation with him in the study, which was readily granted.",come request few minute conversation study grant 
61,"The study to which the Professor led the way was built out at the back of the house, and crowded with Oriental curios of every age and kind; the furniture had been made by Cairene cabinet-makers, and along the cornices of the book-cases were texts from the Koran, while every chair bore the Arabic for ""Welcome"" in a gilded firework on its leather back; the lamp was a perforated mosque lantern with long pendent glass tubes like hyacinth glasses; a mummy-case smiled from a corner with laboured _bonhomie_.",study lead way build back house crowd oriental curio age kind furniture make cabinet maker cornice book case text chair bear gilded firework leather back lamp perforate mosque lantern long pendent glass tube hyacinth glasses mummy case smile corner laboure _bonhomie_ 
62,"""Well,"" began the Professor, as soon as they were seated, ""so I was not mistaken--there was something in the brass bottle after all, then? Let's have a look at it, whatever it is.""",begin seat mistaken be brass bottle let have look 
63,"For the moment Horace had almost forgotten the bottle. ""Oh!"" he said, ""I--I got it open; but there was nothing in it.""",moment forget bottle say get open be 
64,"""Just as I anticipated, sir,"" said the Professor. ""I told you there couldn't be anything in a bottle of that description; it was simply throwing money away to buy it.""",anticipate sir say tell be bottle description throw money buy 
