id,paragraph,tokens
80,"When they awoke the next morning they found the Strawberry sitting by the Indian woman, who was now quite sensible and collected, although very weak and exhausted. Malachi and Martin went to her, and had a long conversation with her at intervals. Malachi had been right in his supposition; the Angry Snake had discovered her in the act of bending a twig, and had struck her down with his tomahawk. They gained from her the following information. The Angry Snake, irritated at the detention of the Young Otter, and resolved to have another hostage in lieu of him, had carried off Mary Percival. He had six Indians with him, which were the whole of his grown-up warriors. They were now but one day's journey ahead of them, as Miss Percival was very sore on her feet, and they could not get her along, but that in every other respect she had been well treated. That the Indians were not going to their lodges in a direct course, but by a circuitous route, which would make a difference of at least six or seven days; and that they did this that they might not be seen by some other tribes who were located in their direct route, and who might give information. She said that it was she who had written the Indian letter which Malachi had received the autumn before, and that she had done it because she had been so kindly treated by Mr. and Mrs. Campbell, when she had been found in the forest with her ankle sprained. That Percival was at the Indian lodges, quite well when they left, and that if the Angry Snake did not receive a large quantity of powder and shot and a great many rifles in exchange for him, it was his intention to adopt the boy, as he was very partial to him. On being asked if the boy was happy, she replied that he was not at first, but now he was almost an Indian; that he was seldom permitted to leave the lodges, and never unless accompanied by the Angry Snake. In answer to their questions as to the direction and distance to the lodges, she said that they were about seven days' journey by the straight road; but that the party with Miss Percival would not arrive there in less than fifteen days, if so soon, as she was every day less able to travel. Having obtained all this information, a council was held, and Malachi spoke first, having been requested so to do.",awoke next morning find sit indian woman sensible collect weak exhausted go have long conversation interval right supposition angry discover act bending twig strike tomahawk gain follow information angry irritate detention young resolve have hostage lieu carry have whole grow warrior day journey sore foot get other respect treat go lodge direct course circuitous route make difference least day do see other tribe locate direct route give information say write indian letter receive autumn do treat find forest ankle sprain indian lodge leave angry receive large quantity powder shot great many rifle exchange intention adopt boy partial ask boy happy reply first indian permit leave lodge accompany angry answer question direction distance lodge say day journey straight road party arrive less day day able travel obtain information council hold speak request do 
81,"""My opinion is this,"" said Malachi, ""that we can do no better than remain here at present, and wait till the woman is sufficiently recovered to travel, and show us the direct road to the lodges. In two or three days she will probably be well enough to go with us, and then we will take the direct road, and be there before them. The knowledge of the place and the paths will enable us to lay an ambush for them, and to rescue the young lady without much danger to ourselves. They will have no idea of falling in with us, for they of course imagine the woman is dead; a tomahawk seldom fails.""",opinion say do good remain present wait woman recover travel show direct road lodge day enough go take direct road knowledge place path enable lay ambush rescue young lady much danger have idea fall course imagine woman dead tomahawk fail 
82,"After a long parley, the advice of Malachi was considered the most judicious, and a further conversation with the Indian woman confirmed them in their resolution. As they had no fear of the Indians discovering that they were on their trail, Martin and Alfred went out in pursuit of game for provisions, while the others raised up a large hut with branches of trees, for the accommodation of the whole party. In the evening Martin and Alfred returned, carrying a fine buck between them. The fire was lighted, and very soon all were busy cooking and eating. The Indian woman also begged for something to eat, and her recovery was now no longer considered doubtful.",long parley advice consider judicious further conversation indian woman confirm resolution have fear discover trail go pursuit game provision other raise large hut branch tree accommodation whole party evening return carry fine buck fire light busy cook eat indian woman begg eat recovery consider doubtful 
83,,
84, ,
