id,paragraph,tokens
84,"""I will come again after dinner,"" said Myra, and then I whispered something to her. She nodded; she quite understood me. What I said was this:",come dinner say whisper nod understand say 
85,"""I wish you would go downstairs and tell the carved lions that they made me very happy last night, and I _am_ so glad they brought me back here to you, instead of taking me to Green Bank.""",wish go tell carve lion make happy last night glad bring take green 
86,"""Where did they take you to in the night?"" said Myra with great interest, though not at all as if she thought I was talking nonsense.",take night say great interest think talk nonsense 
87,"""I'll tell you all about it afterwards,"" I said. ""It was beautiful. But it would take a long time to tell, and I'm rather tired.""",tell say beautiful take long time tell tired 
88,"""You are looking tired, dear,"" said Miss Fenmore, who heard my last words, as she gave me a cupful of beef-tea. ""Try to go to sleep for a little, and then Myra can come to sit with you again.""",look tired dear say hear last word give cupful beef tea try go sleep little come sit 
89,"I did go to sleep, but Myra was not allowed to see me again that day, nor the next--nor for several days after, except for a very few minutes at a time. For I did not improve as the kind people about me had hoped I would, and Dr. Fallis looked graver when he came that evening than he had done in the morning. Miss Fenmore was afraid she had let me talk too much, but after all I do not think anything would have made any great difference. I had really been falling out of health for months past, and I should probably have got ill in some other way if I had not caught cold in my wanderings. I do not very clearly remember those days of serious illness. I knew whenever I was awake that I was being tenderly cared for, and in the half-dozing, half-dreaming state in which many hours must have been passed, I fancied more than once that mamma was beside me, which made me very happy. And though never actually delirious, I had very strange though not unpleasant dreams, especially about the carved lions; none of them, however, so clear and real as the one I related at full in the last chapter.",go sleep allow see day next several day few minute time improve kind person hope look graver come evening do morning afraid let talk think make great difference fall health month past get ill other way catch cold wandering remember day serious illness know awake care half dozing half dreaming state many hour pass fancy more mamma make happy delirious have strange unpleasant dream carve lion clear real one relate full last chapter 
90,"On the whole, that illness left more peaceful and sweet memories than memories of pain. Through it all I had the delightful feeling of being cared for and protected, and somehow it all seemed to have to do with the pair of lions downstairs in Mr. Cranston's show-room!",whole illness leave more peaceful sweet memory memory pain have delightful feeling care protect seem have do pair lion show room 
91,,
92, ,
