id,paragraph,tokens
42,"This force, having taken Fort Saint David, had operated against Tanjore, where it had suffered a repulse. The news of this reached the Northern Sirkars, soon after the departure of Bussy; and Anandraz, the most powerful chief of the country, rose in rebellion, and sent a messenger to Calcutta, begging the assistance of the English to drive out the French.",force take operate suffer repulse news reach northern departure powerful chief country rise rebellion send messenger begg assistance drive 
43,"While the rest of the Bengal council, seeing that Bengal was, at the time, threatened with invasion from the north, and menaced with troubles within, considered that it would be an act little short of madness to send troops, at a time when they could be so little spared, to assist a chief, who, even from his own accounts, was only able to raise three thousand irregular followers, Clive thought otherwise. He saw the great value of the Northern Sirkars, whose possession would complete the line of British territory, along the seacoast, from Calcutta down to Madras. He saw, too, that a movement here would effect a diversion, in favour of Madras. The situation there appeared very serious, and he could spare no troops which would suffice to turn the scale. But even should Madras be lost, the gain of the Northern Sirkars would almost compensate for the disaster.",rest bengal council see time threaten invasion north menace trouble consider act little short madness send troops time little spare assist chief own account able raise irregular follower think see great value northern possession complete line british territory seacoast see movement effect diversion favour situation appear serious spare troops suffice turn scale lose gain northern compensate disaster 
44,"Having gained the council to his views, he sent Lieutenant Colonel Forde, who commanded the Company's troops in Bengal, with five hundred Europeans, two thousand natives, and six six-pounders, by sea to Vizagapatam, a port which Anandraz had seized. These landed on the 20th of October, 1758.",gain council view send command troops native pounder sea port seize land 20th 
45,"Had Conflans been an efficient officer, he could have crushed Anandraz long before the arrival of the English. He had, under his orders, a force composed of five hundred European troops, men trained by Bussy, and accustomed to victory; four thousand native troops, and a brigade of artillery. Instead of marching at once to crush the rebellion, he sent messenger after messenger to Lally, begging for assistance. It was only when he heard, from Lally, that he had directed Moracin, with three hundred European troops, to support him, that he moved against Anandraz.",efficient officer crush arrival order force compose european troops man train accustom victory native troops brigade artillery march crush rebellion send messenger messenger begg assistance hear direct european troops support move 
46,"His opportunity had, however, slipped from his hands. He had thrown away six weeks; and when, upon the march, the news reached him of the landing of the English, he took up the very strong position within sight of the fort Peddapur, and intrenched himself there.",opportunity slip hand throw week march news reach landing take strong position sight intrench 
47,"Clive had sent to Madras the news that he was despatching Colonel Forde to the Sirkars, and begged that any body of troops who might be available might be forwarded. Charlie's corps had already been recalled towards Madras, to keep the bodies of French who were converging in that direction at a distance, as long as possible, so as to allow the victualling of Madras to go on uninterrupted. Mr. Pigot now instructed Charlie to hand over the command of that force to Peters; and, with fifty men, to make his way north and to effect a junction with Forde, who was entirely deficient in cavalry.",send news despatch begg body troops available forward corps recall keep body converg direction distance possible allow victualling go uninterrupted instruct hand command force man make way effect junction deficient cavalry 
48,"Avoiding the French force, Charlie reached Vizagapatam upon the 2nd of December, and found that Forde had marched on the previous day. He started at once, and on the evening of the 3rd came up to Forde, who had arrived in sight of the French position.",avoid french force reach 2nd find march previous day start evening 3rd come arrive sight french position 
49,"Charlie had already made the acquaintance of Colonel Forde in Bengal, and Forde was glad to obtain the assistance, and advice, of an officer who had seen so much service. An hour after arriving, Charlie rode out with his commander and reconnoitred the French position; which was, they concluded, too strong to be attacked. In point of numbers, the forces were about even. Conflans had, in addition to his five hundred Europeans, six thousand native infantry, five hundred native cavalry, and thirty guns. Forde had four hundred and seventy Europeans, one thousand nine hundred Sepoys, and six guns. Anandraz had forty Europeans, five thousand infantry, five hundred horsemen, and four guns. These five thousand men were, however, a mere ragged mob, of whom very few had firearms, and the rest were armed with bows and arrows. His horsemen were equally worthless, and Forde could only rely upon the troops he had brought with him from Calcutta, and the troop of fifty natives under Charlie Marryat.",make acquaintance glad obtain assistance advice officer see much service hour arrive ride commander reconnoitr french position conclude strong attack point number force addition native infantry native cavalry gun have sepoy gun have infantry horsemen gun man mere ragged mob few have firearm rest armed bow arrow horsemen worthless rely troops bring troop native 
50,"Finding that the French position was too strong to be attacked, Forde fell back to a strong position at Chambol, a village nearly four miles from the French camp. Here, for four days, the two armies remained watching each other, the leaders of both sides considering that the position of the other was too strong to be attacked.",find french position strong attack fall strong position village mile french camp day army remain watch other leader side consider position other strong attack 
51,,
52,,
