id,paragraph,tokens
103,"“And will you try to bear with her, and remember it is right in the main, though it is troublesome?”",try bear remember right main troublesome 
104,"“That I will. I won’t plague you again. I know it is bad for you, you look tired.”",plague know bad look tired 
105,"“Pray don’t leave off telling me,” said Margaret--“it is just what I wish on my own account, and I know it is comfortable to have a good grumble.”",pray leave tell say wish own account know comfortable have good grumble 
106,"“If it does not hurt you, but I am sure you are not easy now--are you?”",hurt sure easy 
107,"“Only my back,” said Margaret. “I have been sitting up longer than usual, and it is tired. Will you call nurse to lay me flat again?”",back say sit usual tired call nurse lay flat 
108,"The nursery was deserted--all were out, and Ethel came back in trepidation at the notion of having to do it herself, though she knew it was only to put one arm to support her sister, while, with the other, she removed the pillows; but Ethel was conscious of her own awkwardness and want of observation, nor had Margaret entire trust in her. Still she was too much fatigued to wait, so Ethel was obliged to do her best. She was careful and frightened, and therefore slow and unsteady. She trusted that all was right, and Margaret tried to believe so, though still uneasy.",nursery desert come trepidation notion have do know put arm support sister other remove pillow conscious own awkwardness want observation have entire trust fatigued wait oblige do good careful frighten slow unsteady trust right try believe uneasy 
109,"Ethel began to read to her, and Dr. May came home. She looked up smiling, and asked where he had been, but it was vain to try to keep him from reading her face. He saw in an instant that something was amiss, and drew from her a confession that her back was aching a little. He knew she might have said a great deal--she was not in a comfortable position--she must be moved. She shook her head--she had rather wait--there was a dread of being again lifted by Ethel that she could not entirely hide. Ethel was distressed, Dr. May was angry, and, no wonder, when he saw Margaret suffer, felt his own inability to help, missed her who had been wont to take all care from his hands, and was vexed to see a tall strong girl of fifteen, with the full use of both arms, and plenty of sense, incapable of giving any assistance, and only doing harm by trying.",begin read come look smile ask vain try keep read face see instant amiss draw confession back ach little know say great deal comfortable position move shake head wait be dread lift hide distress angry wonder see suffer feel own inability help miss wont take care hand vex see tall strong girl full use arm plenty sense incapable give assistance do harm try 
110,"“It is of no use,” said he. “Ethel will give no attention to anything but her books! I’ve a great mind to put an end to all the Latin and Greek! She cares for nothing else.”",use say give attention book have great mind put end latin care else 
111,"Ethel could little brook injustice, and much as she was grieving, she exclaimed, “Papa, papa, I do care--now don’t I, Margaret? I did my best!”",little brook injustice much grieve exclaim care do good 
112,"“Don’t talk nonsense. Your best, indeed! If you had taken the most moderate care--”",talk nonsense good take moderate care 
113,"“I believe Ethel took rather too much care,” said Margaret, much more harassed by the scolding than by the pain. “It will be all right presently. Never mind, dear papa.”",believe take much care say harass scolding pain right mind dear papa 
114,"But he was not only grieved for the present, but anxious for the future; and, though he knew it was bad for Margaret to manifest his displeasure, he could not restrain it, and continued to blame Ethel with enough of injustice to set her on vindication, whereupon he silenced her, by telling her she was making it worse by self-justification when Margaret ought to be quiet. Margaret tried to talk of other things, but was in too much discomfort to exert herself enough to divert his attention.",grieve present anxious future know bad manifest displeasure restrain continue blame enough injustice set vindication silence tell make bad self justification quiet try talk other thing much discomfort exert divert attention 
115,"At last Flora returned, and saw in an instant what was wanted. Margaret was settled in the right posture, but the pain would not immediately depart, and Dr. May soon found out that she had a headache, of which he knew he was at least as guilty as Etheldred could be.",last return see instant want settle right posture pain depart find have headache know least guilty 
116,"Nothing could be done but keep her quiet, and Ethel went away to be miserable; Flora tried to comfort her by saying it was unfortunate, but no doubt there was a knack, and everyone could not manage those things; Margaret was easier now, and as to papa’s anger, he did not always mean all he said.",do keep quiet go miserable try comfort say unfortunate doubt be knack manage thing easy papa anger mean say 
117,"But consolation came at bedtime; Margaret received her with open arms when she went to wish her goodnight. “My poor Ethel,” she said, holding her close, “I am sorry I have made such a fuss.”",consolation come bedtime receive open arm go wish goodnight poor say hold close sorry make fuss 
118,"“Oh, you did not, it was too bad of me--I am grieved; are you quite comfortable now?”",bad grieve comfortable 
119,"“Yes, quite, only a little headache, which I shall sleep off. It has been so nice and quiet. Papa took up George Herbert, and has been reading me choice bits. I don’t think I have enjoyed anything so much since I have been ill.”",little headache sleep nice quiet take read choice bit think enjoy much ill 
120,"“I am glad of that, but I have been unhappy all the evening. I wish I knew what to do. I am out of heart about everything!”",glad unhappy evening wish know do heart 
121,"“Only try to mind and heed, and you will learn. It will be a step if you will only put your shoes side by side when you take them off.”",try mind heed learn step put shoe side side take 
122,"Ethel smiled and sighed, and Margaret whispered, “Don’t grieve about me, but put your clever head to rule your hands, and you will do for home and Cocksmoor too. Good-night, dearest.”",smile sigh whisper grieve put clever head rule hand do home good night dearest 
123,"“I’ve vexed papa,” sighed Ethel--and just then he came into the room.",vex papa sigh come room 
124,"“Papa,” said Margaret, “here’s poor Ethel, not half recovered from her troubles.”",say poor half recover trouble 
125,"He was now at ease about Margaret, and knew he had been harsh to another of his motherless girls.",ease know harsh motherless girl 
126,"“Ah! we must send her to the infant-school, to learn ‘this is my right hand, and this is my left,’” said he, in his half-gay, half-sad manner.",send infant school learn right hand left say half gay half sad manner 
127,"“I was very stupid,” said Ethel.",stupid say 
128,"“Poor child!” said her papa, “she is worse off than I am. If I have but one hand left, she has two left hands.”",poor child say papa bad have hand leave have left hand 
129,"“I do mean to try, papa.”",mean try papa 
130,"“Yes, you must, Ethel. I believe I was hasty with you, my poor girl. I was vexed, and we have no one to smooth us down. I am sorry, my dear, but you must bear with me, for I never learned her ways with you when I might. We will try to have more patience with each other.”",believe hasty poor girl vex have smooth sorry dear bear learn way try have more patience other 
131,"What could Ethel do but hang round his neck and cry, till he said, but tenderly, that they had given Margaret quite disturbance enough to-day, and sent her to bed, vowing to watch each little action, lest she should again give pain to such a father and sister.",do hang neck cry say give disturbance day send bed vow watch little action give pain father sister 
132,,
133, ,
