id,paragraph,tokens
1,CHAPTER XI. ERIC IN COVENTRY,
2,"                     ""And either greet him not      Or else disdainfully, which shall shake him more      Than if not looked on.""--TROILUS AND CRESSIDA, iii. 3.",greet shake look iii. 
3,"Upton, expatriated from his study, was allowed to use one of the smaller class-rooms which were occupied during play-hours by those boys who were too high in the school for ""the boarders' room,"" and who were waiting to succeed to the studies as they fell vacant. There were three or four others with him in this class-room, and although it was less pleasant than his old quarters, it was yet far more comfortable than the Pandemonium of the shell and fourth-form boys.",expatriate study allow use small class room occupy play hour boy high school border room wait succeed study fall vacant be other class room pleasant old quarter comfortable shell fourth form boy 
4,"As a general rule, no boys were allowed to sit in any of the class-rooms except their legitimate occupants. The rule, however, was very generally overlooked, and hence Eric, always glad of an opportunity to escape from the company of Barker and his associates, became a constant frequenter of his friend's new abode. Here they used to make themselves very comfortable. Joining the rest, they would drink coffee or chocolate, and amuse themselves over the fire with Punch, or some warlike novel in a green or yellow cover. One of them very often read aloud to the rest: and Eric, being both a good reader and a merry, intelligent listener, soon became quite a favorite among the other boys.",general rule boy allow sit class room legitimate occupant rule overlook glad opportunity escape company associate become constant frequenter friend new abode use make comfortable roin rest drink coffee chocolate amuse fire punch warlike novel green yellow cover read rest good reader merry intelligent listener become favorite other boy 
5,"Mr. Rose had often seen him sitting there, and left him unmolested; but if ever Mr. Gordon happened to come in and notice him, he invariably turned him out, and after the first offence or two, had several times set him an imposition. This treatment gave fresh intensity to his now deeply-seated disgust at his late master, and his expressions of indignation at ""Gordon's spite"" were loud and frequent.",see sit leave unmolested happen come notice turn first offence have several time set imposition treatment give fresh intensity seat disgust late master expression indignation spite loud frequent 
6,"One day Mr. Gordon had accidentally come in, and found no one there but Upton and Eric; they were standing very harmlessly by the window, with Upton's arm resting kindly on Eric's shoulder as they watched with admiration the net-work of rippled sunbeams that flashed over the sea. Upton had just been telling Eric the splendid phrase [Greek: anêrithmon gelasma pontiôn], which he had stumbled upon in an Aeschylus lesson that morning, and they were trying which would hit on the best rendering of it. Eric stuck up for the literal sublimity of ""the innumerable laughter of the sea,"" while Upton was trying to win him over to ""the many-twinkling smile of ocean."" They were enjoying the discussion, and each stoutly maintaining his own rendering, when Mr. Gordon entered.",day come find stand window arm rest shoulder watch admiration net work ripple sunbeam flash sea tell splendid phrase stumble lesson morning try hit good rendering stick literal sublimity innumerable laughter sea try win many twinkle smile ocean enjoy discussion maintain own rendering enter 
7,"On this occasion he was particularly angry; he had an especial dislike of seeing the two boys together, because he fancied that the younger had grown more than usually conceited and neglectful, since he had been under the fifth-form patronage; and he saw in Eric's presence there, a new case of wilful disobedience.",occasion angry have especial dislike see boy fancy young grow more conceited neglectful fifth form patronage see presence new case wilful disobedience 
8,"""Williams, here _again!_"" he exclaimed sharply. ""Why, sir, you seem to suppose that you may defy rules with impunity! How often have I told you that no one is allowed to sit here, except the regular occupants?""",_again exclaim sir seem suppose defy rule impunity tell allow sit regular occupant 
9,His voice startled the two boys from their pleasant discussion.,voice startle boy pleasant discussion 
10,"""No other master takes any notice of it, sir,"" said Upton.",other master take notice sir say 
11,"""I have nothing to do with other masters, Williams, you will bring me the fourth Georgic, written out by Saturday morning, for your repeated disobedience. Upton, I have a great mind to punish you also, for tempting him to come here.""",have do other master bring fourth write morning repeat disobedience have great mind punish tempting come 
12,"This was a mistake on Mr. Gordon's part, of which Upton took immediate advantage.",mistake part take immediate advantage 
13,"""I have no power to prevent it, sir, if he wishes it. Besides,"" he continued, with annoying blandness of tone, ""it would be inhospitable; and I am too glad of his company.""",have power prevent sir wish continue annoying blandness tone inhospitable glad company 
14,"Eric smiled, and Mr. Gordon frowned. ""Williams, leave the room instantly.""",smile frown leave room 
15,"The boy obeyed slowly and doggedly. ""Mr. Rose never interferes with me, when he sees me here,"" he said as he retreated.",boy obey interfere see say retreat 
16,"""Then I shall request Mr. Rose to do so in future; your conceit and impertinence are getting intolerable.""",request do future conceit impertinence get intolerable 
17,"Eric only answered with a fiery glance; the next minute Upton joined him on the stairs, and Mr. Gordon heard them laughing a little ostentatiously, as they ran out into the playground together. He went away full of strong contempt, and from that moment began to look on the friends as two of the worst boys in the school.",answer fiery glance next minute join stair hear laugh little run playground go full strong contempt moment begin look friend bad boy school 
18,"This incident had happened on Thursday, which was a half-holiday, and instead of being able to join in any of the games, Eric had to spend that weary afternoon in writing away at the fourth Georgic; Upton staying in a part of the time to help him a little, by dictating the lines to him--an occupation not unfrequently interrupted by storms of furious denunciation against Mr. Gordon's injustice and tyranny; Eric vowing ""that he would pay him out somehow yet.""",incident happen half holiday able join game have spend weary afternoon write fourth stay part time help little dictate line occupation interrupt storm furious denunciation injustice tyranny vow pay 
19,"The imposition was not finished that evening, and it again consumed some of the next day's leisure, part of it being written between schools in the forbidden class-room. Still it was not quite finished on Friday afternoon at six, when school ended, and Eric stayed a few minutes behind the rest to scribble off the last ten lines; which done, he banged down the lid of his desk, not locking it, and ran out.",imposition finish evening consume next day leisure part write school forbidden class -room finish afternoon school end stay few minute rest scribble last line do bang lid desk lock run 
20,The next morning an incident happened which involved considerable consequences to some of the actors in my story.,next morning incident happen involve considerable consequence actor story 
21,"Mr. Rose and several other masters had not a room to themselves, like Mr. Gordon, but heard their forms in the great hall. At one end of this hall was a board used for the various school notices, to which there were always affixed two or three pieces of paper containing announcements about examinations and other matters of general interest.",several other master have room hear form great hall end hall board use various school notice affix piece paper contain announcement examination other matter general interest 
22,"On Saturday morning (when Eric was to give up his Georgic), the boys, as they dropped into the hall for morning school, observed a new notice on the board, and, thronging round to see what it was, read these words, written on a half-sheet of paper, attached by wafers to the board--",morning give boy drop hall morning school observe new notice board throng see read word write half sheet paper attach wafer board 
23,"""GORDON IS A SURLY DEVIL.""",surly 
24,"As may be supposed, so completely novel an announcement took them all very much by surprise, and they wondered who had been so audacious as to play this trick. But their wonder was cut short by the entrance of the masters, and they all took their seats, without any one tearing down the dangerous paper.",suppose novel announcement take surprise wonder audacious play trick wonder cut short entrance master take seat one tear dangerous paper 
25,"After a few minutes the eye of the second master, Mr. Ready, fell on the paper, and, going up, he read it, stood for a moment transfixed with astonishment, and then called Mr. Rose.",few minute eye second master fall paper go read stand moment transfixe astonishment call 
26,"Pointing to the inscription, he said: ""I think we had better leave that there, Rose, exactly as it is, till Dr. Rowlands has seen it. Would you mind asking him to step in here?""",point inscription say think have leave see mind ask step 
27,"Just at this juncture Eric came in, having been delayed by Mr. Gordon while he rigidly inspected the imposition. As he took his seat, Montagu, who was next him, whispered--",juncture come delay inspect imposition take seat whisper 
28,"""I say, have you seen the notice-board?""",say see notice board 
29,"""No. Why?""",
30,"""Why, some fellow has been writing up an opinion of Gordon not very favorable.""",fellow write opinion favorable 
31,"""And serve him right, too, brute!"" said Eric, smarting with the memory of his imposition.",serve brute say smart memory imposition 
32,"""Well, there'll be no end of a row; you'll see.""",be end row see 
33,"During this conversation, Dr. Rowlands came in with Mr. Rose. He read the paper, frowned, pondered a moment, and then said to Mr. Rose--""Would you kindly summon the lower school into the hall? As it would be painful to Mr. Gordon to be present, you had better explain to him how matters stand.""",conversation come read paper frown ponder moment say summon low school hall painful present explain matter stand 
34,"""Halloa! here's a rumpus!"" whispered Montagu; ""he never has the lower school down for nothing.""",rumpus whisper have low school 
35,"A noise was heard on the stairs, and in flocked the lower school. When they had ranged themselves on the vacant forms, there was a dead silence and hush of expectation.",noise hear stair flock low school rang vacant form be dead silence hush expectation 
36,"""I have summoned you all together,"" said the Doctor, ""on a most serious occasion. This morning, on coming into the school-room, the masters found that the notice-board had been abused for the purpose of writing up an insult to one of our number, which is at once coarse and wicked. As only a few of you have seen it, it becomes my deeply painful duty to inform you of its purport; the words are these--'Gordon is a surly devil.'""--A _very_ slight titter followed this statement, which was instantly succeeded by a sort of thrilling excitement; but Eric, when he heard the words, started perceptibly, and colored as he caught Montagu's eye fixed on him.",summon say serious occasion morning come school room master find notice board abuse purpose write insult number coarse wicked few see become painful duty inform purport word surly slight titter follow statement succeed sort thrilling excitement hear word start color catch eye fix 
37,"Dr. Rowlands continued--""I suppose this dastardly impertinence has been perpetrated by some boy out of a spirit of revenge. I am perfectly amazed at the unparalleled audacity and meanness of the attempt, and it may be very difficult to discover the author of it. But, depend upon it, discover him _we will_, at whatever cost. Whoever the offender may be, and he must be listening to me at this moment, let him be assured that he shall _not_ be unpunished. His guilty secret shall be torn from him. His punishment can only be mitigated by his instantly yielding himself up.""",continue suppose dastardly impertinence perpetrate boy spirit revenge amazed unparalleled audacity meanness attempt difficult discover author depend discover will_ cost offender listen moment let assure unpunished guilty secret tear punishment mitigate yield 
38,"No one stirred, but during the latter part of this address Eric was so uneasy, and his cheek burned with such hot crimson, that several eyes were upon him, and the suspicions of more than one boy were awakened.",stirr latter part address uneasy cheek burn such hot crimson several eye suspicion more boy awaken 
39,"""Very well,"" said the head master, ""the guilty boy is not inclined to confess. Mark, then; if his name has not been given up to me by to-day week, every indulgence to the school will be forfeited, the next whole holiday stopped, and the coming cricket-match prohibited.""",say head master guilty boy inclined confess name give day week indulgence school forfeit next whole holiday stop come cricket match prohibit 
40,"""The handwriting may be some clue,"" suggested Mr. Ready. ""Would you have any objection to my examining the note-books of the Shell?""",handwriting clue suggest have objection examine note book shell 
41,"""None at all. The Shell-boys are to show their books to Mr. Ready immediately.""",boy show book ready 
42,"The head-boy of the Shell collected the books, and took them to the desk; the three masters glanced casually at about a dozen, and suddenly stopped at one. Eric's heart beat loud, as his saw Mr. Rose point towards him.",head boy collect book take desk master glance stop heart beat see point 
43,"""We have discovered a handwriting which remarkably resembles that on the board. I give the offender one more chance of substituting confession for detection.""",discover handwriting resemble board give offender more chance substitute confession detection 
44,No one stirred; but Montagu felt that his friend was trembling violently.,stirr feel friend tremble 
45,"""Eric Williams, stand out in the room.""",stand room 
46,"Blushing scarlet, and deeply agitated, the boy obeyed",blush scarlet agitated boy obey 
47,"""The writing on the notice is exactly like yours. Do you know anything of this shameful proceeding?""",writing notice know shameful proceeding 
48,"""Nothing, sir,"" he murmured in a low tone.",sir murmure low tone 
49,"""Nothing whatever?""",
50,"""Nothing whatever, sir.""",sir 
51,"Dr. Rowlands' look searched him through and through, and seemed to burn into his heart. He did not meet it, but hung his head. The Doctor felt certain from his manner that he was guilty. He chained him to the spot with his glance for a minute or two, and then said slowly, and with a deep sigh--",look search seem burn heart meet hang head feel certain manner guilty chain spot glance minute say deep sigh 
52,"""Very well; I _hope_ you have spoken the truth; but whether you have or no, we shall soon discover. The school, and especially the upper boys, will remember what I have said. I shall now tear down the insulting notice, and put it into your hands, Avonley, as head of the school, that you may make further inquiries."" He left the room, and the boys resumed their usual avocation till twelve o'clock. But poor Eric could hardly get through his ordinary pursuits; he felt sick and giddy, until everybody noticed his strange embarrassed manner, and random answers.",_hope_ speak truth have discover school upper boy remember say tear insulting notice put hand head school make further inquiry leave room boy resume usual avocation o'clock poor get ordinary pursuit feel sick giddy notice strange embarrass manner random answer 
53,"No sooner had twelve o'clock struck, than the whole school broke up into knots of buzzing and eager talkers.",have o'clock strike whole school break knot buzz eager talker 
54,"""I wonder who did it,"" said a dozen voices at once.",wonder do say voice 
55,"""The writing was undoubtedly Williams',"" suggested some.",writing suggest 
56,"""And did you notice how red and pale he got when the Doctor spoke to him, and how he hung his head?""",notice red pale get speak hang head 
57,"""Yes; and one knows how he hates Gordon.""",know hate 
58,"""Ay; by the bye, Gordon set him a Georgic only on Thursday, and he has been swearing at him ever since.""",bye set swear 
59,"""I noticed that he stayed in after all the rest last night,"" said Barker.",notice stay rest last night say 
60,"""Did he? By Jove, that looks bad.""",look bad 
61,"""Has any one charged him with it?"" asked Duncan.",one charge ask 
62,"""Yes,"" answered one of the group: ""but he's as proud about it as Lucifer, and is furious if you mention it to him. He says we ought to know him better than to think him capable of such a thing.""",answer group proud furious mention say know good think capable thing 
63,"""And quite right, too,"" said Duncan. ""If he did it, he's done something totally unlike what one would have believed possible of him.""",right say do do believe possible 
64,"The various items of evidence were put together, and certainly they seemed to prove a strong case against Eric. In addition to the probabilities already mentioned, it was found that the ink used was of a violet color, and a peculiar kind, which Eric was known to patronise; and not only so, but the wafers with which the paper had been attached to the board were yellow, and exactly of the same size with some which Eric was said to possess. How the latter facts had been discovered, nobody exactly knew, but they began to be very generally whispered throughout the school.",various item evidence put seem prove strong case addition probability mention find ink use violet color peculiar kind know patronise wafer paper attach board yellow same size say possess latter fact discover know begin whisper school 
65,"In short, the almost universal conviction among the boys proclaimed that he was guilty, and many urged him to confess it at once, and save the school from the threatened punishment. But he listened to such suggestions with the most passionate indignation.",short universal conviction boy proclaim guilty many urge confess save school threaten punishment listen such suggestion passionate indignation 
66,"""What!"" he said, angrily, ""tell a wilful lie to blacken my own innocent character? Never!""",say tell wilful lie black own innocent character 
67,"The consequence was, they all began to shun him. Eric was put into Coventry. Very few boys in the school still clung to him, and maintained his innocence in spite of appearances, but they were the boys whom he had most loved and valued, and they were most vigorous in his defence. They were Russell, Montagu, Duncan, Owen, and little Wright.",consequence begin shun put few boy school cling maintain innocence spite appearance boy love value vigorous defence little 
68,"On the evening of the Saturday, Upton had sought out Eric, and said in a very serious tone, ""This is a bad business, Williams. I cannot forget how you have been abusing Gordon lately, and though I won't believe you guilty, yet you ought to explain.""",evening seek say serious tone bad business forget abuse believe guilty explain 
69,"""What? even _you_, then suspect me?"" said Eric, bursting into proud tears. ""Very well. I shan't condescend to _deny_ it. I won't speak to you again till you have repented of mistrusting me;"" and he resolutely rejected all further overtures on Upton's part.",suspect say burst proud tear condescend speak repent mistrust reject further overture part 
70,"He was alone in his misery. Some one, he perceived, had plotted to destroy his character, and he saw too clearly how many causes of suspicion told against him. But it was very bitter to think that the whole school could so readily suppose that he would do a thing which from his soul he abhorred. ""No,"" he thought, ""bad I may be, but I _could_ not have done such a base and cowardly trick.""",alone misery one perceive plot destroy character see many cause suspicion tell bitter think whole school suppose do thing soul abhorr think bad do base cowardly trick 
71,"Never in his life had he been so wretched. He wandered alone to the rocks, and watched the waves dashing against them with the rising tide. The tumult of the weather seemed to relieve and console the tumult of his heart. He drank in strength and defiance from the roar of the waters, and climbed to their very edge along the rocks, where every fresh, rush of the waves enveloped him in white swirls of angry loam. The look of the green, rough, hungry sea, harmonised with his feelings, and he sat down and stared into it, to find relief from the torment of his thoughts.",life wretched wander rock watch wave dash rise tide tumult weather seem relieve console tumult heart drink strength defiance roar water climb very edge rock fresh rush wave envelop white swirl angry loam look green rough hungry sea harmonise feeling sit stare find relief torment thought 
72,"At last, with a deep sigh, he turned away to go back, and meet the crowd of suspicious and unkindly companions, and brood alone over his sorrow in the midst of them. He had not gone many steps, when he caught sight of Russell in the distance. His first impulse was to run away and escape; but Russell determined to stop him, and when he came up, said, ""Dear Eric, I have sought you out on purpose to tell you that _I_ don't suspect you, and have never done so for a moment. I know you too well, my boy, and be sure that _I_ will always stick to you, even if the whole school cut you.""",last deep sigh turn go meet crowd suspicious unkindly companion briod alone sorrow midst go many step catch sight distance first impulse run escape determine stop come say dear seek purpose tell suspect do moment know boy sure stick whole school cut 
73,"""Oh, Edwin, I am _so_ wretched. I needn't tell you that I am quite innocent of this. What have I done to be so suspected? Why, even your cousin Upton won't believe me.""",wretched tell innocent do suspect cousin believe 
74,"""But he does, Eric,"" said Russell; ""he told me so just now, and several others said the same thing.""",say tell several other say same thing 
75,A transient gleam passed over Eric's face.,transient gleam pass face 
76,"""O, I do so long for home again,"" he said. ""Except you, I have no friend.""",do home say have friend 
77,"""Don't say so, Eric. This cloud will soon blow over. Depend upon it, as the Doctor said, we shall discover the offender yet, and the fellows will soon make you reparation for their false suspicions. And you _have_ one friend, Eric,"" he continued, pointing reverently upwards.",say cloud blow depend say discover offender fellow make reparation false suspicion _have_ friend continue point 
78,"Eric was overcome; he sat down on the grass and hid his face till the tears flowed through his closed fingers. Russell sat silent and pitying beside him, and let Eric's head rest upon his shoulder.",overcome sit grass hide face tear flow close finger sit silent pity let head rest shoulder 
79,"When they got home, Eric found three notes in his drawer. One was from Mr. Gordon, and ran thus:--",get find note drawer run 
80,"""I have little doubt, Williams, that you have done this act. Believe me, I feel no anger, only pity for you. Come to me and confess, and I promise, by every means in my power, to befriend and save you.""",have little doubt do act believe feel anger pity come confess promise means power befriend save 
81,"This note he read, and then, stamping on the floor, tore it up furiously into twenty pieces, which he scattered about the room.",note read stamp floor tore piece scatter room 
82,Another was from Mr. Rose;,
83,"""Dear Eric--I _cannot, will_ not, believe you guilty, although appearances look very black. You have many faults, but I feel sure that I cannot be mistaken in supposing you too noble-minded for a revenge so petty and so mean. Come to me, dear boy, if I can help you in any way. I _trust you_, Eric, and will use every endeavor to right you in the general estimation. You are innocent; pray to God for help under this cruel trial, and be sure that your character will yet be cleared.--Affectionately yours, WALTER ROSE.""",dear believe guilty appearance look black have many fault feel sure mistaken suppose noble minded revenge petty mean come dear boy help way _trust use endeavor right general estimation innocent pray help cruel trial sure character clear rose 
84,"""_P.S._--I can easily understand that just now you will like quiet; come and sit with me in the library as much as you like.""",understand like quiet come sit library like 
85,"He read this note two or three times with grateful emotion, and at that moment would have died for Mr. Rose. The third note was from Owen, as follows:--",read note time grateful emotion moment die third note follow 
86,"""Dear Williams--We have been cool to each other lately; naturally, perhaps. But yet I think that it will be some consolation to you to be told, even by a rival, that I, for one, feel certain of your innocence. If you want company, I shall be delighted now to walk with you.--Yours truly, D. OWEN.""",dear cool other think consolation tell rival feel certain innocence want company delight walk 
