id,paragraph,tokens
87,"This note, too, brought much comfort to the poor boy's lonely and passionate heart. He put it into his pocket, and determined at once to accept Mr. Rose's kind offer of allowing him to sit for the present in the library.",note bring much comfort poor boy lonely passionate heart put pocket determine accept kind offer allow sit present library 
88,"There were several boys in the room while he was reading his notes, but none of them spoke to him, and he was too proud to notice them, or interrupt the constrained silence. As he went out he met Duncan and Montagu, who at once addressed him in the hearing of the rest.",be several boy room read note speak proud notice interrupt constrain silence go meet address hearing rest 
89,"""Ha! Williams,"" said Duncan, ""we have been looking everywhere for you, dear fellow. Cheer up, you shall be cleared yet. I, for one, and Monty for another, will maintain your innocence before the whole school.""",say look dear fellow cheer clear maintain innocence whole school 
90,"Montagu _said_ nothing, but Eric understood full well the trustful kindness of his soft pressure of the hand. His heart was too full to speak, and he went on towards the library.",understand full trustful kindness soft pressure hand heart full speak go library 
91,"""I wonder at your speaking to that fellow,"" said Bull, as the two new comers joined the group at the fire-place.",wonder speak fellow say new comer join group fire place 
92,"""You will be yourself ashamed of having ever suspected him before long,"" said Montagu warmly; ""ay, the whole lot of you; and you are very unkind to condemn him before you are certain.""",ashamed suspect say whole lot unkind condemn certain 
93,"""I wish you joy of your _friend_, Duncan,"" sneered Barker.",wish joy sneer 
94,"""Friend?"" said Duncan, firing up; ""yes! he is my friend, and I'm not ashamed of him. It would be well for the school if _all_ the fellows were as honorable as Williams.""",friend say fire friend ashamed school fellow honorable 
95,"Barker took the hint, and although he was too brazen to blush, thought it better to say no more.",take hint brazen blush think good say more 
96,,
97,,
