id,paragraph,tokens
1,The Tale of the Flopsy Bunnies Beatrix Potter,
2,    FOR ALL LITTLE FRIENDS,little frilnd 
3,    OF,
4,    MR. MCGREGOR & PETER & BENJAMIN,
5,BOOK 1.,
6," It is said that the effect of eating too much lettuce is ""soporific.""",say effect eat much lettuce soporific 
7,_I_ have never felt sleepy after eating lettuces; but then _I_ am not a rabbit.,feel sleepy eat lettuce rabbit 
8,They certainly had a very soporific effect upon the Flopsy Bunnies!,have soporific effect bunny 
9,"When Benjamin Bunny grew up, he married his Cousin Flopsy. They had a large family, and they were very improvident and cheerful.",grow marry cousin have large family improvident cheerful 
10,"I do not remember the separate names of their children; they were generally called the ""Flopsy Bunnies.""",remember separate name child call 
11,,
12,"As there was not always quite enough to eat,--Benjamin used to borrow cabbages from Flopsy's brother, Peter Rabbit, who kept a nursery garden.",be enough eat use borrow cabbage brother keep nursery garden 
13,Sometimes Peter Rabbit had no cabbages to spare.,have cabbage spare 
14,,
15,"When this happened, the Flopsy Bunnies went across the field to a rubbish heap, in the ditch outside Mr. McGregor's garden.",happen go field rubbish heap ditch garden 
16,"Mr. McGregor's rubbish heap was a mixture. There were jam pots and paper bags, and mountains of chopped grass from the mowing machine (which always tasted oily), and some rotten vegetable marrows and an old boot or two. One day--oh joy!--there were a quantity of overgrown lettuces, which had ""shot"" into flower.",rubbish heap mixture be jam pot paper bag mountain choppe grass mowing machine taste oily rotten vegetable marrow old boot day joy be quantity overgrown lettuce have shot flower 
17," The Flopsy Bunnies simply stuffed lettuces. By degrees, one after another, they were overcome with slumber, and lay down in the mown grass.",stuff lettuce degree overcome slumber lay mown grass 
18,Benjamin was not so much overcome as his children. Before going to sleep he was sufficiently wide awake to put a paper bag over his head to keep off the flies.,overcome child go sleep wide awake put paper bag head keep fly 
19,"The little Flopsy Bunnies slept delightfully in the warm sun. From the lawn beyond the garden came the distant clacketty sound of the mowing machine. The bluebottles buzzed about the wall, and a little old mouse picked over the rubbish among the jam pots.",little sleep warm sun lawn garden come distant clacketty sound mowing machine bluebottle buzz wall little old mouse pick rubbish jam pot 
20,"(I can tell you her name, she was called Thomasina Tittlemouse, a woodmouse with a long tail.)",tell name call woodmouse long tail 
21,,
22,"She rustled across the paper bag, and awakened Benjamin Bunny.",rustle paper bag awaken 
23,"The mouse apologized profusely, and said that she knew Peter Rabbit.",mouse apologize say know 
24,"While she and Benjamin were talking, close under the wall, they heard a heavy tread above their heads; and suddenly Mr. McGregor emptied out a sackful of lawn mowings right upon the top of the sleeping Flopsy Bunnies! Benjamin shrank down under his paper bag. The mouse hid in a jam pot.",talk wall hear heavy tread head empty sackful lawn mowing top sleeping shrank paper bag mouse hide jam pot 
25,,
26,The little rabbits smiled sweetly in their sleep under the shower of grass; they did not awake because the lettuces had been so soporific.,little rabbit smile sleep shower grass awake lettuce soporific 
27,They dreamt that their mother Flopsy was tucking them up in a hay bed.,dreamt mother tuck hay bed 
28,Mr. McGregor looked down after emptying his sack. He saw some funny little brown tips of ears sticking up through the lawn mowings. He stared at them for some time.,look empty sack see funny little brown tip ear stick lawn mowing stare time 
29,Presently a fly settled on one of them and it moved.,fly settle move 
30,Mr. McGregor climbed down on to the rubbish heap--,climb rubbish heap 
31,"""One, two, three, four! five! six leetle rabbits!"" said he as he dropped them into his sack. The Flopsy Bunnies dreamt that their mother was turning them over in bed. They stirred a little in their sleep, but still they did not wake up.",leetle rabbit say drop sack dreamt mother turn bed stirr little sleep wake 
32,,
33,Mr. McGregor tied up the sack and left it on the wall.,tie sack leave wall 
34,He went to put away the mowing machine.,go put mowing machine 
35,"While he was gone, Mrs. Flopsy Bunny (who had remained at home) came across the field.",gone remain home come field 
36,She looked suspiciously at the sack and wondered where everybody was?,look sack wonder 
37," Then the mouse came out of her jam pot, and Benjamin took the paper bag off his head, and they told the doleful tale.",mouse come jam pot take paper bag head tell doleful tale 
38,"Benjamin and Flopsy were in despair, they could not undo the string.",despair undo string 
39,But Mrs. Tittlemouse was a resourceful person. She nibbled a hole in the bottom corner of the sack.,resourceful person nibble hole bottom corner sack 
40, The little rabbits were pulled out and pinched to wake them.,little rabbit pull pinch wake 
41,"Their parents stuffed the empty sack with three rotten vegetable marrows, an old blacking-brush and two decayed turnips.",parent stuff empty sack rotten vegetable marrow old blacking brush decay turnip 
42, Then they all hid under a bush and watched for Mr. McGregor.,hide bush watch 
43," Mr. McGregor came back and picked up the sack, and carried it off.",come pick sack carry 
44,"He carried it hanging down, as if it were rather heavy.",carry hang heavy 
45,The Flopsy Bunnies followed at a safe distance.,follow safe distance 
46, The watched him go into his house.,watch go house 
47,And then they crept up to the window to listen.,creep window listen 
48," Mr. McGregor threw down the sack on the stone floor in a way that would have been extremely painful to the Flopsy Bunnies, if they had happened to have been inside it.",throw sack stone floor way painful happen 
49,"They could hear him drag his chair on the flags, and chuckle--",hear drag chair flag chuckle 
50,"""One, two, three, four, five, six leetle rabbits!"" said Mr. McGregor.",leetle rabbit say 
51,,
52,"""Eh? What's that? What have they been spoiling now?"" enquired Mrs. McGregor.",spoil enquire 
53,"""One, two, three, four, five, six leetle fat rabbits!"" repeated Mr. McGregor, counting on his fingers--""one, two, three--""",leetle fat rabbit repeat count finger 
54,"""Don't you be silly; what do you mean, you silly old man?""",silly mean silly old man 
55,"""In the sack! one, two, three, four, five, six!"" replied Mr. McGregor.",sack reply 
56,(The youngest Flopsy Bunny got upon the window-sill.),young get window sill 
57,"Mrs. McGregor took hold of the sack and felt it. She said she could feel six, but they must be _old_ rabbits, because they were so hard and all different shapes.",take hold sack feel say feel _old_ rabbit hard different shape 
58,"""Not fit to eat; but the skins will do fine to line my old cloak.""",fit eat skin do fine line old cloak 
59,"""Line your old cloak?"" shouted Mr. McGregor--""I shall sell them and buy myself baccy!""",line old cloak shout sell buy baccy 
60,"""Rabbit tobacco! I shall skin them and cut off their heads.""",rabbit tobacco skin cut head 
61, Mrs. McGregor untied the sack and put her hand inside.,unty sack put hand 
62,"When she felt the vegetables she became very very angry. She said that Mr. McGregor had ""done it a purpose.""",feel vegetable become angry say do purpose 
63," And Mr. McGregor was very angry too. One of the rotten marrows came flying through the kitchen window, and hit the youngest Flopsy Bunny.",angry rotten marrow come fly kitchen window hit young 
64,It was rather hurt.,hurt 
65, Then Benjamin and Flopsy thought that it was time to go home.,think time go 
66," So Mr. McGregor did not get his tobacco, and Mrs. McGregor did not get her rabbit skins.",get tobacco get rabbit skin 
67," But next Christmas Thomasina Tittlemouse got a present of enough rabbit-wool to make herself a cloak and a hood, and a handsome muff and a pair of warm mittens.",next get present enough rabbit wool make cloak hood handsome muff pair warm mitten 
68, ,
