id,paragraph,tokens
30,"""Master Harry, I would go round the wide world to serve any one of you! who else have I to care for? But it was chiefly to see Master Frank. Let us hope the best, and pray to be prepared for any event that may come. All things are ordained for good, and we can only make the best of what happens. The world must go round,--it must go round, and we can't prevent it.""",go wide world serve have care see let hope good pray prepare event come thing ordain good make good happen world go go prevent 
31,"Harry and Laura hung their heads in dismay, for there was something agitated and solemn in Mrs. Crabtree's manner, which astonished and shocked them, so they hurried silently to bed; and Laura's pillow was drenched with tears of anxiety and distress that night, though gradually, as she thought of Frank's bright colour and sparkling eyes, his joyous spirits and unbroken health, it seemed impossible that all were so soon to fade away, that the wind should have already passed over them, and they were gone, till by degrees her mind became more calm; her hopes grew into certainties; she told herself twenty times over, that Mrs. Crabtree must be entirely mistaken, and at last sunk into a restless agitated slumber.",hang head dismay be agitated solemn manner astonished shock hurry bed pillow drench tear anxiety distress night think bright colour sparkling eye joyous spirit unbroken health seem impossible fade wind pass gone degree mind become calm hope grow certainty tell time mistaken last sink restless agitate slumber 
32,"Next day the sun shone, the sky was clear, and every thing appeared so full of life and joy, that Harry and Laura would have fancied the whole scene with Mrs. Crabtree a distressing dream, had they not been awakened to recollection before six in the morning, by the sound of her voice, angrily rebuking Miss Perceval and other ladies, who with too good reason, were grumbling at the hardship of sleeping, or rather vainly attempting to sleep, in such narrow uncomfortable dog-holes. Laura heard Mrs. Crabtree conclude an eloquent oration on the subject of contentment, by saying, ""Indeed, ladies! many a brave man, and noblemen's sons too, have laid their heads on the green grass, fighting for you, so we should put up with a hard bed patiently for one night.""",next day sun shine sky clear thing appear full life joy fancy whole scene distressing dream awaken recollection morning sound voice rebuke other lady good reason grumble hardship sleeping attempt sleep such narrow uncomfortable dog hole hear conclude eloquent oration subject contentment say lady many brave man noblemen son lay head green grass fight put hard bed night 
33,"Miss Perceval turned angrily away, and summoned her maid to receive a multitude of new directions. ""Mary, tell the Captain that when I looked out last, there was scarcely any smoke coming out of the funnel, so I am sure he is saving fuel, and not keeping good enough fires to carry us on! I never knew such shabbiness! Tell the engineer, that I insist on his throwing on more coals immediately. Bring me some hot water, as fast as possible! These towels are so coarse, I cannot, on any account, use them. After being accustomed to such pocket-handkerchiefs as mine, at ten guineas each, one does become particular. Can you not find a larger basin? This looks like a soup-plate, and it seems impossible here to get enough of hot water to wash comfortably.""",turn summon maid receive multitude new direction tell look last be smoke come funnel sure save fuel keep good enough fire carry know such shabbiness tell engineer insist throw more coal bring hot water possible towel coarse account use accustom such pocket handkerchief guinea become particular find large basin look soup plate seem impossible get enough hot water wash 
34,"""She should be put into the boiler of the steam-boat,"" muttered Mrs. Crabtree. ""I wish them animal-magnifying doctors would put the young lady to sleep till we arrive in London.""",put boiler steam boat mutter wish animal magnify doctor put young lady sleep arrive 
35,"""Now!"" continued Miss Perceval, ""get me another cup of tea. The last was too sweet, the one before not strong enough, and the first half cold, but this is worse than any. Do remember to mention, that yesterday night the steward sent up a tin tea-pot, a thing I cannot possibly suffer again. We must have the urn, too, instead of that black tea-kettle; and desire him to prepare some butter-toast--I am not hungry, so three rounds will be enough. Let me have some green tea this time; and see that the cream is better than last night, when I am certain it was thickened with chalk or snails. The jelly, too, was execrable, for it tasted like sticking-plaster--I shall starve if better can't be had; and the table-cloth looked like a pair of old sheets. Tell the steward all this, and say, he must get my breakfast ready on deck in half an hour; but meantime, I shall sit here with a book while you brush my hair.""",continue get cup tea last sweet one strong first half cold bad remember mention yesterday night steward send tin tea pot thing suffer have urn black tea- kettle desire prepare butter toast hungry round enough let have green tea time see cream good last night certain thicken chalk snail jelly execrable taste stick plaster starve good have table cloth look pair old sheet tell steward say get breakfast ready deck hour meantime sit book brush hair 
36,"The sick persecuted maid seemed anxious to do all she was bid; so, after delivering as many of the messages as possible, she tried to stand up and do Miss Perceval's hair, but the motion of the vessel had greatly increased, and she turned as pale as death, apparently on the point of sinking to the ground, when Laura, now quite dressed, quietly slipped the brush out of her hand, and carefully brushed Miss Perceval's thin locks, while poor Mary silently dropped upon a seat, being perfectly faint with sickness.",sick persecute maid seem anxious do bid deliver many message possible try stand do hair motion vessel increase turn pale death point sink ground dress slip brush hand brush thin lock poor drop seat faint sickness 
37,"Miss Perceval read on, without observing the change of abigails, till Harry, who had watched this whole scene from the cabin-door, made a hissing noise, such as grooms do when they currycomb a horse, which caused the young lady to look hastily round, when great was Miss Perceval's astonishment to discover her new abigail, with a very pains-taking look, brushing her hair, while poor Mary lay more dead than alive on the benches. ""Well! I declare! was there ever anything so odd!"" she exclaimed in a voice of amazement. ""How very strange! What can be the matter with Mary! There is no end to the plague of servants!""",read observe change abigail watch whole scene cabin door make hiss noise such groom do currycomb horse cause young lady look great astonishment discover new abigail pain take look brush hair poor lay dead alive bench declare be odd exclaim voice amazement strange matter be end plague servant 
38,"""Or rather to the plague of mistresses!"" thought Laura, while she glanced from Miss Perceval's round, red bustling face, to the poor suffering maid, who became worse and worse during the day, for there came on what sailors call ""a capful of wind,"" which gradually rose to a ""stiff breeze,"" or, what the passengers considered a hurricane; and, towards night, it attained the dignity of a real undeniable ""storm."" A scene of indescribable tumult then ensued. The Captain attempted to make his voice heard above the roaring tempest, using a torrent of unintelligible nautical phrases, and an incessant volley of very intelligible oaths. The sailors flew about, and every plank in the vessel seemed creaking and straining, but high above all, the shrill tones of Miss Perceval were audibly heard, exclaiming,",plague mistress think glance round red bustle face poor suffering maid become bad bad day come sailor call capful wind rise stiff breeze passenger consider hurricane night attain dignity real undeniable storm scene indescribable tumult ensue attempt make voice hear roar tempest use torrent unintelligible nautical phrase incessant volley intelligible oath sailor fly plank vessel seem creak strain high shrill tone hear exclaim 
39,"""Are there enough of 'hands' on board? Is there any danger? Are you sure the boiler will not burst? I wish steam-boats had never been invented! People are sure to be blown up to the clouds, or sunk to the bottom of the ocean, or scalded to death like so many lobsters. I cannot stand this any longer! Stop the ship, and set me on shore instantly!""",be enough hand board be danger sure boiler burst wish steam boat invent person sure blow cloud sink bottom ocean scald death many lobster stand stop ship set shore 
40,"Laura clung closer to Harry, and felt that they were like two mere pigmies, amid the wide waste of waters, rolling and tossing around them, while his spirits, on the contrary, rose to the highest pitch of excitement with all he heard and saw, till at length, wishing to enjoy more of the ""fun,"" he determined to venture above board. By the time Harry's nose was on a level with the deck, he gazed around, and saw that not a person appeared visible except two sailors, both lashed to the helm, while all was silent now, except the deafening noise made by the wild waves and the stormy blast, which seemed as if it would blow his teeth down his throat. Harry thought the two men looked no larger than mice in such a scene, and stood, clinging to the bannisters, perfectly entranced with astonishment and admiration at the novelty of all he saw, and thinking how often Frank must have been in such scenes, when suddenly a wave washed quite over the deck, and he felt his arm grasped by Mrs. Crabtree, who desired him to come down immediately, in a tone of authority which he did not even yet feel bold enough to disobey; therefore, slowly and reluctantly he descended to the cabin, where the only living thing that seemed well enough to move, was Miss Perceval's tongue.",cling feel mere pigmy wide waste water roll toss spirit contrary rise high pitch excitement hear see length wish enjoy more fun determine venture board time nose level deck gaze see person appear visible sailor lash helm silent deafening noise make wild wave stormy blast seem blow tooth throat think man look large mouse scene stand cling bannister entrance astonishment admiration novelty see think such scene wave wash deck feel arm grasp desire come tone authority feel bold disobey descend cabin only living thing seem move tongue 
41,"""Steward!"" she cried, in sharp angry accents. ""Steward! here is water pouring down the sky-lights like a shower-bath! Look at my band-box swimming on the floor! Mary! Tiresome creature! don't you see that? My best bonnet will be destroyed! Send the Captain here! He must positively stop that noise on deck; it is quite intolerable. My head aches, as if it would burst like the boiler of a steam-boat! Stupid man! Can't he put into some port, or cast anchor? How can he keep us all uncomfortable in this way! Mary! Mary, I say! are you deaf? Steward! send one of the sailors here to take care of this dog! I declare poor Frisk is going to be sick! Mary! Mary! This is insufferable! I wish the Captain would come and help me to scold my maid! I shall certainly give you warning, Mary.""",steward cry sharp angry accent steward water pour sky light shower bath look band box swim floor tiresome creature see good bonnet destroy send stop noise deck intolerable head ache burst boiler steam boat stupid man put port cast anchor keep uncomfortable way say deaf steward send sailor take care dog declare poor go sick insufferable wish come help scold maid give warning 
42,"This awful threat had but little effect on one who thought herself on the brink of being buried beneath the waves, besides being too sick to care whether she died the next minute or not; and even Miss Perceval's voice became drowned at last in the tremendous storm which raged throughout the night, during which the Captain rather increased Laura's panic, if that were possible, by considerately putting his head into the cabin now and then to say, ""Don't be afraid, ladies! There is no danger!""",awful threat have little effect think brink bury wave sick care die next minute voice become drown last tremendous storm rage night increase panic possible put head cabin say afraid lady be danger 
43,"""But I must come up and see what you are about, Captain!"" exclaimed Miss Perceval.",come see exclaim 
44,"""You had better be still, ma'am,"" replied Mrs. Crabtree. ""It is as well to be drowned in bed as on deck.""",have good reply drown bed deck 
45,"Nothing gives a more awful idea of the helplessness of man, and the wrath of God, than a tempestuous sea during the gloom of midnight; and every mind on board became awed into silence and solemnity during this war of elements, till at length, towards morning, while the hurricane seemed yet raging with undiminished fury, Laura suddenly gave an exclamation of rapture, on hearing a sailor at the helm begin to sing Tom Bowling. ""Now I feel sure the danger is over,"" said she, ""otherwise that man could not have the heart to sing! If I live a century, I shall always like a sailor's song for the future.""",give awful idea helplessness man wrath tempestuous sea gloom midnight mind board become awe silence solemnity war element length morning hurricane seem rage undiminished fury give exclamation rapture hear sailor helm begin sing feel sure danger say man have heart sing live century like sailor song future 
46,"It is seldom that any person's thankfulness after danger bears a fair proportion to the fear they felt while it lasted; but Harry and Laura had been taught to remember where their gratitude was due, and felt it the more deeply next day, when they entered the Yarmouth Roads, and were shewn the masts of several vessels, appearing partly above the water, which had on various occasions, been lost in that wilderness of shoals, where so many melancholy catastrophes have occurred.",seldom person thankfulness danger bear fair proportion fear feel last teach remember gratitude due feel next day enter shew mast several vessel appear water have various occasion lose wilderness shoal many melancholy catastrophe occur 
47,"After sailing up the Thames, and duly staring at Greenwich hospital, the hulks, and the Tower of London, they landed at last; and having offered Mrs. Crabtree a place in the hackney coach, they hurried impatiently into it, eager for the happy moment of meeting with Frank. Harry, in his ardour, thought that no carriage had ever driven so slowly before. He wished there had been a rail-road through the town; and far from wasting a thought upon the novelties of Holborn or Piccadilly, he and Laura gained no idea of the metropolis, more distinct than that of the Irishman who complained he could not see London for the quantity of houses. One only idea filled their hearts, and brightened their countenances, while they looked at each other with a smile of delight, saying, ""now, at last, we are going to see Frank!""",sail stare hospital hulk land last offer place coach hurry eager happy moment meeting ardour think carriage drive wish be rail road town waste thought novelty gain idea metropolis distinct complain see quantity house only idea fill heart brighten countenance look other smile delight say last go see 
48,,
49, ,
