id,paragraph,tokens
39,"""If I do not help myself, nobody else seems likely to give me any supper! I appear to be the only person who is to taste anything to-night,"" answered Peter, laughing, while the impudent boy took a cup of milk, and drank it off, saying, ""Here's to your very good health, Miss Laura, and an excellent appetite to everybody!""",help else seem likely give supper appear only person taste night answer laugh impudent boy take cup milk drink say good health excellent appetite 
40,"Upon hearing this absurd speech, all the other boys began laughing, and made signs, as if they were eating their fingers off with hunger. Then Peter called Lady Harriet's house ""Famine Castle,"" and pretended he would swallow the knives like an Indian juggler.",hear absurd speech other boy begin laugh make sign eat finger hunger call house pretend swallow knife indian juggler 
41,"""We must learn to live upon air, and here are some spoons to eat it with,"" said John Fordyce. ""Harry! shall I help you to a mouthful of moonshine?""",learn live air spoon eat say help mouthful moonshine 
42,"""Peter! would you like a roasted fly?"" asked Frank Abercromby, catching one on the window. ""I dare say it is excellent for hungry people,--or a slice of buttered wall?""",like roast fly ask catching window say excellent hungry person slice butter wall 
43,"""Or a stewed spider?"" asked Peter. ""Shall we all be cannibals, and eat one another?""",stew spider ask cannibal eat 
44,"""What is the use of all those forks, when there is nothing to stick upon them?"" asked George Maxwell, throwing them about on the floor. ""No buns!--no fruit!--no cakes!--no nothing!""",use fork be stick ask throw floor bun fruit cake 
45,"""What are we to do with those tea-cups, when there is no tea?"" cried Frank Abercromby, pulling the table-cloth till the whole affair fell prostrate on the floor. After this, these riotous boys tossed the plates up in the air, and caught them, becoming, at last, so outrageous, that poor old Andrew called them a ""meal mob."" Never was there so much broken china seen in a dining-room before! It all lay scattered on the floor, in countless fragments, looking as if there had been a bull in a china shop, when suddenly Mrs. Crabtree herself opened the door and walked in, with an aspect of rage enough to petrify a milestone. Now old Andrew had long been trying all in his power to render the boys quiet and contented. He had made them a speech,--he had chased the ring-leaders all round the room,--and he had thrown his stick at Peter, who seemed the most riotous,--but all in vain; they became worse and worse, laughing into fits, and calling Andrew ""the police-officer,"" and ""the bailiff."" It was a very different story, however, when Mrs. Crabtree appeared, so flaming with fury, she might have blown up a powder-mill.",do tea- cup be tea cry pull table cloth whole affair fall prostrate floor riotous boy toss plate air catch become last outrageous poor old call meal mob be much break china see dining room lay scatter floor countless fragment look be bull china shop open door walk aspect rage petrify milestone old try power render boy quiet contented make speech chase ring leader room throw stick seem riotous vain become bad bad laugh fit call police officer bailiff different story appear flame fury blow powder mill 
46,"Nobody could help being afraid of her. Even Peter himself stood stock-still, and seemed withering away to nothing, when she looked at him; and when she began to scold in her most furious manner, not a boy ventured to look off the ground. A large pair of tawse then became visible in her hand, so every heart sunk with fright, and the riotous visitors began to get behind each other, and to huddle out of sight as much as possible, whispering and pushing, and fighting, in a desperate scuffle to escape.",help afraid stand stock seem wither look begin scold furious manner boy venture look ground large pair tawse become visible hand heart sink fright riotous visitor begin get other huddle sight possible whisper push fight desperate scuffle escape 
47,"""What is all this!"" cried she, at the full pitch of her voice, ""has bedlam broke loose! who smashed these cups? I'll break his head for him, let me tell you that! Master Peter! you should be hissed out of the world for your misconduct; but I shall certainly whip you round the room like a whipping-top.""",cry full pitch voice bedlam break smash cup break head let tell master hiss world misconduct whip room whipping top 
48,"At this moment, Peter observed that the dining-room window, which was only about six feet from the ground, had been left wide open, so instantly seizing the opportunity, he threw himself out with a single bound, and ran laughing away. All the other boys immediately followed his example, and disappeared by the same road; after which, Mrs. Crabtree leaned far out of the window, and scolded loudly, as long as they remained in sight, till her face became red, and her voice perfectly hoarse.",moment observe dining room window foot ground leave wide open seize opportunity throw single bind run laugh other boy follow example disappear same road learn window scold remain sight face become red voice hoarse 
49,"Meantime, the little misses sat soberly down before the empty table, and talked in whispers to each other, waiting till their maids came to take them home, after which they all hurried away as fast as possible, hardly waiting to say ""good bye,"" and intending to ask for some supper at home.",little misse sit empty table talk whisper other wait maid come take hurry possible wait say good bye intend ask supper home 
50,"During that night, long after Harry and Laura had been scolded, whipped, and put to bed, they were each heard in different rooms, sobbing and crying, as if their very hearts would break, while Mrs. Crabtree grumbled and scolded to herself, saying she must do her duty, and make them good children, though she were to flay them alive first.",night scold whip put bed hear different room sobb cry very heart break grumble scold say do duty make good child flay alive 
51,"When Lady Harriet returned home some days afterwards, she heard an account of Harry and Laura's misconduct from Mrs. Crabtree, and the whole story was such a terrible case against them, that their poor grandmama became perfectly astonished and shocked, while even uncle David was preparing to be very angry; but before the culprits appeared, Frank most kindly stepped forward, and begged that they might be pardoned for this once, adding all in his power to excuse Harry and Laura, by describing how very penitent they had become, and how very severely they had already been punished.",return day hear account misconduct whole story terrible case poor grandmama become astonished shocked uncle prepare angry culprit appear step begg pardon add power excuse describe penitent become punish 
52,"Frank then mentioned all that Harry had told him about the starving party, which he related with so much humour and drollery, that Lady Harriet could not help laughing; so then he saw that a victory had been gained, and ran to the nursery for the two little prisoners.",mention tell starve party relate much humour drollery help laugh see victory gain run nursery little prisoner 
53,"Uncle David shook his walking-stick at them, and made a terrible face, when they entered; but Harry jumped upon his knee with joy at seeing him again, while Laura forgot all her distress, and rushed up to Lady Harriet, who folded her in her arms, and kissed her most affectionately.",shake walking stick make terrible face enter jump knee joy see forget distress rush fold arm kiss 
54,"Not a word was said that day about the tea-party, but next morning, Major Graham asked Harry, very gravely, ""if he had read in the newspapers the melancholy accounts about several of his little companions, who were ill and confined to bed from having ate too much at a certain tea-party on Saturday last. Poor Peter Grey has been given over, and Charles Forrester, it is feared, may not be able to eat another loaf of bread for a fortnight!""",word say day tea party next morning ask read newspaper melancholy account several little companion ill confine bed eat much certain tea-party last poor give fear able eat loaf bread fortnight 
55,"""Oh! uncle David! it makes me ill whenever I think of that party!"" said Harry, colouring perfectly scarlet; ""that was the most miserable evening of my life!""",uncle make ill think party say colour scarlet miserable evening life 
56,"""I must say it was not quite fair in Mrs. Crabtree to starve all the strange little boys and girls, who came as visitors to my house, without knowing who had invited them,"" observed Lady Harriet. ""Probably those unlucky children will never forget, as long as they live, that scanty supper in our dining-room.""",say fair starve strange little boy girl come visitor house know invite observe unlucky child forget live scanty supper dining room 
57,"And it turned out exactly as Lady Harriet had predicted; for though they were all asked to tea, in proper time, the very next Saturday, when Major Graham showered torrents of sugar-plums on the table, while the children scrambled to pick them up, and the side-board almost broke down afterwards under the weight of buns, cakes, cheesecakes, biscuits, fruit, and preserves, which were heaped upon each other--yet, for years afterwards, Peter Grey, whenever he ate a particularly enormous dinner, always observed, that he must make up for having once been starved at Harry Graham's; and whenever any one of those little boys or girls again happened to meet Harry or Laura, they were sure to laugh and say, ""When are you going to give us another",turn predict ask tea proper time next shower torrent sugar plum table child scramble pick side board break weight bun cake cheesecake biscuit fruit preserve heap other year eat enormous dinner observe make starve one little boy girl happen meet sure laugh say go give 
58,"                              ""GRAND FEAST?""",grand feast 
59,,
60, ,
