id,paragraph,tokens
47,"""Pshaw!--nonsense!"" exclaimed Lord Rockville impatiently. ""The bull would have done you no harm! He is a most respectable, quiet, well-disposed animal, and brought an excellent character from his last place! I never heard a complaint of him before!""",nonsense exclaim bull do harm respectable quiet dispose animal bring excellent character last place hear complaint 
48,"""It is curious,"" observed Laura, ""that all bulls are reckoned peaceable and tame, till they have tossed two or three people, and killed them!""",curious observe bull reckon peaceable tame toss person kill 
49,"""I thought,"" added Lord Rockville, looking very grand and contemptuous, ""that Harry was grown more a man than to be so easily put to flight. When a bull, another time, threatens to toss you, seize hold of his tail,--or toss him!--or, in short, do anything rather than run away the first time an animal looks at you. This is a mere cock-and-a-bull story, to excuse your keeping me waiting almost a quarter of an hour for my dinner!--you should be made guard of a mail-coach for a month, to teach you punctuality, Master Graham.""",think add look grand contemptuous grow man put flight bull time threaten toss seize hold tail toss short do run first time animal look mere cock bull story excuse keep wait quarter hour dinner make guard mail coach month teach punctuality 
50,"Lord Rockville gravely looked at his watch, while Harry luckily considered how often his grandmama had recommended him to make no answer when he was scolded, so he nearly bit off the tip of his tongue to keep it quiet, while he could not but wish, in his own mind, that my Lord himself saw how very fierce the bull had looked.",look watch consider grandmama recommend make answer scold bite tip tongue keep quiet wish own mind see fierce bull look 
51,"Laura felt more vexed on Harry's account than her own, and the dinner went on as uncomfortably as possible; for even when a French cook has dressed it, if ill-humour be the sauce, any dish becomes unpalatable. Nothing was to be seen reflected on the surface of many fine silver covers, but very cross, or very melancholy faces; while Lady Rockville tried to make her own countenance look both cheerful and good-natured. She told Harry and Laura, to divert them, that old Mrs. Bouverie had once been pursued by a furious milch cow, along a lane, flanked on both sides by such very high walls, that escape seemed impossible, so the good lady, who was fat and breathless, became so desperate, that without a hope of getting off, she seized the enraged animal by the horns, and screamed in its face, till the cow herself became frightened. The creature stared, stepping backwards and backwards, with increasing alarm, till at last, to the old lady's great relief and surprise, she fairly turned her tail and ran off.",feel vex account own dinner go possible french cook dress ill humour sauce dish become unpalatable see reflect surface many fine silver cover cross melancholy face try make own countenance look cheerful good natured tell divert old pursue furious milch cow lane flank side such high wall escape seem impossible good lady fat breathless become desperate hope get seize enrage animal horn scream face cow become frighten creature stare step increase alarm last old lady great relief surprise turn tail run 
52,"In the evening, Lord Rockville had not yet recovered his equanimity, and went out, rather in bad humour, to take his usual walk before supper. Without once remembering about Harry and the bull, he strolled a great way into the woods, marking several trees to be cut down, and admiring a fine forest which he had planted himself long ago, but without particularly considering what way he turned. It was beginning, at last, to grow very dark and gloomy, so Lord Rockville had some thoughts of returning home, when he became suddenly startled by hearing a loud roar not far off, and a moment afterwards the furious bull dashed out of a neighbouring thicket, raging and foaming, and tearing the ground with his horns, exactly as Harry had described in the morning, while poor Lord Rockville, who seldom moved faster than a very dignified walk, instantly quickened his pace, in an opposite direction, striding away faster and faster, till at last,--it must be confessed,--his Lordship ended by running!!!",evening recover equanimity go bad humour take usual walk supper remember bull stroll great way wood mark several tree cut admire fine forest plant consider way turn begin last grow dark gloomy have thought return become startle hear loud roar moment furious bull dash neighbour thicket rage foam tear ground horn describe morning poor move fast dignified walk quicken pace opposite direction strid fast fast last confess end run 
53,"In spite of all Lord Rockville's exertions, the bull continued rapidly to gain upon him, for his Lordship, being rather corpulent and easily fatigued, stopped every now and then to gasp for breath; till at last, feeling it impossible to get on faster, though the stables were now within sight, he seized the branch of a large oak tree, which swept nearly to the ground, and contrived, with great difficulty, to scramble out of reach.",spite exertion bull continue gain corpulent fatigued stop gasp breath last feel impossible get fast stable sight seize branch large oak tree sweep ground contrive great difficulty scramble reach 
54,"The enraged bull gazed up into the tree and bellowed with fury, when he saw Lord Rockville so judiciously perched overhead, and he remained for half-an-hour, watching to see if his Lordship would venture down again. At last the tormenting animal began leisurely eating grass under the tree, but gradually he moved away, turning his back while he fed, till Lord Rockville vainly deluded himself with the hope of stealing off unobserved. Being somewhat rested and refreshed, while the enemy was looking in another direction, he descended cautiously, as if he had been going to tread upon needles and pins; but, unaccustomed to such movements, he jumped so heavily upon the ground, that the bull hearing a noise, turned round, and set up a loud furious roar, when he saw his intended victim again within reach.",enrage bull gaze tree bellow fury see perch remain half hour watch see lordship venture last torment animal begin eat grass tree move turn back feed delude hope steal unobserved rest refresh enemy look direction descend go tread needle pin unaccustomed such movement jump ground bull hear noise turn set loud furious roar see intend victim reach 
55,"Now the race began once more with redoubled agility! The odds seemed greatly in favour of the bull, and Lord Rockville thought he already felt the animal's horns in his side, when a groom, who saw the party approaching, instantly seized a pitchfork and flew to the rescue of his master. Lord Rockville never stopped his career till he reached the stable, and ran up into a loft, from the window of which he gave the alarm and called for more assistance, when several ploughmen and stable-boys assembled, who drove the animal with great difficulty, into a stall, where he continued so ungovernable, that iron chains were put round his neck, and some days afterwards, seeing no one could manage him, Lord Rockville ordered the bull to be shot, and his carcase turned into beef for the poor of the parish, who all, consequently, rejoiced at his demise; though the meat turned out so tough, that it required their best teeth to eat it with.",race begin more redoubl agility odd seem favour bull think feel animal horn side groom see party approach seize pitchfork fly rescue master stop career reach stable run loft window give alarm call more assistance several ploughmen stable boy assemble drive animal great difficulty stall continue ungovernable iron chain put neck day see manage order bull shoot carcase turn beef poor parish rejoice demise meat turn tough require good tooth eat 
56,"Meantime, on that memorable evening of so many adventures, Harry, Laura, and Lady Rockville, wondered often what had become of his Lordship, and, at last, when supper appeared at the usual hour, his absence became still more unaccountable!",memorable evening many adventure wonder become last supper appear usual hour absence become unaccountable 
57,"""What can be the matter?"" exclaimed Lady Rockville, anxiously. ""This is very odd! His Lordship is as punctual as the postman in general! especially for supper; and here is Lord Rockville's favourite dish of sago and wine, which will become uneatably cold in ten minutes, if he does not return home to enjoy it!""",matter exclaim odd lordship punctual postman general supper favourite dish sago wine become cold minute return enjoy 
58,"Scarcely had she finished speaking, when the door opened and Lord Rockville walked majestically into the room. There was something so different from usual in his manner and appearance, however, that Harry and Laura exchanged looks of astonishment; his neckcloth was loose--his face excessively red--and his hand shook, while he breathed so hard, that he might have been heard at the porter's lodge. Lady Rockville gazed with amazement at all she saw, and then asked what he chose for supper; but when Lord Rockville tried to speak, the words died on his lips, so he could only point in silence to the sago and wine.",finish speak door open walk room be different usual manner appearance exchange look astonishment neckcloth loose face red hand shake breathe hear porter lodge gaze amazement see ask choose supper try speak word die lip point silence sago wine 
59,"""What in all the world has happened to you this evening, my Lord?"" exclaimed Lady Rockville, unable to restrain her curiosity a moment longer. ""I never saw you in such a way before! Your eyes are perfectly blood-shot--your dress strangely disordered--and you seem so hot and so fatigued! Tell me!--what is the matter?""",world happen evening exclaim unable restrain curiosity moment see way eye blood shot dress disorder seem hot fatigued tell matter 
60,"""Nothing!"" answered Lord Rockville, drawing himself up, while he tried to look grander and graver than ever, though his Lordship could not help panting for breath--putting his hands to his sides--and wiping his forehead with his pocket-handkerchief in an agony of fatigue. Harry observed all this for some time, as eagerly and intently as a cat watches a bird on a tree. He saw that something extraordinary had occurred, and he began to have hopes that it really was the very thing he wished; because, seeing Lord Rockville now perfectly safe, he would not have grudged him a pretty considerable fright from his friend the bull. At last, unable any longer to control his impatience, Harry started off his chair, gazing so earnestly at Lord Rockville, that his eyes almost sprung out of their sockets, while he rubbed his hands with ecstacy, saying,",answer draw try look grander graver lordship help pant breath put hand side wipe forehead pocket handkerchief agony fatigue observe time cat watch bird tree see extraordinary occur begin have hope very thing wish see safe grudge considerable fright friend bull last unable control impatience start chair gaze eye spring socket rub hand ecstacy say 
61,"""I guess you've seen the bull? Oh! I am sure you did! Pray tell us if you have? Did he run after you,--and did you run away?""",guess see bull sure pray tell have run run 
62,"Lord Rockville tried more than he had ever done in his life to look grave, but it would not do. Gradually his face relaxed into a smile, till at last he burst into loud peals of laughter, joined most heartily by Harry, Laura, and Lady Rockville. Nobody recovered any gravity during the rest of that evening, for whenever they tried to think or talk quietly about anything else, Harry and Laura were sure to burst forth again upon the subject, and even after being safely stowed in their beds for the night, they both laughed themselves to sleep at the idea of Lord Rockville himself having been obliged, after all, to run away from that ""most respectable, quiet, well-disposed animal,",try more do life look grave do face relax smile last burst loud peal laughter join recover gravity rest evening try think talk else sure burst subject stow bed night laugh sleep idea oblige run respectable quiet dispose animal 
63,"                              ""THE MAD BULL!""",mad bull 
64,,
65, ,
