id,paragraph,tokens
1,CHAPTER XXII. HOW UMSLOPOGAAS HELD THE STAIR,held stair 
2,,
3,We looked at one another.,look 
4,"‘Thou seest,’ I said, ‘they have taken away the door. Is there aught with which we may fill the place? Speak quickly for they will be on us ere the daylight.’ I spoke thus, because I knew that we must hold this place or none, as there were no inner doors in the palace, the rooms being separated one from another by curtains. I also knew that if we could by any means defend this doorway the murderers could get in nowhere else; for the palace is absolutely impregnable, that is, since the secret door by which Sorais had entered on that memorable night of attempted murder had, by Nyleptha’s order, been closed up with masonry.",say take door be aught fill place speak daylight speak know hold place be inner door palace room separate curtain know means defend doorway murderer get else palace impregnable secret door enter memorable night attempt murder order close masonry 
5,"‘I have it,’ said Nyleptha, who, as usual with her, rose to the emergency in a wonderful way. ‘On the farther side of the courtyard are blocks of cut marble--the workmen brought them there for the bed of the new statue of Incubu, my lord; let us block the door with them.’",have say usual rise emergency wonderful way far side courtyard block cut marble workmen bring bed new statue lord let block door 
6,"I jumped at the idea; and having despatched one of the remaining maidens down the great stair to see if she could obtain assistance from the docks below, where her father, who was a great merchant employing many men, had his dwelling-place, and set another to watch through the doorway, we made our way back across the courtyard to where the hewn marble lay; and here we met Kara returning from despatching the first two messengers. There were the marble blocks, sure enough, broad, massive lumps, some six inches thick, and weighing about eighty pounds each, and there, too, were a couple of implements like small stretchers, that the workmen used to carry them on. Without delay we got some of the blocks on to the stretchers, and four of the girls carried them to the doorway.",jump idea despatch remain maiden great stair see obtain assistance dock father great merchant employ many man have dwelling place set watch doorway make way courtyard hewn marble lay meet return despatch first messenger be marble block broad massive lump inch thick weigh pound couple implement small stretcher workmen use carry delay get block stretcher girl carry doorway 
7,"‘Listen, Macumazahn,’ said Umslopogaas, ‘if those low fellows come, it is I who will hold the stair against them till the door is built up. Nay, nay, it will be a man’s death: gainsay me not, old friend. It has been a good day, let it now be good night. See, I throw myself down to rest on the marble there; when their footsteps are nigh, wake thou me, not before, for I need my strength,’ and without a word he went outside and flung himself down on the marble, and was instantly asleep.",listen say low fellow come hold stair door build man death gainsay old friend good day let good night see throw rest marble footstep nigh wake need strength word go flung marble asleep 
8,"At this time, I too was overcome, and was forced to sit down by the doorway, and content myself with directing operations. The girls brought the block, while Kara and Nyleptha built them up across the six-foot-wide doorway, a triple row of them, for less would be useless. But the marble had to be brought forty yards and then there were forty yards to run back, and though the girls laboured gloriously, even staggering along alone, each with a block in her arms, it was slow work, dreadfully slow.",time overcome force sit doorway content direct operation girl bring block build foot wide doorway triple row less useless marble have bring yard be yard run girl laboure staggering block arm slow work slow 
9,"The light was growing now, and presently, in the silence, we heard a commotion at the far-bottom of the stair, and the faint clinking of armed men. As yet the wall was only two feet high, and we had been eight minutes at the building of it. So they had come. Alphonse had heard aright.",light grow silence hear commotion bottom stair faint clinking armed man wall foot high minute building come hear 
10,"The clanking sound came nearer, and in the ghostly grey of the dawning we could make out long files of men, some fifty or so in all, slowly creeping up the stair. They were now at the half-way standing place that rested on the great flying arch; and here, perceiving that something was going on above, they, to our great gain, halted for three or four minutes and consulted, then slowly and cautiously advanced again.",clanking sound come ghostly grey dawning make long file man creep stair half way standing place rest great fly arch perceive go great gain halt minute consult advance 
11,"We had been nearly a quarter of an hour at the work now, and it was almost three feet high.",quarter hour work foot high 
12,"Then I woke Umslopogaas. The great man rose, stretched himself, and swung Inkosi-kaas round his head.",wake great man rise stretch swing head 
13,"‘It is well,’ he said. ‘I feel as a young man once more. My strength has come back to me, ay, even as a lamp flares up before it dies. Fear not, I shall fight a good fight; the wine and the sleep have put a new heart into me.",well say feel young man more strength come lamp flare die fear fight good fight wine sleep put new heart 
14,"‘Macumazahn, I have dreamed a dream. I dreamed that thou and I stood together on a star, and looked down on the world, and thou wast as a spirit, Macumazahn, for light flamed through thy flesh, but I could not see what was the fashion of mine own face. The hour has come for us, old hunter. So be it: we have had our time, but I would that in it I had seen some more such fights as yesterday’s.",dream dream dream stand star look world wast spirit light flame flesh see fashion own face hour come old hunter have time see more such fight yesterday 
15,"‘Let them bury me after the fashion of my people, Macumazahn, and set my eyes towards Zululand;’ and he took my hand and shook it, and then turned to face the advancing foe.",let bury fashion person set eye take hand shake turn face advance foe 
16,"Just then, to my astonishment, the Zu-Vendi officer Kara clambered over our improvised wall in his quiet, determined sort of way, and took his stand by the Zulu, unsheathing his sword as he did so.",astonishment officer clamber improvise wall quiet determined sort way take stand unsheath sword do 
17,"‘What, comest thou too?’ laughed out the old warrior. ‘Welcome--a welcome to thee, brave heart! Ow! for the man who can die like a man; ow! for the death grip and the ringing of steel. Ow! we are ready. We wet our beaks like eagles, our spears flash in the sun; we shake our assegais, and are hungry to fight. Who comes to give greeting to the Chieftainess [Inkosi-kaas]? Who would taste her kiss, whereof the fruit is death? I, the Woodpecker, I, the Slaughterer, I the Swiftfooted! I, Umslopogaas, of the tribe of the Maquilisini, of the people of Amazulu, a captain of the regiment of the Nkomabakosi: I, Umslopogaas, the son of Indabazimbi, the son of Arpi the son of Mosilikaatze, I of the royal blood of T’Chaka, I of the King’s House, I the Ringed Man, I the Induna, I call to them as a buck calls, I challenge them, I await them. Ow! it is thou, it is thou!’",laugh old warrior welcome brave heart man die man death grip ringing steel ready wet beak eagle spear flash sun shake assegais hungry fight come give greeting taste kiss fruit death tribe person captain regiment son son son royal blood ringed call buck call challenge await 
18,"As he spake, or rather chanted, his wild war-song, the armed men, among whom in the growing light I recognized both Nasta and Agon, came streaming up the stair with a rush, and one big fellow, armed with a heavy spear, dashed up the ten semicircular steps ahead of his comrades and struck at the great Zulu with the spear. Umslopogaas moved his body but not his legs, so that the blow missed him, and next instant Inkosi-kaas crashed through headpiece, hair and skull, and the man’s corpse was rattling down the steps. As he dropped, his round hippopotamus-hide shield fell from his hand on to the marble, and the Zulu stooped down and seized it, still chanting as he did so.",spake chant wild war song armed man grow light recognize come stream stair rush big fellow armed heavy spear dash semicircular step comrade strike great spear move body leg blow miss next instant crash headpiece hair skull man corpse rattling step drop round hippopotamus hide shield fall hand marble stoop seize chant do 
19,"In another second the sturdy Kara had also slain a man, and then began a scene the like of which has not been known to me.",second sturdy slain man begin scene like know 
20,"Up rushed the assailants, one, two, three at a time, and as fast as they came, the axe crashed and the sword swung, and down they rolled again, dead or dying. And ever as the fight thickened, the old Zulu’s eye seemed to get quicker and his arm stronger. He shouted out his war-cries and the names of chiefs whom he had slain, and the blows of his awful axe rained straight and true, shearing through everything they fell on. There was none of the scientific method he was so fond of about this last immortal fight of his; he had no time for it, but struck with his full strength, and at every stroke a man sank in his tracks, and went rattling down the marble steps.",rush assailant time come axe crash sword swing roll dead die fight thicken old eye seem get quick arm strong shout war cry name chief slain blow awful axe rain true shear fall be scientific method fond last immortal fight have time strike full strength stroke man sink track go rattling marble step 
21,"They hacked and hewed at him with swords and spears, wounding him in a dozen places till he streamed red with blood; but the shield protected his head and the chain-shirt his vitals, and for minute after minute, aided by the gallant Zu-Vendi, he still held the stair.",hack hew sword spear wound place stream red blood shield protect head chain shirt vital minute minute aid gallant hold stair 
22,"At last Kara’s sword broke, and he grappled with a foe, and they rolled down together, and he was cut to pieces, dying like the brave man that he was.",last sword break grapple foe roll cut piece die brave man 
23,"Umslopogaas was alone now, but he never blenched or turned. Shouting out some wild Zulu battle-cry, he beat down a foe, ay, and another, and another, till at last they drew back from the slippery blood-stained steps, and stared at him with amazement, thinking that he was no mortal man.",alone blench turn shout wild battle cry beat foe last draw slippery blood stain step stare amazement think mortal man 
24,"The wall of marble block was four feet six high now, and hope rose in my teeth as I leaned there against it a miserable helpless log, and ground my teeth, and watched that glorious struggle. I could do no more for I had lost my revolver in the battle.",wall marble block foot high hope rise tooth learn miserable helpless log ground tooth watch glorious struggle do more lose revolver battle 
25,"And old Umslopogaas, he leaned too on his good axe, and, faint as he was with wounds, he mocked them, he called them ‘women’--the grand old warrior, standing there one against so many! And for a breathing space none would come against him, notwithstanding Nasta’s exhortations, till at last old Agon, who, to do him justice, was a brave man, mad with baffled rage, and seeing that the wall would soon be built and his plans defeated, shook the great spear he held, and rushed up the dripping steps.",old learn good axe faint wound mock call woman grand old warrior stand many breathing space come notwithstand exhortation last old do justice brave man mad baffle rage see wall build plan defeat shake great spear hold rush drip step 
26,"‘Ah, ah!’ shouted the Zulu, as he recognized the priest’s flowing white beard, ‘it is thou, old “witch-finder”! Come on! I await thee, white “medicine man”; come on! come on! I have sworn to slay thee, and I ever keep my faith.’",shout recognize priest flow white beard old witch finder come await white medicine man come come swear slay keep faith 
27,"On he came, taking him at his word, and drave the big spear with such force at Umslopogaas that it sunk right through the tough shield and pierced him in the neck. The Zulu cast down the transfixed shield, and that moment was Agon’s last, for before he could free his spear and strike again, with a shout of ‘_There’s for thee, Rain-maker!_’ Umslopogaas gripped Inkosi-kaas with both hands and whirled on high and drave her right on to his venerable head, so that Agon rolled down dead among the corpses of his fellow-murderers, and there was an end to him and his plots altogether. And even as he fell, a great cry rose from the foot of the stair, and looking out through the portion of the doorway that was yet unclosed, we saw armed men rushing up to the rescue, and called an answer to their shouts. Then the would-be murderers who yet remained on the stairway, and amongst whom I saw several priests, turned to fly, but, having nowhere to go, were butchered as they fled. Only one man stayed, and he was the great lord Nasta, Nyleptha’s suitor, and the father of the plot. For a moment the black-bearded Nasta stood with bowed face leaning on his long sword as though in despair, and then, with a dreadful shout, he too rushed up at the Zulu, and, swinging the glittering sword around his head, dealt him such a mighty blow beneath his guard, that the keen steel of the heavy blade bit right through the chain armour and deep into Umslopogaas’ side, for a moment paralysing him and causing him to drop his axe.",come take word drave big spear such force sink tough shield pierce neck cast transfixe shield moment last free spear strike shout rain maker grip hand whirl high drave venerable head roll dead corpse fellow murderer be end plot fall great cry rise foot stair look portion doorway unclosed see armed man rush rescue call answer shout murderer remain stairway see several priest turn fly have go butcher flead man stay great lord suitor father plot moment black bearded stand bow face lean long sword despair dreadful shout rush swing glitter sword head deal mighty blow guard keen steel heavy blade bit chain armour side moment paraly cause drop axe 
28,"Raising the sword again, Nasta sprang forward to make an end of him, but little he knew his foe. With a shake and a yell of fury, the Zulu gathered himself together and sprang straight at Nasta’s throat, as I have sometimes seen a wounded lion spring. He struck him full as his foot was on the topmost stair, and his long arms closing round him like iron bands, down they rolled together struggling furiously. Nasta was a strong man and a desperate, but he could not match the strongest man in Zululand, sore wounded though he was, whose strength was as the strength of a bull. In a minute the end came. I saw old Umslopogaas stagger to his feet--ay, and saw him by a single gigantic effort swing up the struggling Nasta and with a shout of triumph hurl him straight over the parapet of the bridge, to be crushed to powder on the rocks two hundred feet below.",raise sword spring make end little know foe shake yell fury gather spring throat see wound lion spring strike full foot topmost stair long arm close iron band roll struggle strong man desperate match strong man sore wound strength strength bull minute end come see old stagger foot see single gigantic effort swing struggle shout triumph hurl parapet bridge crush powder rock foot 
29,"The succour which had been summoned by the girl who had passed down the stair before the assassins passed up was at hand, and the loud shouts which reached us from the outer gates told us that the town was also aroused, and the men awakened by the women were calling to be admitted. Some of Nyleptha’s brave ladies, who in their night-shifts and with their long hair streaming down their backs, just as they had been aroused from rest, went off to admit them at the side entrance, whilst others, assisted by the rescuing party outside, pushed and pulled down the marble blocks they had placed there with so much labour.",succour summon girl pass stair assassin pass hand loud shout reach outer gate tell town arouse man awaken woman call admit brave lady night shift long hair stream back arouse rest go admit side entrance other assist rescuing party push pull marble block place much labour 
30,"Soon the wall was down again, and through the doorway, followed by a crowd of rescuers, staggered old Umslopogaas, an awful and, in a way, a glorious figure. The man was a mass of wounds, and a glance at his wild eye told me that he was dying. The ‘keshla’ gum-ring upon his head was severed in two places by sword-cuts, one just over the curious hole in his skull, and the blood poured down his face from the gashes. Also on the right side of his neck was a stab from a spear, inflicted by Agon; there was a deep cut on his left arm just below where the mail shirt-sleeve stopped, and on the right side of his body the armour was severed by a gash six inches long, where Nasta’s mighty sword had bitten through it and deep into its wearer’s vitals.",wall doorway follow crowd rescuer stagger old awful way glorious figure man mass wound glance wild eye tell die keshla’ gum ring head sever place sword cut curious hole skull blood pour face gashe right side neck stab spear inflict be deep cut left arm mail shirt sleeve stop right side body armour sever gash inch long mighty sword bit deep wearer vital 
31,"On, axe in hand, he staggered, that dreadful-looking, splendid savage, and the ladies forgot to turn faint at the scene of blood, and cheered him, as well they might, but he never stayed or heeded. With outstretched arms and tottering gait he pursued his way, followed by us all along the broad shell-strewn walk that ran through the courtyard, past the spot where the blocks of marble lay, through the round arched doorway and the thick curtains that hung within it, down the short passage and into the great hall, which was now filling with hastily-armed men, who poured through the side entrance. Straight up the hall he went, leaving behind him a track of blood on the marble pavement, till at last he reached the sacred stone, which stood in the centre of it, and here his strength seemed to fail him, for he stopped and leaned upon his axe. Then suddenly he lifted up his voice and cried aloud--",axe hand stagger dreadful look splendid savage lady forget turn faint scene blood cheer stay heed outstretched arm totter gait pursue way follow broad shell strewn walk run courtyard spot block marble lay round arched doorway thick curtain hang short passage great hall fill armed man pour side entrance hall go leave track blood marble pavement last reach sacred stone stand centre strength seem fail stop learn axe lift voice cry 
32,"‘I die, I die--but it was a kingly fray. Where are they who came up the great stair? I see them not. Art thou there, Macumazahn, or art thou gone before to wait for me in the dark whither I go? The blood blinds me--the place turns round--I hear the voice of waters.’",die die kingly fray come great stair see art art go wait dark go blood blind place turn hear voice water 
33,"Next, as though a new thought had struck him, he lifted the red axe and kissed the blade.",new thought strike lift red axe kiss blade 
34,"‘Farewell, Inkosi-kaas,’ he cried. ‘Nay, nay, we will go together; we cannot part, thou and I. We have lived too long one with another, thou and I.",cry go part live long 
35,"‘One more stroke, only one! A good stroke! a straight stroke! a strong stroke!’ and, drawing himself to his full height, with a wild heart-shaking shout, he with both hands began to whirl the axe round his head till it looked like a circle of flaming steel. Then, suddenly, with awful force he brought it down straight on to the crown of the mass of sacred stone. A shower of sparks flew up, and such was the almost superhuman strength of the blow, that the massive marble split with a rending sound into a score of pieces, whilst of Inkosi-kaas there remained but some fragments of steel and a fibrous rope of shattered horn that had been the handle. Down with a crash on to the pavement fell the fragments of the holy stone, and down with a crash on to them, still grasping the knob of Inkosi-kaas, fell the brave old Zulu--_dead_.",more stroke good stroke straight stroke strong stroke draw full height wild heart shaking shout hand begin whirl axe head look circle flame steel awful force bring crown mass sacred stone shower spark fly such superhuman strength blow massive marble split rend sound score piece remain fragment steel fibrous rope shattered horn handle crash pavement fall fragment holy stone crash grasp knob fall brave old 
36,And thus the hero died.,hero die 
37,"A gasp of wonder and astonishment rose from all those who witnessed the extraordinary sight, and then somebody cried, ‘_The prophecy! the prophecy!_ He has shattered the sacred stone!’ and at once a murmuring arose.",gasp wonder astonishment rise witness extraordinary sight cry prophecy prophecy shattered sacred stone murmuring arise 
38,"‘Ay,’ said Nyleptha, with that quick wit which distinguishes her. ‘Ay, my people, he has shattered the stone, and behold the prophecy is fulfilled, for a stranger king rules in Zu-Vendis. Incubu, my lord, hath beat Sorais back, and I fear her no more, and to him who hath saved the Crown it shall surely be. And this man,’ she said, turning to me and laying her hand upon my shoulder, ‘wot ye that, though wounded in the fight of yesterday, he rode with that old warrior who lies there, one hundred miles ‘twixt sun set and rise to save me from the plots of cruel men. Ay, and he has saved me, by a very little, and therefore because of the deeds that they have done--deeds of glory such as our history cannot show the like--therefore I say that the name of Macumazahn and the name of dead Umslopogaas, ay, and the name of Kara, my servant, who aided him to hold the stair, shall be blazoned in letters of gold above my throne, and shall be glorious for ever while the land endures. I, the Queen, have said it.’",say quick wit distinguish person shattered stone behold prophecy fulfil stranger king rule lord have beat fear more save man say turn lay hand shoulder wound fight yesterday ride old warrior lie mile twixt sun set rise save plot cruel man save little deed do deed glory such history show like say name name dead name servant aid hold stair blazon letter gold throne glorious land endure say 
39,"This spirited speech was met with loud cheering, and I said that after all we had only done our duty, as it is the fashion of both Englishmen and Zulus to do, and there was nothing to make an outcry about; at which they cheered still more, and then I was supported across the outer courtyard to my old quarters, in order that I might be put to bed. As I went, my eyes lit upon the brave horse Daylight that lay there, his white head outstretched on the pavement, exactly as he had fallen on entering the yard; and I bade those who supported me take me near him, that I might look on the good beast once more before he was dragged away. And as I looked, to my astonishment he opened his eyes and, lifting his head a little, whinnied faintly. I could have shouted for joy to find that he was not dead, only unfortunately I had not a shout left in me; but as it was, grooms were sent for and he was lifted up and wine poured down his throat, and in a fortnight he was as well and strong as ever, and is the pride and joy of all the people of Milosis, who, whenever they see him, point him out to the little children as the ‘horse which saved the White Queen’s life’.",spirit speech meet loud cheering say do duty fashion do be make outcry cheer more support outer courtyard old quarter order put bed go eye light brave horse daylight lay white head outstretch pavement fall enter yard bid support take look good beast drag look astonishment open eye lift head little whinie shout joy find dead have shout leave groom send lift wine pour throat fortnight strong pride joy person see point little child horse save white life 
40,"Then I went on and got off to bed, and was washed and had my mail shirt removed. They hurt me a great deal in getting it off, and no wonder, for on my left breast and side was a black bruise the size of a saucer.",go get bed wash have mail shirt remove hurt great deal get wonder left breast side black bruise size saucer 
