id,paragraph,tokens
80,"This was no reason, thought Philip, why Guy might not have been with Tom Harewood without the Colonel’s knowledge. Tom was just the man to lead him amongst those who were given to betting; he might have been drawn in, and, perhaps, he had given some pledge of payment when he was of age, or, possibly, obtained an immediate supply of money from the old steward at Redclyffe, who was devotedly attached to him. If so, Philip trusted to be able to detect it from the accounts; on the other supposition, there was no hope of discovery.",reason think guy knowledge man lead give betting draw give pledge payment age obtain immediate supply money old steward attach trust able detect account other supposition be hope discovery 
81,"The conversation with Colonel Harewood kept him so late that he had no time for going, as usual, to his old haunts, at Stylehurst; nor did he feel inclined just then to revive the saddening reflections they excited. He spent the evening in talking over books with his sister, and the next day proceeded on his journey to Thorndale Park.",conversation keep late have time go usual old haunt feel inclined revive saddening reflection excite spend evening talk book sister next day proceed journey 
82,"This was one of the places where he was always the most welcome, ever since he had been a school-boy, received in a way especially flattering, considering that the friendship was entirely owing to the uncompromising good sense and real kindness with which he had kept in order the follies of his former fag.",place welcome school boy receive way flattering consider friendship ow uncompromising good sense real kindness keep order follie former fag 
83,"Charles might laugh, and call them the young man and young man’s companion, and Guy more classically term them the pious Aeneas and his fidus Achates, but it was a friendship that did honour to both; and the value that the Thorndales set upon Captain Morville was not misplaced, and scarcely over-rated. Not particularly clever themselves, they the more highly appreciated his endowments, and were proud that James had been able to make such a friend, for they knew, as well as the rest of the world, that Captain Morville was far from seeking the acquaintance for the sake of their situation in life, but that it was from real liking and esteem. How far this esteem was gained by the deference the whole family paid to his opinion, was another question; at any rate, the courting was from them.",laugh call young man young man companion guy term pious fidus friendship honour value set misplace rate clever appreciate endowment proud able make friend know rest world seek acquaintance sake situation life real like esteem esteem gain deference whole family pay opinion question rate courting 
84,"The Miss Thorndales deemed Captain Morville the supreme authority in drawing, literature, and ecclesiastical architecture; and whenever a person came in their way who was thought handsome, always pronounced that he was not by any means equal to James’s friend. Lady Thorndale delighted to talk over James with him, and thank him for his kindness; and Lord Thorndale, rather a pompous man himself, liked his somewhat stately manners, and talked politics with him, sincerely wishing he was his neighbour at Redclyffe, and calculating how much good he would do there. Philip listened with interest to accounts of how the Thorndale and Morville influence had always divided the borough of Moorworth, and, if united, might dispose of it at will, and returned evasive answers to questions what the young heir of Redclyffe might be likely to do.",deem supreme authority draw literature ecclesiastical architecture person come way think handsome pronounce means equal friend delight talk thank kindness pompous man like stately manners talk politics wish neighbour calculate much good do listen interest account influence divide borough unite dispose will return evasive answer question young heir likely do 
85,"James Thorndale drove his friend to Redclyffe, as Philip had authority from Mr. Edmonstone to transact any business that might be required with Markham, the steward; and, as has been said before, he expected to discover in the accounts something that might explain why Guy had ceased to press for the thousand pounds. However, he could find nothing amiss in them, though--bearing in mind that it is less easy to detect the loss of a score of sheep than of one--he subjected them to a scrutiny which seemed by no means agreeable to the gruff old grumbling steward. He also walked about the park, saw to the marking of certain trees that were injuring each other; and finding that there was a misunderstanding between Markham and the new rector, Mr. Ashford, about certain parish matters, where the clergyman was certainly right, he bore down Markham’s opposition with Mr. Edmonstone’s weight, and felt he was doing good service.",drive friend have authority transact business require steward say expect discover account explain cease press pound find amiss bear mind easy detect loss score sheep subject scrutiny seem means agreeable gruff old grumble steward walk park see mark certain tree injure other find be misunderstanding new rector certain parish matter clergyman right bear opposition weight feel do good service 
86,"He paused at the gate, and looked back at the wide domain and fine old house. He pitied them, and the simple-hearted, honest tenantry, for being the heritage of such a family, and the possession of one so likely to misuse them, instead of training them into the means of conferring benefits on them, on his country. What would not Philip himself do if those lands were his,--just what was needed to give his talents free scope? and what would it be to see his beautiful Laura their mistress?",pause gate look wide domain fine old house pity simple hearted honest tenantry heritage family possession likely misuse train means conferr benefit country do land need give talent free scope see beautiful mistress 
87,,
88, ,
