id,paragraph,tokens
1,CHAPTER XXIII. MAGIC,
2, Dr. Craven had been waiting some time at the house when they returned to it.  He had indeed begun to wonder if it might not be wise to send some one out to explore the garden paths.  When Colin was brought back to his room the poor man looked him over seriously.,wait time house return begin wonder wise send explore garden path bring room poor man look 
3,"""You should not have stayed so long,"" he said.  ""You must not overexert yourself.""",stay say overexert 
4,"""I am not tired at all,"" said Colin.  ""It has made me well.  Tomorrow I am going out in the morning as well as in the afternoon.""",tired say make tomorrow go morning afternoon 
5,"""I am not sure that I can allow it,"" answered Dr. Craven.  ""I am afraid it would not be wise.""",sure allow answer afraid wise 
6,"""It would not be wise to try to stop me,"" said Colin quite seriously. ""I am going.""",wise try stop say go 
7,Even Mary had found out that one of Colin's chief peculiarities was that he did not know in the least what a rude little brute he was with his way of ordering people about.  He had lived on a sort of desert island all his life and as he had been the king of it he had made his own manners and had had no one to compare himself with.  Mary had indeed been rather like him herself and since she had been at Misselthwaite had gradually discovered that her own manners had not been of the kind which is usual or popular.  Having made this discovery she naturally thought it of enough interest to communicate to Colin. So she sat and looked at him curiously for a few minutes after Dr. Craven had gone.  She wanted to make him ask her why she was doing it and of course she did.,find chief peculiarity know least rude little brute way order person live sort desert island life king make own manners have compare discover own manners kind usual popular make discovery think enough interest communicate sit look few minute go want make ask do course 
8,"""What are you looking at me for?"" he said.",look say 
9,"""I'm thinking that I am rather sorry for Dr. Craven.""",think sorry 
10,"""So am I,"" said Colin calmly, but not without an air of some satisfaction.  ""He won't get Misselthwaite at all now I'm not going to die.""",say air satisfaction get go die 
11,"""I'm sorry for him because of that, of course,"" said Mary, ""but I was thinking just then that it must have been very horrid to have had to be polite for ten years to a boy who was always rude.  I would never have done it.""",sorry course say think horrid have polite year boy rude do 
12,"""Am I rude?"" Colin inquired undisturbedly.",rude inquire 
13,"""If you had been his own boy and he had been a slapping sort of man,"" said Mary, ""he would have slapped you.""",own boy slap sort man say slap 
14,"""But he daren't,"" said Colin.",say 
15,"""No, he daren't,"" answered Mistress Mary, thinking the thing out quite without prejudice.  ""Nobody ever dared to do anything you didn't like--because you were going to die and things like that.  You were such a poor thing.""",answer think thing prejudice dare do like go die thing poor thing 
16,"""But,"" announced Colin stubbornly, ""I am not going to be a poor thing. I won't let people think I'm one.  I stood on my feet this afternoon.""",announce go poor thing let person think stand foot afternoon 
17,"""It is always having your own way that has made you so queer,"" Mary went on, thinking aloud.",have own way make queer go think 
18,"Colin turned his head, frowning.",turn head frown 
19,"""Am I queer?"" he demanded.",queer demand 
20,"""Yes,"" answered Mary, ""very. But you needn't be cross,"" she added impartially, ""because so am I queer--and so is Ben Weatherstaff.  But I am not as queer as I was before I began to like people and before I found the garden.""",answer cross add queer queer begin like person find garden 
21,"""I don't want to be queer,"" said Colin.  ""I am not going to be,"" and he frowned again with determination.",want queer say go frown determination 
22,He was a very proud boy.  He lay thinking for a while and then Mary saw his beautiful smile begin and gradually change his whole face.,proud boy lay think while see beautiful smile begin change whole face 
23,"""I shall stop being queer,"" he said, ""if I go every day to the garden. There is Magic in there--good Magic, you know, Mary.  I am sure there is."" ""So am I,"" said Mary.",stop queer say go day garden be good know sure be say 
24,"""Even if it isn't real Magic,"" Colin said, ""we can pretend it is. Something is there--something!""",real say pretend 
25,"""It's Magic,"" said Mary, ""but not black.  It's as white as snow.""",say black white snow 
26,"They always called it Magic and indeed it seemed like it in the months that followed--the wonderful months--the radiant months--the amazing ones.  Oh! the things which happened in that garden! If you have never had a garden you cannot understand, and if you have had a garden you will know that it would take a whole book to describe all that came to pass there.  At first it seemed that green things would never cease pushing their way through the earth, in the grass, in the beds, even in the crevices of the walls.  Then the green things began to show buds and the buds began to unfurl and show color, every shade of blue, every shade of purple, every tint and hue of crimson.  In its happy days flowers had been tucked away into every inch and hole and corner.  Ben Weatherstaff had seen it done and had himself scraped out mortar from between the bricks of the wall and made pockets of earth for lovely clinging things to grow on.  Iris and white lilies rose out of the grass in sheaves, and the green alcoves filled themselves with amazing armies of the blue and white flower lances of tall delphiniums or columbines or campanulas.",call seem month follow wonderful month radiant month amazing one thing happen garden have garden understand have garden know take whole book describe come pass first seem green thing cease push way earth grass bed crevice wall green thing begin show bud bud begin unfurl show color shade blue shade purple tint hue crimson happy day flower tuck inch hole corner see do scrape mortar brick wall make pocket earth lovely cling thing grow white lilie rise grass sheave green alcove fill amazing army blue white flower lance tall delphinium columbine campanula 
27,"""She was main fond o' them--she was,"" Ben Weatherstaff said.  ""She liked them things as was allus pointin' up to th' blue sky, she used to tell.  Not as she was one o' them as looked down on th' earth--not her. She just loved it but she said as th' blue sky allus looked so joyful.""",main fond say like thing allus pointin blue sky use tell look earth love say blue sky allus look joyful 
28,"The seeds Dickon and Mary had planted grew as if fairies had tended them.  Satiny poppies of all tints danced in the breeze by the score, gaily defying flowers which had lived in the garden for years and which it might be confessed seemed rather to wonder how such new people had got there.  And the roses--the roses! Rising out of the grass, tangled round the sun-dial, wreathing the tree trunks and hanging from their branches, climbing up the walls and spreading over them with long garlands falling in cascades--they came alive day by day, hour by hour. Fair fresh leaves, and buds--and buds--tiny at first but swelling and working Magic until they burst and uncurled into cups of scent delicately spilling themselves over their brims and filling the garden air.",seed plant grow fairy tend satiny poppie tint dance breeze score defy flower live garden year confess seem wonder such new person get rose rose rise grass tangle sun- dial wreath tree trunk hang branch climb wall spread long garland fall cascade come alive day day hour hour fair fresh leave bud bud tiny first swell work burst uncurle cup scent spill brim fill garden air 
29,"Colin saw it all, watching each change as it took place.  Every morning he was brought out and every hour of each day when it didn't rain he spent in the garden.  Even gray days pleased him.  He would lie on the grass ""watching things growing,"" he said.  If you watched long enough, he declared, you could see buds unsheath themselves.  Also you could make the acquaintance of strange busy insect things running about on various unknown but evidently serious errands, sometimes carrying tiny scraps of straw or feather or food, or climbing blades of grass as if they were trees from whose tops one could look out to explore the country.  A mole throwing up its mound at the end of its burrow and making its way out at last with the long-nailed paws which looked so like elfish hands, had absorbed him one whole morning.  Ants' ways, beetles' ways, bees' ways, frogs' ways, birds' ways, plants' ways, gave him a new world to explore and when Dickon revealed them all and added foxes' ways, otters' ways, ferrets' ways, squirrels' ways, and trout' and water-rats' and badgers' ways, there was no end to the things to talk about and think over.",see watch change take place morning bring hour day rain spend garden gray day pleased lie grass watch thing grow say watch declare see bud unsheath make acquaintance strange busy insect thing run various unknown serious errand carry tiny scrap straw feather food climb blade grass tree top look explore country mole throw mound end burrow make way last long nail paw look elfish hand absorb whole morning ant way beetle way bee way frog way bird way plant way give new world explore reveal add fox way otter way ferret way squirrel way trout water rat badger way be end thing talk think 
30,And this was not the half of the Magic.  The fact that he had really once stood on his feet had set Colin thinking tremendously and when Mary told him of the spell she had worked he was excited and approved of it greatly.  He talked of it constantly.,half fact stand foot set think tell spell work excite approve talk 
31,"""Of course there must be lots of Magic in the world,"" he said wisely one day, ""but people don't know what it is like or how to make it. Perhaps the beginning is just to say nice things are going to happen until you make them happen.  I am going to try and experiment.""",course be lot world say day person know make beginning say nice thing go happen make happen go try experiment 
32,The next morning when they went to the secret garden he sent at once for Ben Weatherstaff.  Ben came as quickly as he could and found the Rajah standing on his feet under a tree and looking very grand but also very beautifully smiling.,next morning go secret garden send come find stand foot tree look grand smile 
33,"""Good morning, Ben Weatherstaff,"" he said.  ""I want you and Dickon and Miss Mary to stand in a row and listen to me because I am going to tell you something very important.""",good morning say want stand row listen go tell important 
34,"""Aye, aye, sir!"" answered Ben Weatherstaff, touching his forehead. (One of the long concealed charms of Ben Weatherstaff was that in his boyhood he had once run away to sea and had made voyages.  So he could reply like a sailor.)",sir answer touch forehead long conceal charm boyhood run sea make voyage reply sailor 
35,"""I am going to try a scientific experiment,"" explained the Rajah. ""When I grow up I am going to make great scientific discoveries and I am going to begin now with this experiment.""",go try scientific experiment explain grow go make great scientific discovery go begin experiment 
36,"""Aye, aye, sir!"" said Ben Weatherstaff promptly, though this was the first time he had heard of great scientific discoveries.",sir say first time hear great scientific discovery 
37,"It was the first time Mary had heard of them, either, but even at this stage she had begun to realize that, queer as he was, Colin had read about a great many singular things and was somehow a very convincing sort of boy.  When he held up his head and fixed his strange eyes on you it seemed as if you believed him almost in spite of yourself though he was only ten years old--going on eleven.  At this moment he was especially convincing because he suddenly felt the fascination of actually making a sort of speech like a grown-up person.",first time hear stage begin realize queer read great many singular thing convincing sort boy hold head fix strange eye seem believe spite year old go moment convincing feel fascination make sort speech grow person 
38,"""The great scientific discoveries I am going to make,"" he went on, ""will be about Magic.  Magic is a great thing and scarcely any one knows anything about it except a few people in old books--and Mary a little, because she was born in India where there are fakirs.  I believe Dickon knows some Magic, but perhaps he doesn't know he knows it.  He charms animals and people.  I would never have let him come to see me if he had not been an animal charmer--which is a boy charmer, too, because a boy is an animal.  I am sure there is Magic in everything, only we have not sense enough to get hold of it and make it do things for us--like electricity and horses and steam.""",great scientific discovery go make go great thing one know few person old book little bear be fakir believe know know know charm animal person let come see animal charmer boy charmer boy animal sure be sense get hold make do thing electricity horse steam 
39,"This sounded so imposing that Ben Weatherstaff became quite excited and really could not keep still.  ""Aye, aye, sir,"" he said and he began to stand up quite straight.",sound imposing become excited keep sir say begin stand 
40,"""When Mary found this garden it looked quite dead,"" the orator proceeded.  ""Then something began pushing things up out of the soil and making things out of nothing.  One day things weren't there and another they were.  I had never watched things before and it made me feel very curious.  Scientific people are always curious and I am going to be scientific.  I keep saying to myself, 'What is it? What is it?' It's something.  It can't be nothing! I don't know its name so I call it Magic.  I have never seen the sun rise but Mary and Dickon have and from what they tell me I am sure that is Magic too.  Something pushes it up and draws it.  Sometimes since I've been in the garden I've looked up through the trees at the sky and I have had a strange feeling of being happy as if something were pushing and drawing in my chest and making me breathe fast.  Magic is always pushing and drawing and making things out of nothing.  Everything is made out of Magic, leaves and trees, flowers and birds, badgers and foxes and squirrels and people. So it must be all around us.  In this garden--in all the places.  The Magic in this garden has made me stand up and know I am going to live to be a man.  I am going to make the scientific experiment of trying to get some and put it in myself and make it push and draw me and make me strong.  I don't know how to do it but I think that if you keep thinking about it and calling it perhaps it will come.  Perhaps that is the first baby way to get it.  When I was going to try to stand that first time Mary kept saying to herself as fast as she could, 'You can do it! You can do it!' and I did.  I had to try myself at the same time, of course, but her Magic helped me--and so did Dickon's. Every morning and evening and as often in the daytime as I can remember I am going to say, 'Magic is in me! Magic is making me well! I am going to be as strong as Dickon, as strong as Dickon!' And you must all do it, too.  That is my experiment Will you help, Ben Weatherstaff?""",find garden look dead orator proceed begin push thing soil make thing day thing watch thing make feel curious scientific person curious go scientific keep say know name call see sun rise have tell sure push draw garden look tree sky have strange feeling happy push draw chest make breathe push draw make thing make leave tree flower bird badger fox squirrel person garden place garden make stand know go live man go make scientific experiment try get put make push draw make strong know do think keep think call come first baby way get go try stand first time keep say do do have try same time course help do morning evening daytime remember go say make go strong strong do experiment help 
41,"""Aye, aye, sir!"" said Ben Weatherstaff.  ""Aye, aye!""",sir say 
42,"""If you keep doing it every day as regularly as soldiers go through drill we shall see what will happen and find out if the experiment succeeds.  You learn things by saying them over and over and thinking about them until they stay in your mind forever and I think it will be the same with Magic.  If you keep calling it to come to you and help you it will get to be part of you and it will stay and do things."" ""I once heard an officer in India tell my mother that there were fakirs who said words over and over thousands of times,"" said Mary.",keep do day soldier go drill see happen find experiment succeed learn thing say think stay mind think same keep call come help get part stay do thing hear officer tell mother be fakir say word thousand time say 
43,"""I've heard Jem Fettleworth's wife say th' same thing over thousands o' times--callin' Jem a drunken brute,"" said Ben Weatherstaff dryly. ""Summat allus come o' that, sure enough.  He gave her a good hidin' an' went to th' Blue Lion an' got as drunk as a lord.""",hear wife say same thing thousand time call drunken brute say allus come sure give good hidin go blue get drunk lord 
44,Colin drew his brows together and thought a few minutes.  Then he cheered up.,draw brow think few minute cheer 
45,"""Well,"" he said, ""you see something did come of it.  She used the wrong Magic until she made him beat her.  If she'd used the right Magic and had said something nice perhaps he wouldn't have got as drunk as a lord and perhaps--perhaps he might have bought her a new bonnet.""",say see come use wrong make beat use right say nice get drunk lord buy new bonnet 
46,Ben Weatherstaff chuckled and there was shrewd admiration in his little old eyes.,chuckle be shrewd admiration little old eye 
47,"""Tha'rt a clever lad as well as a straight-legged one, Mester Colin,"" he said.  ""Next time I see Bess Fettleworth I'll give her a bit of a hint o' what Magic will do for her.  She'd be rare an' pleased if th' sinetifik 'speriment worked--an' so 'ud Jem.""",clever lad straight legged one say next time see give bit hint do rare pleased speriment work ud 
48,"Dickon had stood listening to the lecture, his round eyes shining with curious delight.  Nut and Shell were on his shoulders and he held a long-eared white rabbit in his arm and stroked and stroked it softly while it laid its ears along its back and enjoyed itself.",stand listen lecture round eye shine curious delight shoulder hold long eared white rabbit arm stroke stroke lay ear back enjoy 
49,"""Do you think the experiment will work?"" Colin asked him, wondering what he was thinking.  He so often wondered what Dickon was thinking when he saw him looking at him or at one of his ""creatures"" with his happy wide smile.",think experiment work ask wonder think wonder think see look creature happy wide smile 
50,He smiled now and his smile was wider than usual.,smile smile wide usual 
51,"""Aye,"" he answered, ""that I do.  It'll work same as th' seeds do when th' sun shines on 'em. It'll work for sure.  Shall us begin it now?""",answer work same th' seed do sun shine work sure begin 
52,Colin was delighted and so was Mary.  Fired by recollections of fakirs and devotees in illustrations Colin suggested that they should all sit cross-legged under the tree which made a canopy.,delighted fire recollection fakir devotee illustration suggest sit cross-legg tree make canopy 
53,"""It will be like sitting in a sort of temple,"" said Colin.  ""I'm rather tired and I want to sit down.""",sit sort temple say tired want sit 
54,"""Eh!"" said Dickon, ""tha' mustn't begin by sayin' tha'rt tired.  Tha' might spoil th' Magic.""",say tha begin tired spoil 
55,Colin turned and looked at him--into his innocent round eyes.,turn look innocent round eye 
56,"""That's true,"" he said slowly.  ""I must only think of the Magic."" It all seemed most majestic and mysterious when they sat down in their circle.  Ben Weatherstaff felt as if he had somehow been led into appearing at a prayer-meeting. Ordinarily he was very fixed in being what he called ""agen' prayer-meetin's"" but this being the Rajah's affair he did not resent it and was indeed inclined to be gratified at being called upon to assist.  Mistress Mary felt solemnly enraptured. Dickon held his rabbit in his arm, and perhaps he made some charmer's signal no one heard, for when he sat down, cross-legged like the rest, the crow, the fox, the squirrels and the lamb slowly drew near and made part of the circle, settling each into a place of rest as if of their own desire.",true say think seem majestic mysterious sit circle feel lead appear prayer meeting fix call agen prayer meetin affair resent inclined gratified call assist mistress feel enrapture hold rabbit arm make charmer signal hear sit cross -legge rest crow fox squirrel lamb draw make part circle settle place rest own desire 
57,"""The 'creatures' have come,"" said Colin gravely.  ""They want to help us.""",creature come say want help 
58,"Colin really looked quite beautiful, Mary thought.  He held his head high as if he felt like a sort of priest and his strange eyes had a wonderful look in them.  The light shone on him through the tree canopy.",look beautiful think hold head high feel sort priest strange eye have wonderful look light shine tree canopy 
59,"""Now we will begin,"" he said.  ""Shall we sway backward and forward, Mary, as if we were dervishes?""",begin say sway dervishe 
60,"""I canna' do no swayin' back'ard and for'ard,"" said Ben Weatherstaff. ""I've got th' rheumatics.""",do swayin' back'ard for'ard say get rheumatics 
61,"""The Magic will take them away,"" said Colin in a High Priest tone, ""but we won't sway until it has done it.  We will only chant.""",take say high tone sway do chant 
62,"""I canna' do no chantin'"" said Ben Weatherstaff a trifle testily. ""They turned me out o' th' church choir th' only time I ever tried it.""",do chantin say trifle turn church choir only time try 
63,No one smiled.  They were all too much in earnest.  Colin's face was not even crossed by a shadow.  He was thinking only of the Magic.,smile much earnest face cross shadow think 
64,"""Then I will chant,"" he said.  And he began, looking like a strange boy spirit.  ""The sun is shining--the sun is shining.  That is the Magic. The flowers are growing--the roots are stirring.  That is the Magic. Being alive is the Magic--being strong is the Magic.  The Magic is in me--the Magic is in me.  It is in me--it is in me.  It's in every one of us.  It's in Ben Weatherstaff's back.  Magic! Magic! Come and help!""",chant say begin look strange boy spirit sun shine sun shine flower grow root stir alive strong one back magic magic come help 
65,"He said it a great many times--not a thousand times but quite a goodly number.  Mary listened entranced.  She felt as if it were at once queer and beautiful and she wanted him to go on and on.  Ben Weatherstaff began to feel soothed into a sort of dream which was quite agreeable. The humming of the bees in the blossoms mingled with the chanting voice and drowsily melted into a doze.  Dickon sat cross-legged with his rabbit asleep on his arm and a hand resting on the lamb's back.  Soot had pushed away a squirrel and huddled close to him on his shoulder, the gray film dropped over his eyes.  At last Colin stopped.",say great many time time goodly number listen entrance feel queer beautiful want go begin feel sooth sort dream agreeable hum bee blossom mingle chant voice melt doze sit cross -legge rabbit arm hand rest lamb back soot push squirrel huddle shoulder gray film drop eye last stop 
66,"""Now I am going to walk round the garden,"" he announced.",go walk garden announce 
67,Ben Weatherstaff's head had just dropped forward and he lifted it with a jerk.,head drop lift jerk 
68,"""You have been asleep,"" said Colin.",asleep say 
69,"""Nowt o' th' sort,"" mumbled Ben.  ""Th' sermon was good enow--but I'm bound to get out afore th' collection.""",sort mumble th' sermon good bind get th' collection 
70,He was not quite awake yet.,awake 
71,"""You're not in church,"" said Colin.",church say 
72,"""Not me,"" said Ben, straightening himself.  ""Who said I were? I heard every bit of it.  You said th' Magic was in my back.  Th' doctor calls it rheumatics.""",say straighten say hear bit say back doctor call rheumatics 
73,The Rajah waved his hand.,wave hand 
74,"""That was the wrong Magic,"" he said.  ""You will get better.  You have my permission to go to your work.  But come back tomorrow.""",wrong say get good have permission go work come tomorrow 
75,"""I'd like to see thee walk round the garden,"" grunted Ben.",like see walk garden grunt 
76,"It was not an unfriendly grunt, but it was a grunt.  In fact, being a stubborn old party and not having entire faith in Magic he had made up his mind that if he were sent away he would climb his ladder and look over the wall so that he might be ready to hobble back if there were any stumbling.",unfriendly grunt grunt fact stubborn old party have entire faith make mind send climb ladder look wall ready hobble be stumbling 
