id,paragraph,tokens
77,"The Rajah did not object to his staying and so the procession was formed.  It really did look like a procession.  Colin was at its head with Dickon on one side and Mary on the other.  Ben Weatherstaff walked behind, and the ""creatures"" trailed after them, the lamb and the fox cub keeping close to Dickon, the white rabbit hopping along or stopping to nibble and Soot following with the solemnity of a person who felt himself in charge.",object stay procession form look procession head side other walk creature trail lamb fox cub keep white rabbit hopping stop nibble follow solemnity person feel charge 
78,"It was a procession which moved slowly but with dignity.  Every few yards it stopped to rest.  Colin leaned on Dickon's arm and privately Ben Weatherstaff kept a sharp lookout, but now and then Colin took his hand from its support and walked a few steps alone.  His head was held up all the time and he looked very grand.",procession move dignity few yard stop rest learn arm keep sharp lookout take hand support walk few step head hold time look grand 
79,"""The Magic is in me!"" he kept saying.  ""The Magic is making me strong! I can feel it! I can feel it!""",keep say make strong feel feel 
80,"It seemed very certain that something was upholding and uplifting him. He sat on the seats in the alcoves, and once or twice he sat down on the grass and several times he paused in the path and leaned on Dickon, but he would not give up until he had gone all round the garden.  When he returned to the canopy tree his cheeks were flushed and he looked triumphant.",seem certain uphold uplift sit seat alcove sit grass several time pause path learn give go garden return canopy tree cheek flush look triumphant 
81,"""I did it! The Magic worked!"" he cried.  ""That is my first scientific discovery."".",do work cry first scientific discovery 
82,"""What will Dr. Craven say?"" broke out Mary.",say break 
83,"""He won't say anything,"" Colin answered, ""because he will not be told. This is to be the biggest secret of all.  No one is to know anything about it until I have grown so strong that I can walk and run like any other boy.  I shall come here every day in my chair and I shall be taken back in it.  I won't have people whispering and asking questions and I won't let my father hear about it until the experiment has quite succeeded.  Then sometime when he comes back to Misselthwaite I shall just walk into his study and say 'Here I am; I am like any other boy. I am quite well and I shall live to be a man.  It has been done by a scientific experiment.'""",say answer tell big secret know grow strong walk run other boy come day chair take have person whisper ask question let father hear experiment succeed come walk study say other boy well live man do scientific experiment 
84,"""He will think he is in a dream,"" cried Mary.  ""He won't believe his eyes.""",think dream cry believe eye 
85,"Colin flushed triumphantly.  He had made himself believe that he was going to get well, which was really more than half the battle, if he had been aware of it.  And the thought which stimulated him more than any other was this imagining what his father would look like when he saw that he had a son who was as straight and strong as other fathers' sons.  One of his darkest miseries in the unhealthy morbid past days had been his hatred of being a sickly weak-backed boy whose father was afraid to look at him.",flush make believe go get more battle aware thought stimulate more other imagin father look see have son straight strong other father son dark misery unhealthy morbid past day hatred sickly weak back boy father afraid look 
86,"""He'll be obliged to believe them,"" he said.",oblige believe say 
87,"""One of the things I am going to do, after the Magic works and before I begin to make scientific discoveries, is to be an athlete.""",thing go do work begin make scientific discovery athlete 
88,"""We shall have thee takin' to boxin' in a week or so,"" said Ben Weatherstaff.  ""Tha'lt end wi' winnin' th' Belt an' bein' champion prize-fighter of all England.""",have takin boxin week say end winnin belt bein' champion prize fighter 
89,Colin fixed his eyes on him sternly.,fix eye 
90,"""Weatherstaff,"" he said, ""that is disrespectful.  You must not take liberties because you are in the secret.  However much the Magic works I shall not be a prize-fighter.  I shall be a Scientific Discoverer.""",weatherstaff say disrespectful take liberty secret much work prize fighter scientific discoverer 
91,"""Ax pardon--ax pardon, sir"" answered Ben, touching his forehead in salute.  ""I ought to have seed it wasn't a jokin' matter,"" but his eyes twinkled and secretly he was immensely pleased.  He really did not mind being snubbed since the snubbing meant that the lad was gaining strength and spirit.",ax pardon ax pardon sir answer touch forehead salute have seed jokin' matter eye twinkle pleased mind snubb snubbing mean lad gain strength spirit 
92,,
93, ,
