id,paragraph,tokens
39,"""Yes,"" said Dudu, ""he got better, but never quite well again. However, he lived some years, long enough to see his boys grown up and to return--after the death of our old Monsieur and Madame--to return to his own country with his wife and sister-in-law. But before very long, while still far from an old man, he died. Then our young ladies, young no longer, came back, after a time, to their childish home; and here they lived together quietly, kind and charitable to all, cheered from time to time by the visits of Madame's two sons, out in the world now and married, and with homes of their own. And time went on gently and uneventfully, and gradually Madame's hair became quite, quite white, and Mademoiselle Eliane took to limping a little in her walk with the rheumatism, and when they slowly paced up and down the terrace it was difficult for me to think they were really my pretty young ladies with the white dresses and blue ribbons of half a century ago. For it was now just thirty-five years since the last visit of their English friend. She too, if she were alive, must be a woman of more than sixty. They had never heard of her again. In the hurry and anxiety of their last meeting they had forgotten to ask and she to give her exact address, so they could not write. She might have written to them to the old house perhaps, on the chance of it finding them; but if so, they had never got the letter. Yet they often spoke of her, and never saw the balcony at the end of the terrace without a kindly thought of those long ago days.",say get good live year see boy grow return death old return own country wife sister law old man die young lady young come time childish home live kind charitable cheer time time visit son world marry home own time go hair become white take limp little walk rheumatism pace terrace difficult think pretty young lady white dress blue ribbon century year last visit english friend alive woman more hear hurry anxiety last meeting forget ask give exact address write write old house chance find get letter speak see balcony end terrace kindly thought long ago day 
40,"""One evening--an autumn evening--mild and balmy, the two old ladies were slowly pacing up and down their favourite walk, when a servant came out to say that they were wanted--a lady was asking for them. But not to disturb them, he added, the visitor would be glad to see them in the garden, if they would allow it. Wondering who it could be, Madame and her sister were hesitating what to do, when a figure was seen approaching them from the house.",evening autumn evening mild balmy old lady pace favourite walk servant come say want lady ask disturb add visitor glad see garden allow wonder sister hesitate do figure see approach house 
41,"""'I could not wait,' she said, almost before she reached them. 'I wished so much to see you once more in the old spot, dear friends;' and they knew her at once. They recognised in the bowed and worn but still sweet and lovely woman, their pretty child-friend of fifty years ago. She had come to bid them farewell, she said. She was on her way to the south--not to live but to die, for she had suffered much and her days were numbered.",wait say reach wish much see old spot dear friend know recognise bow wear sweet lovely woman pretty child friend year come bid farewell say way south live die suffer much day number 
42,"""'My dear husband is dead some years ago,' she said. 'But we were very happy together, which is a blessed thought. And my children--one after another they faded. So I am an old woman now and quite alone, and I am glad to go to them all. My friends wished me to go to the south, for I have always loved the sunshine, and there my little daughter died, and perhaps death will there come to me in gentler shape. But on my way, I wished to say good-bye to you, dear friends of long ago, whom I have always loved, though we have been so little together.'",dear husband dead year say happy bless thought child fade old woman alone glad go friend wish go south love sunshine little daughter die death come gentler shape way wish say good bye dear friend love little 
43,"""And then they took each other's hands, gently and quietly, the three old ladies, and softly kissed each other's withered cheeks, down which a few tears made their way; the time was past for them for anything but gentle and chastened feelings. And whispering to their old friend not good-bye, but 'Au revoir, au revoir in a better country,' my ladies parted once more with their childish friend.",take other hand old lady kiss other wither cheek few tear make way time past gentle chasten feeling whisper old friend good good country lady part more childish friend 
44,"""She died a few months later; news of her death was sent them. _They_ lived to be old--past eighty both of them, when they died within a few days of each other. But I never hobble up and down the terrace walk without thinking of them,"" added Dudu, ""and on the whole, my dears, even if I had my choice, I don't think I should care to live another two or three hundred years in a world where changes come so quickly.""",die few month news death send live old die few day other hobble terrace walk think add whole dear have choice think care live year world change come 
45,"Hugh and Jeanne were silent for a moment. Then ""Thank you, dear Dudu,"" they said together.",silent moment thank dear say 
46,"And Dudu cocked his head on one side. ""There is Marcelline calling you,"" he said, in a matter-of-fact tone. ""Run downstairs. Take a look at the beautiful stars overhead before you go. Good-bye, my dears.""",cocked head side be call say matter fact tone run take look beautiful star go good dear 
47,"""Good-night, Dudu, and thank you again,"" said the children, as they hastened away.",good night thank say child hasten 
48,"They found their way back to the tapestry room without difficulty. They were standing in the middle of the room, half puzzled as to how they had got there, when Marcelline appeared.",find way tapestry room difficulty stand middle room half puzzle get appear 
49,"""We have been with Dudu,"" they told her, before she had time to ask them anything. ""He has told us lovely stories--nicer even than fairy adventures."" And Marcelline smiled and seemed pleased, but not at all surprised.",tell have time ask tell lovely story nice fairy adventure smile seem pleased surprise 
50,       *       *       *       *       *,
51,"""A strange thing has happened,"" said Jeanne's father the next day. ""I feel quite distressed about it. Old Dudu the raven has disappeared. He is nowhere to be found since yesterday afternoon, the gardener tells me. They have looked for him everywhere in vain. I feel quite sorry--he has been in the family so long--how long indeed I should be afraid to say, for my father remembered him as a child.""",strange thing happen say father next day feel distressed old raven disappear find yesterday afternoon gardener tell look vain feel sorry family afraid say father remember child 
52,The children looked at each other.,child look other 
53,"""Dudu has gone!"" they said softly.",go say 
54,"""We shall have no more stories,"" whispered Hugh.",have more story whisper 
55,"""Nor fairy adventures,"" said Jeanne.",fairy adventure say 
56,"""He may come back again,"" said Hugh.",come say 
57,"""I think not,"" said Jeanne, shaking her smooth little black head. ""Don't you remember, Chéri, what he said about not wishing to stay here longer?""",think say shake smooth little black head remember say wish stay 
58,"""And he said 'good-bye,'"" added Hugh sadly. ""I fear he will not come back.""",say good bye add fear come 
59,"But if he _ever_ does, children dear, and if you care to hear what he has to tell, you shall not be forgotten, I promise you.",child dear care hear have tell forget promise 
60,,
61,THE END,end 
62, ,
