id,paragraph,tokens
67,"“You won’t leave the young un, will you?” says he, as they haul poor little Arthur, already losing wind from the fright, through the next hedge. “Not we,” is the answer from both. The next hedge is a stiff one; the pursuers gain horribly on them, and they only just pull Arthur through, with two great rents in his trousers, as the foremost shepherd comes up on the other side. As they start into the next field, they are aware of two figures walking down the footpath in the middle of it, and recognize Holmes and Diggs taking a constitutional. Those good-natured fellows immediately shout, “On.” “Let’s go to them and surrender,”  pants Tom. Agreed. And in another minute the four boys, to the great astonishment of those worthies, rush breathless up to Holmes and Diggs, who pull up to see what is the matter; and then the whole is explained by the appearance of the farmer and his men, who unite their forces and bear down on the knot of boys.",leave young un say haul poor little lose wind fright next hedge answer next hedge stiff one pursuer gain pull great rent trousers foremost shepherd come other side start next field aware figure walk footpath middle recognize take constitutional good natured fellow shout let go surrender pants agree minute boy great astonishment worthie rush breathless pull see matter whole explain appearance farmer man unite force bear knot boy 
68,"There is no time to explain, and Tom’s heart beats frightfully quick, as he ponders, “Will they stand by us?”",be time explain heart beat quick ponder stand 
69,"The farmer makes a rush at East and collars him; and that young gentleman, with unusual discretion, instead of kicking his shins, looks appealingly at Holmes, and stands still.",farmer make rush collar young gentleman unusual discretion kick shin look stand 
70,"“Hullo there; not so fast,” says Holmes, who is bound to stand up for them till they are proved in the wrong. “Now what’s all this about?”",say bound stand prove wrong 
71,"“I’ve got the young varmint at last, have I,” pants the farmer; “why, they’ve been a-skulking about my yard and stealing my fowls--that’s where ‘tis; and if I doan’t have they flogged for it, every one on ‘em, my name ain’t Thompson.”",get young varmint last pants farmer skulk yard steal fowl flogge one name 
72,"Holmes looks grave and Diggs’s face falls. They are quite ready to fight--no boys in the school more so; but they are praepostors, and understand their office, and can’t uphold unrighteous causes.",look grave face fall ready fight boy school praepostor understand office uphold unrighteous cause 
73,"“I haven’t been near his old barn this half,” cries East. “Nor I,” “Nor I,” chime in Tom and Martin.",old barn half cry chime 
74,"“Now, Willum, didn’t you see ‘em there last week?”",see last week 
75,"“Ees, I seen ‘em sure enough,” says Willum, grasping a prong he carried, and preparing for action.",see sure say grasp prong carry prepare action 
76,"The boys deny stoutly, and Willum is driven to admit that “if it worn’t they ‘twas chaps as like ‘em as two peas’n;” and “leastways he’ll swear he see’d them two in the yard last Martinmas,” indicating East and Tom.",boy deny drive admit twat chap peas’n leastway swear see would yard last indicate 
77,"Holmes has had time to meditate. “Now, sir,” says he to Willum, “you see you can’t remember what you have seen, and I believe the boys.”",have time meditate sir say see remember see believe boy 
78,"“I doan’t care,” blusters the farmer; “they was arter my fowls to-day--that’s enough for I.--Willum, you catch hold o’ t’other chap. They’ve been a-sneaking about this two hours, I tells ‘ee,” shouted he, as Holmes stands between Martin and Willum, “and have druv a matter of a dozen young pullets pretty nigh to death.”",care bluster farmer arter fowl day enough catch hold t’other chap sneak hour tell shout stand have druv matter young pullet nigh death 
79,"“Oh, there’s a whacker!” cried East; “we haven’t been within a hundred yards of his barn; we haven’t been up here above ten minutes, and we’ve seen nothing but a tough old guinea-hen, who ran like a greyhound.”",be whacker cry yard barn minute see tough old guinea hen run greyhound 
80,"“Indeed, that’s all true, Holmes, upon my honour,” added Tom; “we weren’t after his fowls; guinea-hen ran out of the hedge under our feet, and we’ve seen nothing else.”",true honour add fowl guinea hen run hedge foot see else 
81,"“Drat their talk. Thee catch hold o’ t’other, Willum, and come along wi’ un.”",drat talk catch hold t’other come wil 
82,"“Farmer Thompson,” said Holmes, warning off Willum and the prong with his stick, while Diggs faced the other shepherd, cracking his fingers like pistol-shots, “now listen to reason. The boys haven’t been after your fowls, that’s plain.”",say warning prong stick face other shepherd crack finger pistol shot listen reason boy fowl plain 
83,"“Tells ‘ee I see’d’em. Who be you, I should like to know?”",tell see’d’em like know 
84,"“Never you mind, farmer,” answered Holmes. “And now I’ll just tell you what it is: you ought to be ashamed of yourself for leaving all that poultry about, with no one to watch it, so near the School. You deserve to have it all stolen. So if you choose to come up to the Doctor with them, I shall go with you, and tell him what I think of it.”",mind farmer answer tell ashamed leave poultry watch deserve have steal choose come doctor go tell think 
85,"The farmer began to take Holmes for a master; besides, he wanted to get back to his flock. Corporal punishment was out of the question, the odds were too great; so he began to hint at paying for the damage. Arthur jumped at this, offering to pay anything, and the farmer immediately valued the guinea-hen at half a sovereign.",farmer begin take master want get flock corporal punishment question odd great begin hint pay damage jump offer pay farmer value guinea hen sovereign 
86,"“Half a sovereign!” cried East, now released from the farmer’s grip; “well, that is a good one! The old hen ain’t hurt a bit, and she’s seven years old, I know, and as tough as whipcord; she couldn’t lay another egg to save her life.”",sovereign cry release farmer grip good one old hen hurt bit year old know tough whipcord lay egg save life 
87,"It was at last settled that they should pay the farmer two shillings, and his man one shilling; and so the matter ended, to the unspeakable relief of Tom, who hadn’t been able to say a word, being sick at heart at the idea of what the Doctor would think of him; and now the whole party of boys marched off down the footpath towards Rugby. Holmes, who was one of the best boys in the School, began to improve the occasion. “Now, you youngsters,” said he, as he marched along in the middle of them, “mind this; you’re very well out of this scrape. Don’t you go near Thompson’s barn again; do you hear?”",last settle pay farmer shilling man shilling matter end unspeakable relief able say word sick heart idea think whole party boy march footpath good boy begin improve occasion youngster say march middle mind scrape go barn hear 
88,"Profuse promises from all, especially East.",profuse promise 
89,"“Mind, I don’t ask questions,” went on Mentor, “but I rather think some of you have been there before this after his chickens. Now, knocking over other people’s chickens, and running off with them, is stealing. It’s a nasty word, but that’s the plain English of it. If the chickens were dead and lying in a shop, you wouldn’t take them, I know that, any more than you would apples out of Griffith’s basket; but there’s no real difference between chickens running about and apples on a tree, and the same articles in a shop. I wish our morals were sounder in such matters. There’s nothing so mischievous as these school distinctions, which jumble up right and wrong, and justify things in us for which poor boys would be sent to prison.” And good old Holmes delivered his soul on the walk home of many wise sayings, and, as the song says,",mind ask question go think chicken knock other person chicken run steal nasty word plain chicken dead lie shop take know more apple basket be real difference chicken run apple tree same article shop wish moral sounder such matter be mischievous school distinction jumble right wrong justify thing poor boy send prison good old deliver soul walk home many wise saying song say 
90,     “Gee’d ‘em a sight of good advice;”,sight good advice 
91,"which same sermon sank into them all, more or less, and very penitent they were for several hours. But truth compels me to admit that East, at any rate, forgot it all in a week, but remembered the insult which had been put upon him by Farmer Thompson, and with the Tadpole and other hair-brained youngsters committed a raid on the barn soon afterwards, in which they were caught by the shepherds and severely handled, besides having to pay eight shillings--all the money they had in the world--to escape being taken up to the Doctor.",same sermon sink more less penitent several hour truth compel admit rate forget week remember insult put other hair brain youngster commit raid barn catch shepherd handle have pay shilling money have world escape take 
92,"Martin became a constant inmate in the joint study from this time, and Arthur took to him so kindly that Tom couldn’t resist slight fits of jealousy, which, however, he managed to keep to himself. The kestrel’s eggs had not been broken, strange to say, and formed the nucleus of Arthur’s collection, at which Martin worked heart and soul, and introduced Arthur to Howlett the bird-fancier, and instructed him in the rudiments of the art of stuffing. In token of his gratitude, Arthur allowed Martin to tattoo a small anchor on one of his wrists; which decoration, however, he carefully concealed from Tom. Before the end of the half-year he had trained into a bold climber and good runner, and, as Martin had foretold, knew twice as much about trees, birds, flowers, and many other things, as our good-hearted and facetious young friend Harry East.",become constant inmate joint study time take resist slight fit jealousy manage keep kestrel egg break strange say form nucleus collection work heart soul introduce bird fancier instruct rudiment art stuff token gratitude allow tattoo small anchor wrist decoration conceal end half year train bold climber good runner foretell know much tree bird flower many other thing good hearted facetious young friend 
93,,
94,,
