id,paragraph,tokens
44,"Then came summonses to open, which being unanswered, the assault commenced. Luckily the door was a good strong oak one, and resisted the united weight of Flashman’s party. A pause followed, and they heard a besieger remark, “They’re in safe enough. Don’t you see how the door holds at top and bottom? So the bolts must be drawn. We should have forced the lock long ago.” East gave Tom a nudge, to call attention to this scientific remark.",come summonse open unanswered assault commence door good strong oak one resist united weight party pause follow hear besieger remark safe see door hold top bottom bolt draw force lock give nudge call attention scientific remark 
45,"Then came attacks on particular panels, one of which at last gave way to the repeated kicks; but it broke inwards, and the broken pieces got jammed across (the door being lined with green baize), and couldn’t easily be removed from outside: and the besieged, scorning further concealment, strengthened their defences by pressing the end of their sofa against the door. So, after one or two more ineffectual efforts, Flashman and Company retired, vowing vengeance in no mild terms.",come attack particular panel last give way repeat kick break break piece jamm door line green baize remove besiege scorn further concealment strengthen defence press end sofa door more ineffectual effort retire vow vengeance mild term 
46,"The first danger over, it only remained for the besieged to effect a safe retreat, as it was now near bed-time. They listened intently, and heard the supper-party resettle themselves, and then gently drew back first one bolt and then the other. Presently the convivial noises began again steadily. “Now then, stand by for a run,” said East, throwing the door wide open and rushing into the passage, closely followed by Tom. They were too quick to be caught; but Flashman was on the lookout, and sent an empty pickle-jar whizzing after them, which narrowly missed Tom’s head, and broke into twenty pieces at the end of the passage. “He wouldn’t mind killing one, if he wasn’t caught,” said East, as they turned the corner.",first danger remain besiege effect safe retreat bed time listen hear supper party resettle draw first bolt other convivial noise begin stand run say throw door open rush passage follow quick catch lookout send empty pickle jar whizz miss head break piece end passage mind kill catch say turn corner 
47,"There was no pursuit, so the two turned into the hall, where they found a knot of small boys round the fire. Their story was told. The war of independence had broken out. Who would join the revolutionary forces? Several others present bound themselves not to fag for the fifth form at once. One or two only edged off, and left the rebels. What else could they do? “I’ve a good mind to go to the Doctor straight,” said Tom.",be pursuit turn hall find knot small boy fire story tell war independence break join revolutionary force several other present bind fig fifth form edged leave rebel do have good mind go say 
48,“That’ll never do. Don’t you remember the levy of the school last half?”  put in another.,do remember levy school last half put 
49,"In fact, the solemn assembly, a levy of the School, had been held, at which the captain of the School had got up, and after premising that several instances had occurred of matters having been reported to the masters; that this was against public morality and School tradition; that a levy of the sixth had been held on the subject, and they had resolved that the practice must be stopped at once; and given out that any boy, in whatever form, who should thenceforth appeal to a master, without having first gone to some praepostor and laid the case before him, should be thrashed publicly, and sent to Coventry.",fact solemn assembly levy hold captain get premise several instance occur matter report master public morality school tradition levy sixth hold subject resolve practice stop give boy form appeal master go praepostor lay case thrash send 
50,"“Well, then, let’s try the sixth. Try Morgan,” suggested another. “No use”--“Blabbing won’t do,” was the general feeling.",let try sixth try suggest use blabbing do general feeling 
51,"“I’ll give you fellows a piece of advice,” said a voice from the end of the hall. They all turned round with a start, and the speaker got up from a bench on which he had been lying unobserved, and gave himself a shake. He was a big, loose-made fellow, with huge limbs which had grown too far through his jacket and trousers. “Don’t you go to anybody at all--you just stand out; say you won’t fag. They’ll soon get tired of licking you. I’ve tried it on years ago with their forerunners.”",give fellow piece advice say voice end hall turn start speaker get bench lie unobserve give shake big loose make fellow huge limb grow jacket trousers go stand say fig get tired lick try year forerunner 
52,"“No! Did you? Tell us how it was?” cried a chorus of voices, as they clustered round him.",tell cry chorus voice cluster 
53,"“Well, just as it is with you. The fifth form would fag us, and I and some more struck, and we beat ‘em. The good fellows left off directly, and the bullies who kept on soon got afraid.”",fifth form fig strike beat good fellow leave bully keep get afraid 
54,“Was Flashman here then?”,
55,"“Yes; and a dirty, little, snivelling, sneaking fellow he was too. He never dared join us, and used to toady the bullies by offering to fag for them, and peaching against the rest of us.”",dirty little snivelling sneak fellow dare join use toady bully offer fig peach rest 
56,"“Why wasn’t he cut, then?” said East.",cut say 
57,"“Oh, toadies never get cut; they’re too useful. Besides, he has no end of great hampers from home, with wine and game in them; so he toadied and fed himself into favour.”",toady cut useful have end great hamper home wine game toady feed favour 
58,"The quarter-to-ten bell now rang, and the small boys went off upstairs, still consulting together, and praising their new counsellor, who stretched himself out on the bench before the hall fire again. There he lay, a very queer specimen of boyhood, by name Diggs, and familiarly called “the Mucker.” He was young for his size, and a very clever fellow, nearly at the top of the fifth. His friends at home, having regard, I suppose, to his age, and not to his size and place in the school, hadn’t put him into tails; and even his jackets were always too small; and he had a talent for destroying clothes and making himself look shabby. He wasn’t on terms with Flashman’s set, who sneered at his dress and ways behind his back; which he knew, and revenged himself by asking Flashman the most disagreeable questions, and treating him familiarly whenever a crowd of boys were round him. Neither was he intimate with any of the other bigger boys, who were warned off by his oddnesses, for he was a very queer fellow; besides, amongst other failings, he had that of impecuniosity in a remarkable degree. He brought as much money as other boys to school, but got rid of it in no time, no one knew how; and then, being also reckless, borrowed from any one; and when his debts accumulated and creditors pressed, would have an auction in the hall of everything he possessed in the world, selling even his school-books, candlestick, and study table. For weeks after one of these auctions, having rendered his study uninhabitable, he would live about in the fifth-form room and hall, doing his verses on old letter-backs and odd scraps of paper, and learning his lessons no one knew how. He never meddled with any little boy, and was popular with them, though they all looked on him with a sort of compassion, and called him “Poor Diggs,” not being able to resist appearances, or to disregard wholly even the sneers of their enemy Flashman. However, he seemed equally indifferent to the sneers of big boys and the pity of small ones, and lived his own queer life with much apparent enjoyment to himself. It is necessary to introduce Diggs thus particularly, as he not only did Tom and East good service in their present warfare, as is about to be told, but soon afterwards, when he got into the sixth, chose them for his fags, and excused them from study-fagging, thereby earning unto himself eternal gratitude from them and all who are interested in their history.",quarter bell ring small boy go consult prais new counsellor stretch bench hall fire lay queer specimen boyhood name call young size clever fellow top fifth friend home regard suppose age size place school put tail jacket small have talent destroy clothes make look shabby term set sneer dress way back know revenge ask disagreeable question treat crowd boy intimate other big boy warn oddness queer fellow other failing have impecuniosity remarkable degree bring much money other boy school get rid time know reckless borrow one debt accumulate creditor press have auction hall possess world sell school book candlestick study table week auction render study uninhabitable live fifth form room hall do verse old letter back odd scrap paper learn lesson know meddle little boy popular look sort compassion call poor able resist appearance disregard sneer enemy seem indifferent sneer big boy pity small one live own queer life much apparent enjoyment necessary introduce do good service present warfare about tell get sixth choose fag excuse study fagging earn eternal gratitude interested history 
59,"And seldom had small boys more need of a friend, for the morning after the siege the storm burst upon the rebels in all its violence. Flashman laid wait, and caught Tom before second lesson, and receiving a point-blank “No” when told to fetch his hat, seized him and twisted his arm, and went through the other methods of torture in use. “He couldn’t make me cry, though,” as Tom said triumphantly to the rest of the rebels; “and I kicked his shins well, I know.” And soon it crept out that a lot of the fags were in league, and Flashman excited his associates to join him in bringing the young vagabonds to their senses; and the house was filled with constant chasings, and sieges, and lickings of all sorts; and in return, the bullies’ beds were pulled to pieces and drenched with water, and their names written up on the walls with every insulting epithet which the fag invention could furnish. The war, in short, raged fiercely; but soon, as Diggs had told them, all the better fellows in the fifth gave up trying to fag them, and public feeling began to set against Flashman and his two or three intimates, and they were obliged to keep their doings more secret, but being thorough bad fellows, missed no opportunity of torturing in private. Flashman was an adept in all ways, but above all in the power of saying cutting and cruel things, and could often bring tears to the eyes of boys in this way, which all the thrashings in the world wouldn’t have wrung from them.",have small boy more need friend morning siege storm burst rebel violence lay wait catch second lesson receive point blank tell fetch hat seize twist arm go other method torture use make cry say rest rebel kick shin know creep lot fag league excite associate join bring young vagabond sense house fill constant chasing siege licking sort return bully bed pull piece drench water name write wall insulting epithet fag invention furnish war short rage tell good fellow fifth give try fig public feeling begin set intimate oblige keep doing secret thorough bad fellow miss opportunity torture private adept way power say cut cruel thing bring tear eye boy way thrashing world wrung 
60,"And as his operations were being cut short in other directions, he now devoted himself chiefly to Tom and East, who lived at his own door, and would force himself into their study whenever he found a chance, and sit there, sometimes alone, and sometimes with a companion, interrupting all their work, and exulting in the evident pain which every now and then he could see he was inflicting on one or the other.",operation cut short other direction devote live own door force study find chance sit alone companion interrupt work exult evident pain see inflict other 
61,"The storm had cleared the air for the rest of the house, and a better state of things now began than there had been since old Brooke had left; but an angry, dark spot of thunder-cloud still hung over the end of the passage where Flashman’s study and that of East and Tom lay.",storm clear air rest house good state thing begin be old leave angry dark spot thunder cloud hang end passage study lay 
62,"He felt that they had been the first rebels, and that the rebellion had been to a great extent successful; but what above all stirred the hatred and bitterness of his heart against them was that in the frequent collisions which there had been of late they had openly called him coward and sneak. The taunts were too true to be forgiven. While he was in the act of thrashing them, they would roar out instances of his funking at football, or shirking some encounter with a lout of half his own size. These things were all well enough known in the house, but to have his own disgrace shouted out by small boys, to feel that they despised him, to be unable to silence them by any amount of torture, and to see the open laugh and sneer of his own associates (who were looking on, and took no trouble to hide their scorn from him, though they neither interfered with his bullying nor lived a bit the less intimately with him), made him beside himself. Come what might, he would make those boys’ lives miserable. So the strife settled down into a personal affair between Flashman and our youngsters--a war to the knife, to be fought out in the little cockpit at the end of the bottom passage.",feel first rebel rebellion great extent successful stirr hatred bitterness heart frequent collision be late call coward sneak taunt true forgive act thrash roar instance funking football shirk encounter lout own size thing know house have own disgrace shout small boy feel despise unable silence amount torture see open laugh sneer own associate look take trouble hide scorn interfer bullying live bit make come make boy life miserable strife settle personal affair youngster war knife fight little cockpit end bottom passage 
63,"Flashman, be it said, was about seventeen years old, and big and strong of his age. He played well at all games where pluck wasn’t much wanted, and managed generally to keep up appearances where it was; and having a bluff, off-hand manner, which passed for heartiness, and considerable powers of being pleasant when he liked, went down with the school in general for a good fellow enough. Even in the School-house, by dint of his command of money, the constant supply of good things which he kept up, and his adroit toadyism, he had managed to make himself not only tolerated, but rather popular amongst his own contemporaries; although young Brooke scarcely spoke to him, and one or two others of the right sort showed their opinions of him whenever a chance offered. But the wrong sort happened to be in the ascendant just now, and so Flashman was a formidable enemy for small boys. This soon became plain enough. Flashman left no slander unspoken, and no deed undone, which could in any way hurt his victims, or isolate them from the rest of the house. One by one most of the other rebels fell away from them, while Flashman’s cause prospered, and several other fifth-form boys began to look black at them and ill-treat them as they passed about the house. By keeping out of bounds, or at all events out of the house and quadrangle, all day, and carefully barring themselves in at night, East and Tom managed to hold on without feeling very miserable; but it was as much as they could do. Greatly were they drawn then towards old Diggs, who, in an uncouth way, began to take a good deal of notice of them, and once or twice came to their study when Flashman was there, who immediately decamped in consequence. The boys thought that Diggs must have been watching.",say year old big strong age play game pluck want manage keep appearance have bluff hand manner pass heartiness considerable power pleasant like go school general good fellow house dint command money constant supply good thing keep adroit toadyism manage make tolerate popular own contemporary young speak other right sort show opinion chance offer wrong sort happen ascendant formidable enemy small boy become plain leave slander unspoken deed undone way hurt victim isolate rest house most other rebel fall cause prosper several other fifth form boy begin look black ill treat pass house keep bound event house quadrangle day barr night manage hold feel miserable much do draw old uncouth way begin take good deal notice come study decamp consequence boy think watch 
64,"When therefore, about this time, an auction was one night announced to take place in the hall, at which, amongst the superfluities of other boys, all Diggs’s penates for the time being were going to the hammer, East and Tom laid their heads together, and resolved to devote their ready cash (some four shillings sterling) to redeem such articles as that sum would cover. Accordingly, they duly attended to bid, and Tom became the owner of two lots of Diggs’s things:--Lot 1, price one-and-threepence, consisting (as the auctioneer remarked) of a “valuable assortment of old metals,” in the shape of a mouse-trap, a cheese-toaster without a handle, and a saucepan: Lot 2, of a villainous dirty table-cloth and green-baize curtain; while East, for one-and-sixpence, purchased a leather paper-case, with a lock but no key, once handsome, but now much the worse for wear. But they had still the point to settle of how to get Diggs to take the things without hurting his feelings. This they solved by leaving them in his study, which was never locked when he was out. Diggs, who had attended the auction, remembered who had bought the lots, and came to their study soon after, and sat silent for some time, cracking his great red finger-joints. Then he laid hold of their verses, and began looking over and altering them, and at last got up, and turning his back to them, said, “You’re uncommon good-hearted little beggars, you two. I value that paper-case; my sister gave it to me last holidays. I won’t forget.” And so he tumbled out into the passage, leaving them somewhat embarrassed, but not sorry that he knew what they had done.",time auction night announce take place hall superfluity other boy penate time being go hammer lay head resolve devote ready cash shilling sterling redeem such article sum cover attend bid become owner lot thing lot price threepence consist auctioneer remark valuable assortment old metal shape mouse trap cheese toaster handle saucepan lot villainous dirty table cloth green baize curtain sixpence purchase leather paper case lock key handsome bad wear have point settle get take thing hurt feeling solve leave study lock attend auction remember buy lot come study sit silent time crack great red finger joint lay hold verse begin look alter last get turn back say uncommon good hearted little beggar value paper case sister give last holiday forget tumble passage leave embarrass sorry know do 
65,"The next morning was Saturday, the day on which the allowances of one shilling a week were paid--an important event to spendthrift youngsters; and great was the disgust amongst the small fry to hear that all the allowances had been impounded for the Derby lottery. That great event in the English year, the Derby, was celebrated at Rugby in those days by many lotteries. It was not an improving custom, I own, gentle reader, and led to making books, and betting, and other objectionable results; but when our great Houses of Palaver think it right to stop the nation’s business on that day and many of the members bet heavily themselves, can you blame us boys for following the example of our betters? At any rate we did follow it. First there was the great school lottery, where the first prize was six or seven pounds; then each house had one or more separate lotteries. These were all nominally voluntary, no boy being compelled to put in his shilling who didn’t choose to do so. But besides Flashman, there were three or four other fast, sporting young gentlemen in the Schoolhouse, who considered subscription a matter of duty and necessity; and so, to make their duty come easy to the small boys, quietly secured the allowances in a lump when given out for distribution, and kept them. It was no use grumbling--so many fewer tartlets and apples were eaten and fives balls bought on that Saturday; and after locking-up, when the money would otherwise have been spent, consolation was carried to many a small boy by the sound of the night-fags shouting along the passages, “Gentlemen sportsmen of the School-house; the lottery’s going to be drawn in the hall.” It was pleasant to be called a gentleman sportsman, also to have a chance of drawing a favourite horse.",next morning day allowance shilling week pay important event spendthrift youngster great disgust small fry hear allowance impound lottery great event english year celebrate day many lottery improve custom own gentle reader lead make book betting other objectionable result great house think right stop nation business day many member bet blame boy follow example better rate follow be great school lottery first prize pound house have more separate lottery voluntary boy compel put shilling choose do be other fast sport young gentleman consider subscription matter duty necessity make duty come easy small boy secure allowance lump give distribution keep use grumble many few tartlet apple eat fives ball buy lock money spend consolation carry many small boy sound night fag shouting passage sportsmen house lottery go draw hall pleasant call gentleman sportsman have chance draw favourite horse 
66,"The hall was full of boys, and at the head of one of the long tables stood the sporting interest, with a hat before them, in which were the tickets folded up. One of them then began calling out the list of the house. Each boy as his name was called drew a ticket from the hat, and opened it; and most of the bigger boys, after drawing, left the hall directly to go back to their studies or the fifth-form room. The sporting interest had all drawn blanks, and they were sulky accordingly; neither of the favourites had yet been drawn, and it had come down to the upper-fourth. So now, as each small boy came up and drew his ticket, it was seized and opened by Flashman, or some other of the standers-by. But no great favourite is drawn until it comes to the Tadpole’s turn, and he shuffles up and draws, and tries to make off, but is caught, and his ticket is opened like the rest.",hall full boy head long table stand sport interest hat ticket fold begin call list house boy name call draw ticket hat open most big boy draw leave hall go study fifth form room sport interest draw blank sulky favourite draw come upper fourth small boy come draw ticket seize open other stander great favourite draw come turn shuffle draw try make catch ticket open rest 
67,“Here you are! Wanderer--the third favourite!” shouts the opener.,third favourite shout opener 
68,"“I say, just give me my ticket, please,” remonstrates Tadpole.",say give ticket remonstrate 
69,"“Hullo! don’t be in a hurry,” breaks in Flashman; “what’ll you sell Wanderer for now?”",hurry break sell 
70,"“I don’t want to sell,” rejoins Tadpole.",want sell rejoin 
71,"“Oh, don’t you! Now listen, you young fool: you don’t know anything about it; the horse is no use to you. He won’t win, but I want him as a hedge. Now, I’ll give you half a crown for him.” Tadpole holds out, but between threats and cajoleries at length sells half for one shilling and sixpence--about a fifth of its fair market value; however, he is glad to realize anything, and, as he wisely remarks, “Wanderer mayn’t win, and the tizzy is safe anyhow.”",listen young fool know horse use win want hedge give crown hold threat cajolery length sell half shilling sixpence fifth fair market value glad realize remark win tizzy safe 
72,"East presently comes up and draws a blank. Soon after comes Tom’s turn. His ticket, like the others, is seized and opened. “Here you are then,”  shouts the opener, holding it up--“Harkaway!--By Jove, Flashey, your young friend’s in luck.”",come draw blank come turn ticket other seize open shout opener hold young friend luck 
73,"“Give me the ticket,” says Flashman, with an oath, leaning across the table with open hand and his face black with rage.",give ticket say oath lean table open hand face black rage 
