id,paragraph,tokens
1,CHAPTER VIII. THE WAR OF INDEPENDENCE.,war independence 
2,"     “They are slaves who will not choose      Hatred, scoffing, and abuse,      Rather than in silence shrink      From the truth they needs must think;      They are slaves who dare not be      In the right with two or three.”       --LOWELL, Stanzas on Freedom.",slave choose hatred scoffing abuse silence shrink truth need think slave right 
3,"The lower-fourth form, in which Tom found himself at the beginning of the next half-year, was the largest form in the lower school, and numbered upwards of forty boys. Young gentlemen of all ages from nine to fifteen were to be found there, who expended such part of their energies as was devoted to Latin and Greek upon a book of Livy, the “Bucolics”  of Virgil, and the “Hecuba” of Euripides, which were ground out in small daily portions. The driving of this unlucky lower-fourth must have been grievous work to the unfortunate master, for it was the most unhappily constituted of any in the school. Here stuck the great stupid boys, who, for the life of them, could never master the accidence--the objects alternately of mirth and terror to the youngsters, who were daily taking them up and laughing at them in lesson, and getting kicked by them for so doing in play-hours. There were no less than three unhappy fellows in tail coats, with incipient down on their chins, whom the Doctor and the master of the form were always endeavouring to hoist into the upper school, but whose parsing and construing resisted the most well-meant shoves. Then came the mass of the form, boys of eleven and twelve, the most mischievous and reckless age of British youth, of whom East and Tom Brown were fair specimens. As full of tricks as monkeys, and of excuses as Irishwomen, making fun of their master, one another, and their lessons, Argus himself would have been puzzled to keep an eye on them; and as for making them steady or serious for half an hour together, it was simply hopeless. The remainder of the form consisted of young prodigies of nine and ten, who were going up the school at the rate of a form a half-year, all boys’ hands and wits being against them in their progress. It would have been one man’s work to see that the precocious youngsters had fair play; and as the master had a good deal besides to do, they hadn’t, and were for ever being shoved down three or four places, their verses stolen, their books inked, their jackets whitened, and their lives otherwise made a burden to them.",low fourth form find beginning next half year large form low school number upwards boy young gentleman age find expend such part energy devote latin book ground small daily portion driving unlucky low fourth grievous work unfortunate master constitute school stick great stupid boy life master accidence object mirth terror youngster daily take laugh lesson kick do play hour be less unhappy fellow tail coat incipient chin master form endeavour hoist upper school parsing construing resist mean shove come mass form boy mischievous reckless age british youth fair specimen full trick monkey excuse make fun master lesson puzzle keep eye make steady serious hour hopeless remainder form consist young prodigy go school rate form half year boy hand wit progress man work see precocious youngster have fair play master have good deal do shove place verse steal book ink jacket whiten life make burden 
4,"The lower-fourth, and all the forms below it, were heard in the great school, and were not trusted to prepare their lessons before coming in, but were whipped into school three-quarters of an hour before the lesson began by their respective masters, and there, scattered about on the benches, with dictionary and grammar, hammered out their twenty lines of Virgil and Euripides in the midst of babel. The masters of the lower school walked up and down the great school together during this three-quarters of an hour, or sat in their desks reading or looking over copies, and keeping such order as was possible. But the lower-fourth was just now an overgrown form, too large for any one man to attend to properly, and consequently the elysium or ideal form of the young scapegraces who formed the staple of it.",low fourth form hear great school trust prepare lesson come whip school quarter hour lesson begin respective master scatter bench dictionary grammar hammer line midst babel master low school walk great school quarter hour sit desk read look copy keep such order possible low fourth overgrown form large man attend elysium ideal form young scapegrace form staple 
5,"Tom, as has been said, had come up from the third with a good character, but the temptations of the lower-fourth soon proved too strong for him, and he rapidly fell away, and became as unmanageable as the rest. For some weeks, indeed, he succeeded in maintaining the appearance of steadiness, and was looked upon favourably by his new master, whose eyes were first opened by the following little incident.",say come third good character temptation low fourth prove strong fall become unmanageable rest week succeed maintain appearance steadiness look new master eye open follow little incident 
6,"Besides the desk which the master himself occupied, there was another large unoccupied desk in the corner of the great school, which was untenanted. To rush and seize upon this desk, which was ascended by three steps and held four boys, was the great object of ambition of the lower-fourthers; and the contentions for the occupation of it bred such disorder that at last the master forbade its use altogether. This, of course, was a challenge to the more adventurous spirits to occupy it; and as it was capacious enough for two boys to lie hid there completely, it was seldom that it remained empty, notwithstanding the veto. Small holes were cut in the front, through which the occupants watched the masters as they walked up and down; and as lesson time approached, one boy at a time stole out and down the steps, as the masters’ backs were turned, and mingled with the general crowd on the forms below. Tom and East had successfully occupied the desk some half-dozen times, and were grown so reckless that they were in the habit of playing small games with fives balls inside when the masters were at the other end of the big school. One day, as ill-luck would have it, the game became more exciting than usual, and the ball slipped through East’s fingers, and rolled slowly down the steps and out into the middle of the school, just as the masters turned in their walk and faced round upon the desk. The young delinquents watched their master, through the lookout holes, march slowly down the school straight upon their retreat, while all the boys in the neighbourhood, of course, stopped their work to look on; and not only were they ignominiously drawn out, and caned over the hand then and there, but their characters for steadiness were gone from that time. However, as they only shared the fate of some three-fourths of the rest of the form, this did not weigh heavily upon them.",desk master occupy be large unoccupied desk corner great school untenanted rush seize desk ascend step hold boy great object ambition low fourther contention occupation breed such disorder last master forbid use course challenge adventurous spirit occupy capacious boy lie hide seldom remain empty notwithstand veto small hole cut front occupant watch master walk lesson time approach boy time steal step master back turn mingle general crowd form occupy desk half time grow reckless habit play small game fives ball master other end big school day ill luck have game become exciting usual ball slip finger roll step middle school master turn walk face desk young delinquent watch master lookout hole march school retreat boy neighbourhood course stop work look draw cane hand character steadiness gone time share fate fourth rest form weigh 
7,"In fact, the only occasions on which they cared about the matter were the monthly examinations, when the Doctor came round to examine their form, for one long, awful hour, in the work which they had done in the preceding month. The second monthly examination came round soon after Tom’s fall, and it was with anything but lively anticipations that he and the other lower-fourth boys came in to prayers on the morning of the examination day.",fact only occasion care matter monthly examination come examine form long awful hour work do preced month second monthly examination come fall lively anticipation other low fourth boy come prayer morning examination day 
8,"Prayers and calling-over seemed twice as short as usual, and before they could get construes of a tithe of the hard passages marked in the margin of their books, they were all seated round, and the Doctor was standing in the middle, talking in whispers to the master. Tom couldn’t hear a word which passed, and never lifted his eyes from his book; but he knew by a sort of magnetic instinct that the Doctor’s under-lip was coming out, and his eye beginning to burn, and his gown getting gathered up more and more tightly in his left hand. The suspense was agonizing, and Tom knew that he was sure on such occasions to make an example of the School-house boys. “If he would only begin,” thought Tom, “I shouldn’t mind.”",prayer calling seem short usual get construe tithe hard passage mark margin book seat stand middle talk whisper master hear word pass lift eye book know sort magnetic instinct lip come eye begin burn gown gather left hand suspense agonizing know sure such occasion make example house boy begin think mind 
9,"At last the whispering ceased, and the name which was called out was not Brown. He looked up for a moment, but the Doctor’s face was too awful; Tom wouldn’t have met his eye for all he was worth, and buried himself in his book again.",last whispering cease name call look moment face awful meet eye worth bury book 
10,"The boy who was called up first was a clever, merry School-house boy, one of their set; he was some connection of the Doctor’s, and a great favourite, and ran in and out of his house as he liked, and so was selected for the first victim.",boy call clever merry school house boy set connection great favourite run house like select first victim 
11,"“Triste lupus stabulis,” began the luckless youngster, and stammered through some eight or ten lines.",begin luckless youngster stammer line 
12,"“There, that will do,” said the Doctor; “now construe.”",do say construe 
13,"On common occasions the boy could have construed the passage well enough probably, but now his head was gone.",common occasion boy construe passage head gone 
14,"“Triste lupus, the sorrowful wolf,” he began.",sorrowful wolf begin 
15,"A shudder ran through the whole form, and the Doctor’s wrath fairly boiled over. He made three steps up to the construer, and gave him a good box on the ear. The blow was not a hard one, but the boy was so taken by surprise that he started back; the form caught the back of his knees, and over he went on to the floor behind. There was a dead silence over the whole school. Never before and never again while Tom was at school did the Doctor strike a boy in lesson. The provocation must have been great. However, the victim had saved his form for that occasion, for the Doctor turned to the top bench, and put on the best boys for the rest of the hour and though, at the end of the lesson, he gave them all such a rating as they did not forget, this terrible field-day passed over without any severe visitations in the shape of punishments or floggings. Forty young scapegraces expressed their thanks to the “sorrowful wolf” in their different ways before second lesson.",shudder run whole form wrath boil make step construer give good box ear blow hard one boy take surprise start form catch back knee go floor be dead silence whole school school strike boy lesson provocation great victim save form occasion turn top bench put good boy rest hour end lesson give rating forget terrible field day pass severe visitation shape punishment flogging young scapegrace express thanks sorrowful wolf different way second lesson 
16,"But a character for steadiness once gone is not easily recovered, as Tom found; and for years afterwards he went up the school without it, and the masters’ hands were against him, and his against them. And he regarded them, as a matter of course, as his natural enemies.",character steadiness gone recover find year go school master hand regard matter course natural enemy 
17,"Matters were not so comfortable, either, in the house as they had been; for old Brooke left at Christmas, and one or two others of the sixth-form boys at the following Easter. Their rule had been rough, but strong and just in the main, and a higher standard was beginning to be set up; in fact, there had been a short foretaste of the good time which followed some years later. Just now, however, all threatened to return into darkness and chaos again. For the new praepostors were either small young boys, whose cleverness had carried them up to the top of the school, while in strength of body and character they were not yet fit for a share in the government; or else big fellows of the wrong sort--boys whose friendships and tastes had a downward tendency, who had not caught the meaning of their position and work, and felt none of its responsibilities. So under this no-government the School-house began to see bad times. The big fifth-form boys, who were a sporting and drinking set, soon began to usurp power, and to fag the little boys as if they were praepostors, and to bully and oppress any who showed signs of resistance. The bigger sort of sixth-form boys just described soon made common cause with the fifth, while the smaller sort, hampered by their colleagues’ desertion to the enemy, could not make head against them. So the fags were without their lawful masters and protectors, and ridden over rough-shod by a set of boys whom they were not bound to obey, and whose only right over them stood in their bodily powers; and, as old Brooke had prophesied, the house by degrees broke up into small sets and parties, and lost the strong feeling of fellowship which he set so much store by, and with it much of the prowess in games and the lead in all school matters which he had done so much to keep up.",matter comfortable house old leave other sixth form boy follow rule rough strong main high standard begin set fact be short foretaste good time follow year threaten return darkness chaos new praepostor small young boy cleverness carry top school strength body character fit share government big fellow wrong sort boy friendship taste have downward tendency catch meaning position work feel responsibility government house begin see bad time big fifth form boy sport drinking set begin usurp power fig little boy praepostor bully oppress show sign resistance big sort sixth form boy describe make common cause fifth small sort hamper colleague desertion enemy make head fag lawful master protector ride rough shod set boy bind obey only right stand bodily power old prophesy house degree break small set party lose strong feeling fellowship set much store much prowess game lead school matter do much keep 
18,"In no place in the world has individual character more weight than at a public school. Remember this, I beseech you, all you boys who are getting into the upper forms. Now is the time in all your lives, probably, when you may have more wide influence for good or evil on the society you live in than you ever can have again. Quit yourselves like men, then; speak up, and strike out if necessary, for whatsoever is true, and manly, and lovely, and of good report; never try to be popular, but only to do your duty and help others to do theirs, and you may leave the tone of feeling in the school higher than you found it, and so be doing good which no living soul can measure to generations of your countrymen yet unborn. For boys follow one another in herds like sheep, for good or evil; they hate thinking, and have rarely any settled principles. Every school, indeed, has its own traditionary standard of right and wrong, which cannot be transgressed with impunity, marking certain things as low and blackguard, and certain others as lawful and right. This standard is ever varying, though it changes only slowly and little by little; and, subject only to such standard, it is the leading boys for the time being who give the tone to all the rest, and make the School either a noble institution for the training of Christian Englishmen, or a place where a young boy will get more evil than he would if he were turned out to make his way in London streets, or anything between these two extremes.",place world have individual character more weight public school remember beseech boy get upper form time life have wide influence good evil society live have quit man speak strike necessary true manly lovely good report try popular do duty help other do leave tone feeling school high find do good living soul measure generation countryman unborn boy follow herd sheep good evil hate think have settle principle school have own traditionary standard right wrong transgress impunity mark certain thing low blackguard certain other lawful right standard vary change little little subject such standard lead boy time give tone rest make school noble institution training christian place young boy get more evil turn make way street extreme 
19,"The change for the worse in the School-house, however, didn’t press very heavily on our youngsters for some time. They were in a good bedroom, where slept the only praepostor left who was able to keep thorough order, and their study was in his passage. So, though they were fagged more or less, and occasionally kicked or cuffed by the bullies, they were, on the whole, well off; and the fresh, brave school-life, so full of games, adventures, and good-fellowship, so ready at forgetting, so capacious at enjoying, so bright at forecasting, outweighed a thousand-fold their troubles with the master of their form, and the occasional ill-usage of the big boys in the house. It wasn’t till some year or so after the events recorded above that the praepostor of their room and passage left. None of the other sixth-form boys would move into their passage, and, to the disgust and indignation of Tom and East, one morning after breakfast they were seized upon by Flashman, and made to carry down his books and furniture into the unoccupied study, which he had taken. From this time they began to feel the weight of the tyranny of Flashman and his friends, and, now that trouble had come home to their own doors, began to look out for sympathizers and partners amongst the rest of the fags; and meetings of the oppressed began to be held, and murmurs to arise, and plots to be laid as to how they should free themselves and be avenged on their enemies.",change bad house press youngster time good bedroom sleep only praepostor leave able keep thorough order study passage fagg more kick cuff bully whole fresh brave school life full game adventure good fellowship ready forget capacious enjoy bright forecasting outweigh fold trouble master form occasional ill usage big boy house year event record praepostor room passage leave other sixth form boy move passage disgust indignation morning breakfast seize make carry book furniture unoccupied study take time begin feel weight tyranny friend trouble come own door begin look sympathizer partner rest fag meeting oppress begin hold murmur arise plot lay free avenge enemy 
20,"While matters were in this state, East and Tom were one evening sitting in their study. They had done their work for first lesson, and Tom was in a brown study, brooding, like a young William Tell, upon the wrongs of fags in general, and his own in particular.",matter state evening sit study do work first lesson brown study brooding young wrong fag general own particular 
21,"“I say, Scud,” said he at last, rousing himself to snuff the candle, “what right have the fifth-form boys to fag us as they do?”",say say last rouse snuff candle have fifth form boy fig do 
22,"“No more right than you have to fag them,” answered East, without looking up from an early number of “Pickwick,” which was just coming out, and which he was luxuriously devouring, stretched on his back on the sofa.",right have fig answer look early number come devour stretch back sofa 
23,"Tom relapsed into his brown study, and East went on reading and chuckling. The contrast of the boys’ faces would have given infinite amusement to a looker-on--the one so solemn and big with mighty purpose, the other radiant and bubbling over with fun.",relaps brown study go read chuckle contrast boy face give infinite amusement looker one solemn big mighty purpose other radiant bubble fun 
24,"“Do you know, old fellow, I’ve been thinking it over a good deal,” began Tom again.",know old fellow think good deal begin 
25,"“Oh yes, I know--fagging you are thinking of. Hang it all! But listen here, Tom--here’s fun. Mr. Winkle’s horse--”",know fagging think hang listen fun horse 
26,"“And I’ve made up my mind,” broke in Tom, “that I won’t fag except for the sixth.”",make mind break fig sixth 
27,"“Quite right too, my boy,” cried East, putting his finger on the place and looking up; “but a pretty peck of troubles you’ll get into, if you’re going to play that game. However, I’m all for a strike myself, if we can get others to join. It’s getting too bad.”",boy cry put finger place look pretty peck trouble get go play game strike get other join get bad 
28,“Can’t we get some sixth-form fellow to take it up?” asked Tom.,get sixth form fellow take ask 
29,"“Well, perhaps we might. Morgan would interfere, I think. Only,” added East, after a moment’s pause, “you see, we should have to tell him about it, and that’s against School principles. Don’t you remember what old Brooke said about learning to take our own parts?”",interfere think add moment pause see have tell school principle remember old say learn take own part 
30,"“Ah, I wish old Brooke were back again. It was all right in his time.”",wish old right time 
31,"“Why, yes, you see, then the strongest and best fellows were in the sixth, and the fifth-form fellows were afraid of them, and they kept good order; but now our sixth-form fellows are too small, and the fifth don’t care for them, and do what they like in the house.”",see strong good fellow sixth fifth form fellow afraid keep good order sixth form fellow small fifth care do like house 
32,"“And so we get a double set of masters,” cried Tom indignantly--“the lawful ones, who are responsible to the Doctor at any rate, and the unlawful, the tyrants, who are responsible to nobody.”",get double set master cry lawful one responsible doctor rate unlawful tyrant responsible 
33,"“Down with the tyrants!” cried East; “I’m all for law and order, and hurrah for a revolution.”",tyrant cry law order hurrah revolution 
34,"“I shouldn’t mind if it were only for young Brooke now,” said Tom; “he’s such a good-hearted, gentlemanly fellow, and ought to be in the sixth. I’d do anything for him. But that blackguard Flashman, who never speaks to one without a kick or an oath--”",mind young say good hearted gentlemanly fellow sixth do blackguard speak kick oath 
35,"“The cowardly brute,” broke in East--“how I hate him! And he knows it too; he knows that you and I think him a coward. What a bore that he’s got a study in this passage! Don’t you hear them now at supper in his den? Brandy-punch going, I’ll bet. I wish the Doctor would come out and catch him. We must change our study as soon as we can.”",cowardly brute break hate know know think coward bore get study passage hear supper dan punch go bet wish come catch change study 
36,"“Change or no change, I’ll never fag for him again,” said Tom, thumping the table.",change change fig say thump table 
37,"“Fa-a-a-ag!” sounded along the passage from Flashman’s study. The two boys looked at one another in silence. It had struck nine, so the regular night-fags had left duty, and they were the nearest to the supper-party. East sat up, and began to look comical, as he always did under difficulties.",ag sound passage study boy look silence strike regular night fag leave duty near supper party sit begin look comical do difficulty 
38,“Fa-a-a-ag!” again. No answer.,ag answer 
39,"“Here, Brown! East! you cursed young skulks,” roared out Flashman, coming to his open door; “I know you’re in; no shirking.”",curse young skulk roar come open door know shirking 
40,"Tom stole to their door, and drew the bolts as noiselessly as he could; East blew out the candle.",steal door draw bolt blow candle 
41,"“Barricade the first,” whispered he. “Now, Tom, mind, no surrender.”",first whisper mind surrender 
42,"“Trust me for that,” said Tom between his teeth.",trust say tooth 
43,"In another minute they heard the supper-party turn out and come down the passage to their door. They held their breaths, and heard whispering, of which they only made out Flashman’s words, “I know the young brutes are in.”",minute hear supper party turn come passage door hold breath hear whisper make word know young brute 
