id,paragraph,tokens
110,"The Princess went on growing. By dinner-time she was so large that she had to have her dinner brought out into the garden because she was too large to get indoors. But she was too unhappy to be able to eat anything. And she cried so much that there was quite a pool in the garden, and several pages were nearly drowned. So she remembered her “Alice in Wonderland,” and stopped crying at once. But she did not stop growing. She grew bigger and bigger and bigger, till she had to go outside the palace gardens and sit on the common, and even that was too small to hold her comfortably, for every hour she grew twice as much as she had done the hour before. And nobody knew what to do, nor where the Princess was to sleep. Fortunately, her clothes had grown with her, or she would have been very cold indeed, and now she sat on the common in her green gown, embroidered with gold, looking like a great hill covered with gorse in flower.",go grow dinner time large have have dinner bring garden large get unhappy able eat cry be pool garden several page drown remember stop cry stop grow grow big big big have go palace garden sit common small hold hour grow much do hour know do sleep clothes grow cold sit common green gown embroider gold look great hill cover gorse flower 
111,"You cannot possibly imagine how large the Princess was growing, and her mother stood wringing her hands on the castle tower, and the Prince Florizel looked on broken-hearted to see his Princess snatched from his arms and turned into a lady as big as a mountain.",imagine large grow mother stand wring hand castle tower look break hearted see snatch arm turn lady big mountain 
112,"The King did not weep or look on. He sat down at once and wrote to his fairy godmother, asking her advice. He sent a weasel with the letter, and by return of weasel he got his own letter back again, marked “Gone away. Left no address.”",weep look sit write fairy godmother ask advice send weasel letter return weasel get own letter mark gone left address 
113,"It was now, when the kingdom was plunged into gloom, that a neighbouring King took it into his head to send an invading army against the island where Melisande lived. They came in ships and they landed in great numbers, and Melisande looking down from her height saw alien soldiers marching on the sacred soil of her country.",kingdom plunge gloom neighbour take head send invade army island live come ship land great number look height see alien soldier march sacred soil country 
114,"“I don’t mind so much now,” said she, “if I can really be of some use this size.”",mind say use size 
115,"And she picked up the army of the enemy in handfuls and double-handfuls, and put them back into their ships, and gave a little flip to each transport ship with her finger and thumb, which sent the ships off so fast that they never stopped till they reached their own country, and when they arrived there the whole army to a man said it would rather be courtmartialled a hundred times over than go near the place again.",pick army enemy handful double handful put ship give little flip transport ship finger thumb send ship stop reach own country arrive whole army man say courtmartiall time go place 
116,[THE PRINCESS GREW SO BIG THAT SHE HAD TO GO AND SIT ON THE COMMON.],princess grew big have go sit common 
117,"Meantime Melisande, sitting on the highest hill on the island, felt the land trembling and shivering under her giant feet.",sit high hill island feel land tremble shiver giant foot 
118,"“I do believe I’m getting too heavy,” she said, and jumped off the island into the sea, which was just up to her ankles. Just then a great fleet of warships and gunboats and torpedo boats came in sight, on their way to attack the island.",believe get heavy say jump island sea ankle great fleet warship gunboat torpedo boat come sight way attack island 
119,"Melisande could easily have sunk them all with one kick, but she did not like to do this because it might have drowned the sailors, and besides, it might have swamped the island.",sink kick like do drown sailor swamp island 
120,"So she simply stooped and picked the island as you would pick a mushroom—for, of course, all islands are supported by a stalk underneath—and carried it away to another part of the world. So that when the warships got to where the island was marked on the map they found nothing but sea, and a very rough sea it was, because the Princess had churned it all up with her ankles as she walked away through it with the island.",stoop pick island pick mushroom course island support stalk carry part world warship get island mark map find sea rough sea churn ankle walk island 
121,"When Melisande reached a suitable place, very sunny and warm, and with no sharks in the water, she set down the island; and the people made it fast with anchors, and then every one went to bed, thanking the kind fate which had sent them so great a Princess to help them in their need, and calling her the saviour of her country and the bulwark of the nation.",reach suitable place sunny warm shark water set island person make anchor one go bed thank kind fate send great help need call saviour country bulwark nation 
122,"But it is poor work being the nation’s bulwark and your country’s saviour when you are miles high, and have no one to talk to, and when all you want is to be your humble right size again and to marry your sweetheart. And when it was dark the Princess came close to the island, and looked down, from far up, at her palace and her tower and cried, and cried, and cried. It does not matter how much you cry into the sea, it hardly makes any difference, however large you may be. Then when everything was quite dark the Princess looked up at the stars.",poor work nation bulwark country saviour mile high have talk want humble right size marry sweetheart dark come island look palace tower cry cry cry matter much cry sea make difference large dark look star 
123,"“I wonder how soon I shall be big enough to knock my head against them,” said she.",wonder big knock head say 
124,"And as she stood star-gazing she heard a whisper right in her ear. A very little whisper, but quite plain.",stand star gaze hear whisper ear little whisper plain 
125,“Cut off your hair!” it said.,cut hair say 
126,"Now, everything the Princess was wearing had grown big along with her, so that now there dangled from her golden girdle a pair of scissors as big as the Malay Peninsula, together with a pin-cushion the size of the Isle of Wight, and a yard measure that would have gone round Australia.",wear grow big dangle golden girdle pair scissors big malay pin-cushion size yard measure go 
127,"And when she heard the little, little voice, she knew it, small as it was, for the dear voice of Prince Florizel, and she whipped out the scissors from her gold case and snip, snip, snipped all her hair off, and it fell into the sea. The coral insects got hold of it at once and set to work on it, and now they have made it into the biggest coral reef in the world; but that has nothing to do with the story.",hear little little voice know small dear voice whip scissors gold case snip snip snipp hair fall sea coral insect get hold set work make big coral reef world have do story 
128,"Then the voice said, “Get close to the island,” and the Princess did, but she could not get very close because she was so large, and she looked up again at the stars and they seemed to be much farther off.",voice say get close island get close large look star seem 
129,"Then the voice said, “Be ready to swim,” and she felt something climb out of her ear and clamber down her arm. The stars got farther and farther away, and next moment the Princess found herself swimming in the sea, and Prince Florizel swimming beside her.",voice say ready swim feel climb ear clamber arm star get next moment find swim sea swim 
130,"“I crept on to your hand when you were carrying the island,” he explained, when their feet touched the sand and they walked in through the shallow water, “and I got into your ear with an ear-trumpet. You never noticed me because you were so great then.”",creep hand carry island explain foot touch sand walk shallow water get ear ear trumpet notice great 
131,"“Oh, my dear Prince,” cried Melisande, falling into his arms, “you have saved me. I am my proper size again.”",dear cry fall arm save proper size 
132,"So they went home and told the King and Queen. Both were very, very happy, but the King rubbed his chin with his hand, and said—",go tell happy rub chin hand say 
133,"“You’ve certainly had some fun for your money, young man, but don’t you see that we’re just where we were before? Why, the child’s hair is growing already.”",have fun money young man see child hair grow 
134,And indeed it was.,
135,"Then once more the King sent a letter to his godmother. He sent it by a flying-fish, and by return of fish come the answer—",send letter godmother send fly fish return fish come answer 
136,“Just back from my holidays. Sorry for your troubles. Why not try scales?”,holiday sorry trouble try scale 
137,And on this message the whole Court pondered for weeks.,message whole ponder week 
138,"But the Prince caused a pair of gold scales to be made, and hung them up in the palace gardens under a big oak tree. And one morning he said to the Princess—",cause pair gold scale make hang palace garden big oak tree morning say 
139,"“My darling Melisande, I must really speak seriously to you. We are getting on in life. I am nearly twenty: it is time that we thought of being settled. Will you trust me entirely and get into one of those gold scales?”",darling speak get life time think settle trust get gold scale 
140,"So he took her down into the garden, and helped her into the scale, and she curled up in it in her green and gold gown, like a little grass mound with buttercups on it.",take garden help scale curl green gold gown little grass mound buttercup 
141,“And what is going into the other scale?” asked Melisande.,go other scale ask 
142,"“Your hair,” said Florizel. “You see, when your hair is cut off you it grows, and when you are cut off your hair you grow—oh, my heart’s delight, I can never forget how you grew, never! But if, when your hair is no more than you, and you are no more than your hair, I snip the scissors between you and it, then neither you nor your hair can possibly decide which ought to go on growing.”",hair say see hair cut grow cut hair grow heart delight forget grow hair more more hair snip scissors hair decide go grow 
143,"“Suppose _both_ did,” said the poor Princess, humbly.",suppose say poor 
144,"“Impossible,” said the Prince, with a shudder; “there are limits even to Malevola’s malevolence. And, besides, Fortuna said ‘Scales.’ Will you try it?”",impossible say shudder be limit malevolence say scale try 
145,"“I will do whatever you wish,” said the poor Princess, “but let me kiss my father and mother once, and Nurse, and you, too, my dear, in case I grow large again and can kiss nobody any more.”",do wish say poor let kiss father mother dear case grow large kiss more 
146,So they came one by one and kissed the Princess.,come kiss 
147,"Then the nurse cut off the Princess’s hair, and at once it began to grow at a frightful rate.",nurse cut hair begin grow frightful rate 
148,"The King and Queen and nurse busily packed it, as it grew, into the other scale, and gradually the scale went down a little. The Prince stood waiting between the scales with his drawn sword, and just before the two were equal he struck. But during the time his sword took to flash through the air the Princess’s hair grew a yard or two, so that at the instant when he struck the balance was true.",nurse pack grow other scale scale go little stand wait scale draw sword equal strike time sword take flash air hair grow yard instant strike balance true 
149,"“You are a young man of sound judgment,” said the King, embracing him, while the Queen and the nurse ran to help the Princess out of the gold scale.",young man sound judgment say embrace nurse run help gold scale 
150,"The scale full of golden hair bumped down on to the ground as the Princess stepped out of the other one, and stood there before those who loved her, laughing and crying with happiness, because she remained her proper size, and her hair was not growing any more.",scale full golden hair bump ground step other one stand love laugh cry happiness remain proper size hair grow more 
151,[THE PRINCESS IN ONE SCALE AND HER HAIR IN THE OTHER.],princess scale hair other 
152,"She kissed her Prince a hundred times, and the very next day they were married. Every one remarked on the beauty of the bride, and it was noticed that her hair was quite short—only five feet five and a quarter inches long—just down to her pretty ankles. Because the scales had been ten feet ten and a half inches apart, and the Prince, having a straight eye, had cut the golden hair exactly in the middle!",kiss time next day marry one remark beauty bride notice hair short foot quarter inch long pretty ankle scale foot half inch have straight eye cut golden hair middle 
153,,
154,,
