id,paragraph,tokens
1,"BOOK 5. _MELISANDE_ _OR, LONG AND SHORT DIVISION_",long short division_ 
2," WHEN the Princess Melisande was born, her mother, the Queen, wished to have a christening party, but the King put his foot down and said he would not have it.",bear mother wish have christening party put foot say have 
3,"“I’ve seen too much trouble come of christening parties,” said he. “However carefully you keep your visiting-book, some fairy or other is sure to get left out, and you know what _that_ leads to. Why, even in my own family, the most shocking things have occurred. The Fairy Malevola was not asked to my great-grandmother’s christening—and you know all about the spindle and the hundred years’ sleep.”",see much trouble come christening party say keep visit book fairy other sure leave know lead own family shocking thing occur ask great grandmother christening know spindle year sleep 
4,"“Perhaps you’re right,” said the Queen. “My own cousin by marriage forgot some stuffy old fairy or other when she was sending out the cards for her daughter’s christening, and the old wretch turned up at the last moment, and the girl drops toads out of her mouth to this day.”",right say own cousin marriage forget stuffy old fairy other send card daughter christening old wretch turn last moment girl drop toad mouth day 
5,"“Just so. And then there was that business of the mouse and the kitchen-maids,” said the King; “we’ll have no nonsense about it. I’ll be her godfather, and you shall be her godmother, and we won’t ask a single fairy; then none of them can be offended.”",be business mouse kitchen maid say have nonsense godfather godmother ask single fairy offend 
6,"“Unless they all are,” said the Queen.",say 
7,"And that was exactly what happened. When the King and the Queen and the baby got back from the christening the parlourmaid met them at the door, and said—",happen baby get christening parlourmaid meet door say 
8,"“Please, your Majesty, several ladies have called. I told them you were not at home, but they all said they’d wait.”",several lady call tell home say wait 
9,“Are they in the parlour?” asked the Queen.,parlour ask 
10,"“I’ve shown them into the Throne Room, your Majesty,” said the parlourmaid. “You see, there are several of them.”",show say parlourmaid see be several 
11,"There were about seven hundred. The great Throne Room was crammed with fairies, of all ages and of all degrees of beauty and ugliness—good fairies and bad fairies, flower fairies and moon fairies, fairies like spiders and fairies like butterflies—and as the Queen opened the door and began to say how sorry she was to have kept them waiting, they all cried, with one voice, “Why didn’t you ask _me_ to your christening party?”",be great cramm fairy age degree beauty ugliness good fairy bad fairy flower fairy moon fairy fairy spider fairy butterfly open door begin say sorry keep wait cry voice ask christening party 
12,"“I haven’t had a party,” said the Queen, and she turned to the King and whispered, “I told you so.” This was her only consolation.",have party say turn whisper tell only consolation 
13,"“You’ve had a christening,” said the fairies, all together.",have christening say fairy 
14,"“I’m very sorry,” said the poor Queen, but Malevola pushed forward and said, “Hold your tongue,” most rudely.",sorry say poor push say hold tongue 
15,"Malevola is the oldest, as well as the most wicked, of the fairies. She is deservedly unpopular, and has been left out of more christening parties than all the rest of the fairies put together.",old wicked fairy unpopular leave more christening party rest fairy put 
16,"“Don’t begin to make excuses,” she said, shaking her finger at the Queen. “That only makes your conduct worse. You know well enough what happens if a fairy is left out of a christening party. We are all going to give our christening presents _now_. As the fairy of highest social position, I shall begin. The Princess shall be bald.”",begin make excuse say shake finger make conduct bad know happen fairy leave christening party go give christening present _now_ fairy high social position begin bald 
17,"The Queen nearly fainted as Malevola drew back, and another fairy, in a smart bonnet with snakes in it, stepped forward with a rustle of bats’ wings. But the King stepped forward too.",faint draw fairy smart bonnet snake step rustle bat wing step 
18,"“No you don’t!” said he. “I wonder at you, ladies, I do indeed. How can you be so unfairylike? Have none of you been to school—have none of you studied the history of your own race? Surely you don’t need a poor, ignorant King like me to tell you that this is _no go_?”",say wonder lady unfairylike school have study history own race need poor ignorant tell go_ 
19,"“How dare you?” cried the fairy in the bonnet, and the snakes in it quivered as she tossed her head. “It is my turn, and I say the Princess shall be——”",dare cry fairy bonnet snake quiver toss head turn say 
20,The King actually put his hand over her mouth.,put hand mouth 
21,"“Look here,” he said; “I won’t have it. Listen to reason—or you’ll be sorry afterwards. A fairy who breaks the traditions of fairy history goes out—you know she does—like the flame of a candle. And all tradition shows that only _one_ bad fairy is ever forgotten at a christening party and the good ones are always invited; so either this is not a christening party, or else you were all invited except one, and, by her own showing, that was Malevola. It nearly always is. Do I make myself clear?”",look say have listen reason sorry fairy break tradition fairy history go know flame candle tradition show _one_ bad fairy forget christening party good one invite christening party else invite own show make clear 
22,Several of the better-class fairies who had been led away by Malevola’s influence murmured that there was something in what His Majesty said.,several good class fairy lead influence murmure be say 
23,"“Try it, if you don’t believe me,” said the King; “give your nasty gifts to my innocent child—but as sure as you do, out you go, like a candle-flame. Now, then, will you risk it?”",try believe say give nasty gift innocent child sure do go candle flame risk 
24,"No one answered, and presently several fairies came up to the Queen and said what a pleasant party it had been, but they really must be going. This example decided the rest. One by one all the fairies said goodbye and thanked the Queen for the delightful afternoon they had spent with her.",answer several fairy come say pleasant party go example decide rest fairy say goodbye thank delightful afternoon spend 
25,"“It’s been quite too lovely,” said the lady with the snake-bonnet; “_do_ ask us again soon, dear Queen. I shall be so _longing_ to see you again, and the _dear_ baby,” and off she went, with the snake-trimming quivering more than ever.",lovely say lady snake bonnet ask dear _longing_ see _dear_ baby go snake trimming quiver more 
26,"When the very last fairy was gone the Queen ran to look at the baby—she tore off its Honiton lace cap and burst into tears. For all the baby’s downy golden hair came off with the cap, and the Princess Melisande was as bald as an egg.",very last fairy go run look baby tore lace cap burst tear baby downy golden hair come cap bald egg 
27,"“Don’t cry, my love,” said the King. “I have a wish lying by, which I’ve never had occasion to use. My fairy godmother gave it me for a wedding present, but since then I’ve had nothing to wish for!”",cry love say have wish lie have occasion use fairy godmother give wedding present have wish 
28,"“Thank you, dear,” said the Queen, smiling through her tears.",thank dear say smile tear 
29,"“I’ll keep the wish till baby grows up,” the King went on. “And then I’ll give it to her, and if she likes to wish for hair she can.”",keep wish baby grow go give like wish hair 
30,"“Oh, won’t you wish for it _now_?” said the Queen, dropping mixed tears and kisses on the baby’s round, smooth head.",wish say drop mix tear kisse baby round smooth head 
31,"“No, dearest. She may want something else more when she grows up. And besides, her hair may grow by itself.”",dearest want else more grow hair grow 
32,"But it never did. Princess Melisande grew up as beautiful as the sun and as good as gold, but never a hair grew on that little head of hers. The Queen sewed her little caps of green silk, and the Princess’s pink and white face looked out of these like a flower peeping out of its bud. And every day as she grew older she grew dearer, and as she grew dearer she grew better, and as she grew more good she grew more beautiful.",grow beautiful sun good gold hair grow little head sew little cap green silk pink white face look flower peep bud day grow old grow dearer grow dearer grow good grow good grow beautiful 
33,"Now, when she was grown up the Queen said to the King—",grow say 
34,"“My love, our dear daughter is old enough to know what she wants. Let her have the wish.”",love dear daughter old know want let have wish 
35,So the King wrote to his fairy godmother and sent the letter by a butterfly. He asked if he might hand on to his daughter the wish the fairy had given him for a wedding present.,write fairy godmother send letter butterfly ask hand daughter wish fairy give wedding present 
36,"“I have never had occasion to use it,” said he, “though it has always made me happy to remember that I had such a thing in the house. The wish is as good as new, and my daughter is now of an age to appreciate so valuable a present.”",have occasion use say make happy remember have thing house wish good new daughter age appreciate valuable present 
37,To which the fairy replied by return of butterfly:—,fairy reply return butterfly 
38,"    “DEAR KING,—Pray do whatever you like with my poor     little present. I had quite forgotten it, but I am     pleased to think that you have treasured my humble     keepsake all these years.",dear king pray do like poor little present forget pleased think treasure humble keepsake year 
39,"                  “Your affectionate godmother,                                           “FORTUNA F.”",affectionate godmother 
40,"So the King unlocked his gold safe with the seven diamond-handled keys that hung at his girdle, and took out the wish and gave it to his daughter.",unlock gold safe diamond handle key hang girdle take wish give daughter 
41,"And Melisande said: “Father, I will wish that all your subjects should be quite happy.”",say father wish subject happy 
42,"But they were that already, because the King and Queen were so good. So the wish did not go off.",good wish go 
43,So then she said: “Then I wish them all to be good.”,say wish good 
44,"But they were that already, because they were happy. So again the wish hung fire.",happy wish hang fire 
45,"Then the Queen said: “Dearest, for my sake, wish what I tell you.”",say dearest sake wish tell 
46,"“Why, of course I will,” said Melisande. The Queen whispered in her ear, and Melisande nodded. Then she said, aloud—",course say whisper ear nod say 
47,"“I wish I had golden hair a yard long, and that it would grow an inch every day, and grow twice as fast every time it was cut, and——”",wish have golden hair yard grow inch day grow time cut 
48,"“Stop,” cried the King. And the wish went off, and the next moment the Princess stood smiling at him through a shower of golden hair.",stop cry wish go next moment stand smile shower golden hair 
49,"“Oh, how lovely,” said the Queen. “What a pity you interrupted her, dear; she hadn’t finished.”",lovely say pity interrupt dear finish 
50,“What was the end?” asked the King.,end ask 
51,"“Oh,” said Melisande, “I was only going to say, ‘and twice as thick.’”",say go say thick 
52,"“It’s a very good thing you didn’t,” said the King. “You’ve done about enough.” For he had a mathematical mind, and could do the sums about the grains of wheat on the chess-board, and the nails in the horse’s shoes, in his Royal head without any trouble at all.",good thing say do enough have mathematical mind do sum grain wheat chess board nail horse shoe royal head trouble 
53,"“Why, what’s the matter?” asked the Queen.",matter ask 
54,"“You’ll know soon enough,” said the King. “Come, let’s be happy while we may. Give me a kiss, little Melisande, and then go to nurse and ask her to teach you how to comb your hair.”",know say come let happy give kiss little go nurse ask teach comb hair 
55,"“I know,” said Melisande, “I’ve often combed mother’s.”",know say comb mother 
56,"“Your mother has beautiful hair,” said the King; “but I fancy you will find your own less easy to manage.”",mother have beautiful hair say fancy find own easy manage 
57,"And, indeed, it was so. The Princess’s hair began by being a yard long, and it grew an inch every night. If you know anything at all about the simplest sums you will see that in about five weeks her hair was about two yards long. This is a very inconvenient length. It trails on the floor and sweeps up all the dust, and though in palaces, of course, it is all gold-dust, still it is not nice to have it in your hair. And the Princess’s hair was growing an inch every night. When it was three yards long the Princess could not bear it any longer—it was so heavy and so hot—so she borrowed nurse’s cutting-out scissors and cut it all off, and then for a few hours she was comfortable. But the hair went on growing, and now it grew twice as fast as before; so that in thirty-six days it was as long as ever. The poor Princess cried with tiredness; when she couldn’t bear it any more she cut her hair and was comfortable for a very little time. For the hair now grew four times as fast as at first, and in eighteen days it was as long as before, and she had to have it cut. Then it grew eight inches a day, and the next time it was cut it grew sixteen inches a day, and then thirty-two inches and sixty-four inches and a hundred and twenty-eight inches a day, and so on, growing twice as fast after each cutting, till the Princess would go to bed at night with her hair clipped short, and wake up in the morning with yards and yards and yards of golden hair flowing all about the room, so that she could not move without pulling her own hair, and nurse had to come and cut the hair off before she could get out of bed.",hair begin yard long grow inch night know simple sum see week hair yard long inconvenient length trail floor sweep dust palace course gold dust nice have hair hair grow inch night yard bear heavy hot borrow nurse cut scissors cut few hour comfortable hair go grow grow day poor cry tiredness bear more cut hair comfortable little time hair grow time first day have have cut grow inch day next time cut grow inch day inch inch inch day grow cutting go bed night hair clippe short wake morning yard yard yard golden hair flow room move pull own hair nurse have come cut hair get bed 
58,"“I wish I was bald again,” sighed poor Melisande, looking at the little green caps she used to wear, and she cried herself to sleep o’ nights between the golden billows of the golden hair. But she never let her mother see her cry, because it was the Queen’s fault, and Melisande did not want to seem to reproach her.",wish bald sigh poor look little green cap use wear cry sleep night golden billow golden hair let mother see cry fault want seem reproach 
59,"When first the Princess’s hair grew her mother sent locks of it to all her Royal relations, who had them set in rings and brooches. Later, the Queen was able to send enough for bracelets and girdles. But presently so much hair was cut off that they had to burn it. Then when autumn came all the crops failed; it seemed as though all the gold of harvest had gone into the Princess’s hair. And there was a famine. Then Melisande said—",hair grow mother send lock royal relation have set ring brooche able send enough bracelet girdle much hair cut have burn autumn come crop fail seem gold harvest go hair be famine say 
60,"“It seems a pity to waste all my hair; it does grow so very fast. Couldn’t we stuff things with it, or something, and sell them, to feed the people?”",seem pity waste hair grow stuff thing sell feed person 
61,"So the King called a council of merchants, and they sent out samples of the Princess’s hair, and soon orders came pouring in; and the Princess’s hair became the staple export of that country. They stuffed pillows with it, and they stuffed beds with it. They made ropes of it for sailors to use, and curtains for hanging in Kings’ palaces. They made haircloth of it, for hermits, and other people who wished to be uncomfy. But it was so soft and silky that it only made them happy and warm, which they did not wish to be. So the hermits gave up wearing it, and, instead, mothers bought it for their little babies, and all well-born infants wore little shirts of Princess-haircloth.",call council merchant send sample hair order come pour hair become staple export country stuff pillow stuff bed make rope sailor use curtain hang palace make haircloth hermit other person wish uncomfy soft silky make happy warm wish hermit give wear mother buy little baby bear infant wear little shirt haircloth 
62,And still the hair grew and grew. And the people were fed and the famine came to an end.,hair grow grow person feed famine come end 
63,Then the King said: “It was all very well while the famine lasted—but now I shall write to my fairy godmother and see if something cannot be done.”,say famine last write fairy godmother see do 
64,"So he wrote and sent the letter by a skylark, and by return of bird came this answer—",write send letter skylark return bird come answer 
65,“Why not advertise for a competent Prince? Offer the usual reward.”,advertise competent offer usual reward 
66,So the King sent out his heralds all over the world to proclaim that any respectable Prince with proper references should marry the Princess Melisande if he could stop her hair growing.,send herald world proclaim respectable proper reference marry stop hair grow 
67,"Then from far and near came trains of Princes anxious to try their luck, and they brought all sorts of nasty things with them in bottles and round wooden boxes. The Princess tried all the remedies, but she did not like any of them, and she did not like any of the Princes, so in her heart she was rather glad that none of the nasty things in bottles and boxes made the least difference to her hair.",come train prince anxious try luck bring sort nasty thing bottle round wooden box try remedy like like heart glad nasty thing bottle box make least difference hair 
68,[TRAINS OF PRINCES BRINGING NASTY THINGS IN BOTTLES AND ROUND WOODEN BOXES.],trains prince bring nasty thing bottles round wooden booe 
69,"The Princess had to sleep in the great Throne Room now, because no other room was big enough to hold her and her hair. When she woke in the morning the long high room would be quite full of her golden hair, packed tight and thick like wool in a barn. And every night when she had had the hair cut close to her head she would sit in her green silk gown by the window and cry, and kiss the little green caps she used to wear, and wish herself bald again.",have sleep great other room big hold hair wake morning long high room full golden hair pack tight thick wool barn night have hair cut close head sit green silk gown window cry kiss little green cap use wear wish 
70,It was as she sat crying there on Midsummer Eve that she first saw Prince Florizel.,sit cry see 
71,"He had come to the palace that evening, but he would not appear in her presence with the dust of travel on him, and she had retired with her hair borne by twenty pages before he had bathed and changed his garments and entered the reception-room.",come palace evening appear presence dust travel retire hair borne page bath change garment enter reception room 
72,"Now he was walking in the garden in the moonlight, and he looked up and she looked down, and for the first time Melisande, looking on a Prince, wished that he might have the power to stop her hair from growing. As for the Prince, he wished many things, and the first was granted him. For he said—",walk garden moonlight look look first time look wish have power stop hair grow wish many thing first grant say 
73,“You are Melisande?”,
74,“And you are Florizel?”,
75,"“There are many roses round your window,” said he to her, “and none down here.”",be many rose window say 
76,She threw him one of three white roses she held in her hand. Then he said—,throw white rose hold hand say 
77,“White rose trees are strong. May I climb up to you?”,white rose tree strong climb 
78,"“Surely,” said the Princess.",say 
79,So he climbed up to the window.,climb window 
80,"“Now,” said he, “if I can do what your father asks, will you marry me?”",say do father ask marry 
81,"“My father has promised that I shall,” said Melisande, playing with the white roses in her hand.",father promise say play white rose hand 
82,"“Dear Princess,” said he, “your father’s promise is nothing to me. I want yours. Will you give it to me?”",dear say father promise want give 
83,"“Yes,” said she, and gave him the second rose.",say give second rose 
84,“I want your hand.”,want hand 
85,"“Yes,” she said.",say 
86,“And your heart with it.”,heart 
87,"“Yes,” said the Princess, and she gave him the third rose.",say give third rose 
88,“And a kiss to seal the promise.”,kiss seal promise 
89,"“Yes,” said she.",say 
90,“And a kiss to go with the hand.”,kiss go hand 
91,"“Yes,” she said.",say 
92,“And a kiss to bring the heart.”,kiss bring heart 
93,"“Yes,” said the Princess, and she gave him the three kisses.",say give kisse 
94,"“Now,” said he, when he had given them back to her, “to-night do not go to bed. Stay by your window, and I will stay down here in the garden and watch. And when your hair has grown to the filling of your room call to me, and then do as I tell you.”",say give night go bed stay window stay garden watch hair grow fill room call do tell 
95,"“I will,” said the Princess.",say 
96,"So at dewy sunrise the Prince, lying on the turf beside the sun-dial, heard her voice—",dewy sunrise lie turf sun- dial hear voice 
97,“Florizel! Florizel! My hair has grown so long that it is pushing me out of the window.”,hair grow push window 
98,"“Get out on to the window-sill,” said he, “and twist your hair three times round the great iron hook that is there.”",get window say twist hair time great iron hook 
99,And she did.,
100,"Then the Prince climbed up the rose bush with his naked sword in his teeth, and he took the Princess’s hair in his hand about a yard from her head and said—",climb rose bush naked sword tooth take hair hand yard head say 
101,“Jump!”,jump 
102,"The Princess jumped, and screamed, for there she was hanging from the hook by a yard and a half of her bright hair; the Prince tightened his grasp of the hair and drew his sword across it.",jump scream hang hook yard half bright hair tighten grasp hair draw sword 
103,"Then he let her down gently by her hair till her feet were on the grass, and jumped down after her.",let hair foot grass jump 
104,They stayed talking in the garden till all the shadows had crept under their proper trees and the sun-dial said it was breakfast time.,stay talk garden shadow creep proper tree sun-dial say breakfast time 
105,"Then they went in to breakfast, and all the Court crowded round to wonder and admire. For the Princess’s hair had not grown.",go breakfast crowd wonder admire hair grow 
106,"“How did you do it?” asked the King, shaking Florizel warmly by the hand.",do ask shake hand 
107,"“The simplest thing in the world,” said Florizel, modestly. “You have always cut the hair off the Princess. _I_ just cut the Princess off the hair.”",simple thing world say cut hair cut hair 
108,"“Humph!” said the King, who had a logical mind. And during breakfast he more than once looked anxiously at his daughter. When they got up from breakfast the Princess rose with the rest, but she rose and rose and rose, till it seemed as though there would never be an end of it. The Princess was nine feet high.",say have logical mind breakfast more look daughter get breakfast rise rest rise rise rise seem be end foot high 
109,"“I feared as much,” said the King, sadly. “I wonder what will be the rate of progression. You see,” he said to poor Florizel, “when we cut the hair off _it_ grows—when we cut the Princess off _she_ grows. I wish you had happened to think of that!”",fear much say wonder rate progression see say poor cut hair grow cut grow wish happen think 
