id,paragraph,tokens
73,"But the fairies took the good crow, and gave her nine new sets of feathers running, and turned her at last into the most beautiful bird of paradise with a green velvet suit and a long tail, and sent her to eat fruit in the Spice Islands, where cloves and nutmegs grow.",fairy take good crow give new set feather run turn last beautiful bird paradise green velvet suit long tail send eat fruit clove nutmeg grow 
74,"And Mrs. Bedonebyasyoudid settled her account with the wicked hoodies.  For, as they flew away, what should they find but a nasty dead dog?--on which they all set to work, peeking and gobbling and cawing and quarrelling to their hearts' content.  But the moment afterwards, they all threw up their bills into the air, and gave one screech; and then turned head over heels backward, and fell down dead, one hundred and twenty-three of them at once.  For why? The fairy had told the gamekeeper in a dream, to fill the dead dog full of strychnine; and so he did.",settle account wicked hoody fly find nasty dead dog set work peek gobble caw quarrell heart content moment throw bill air give screech turn head heel fall dead fairy tell gamekeeper dream fill dead dog full strychnine 
75,"And after a while the birds began to gather at Allfowlsness, in thousands and tens of thousands, blackening all the air; swans and brant geese, harlequins and eiders, harolds and garganeys, smews and goosanders, divers and loons, grebes and dovekies, auks and razor-bills, gannets and petrels, skuas and terns, with gulls beyond all naming or numbering; and they paddled and washed and splashed and combed and brushed themselves on the sand, till the shore was white with feathers; and they quacked and clucked and gabbled and chattered and screamed and whooped as they talked over matters with their friends, and settled where they were to go and breed that summer, till you might have heard them ten miles off; and lucky it was for them that there was no one to hear them but the old keeper, who lived all alone upon the Ness, in a turf hut thatched with heather and fringed round with great stones slung across the roof by bent-ropes, lest the winter gales should blow the hut right away.  But he never minded the birds nor hurt them, because they were not in season; indeed, he minded but two things in the whole world, and those were, his Bible and his grouse; for he was as good an old Scotchman as ever knit stockings on a winter's night:  only, when all the birds were going, he toddled out, and took off his cap to them, and wished them a merry journey and a safe return; and then gathered up all the feathers which they had left, and cleaned them to sell down south, and make feather- beds for stuffy people to lie on.",while bird begin gather thousand ten thousand blacken air swan brant geese harlequin eider harold garganey smew goosander diver loon grebe doveky auk razor bill gannet petrel skua tern gull naming numbering paddle wash splash comb brush sand shore white feather quack cluck gabble chatter scream whoop talk matter friend settle go breed summer hear mile lucky be hear old keeper live turf hut thatch heather fring great stone sling roof bend rope winter gale blow hut minded bird hurt season minded thing whole world grouse good old scotchman knit stocking winter night bird go toddle take cap wish merry journey safe return gather feather leave clean sell make feather bed stuffy person lie 
76,"Then the petrels asked this bird and that whether they would take Tom to Shiny Wall:  but one set was going to Sutherland, and one to the Shetlands, and one to Norway, and one to Spitzbergen, and one to Iceland, and one to Greenland:  but none would go to Shiny Wall. So the good-natured petrels said that they would show him part of the way themselves, but they were only going as far as Jan Mayen's Land; and after that he must shift for himself.",petrel ask bird take shiny set go go shiny good natured petrel say show part way go shift 
77,"And then all the birds rose up, and streamed away in long black lines, north, and north-east, and north-west, across the bright blue summer sky; and their cry was like ten thousand packs of hounds, and ten thousand peals of bells.  Only the puffins stayed behind, and killed the young rabbits, and laid their eggs in the rabbit-burrows; which was rough practice, certainly; but a man must see to his own family.",bird rise stream long black line north north east north bright blue summer sky cry pack hound peal bell puffin stay kill young rabbit lay egg rabbit burrow rough practice man see own family 
78,"And, as Tom and the petrels went north-eastward, it began to blow right hard; for the old gentleman in the gray great-coat, who looks after the big copper boiler, in the gulf of Mexico, had got behindhand with his work; so Mother Carey had sent an electric message to him for more steam; and now the steam was coming, as much in an hour as ought to have come in a week, puffing and roaring and swishing and swirling, till you could not see where the sky ended and the sea began.  But Tom and the petrels never cared, for the gale was right abaft, and away they went over the crests of the billows, as merry as so many flying-fish.",petrel go begin blow old gentleman gray great coat look big copper boiler gulf get behindhand work send electric message more steam steam come much hour ought come week puffing roar swish swirl see sky end sea begin petrel care gale abaft go crest billow merry many fly fish 
79,"And at last they saw an ugly sight--the black side of a great ship, waterlogged in the trough of the sea.  Her funnel and her masts were overboard, and swayed and surged under her lee; her decks were swept as clean as a barn floor, and there was no living soul on board.",last see ugly sight black side great ship waterlogg trough sea funnel mast overboard sway surge deck sweep clean barn floor be living soul board 
80,"The petrels flew up to her, and wailed round her; for they were very sorry indeed, and also they expected to find some salt pork; and Tom scrambled on board of her and looked round, frightened and sad.",petrel fly wail sorry expect find salt pork scramble board look frighten sad 
81,"And there, in a little cot, lashed tight under the bulwark, lay a baby fast asleep; the very same baby, Tom saw at once, which he had seen in the singing lady's arms.",little cot lash tight bulwark lay baby same baby see see sing lady arm 
82,"He went up to it, and wanted to wake it; but behold, from under the cot out jumped a little black and tan terrier dog, and began barking and snapping at Tom, and would not let him touch the cot.",go want wake cot jump little black tan terrier dog begin bark snapp let touch cot 
83,"Tom knew the dog's teeth could not hurt him:  but at least it could shove him away, and did; and he and the dog fought and struggled, for he wanted to help the baby, and did not want to throw the poor dog overboard:  but as they were struggling there came a tall green sea, and walked in over the weather side of the ship, and swept them all into the waves.",know dog tooth hurt least shove dog fight struggle want help baby want throw poor dog struggle come tall green sea walk weather side ship sweep wave 
84,"""Oh, the baby, the baby!"" screamed Tom:  but the next moment he did not scream at all; for he saw the cot settling down through the green water, with the baby, smiling in it, fast asleep; and he saw the fairies come up from below, and carry baby and cradle gently down in their soft arms; and then he knew it was all right, and that there would be a new water-baby in St. Brandan's Isle.",baby baby scream next moment scream see cot settle green water baby smile asleep see fairy come carry baby cradle soft arm know right be new water baby 
85,And the poor little dog?,poor little dog 
86,"Why, after he had kicked and coughed a little, he sneezed so hard, that he sneezed himself clean out of his skin, and turned into a water-dog, and jumped and danced round Tom, and ran over the crests of the waves, and snapped at the jelly-fish and the mackerel, and followed Tom the whole way to the Other-end-of-Nowhere.",kick cough little sneez sneez clean skin turn water dog jump dance run crest wave snap jelly fish mackerel follow whole way other end 
87,"Then they went on again, till they began to see the peak of Jan Mayen's Land, standing-up like a white sugar-loaf, two miles above the clouds.",go begin see peak standing white sugar loaf mile cloud 
88,"And there they fell in with a whole flock of molly-mocks, who were feeding on a dead whale.",fall whole flock molly mock feed dead whale 
89,"""These are the fellows to show you the way,"" said Mother Carey's chickens; ""we cannot help you farther north.  We don't like to get among the ice pack, for fear it should nip our toes:  but the mollys dare fly anywhere.""",fellow show way say chicken help like get ice pack fear nip toe molly fly 
90,"So the petrels called to the mollys:  but they were so busy and greedy, gobbling and peeking and spluttering and fighting over the blubber, that they did not take the least notice.",petrel call molly busy greedy gobble peek splutter fight blubber take least notice 
91,"""Come, come,"" said the petrels, ""you lazy greedy lubbers, this young gentleman is going to Mother Carey, and if you don't attend on him, you won't earn your discharge from her, you know.""",come come say petrel lazy greedy lubber young gentleman go attend earn discharge know 
92,"""Greedy we are,"" says a great fat old molly, ""but lazy we ain't; and, as for lubbers, we're no more lubbers than you.  Let's have a look at the lad.""",greedy say great fat old molly lazy lubber more lubber let have look lad 
93,"And he flapped right into Tom's face, and stared at him in the most impudent way (for the mollys are audacious fellows, as all whalers know), and then asked him where he hailed from, and what land he sighted last.",flapp face stare impudent way molly audacious fellow whaler know ask hail land sight last 
94,"And, when Tom told him, he seemed pleased, and said he was a good plucked one to have got so far.",tell seem pleased say good pluck one get 
95,"""Come along, lads,"" he said to the rest, ""and give this little chap a cast over the pack, for Mother Carey's sake.  We've eaten blubber enough for to-day, and we'll e'en work out a bit of our time by helping the lad.""",come lad say rest give little chap cast pack sake eat blubber day work bit time help lad 
96,"So the mollys took Tom up on their backs, and flew off with him, laughing and joking--and oh, how they did smell of train oil!",molly take back fly laugh joke smell train oil 
97,"""Who are you, you jolly birds?"" asked Tom.",jolly bird ask 
98,"""We are the spirits of the old Greenland skippers (as every sailor knows), who hunted here, right whales and horse-whales, full hundreds of years agone.  But, because we were saucy and greedy, we were all turned into mollys, to eat whale's blubber all our days. But lubbers we are none, and could sail a ship now against any man in the North seas, though we don't hold with this new-fangled steam.  And it's a shame of those black imps of petrels to call us so; but because they're her grace's pets, they think they may say anything they like.""",spirit old skipper sailor know hunt right whale horse whale full hundred year saucy greedy turn molly eat whale blubber day lubber sail ship man sea hold new fangle steam shame black imp petrel call grace pet think say like 
99,"""And who are you?"" asked Tom of him, for he saw that he was the king of all the birds.",ask see king bird 
100,"""My name is Hendrick Hudson, and a right good skipper was I; and my name will last to the world's end, in spite of all the wrong I did. For I discovered Hudson River, and I named Hudson's Bay; and many have come in my wake that dared not have shown me the way.  But I was a hard man in my time, that's truth, and stole the poor Indians off the coast of Maine, and sold them for slaves down in Virginia; and at last I was so cruel to my sailors, here in these very seas, that they set me adrift in an open boat, and I never was heard of more.  So now I'm the king of all mollys, till I've worked out my time.""",name right good skipper name last world end spite wrong discover name many come wake dare show way hard man time truth steal poor coast sell slave last cruel sailor very sea set adrift open boat hear more king molly work time 
101,"And now they came to the edge of the pack, and beyond it they could see Shiny Wall looming, through mist, and snow, and storm.  But the pack rolled horribly upon the swell, and the ice giants fought and roared, and leapt upon each other's backs, and ground each other to powder, so that Tom was afraid to venture among them, lest he should be ground to powder too.  And he was the more afraid, when he saw lying among the ice pack the wrecks of many a gallant ship; some with masts and yards all standing, some with the seamen frozen fast on board.  Alas, alas, for them!  They were all true English hearts; and they came to their end like good knights-errant, in searching for the white gate that never was opened yet.",come edge pack see shiny loom mist snow storm pack roll swell ice giant fight roar leapt other back ground other powder afraid venture ground powder afraid see lie ice pack wreck many gallant ship mast yard standing seamen freeze board true english heart come end good knight errant search white gate open 
102,"But the good mollys took Tom and his dog up, and flew with them safe over the pack and the roaring ice giants, and set them down at the foot of Shiny Wall.",good molly take dog fly safe pack roar ice giant set foot shiny 
103,"""And where is the gate?"" asked Tom.",gate ask 
104,"""There is no gate,"" said the mollys.",be gate say molly 
105,"""No gate?"" cried Tom, aghast.",gate cry aghast 
106,"""None; never a crack of one, and that's the whole of the secret, as better fellows, lad, than you have found to their cost; and if there had been, they'd have killed by now every right whale that swims the sea.""",crack whole secret good fellow lad find cost be kill right whale swim sea 
107,"""What am I to do, then?""",do 
108,"""Dive under the floe, to be sure, if you have pluck.""",dive floe sure have pluck 
109,"""I've not come so far to turn now,"" said Tom; ""so here goes for a header.""",come turn say go header 
110,"""A lucky voyage to you, lad,"" said the mollys; ""we knew you were one of the right sort.  So good-bye.""",lucky voyage lad say molly know right sort good 
111,"""Why don't you come too?"" asked Tom.",come ask 
112,"But the mollys only wailed sadly, ""We can't go yet, we can't go yet,"" and flew away over the pack.",molly wail go go fly pack 
113,"So Tom dived under the great white gate which never was opened yet, and went on in black darkness, at the bottom of the sea, for seven days and seven nights.  And yet he was not a bit frightened.  Why should he be?  He was a brave English lad, whose business is to go out and see all the world.",dive great white gate open go black darkness bottom sea day night bit frighten brave english lad business go see world 
114,"And at last he saw the light, and clear clear water overhead; and up he came a thousand fathoms, among clouds of sea-moths, which fluttered round his head.  There were moths with pink heads and wings and opal bodies, that flapped about slowly; moths with brown wings that flapped about quickly; yellow shrimps that hopped and skipped most quickly of all; and jellies of all the colours in the world, that neither hopped nor skipped, but only dawdled and yawned, and would not get out of his way.  The dog snapped at them till his jaws were tired; but Tom hardly minded them at all, he was so eager to get to the top of the water, and see the pool where the good whales go.",last see light clear clear water come fathom cloud sea moth flutter head be moth pink head wing opal body flapp moth brown wing flapp yellow shrimp hopp skip jelly colour world hopp skip dawdle yawn get way dog snap jaw tired minded eager get top water see pool good whale go 
115,"And a very large pool it was, miles and miles across, though the air was so clear that the ice cliffs on the opposite side looked as if they were close at hand.  All round it the ice cliffs rose, in walls and spires and battlements, and caves and bridges, and stories and galleries, in which the ice-fairies live, and drive away the storms and clouds, that Mother Carey's pool may lie calm from year's end to year's end.  And the sun acted policeman, and walked round outside every day, peeping just over the top of the ice wall, to see that all went right; and now and then he played conjuring tricks, or had an exhibition of fireworks, to amuse the ice-fairies.  For he would make himself into four or five suns at once, or paint the sky with rings and crosses and crescents of white fire, and stick himself in the middle of them, and wink at the fairies; and I daresay they were very much amused; for anything's fun in the country.",large pool mile mile air clear ice cliff opposite side look close hand ice cliff rise wall spire battlement cave bridge story gallery ice fairy live drive storm cloud pool lie calm year end year end sun act policeman walk day peep top ice wall see go play conjure trick have exhibition firework amuse ice fairy make sun paint sky ring cross crescent white fire stick middle wink fairy daresay amused fun country 
116,"And there the good whales lay, the happy sleepy beasts, upon the still oily sea.  They were all right whales, you must know, and finners, and razor-backs, and bottle-noses, and spotted sea- unicorns with long ivory horns.  But the sperm whales are such raging, ramping, roaring, rumbustious fellows, that, if Mother Carey let them in, there would be no more peace in Peacepool.  So she packs them away in a great pond by themselves at the South Pole, two hundred and sixty-three miles south-south-east of Mount Erebus, the great volcano in the ice; and there they butt each other with their ugly noses, day and night from year's end to year's end.",good whale lay happy sleepy beast oily sea right whale know finner razor back bottle nose spot sea- unicorn long ivory horn sperm whale such rage ramp roar rumbustious fellow let be more peace pack great pond mile south great volcano ice butt other ugly nose day night year end year end 
117,"But here there were only good quiet beasts, lying about like the black hulls of sloops, and blowing every now and then jets of white steam, or sculling round with their huge mouths open, for the sea- moths to swim down their throats.  There were no threshers there to thresh their poor old backs, or sword-fish to stab their stomachs, or saw-fish to rip them up, or ice-sharks to bite lumps out of their sides, or whalers to harpoon and lance them.  They were quite safe and happy there; and all they had to do was to wait quietly in Peacepool, till Mother Carey sent for them to make them out of old beasts into new.",be good quiet beast lie black hull sloop blow jet white steam scull huge mouth open sea- moth swim throat be thresher thresh poor old back sword fish stab stomach see fish rip ice shark bite lump side whaler harpoon lance safe happy have do wait send make old beast new 
118,"Tom swam up to the nearest whale, and asked the way to Mother Carey.",swim near whale ask way 
119,"""There she sits in the middle,"" said the whale.",sit middle say whale 
120,"Tom looked; but he could see nothing in the middle of the pool, but one peaked iceberg:  and he said so.",look see middle pool peak iceberg say 
121,"""That's Mother Carey,"" said the whale, ""as you will find when you get to her.  There she sits making old beasts into new all the year round.""",say whale find get sit make old beast new year 
122,"""How does she do that?""",do 
123,"""That's her concern, not mine,"" said the old whale; and yawned so wide (for he was very large) that there swam into his mouth 943 sea-moths, 13,846 jelly-fish no bigger than pins' heads, a string of salpae nine yards long, and forty-three little ice-crabs, who gave each other a parting pinch all round, tucked their legs under their stomachs, and determined to die decently, like Julius Caesar.",concern say old whale yawn wide large swim mouth sea moth jelly fish big pin head string salpae yard long little ice crab give other parting pinch tuck leg stomach determine die 
124,"""I suppose,"" said Tom, ""she cuts up a great whale like you into a whole shoal of porpoises?""",suppose say cut great whale whole shoal porpoise 
125,"At which the old whale laughed so violently that he coughed up all the creatures; who swam away again very thankful at having escaped out of that terrible whalebone net of his, from which bourne no traveller returns; and Tom went on to the iceberg, wondering.",old whale laugh cough creature swim thankful escape terrible whalebone net bourne traveller return go iceberg wonder 
126,"And, when he came near it, it took the form of the grandest old lady he had ever seen--a white marble lady, sitting on a white marble throne.  And from the foot of the throne there swum away, out and out into the sea, millions of new-born creatures, of more shapes and colours than man ever dreamed.  And they were Mother Carey's children, whom she makes out of the sea-water all day long.",come take form grandest old lady see white marble lady sit white marble throne foot throne swum sea million new bear creature more shape colour man dream child make sea water day 
127,"He expected, of course--like some grown people who ought to know better--to find her snipping, piecing, fitting, stitching, cobbling, basting, filing, planing, hammering, turning, polishing, moulding, measuring, chiselling, clipping, and so forth, as men do when they go to work to make anything.",expect course grow person know good find snipping piecing fitting stitching cobbling basting filing plane hammer turn polish mould measure chisell clip man do go work make 
128,"But, instead of that, she sat quite still with her chin upon her hand, looking down into the sea with two great grand blue eyes, as blue as the sea itself.  Her hair was as white as the snow--for she was very very old--in fact, as old as anything which you are likely to come across, except the difference between right and wrong.",sit chin hand look sea great grand blue eye blue sea hair white snow old fact old likely come difference right wrong 
129,"And, when she saw Tom, she looked at him very kindly.",see look 
130,"""What do you want, my little man?  It is long since I have seen a water-baby here.""",want little man long see water baby 
131,"Tom told her his errand, and asked the way to the Other-end-of- Nowhere.",tell errand ask way other end 
132,"""You ought to know yourself, for you have been there already.""",know 
133,"""Have I, ma'am?  I'm sure I forget all about it.""",sure forget 
134,"""Then look at me.""",look 
135,"And, as Tom looked into her great blue eyes, he recollected the way perfectly.",look great blue eye recollect way 
136,"Now, was not that strange?",strange 
137,"""Thank you, ma'am,"" said Tom.  ""Then I won't trouble your ladyship any more; I hear you are very busy.""",thank say trouble ladyship more hear busy 
138,"""I am never more busy than I am now,"" she said, without stirring a finger.",busy say stir finger 
139,"""I heard, ma'am, that you were always making new beasts out of old.""",hear make new beast old 
140,"""So people fancy.  But I am not going to trouble myself to make things, my little dear.  I sit here and make them make themselves.""",person fancy go trouble make thing little dear sit make make 
141,"""You are a clever fairy, indeed,"" thought Tom.  And he was quite right.",clever fairy think right 
142,"That is a grand trick of good old Mother Carey's, and a grand answer, which she has had occasion to make several times to impertinent people.",grand trick good old grand answer have occasion make several time impertinent person 
143,"There was once, for instance, a fairy who was so clever that she found out how to make butterflies.  I don't mean sham ones; no: but real live ones, which would fly, and eat, and lay eggs, and do everything that they ought; and she was so proud of her skill that she went flying straight off to the North Pole, to boast to Mother Carey how she could make butterflies.",be instance fairy clever find make butterfly mean sham one real live one fly eat lay egg do proud skill go fly boast make butterfly 
144,But Mother Carey laughed.,laugh 
145,"""Know, silly child,"" she said, ""that any one can make things, if they will take time and trouble enough:  but it is not every one who, like me, can make things make themselves.""",know silly child say one make thing take time trouble one make thing make 
146,"But people do not yet believe that Mother Carey is as clever as all that comes to; and they will not till they, too, go the journey to the Other-end-of-Nowhere.",person believe clever come go journey other end 
147,"""And now, my pretty little man,"" said Mother Carey, ""you are sure you know the way to the Other-end-of-Nowhere?""",little man say sure know way other end 
148,"Tom thought; and behold, he had forgotten it utterly.",think forget 
149,"""That is because you took your eyes off me.""",take eye 
150,"Tom looked at her again, and recollected; and then looked away, and forgot in an instant.",look recollect look forget instant 
151,"""But what am I to do, ma'am?  For I can't keep looking at you when I am somewhere else.""",do keep look else 
