id,paragraph,tokens
276,"""It would be no use,"" said the stick.  ""They can't play now, if they tried.  Don't you see how their legs have turned to roots and grown into the ground, by never taking any exercise, but sapping and moping always in the same place?  But here comes the Examiner- of-all-Examiners.  So you had better get away, I warn you, or he will examine you and your dog into the bargain, and set him to examine all the other dogs, and you to examine all the other water- babies.  There is no escaping out of his hands, for his nose is nine thousand miles long, and can go down chimneys, and through keyholes, upstairs, downstairs, in my lady's chamber, examining all little boys, and the little boys' tutors likewise.  But when he is thrashed--so Mrs. Bedonebyasyoudid has promised me--I shall have the thrashing of him:  and if I don't lay it on with a will it's a pity.""",use say stick play try see leg turn root grow ground take exercise sapp mope same place come examiner good get warn examine dog bargain set examine other dog examine other water baby be escape hand nose mile long go chimney keyhole lady chamber examine little boy little boy tutor thrash promise have thrashing lay will pity 
277,"Tom went off:  but rather slowly and surlily; for he was somewhat minded to face this same Examiner-of-all-Examiners, who came striding among the poor turnips, binding heavy burdens and grievous to be borne, and laying them on little children's shoulders, like the Scribes and Pharisees of old, and not touching the same with one of his fingers; for he had plenty of money, and a fine house to live in, and so forth; which was more than the poor little turnips had.",go minded face same examiner examiner come strid poor turnip bind heavy burden grievous borne lay little child shoulder old touch same finger have plenty money fine house live more poor little turnip have 
278,"But when he got near, he looked so big and burly and dictatorial, and shouted so loud to Tom, to come and be examined, that Tom ran for his life, and the dog too.  And really it was time; for the poor turnips, in their hurry and fright, crammed themselves so fast to be ready for the Examiner, that they burst and popped by dozens all round him, till the place sounded like Aldershot on a field- day, and Tom thought he should be blown into the air, dog and all.",get look big burly dictatorial shout come examine run life dog time poor turnip hurry fright cramm fast ready burst pop dozen place sound field day think blow air dog 
279,"As he went down to the shore he passed the poor turnip's new tomb. But Mrs. Bedonebyasyoudid had taken away the epitaph about talents and precocity and development, and put up one of her own instead which Tom thought much more sensible:-",go shore pass poor turnip new tomb take epitaph talent precocity development put own think sensible 
280," ""Instruction sore long time I bore, And cramming was in vain; Till heaven did please my woes to ease With water on the brain.""",instruction sore long time bear cramming vain heaven please woe ease water brain 
281," So Tom jumped into the sea, and swam on his way, singing:-",jump sea swim way sing 
282," ""Farewell, Tomtoddies all; I thank my stars That nought I know save those three royal r's: Reading and riting sure, with rithmetick, Will help a lad of sense through thin and thick.""",thank star nought know save royal be reading rite sure rithmetick help lad sense thin thick 
283," Whereby you may see that Tom was no poet:  but no more was John Bunyan, though he was as wise a man as you will meet in a month of Sundays.",see poet wise man meet month 
284,"And next he came to Oldwivesfabledom, where the folks were all heathens, and worshipped a howling ape.  And there he found a little boy sitting in the middle of the road, and crying bitterly.",come folk heathen worship howling ape find little boy sit middle road cry 
285,"""What are you crying for?"" said Tom.",cry say 
286,"""Because I am not as frightened as I could wish to be.""",frighten wish 
287,"""Not frightened?  You are a queer little chap:  but, if you want to be frightened, here goes--Boo!""",frighten queer little chap want frighten go 
288,"""Ah,"" said the little boy, ""that is very kind of you; but I don't feel that it has made any impression.""",say little boy kind feel make impression 
289,"Tom offered to upset him, punch him, stamp on him, fettle him over the head with a brick, or anything else whatsoever which would give him the slightest comfort.",offer upset punch stamp fettle head brick else give slight comfort 
290,"But he only thanked Tom very civilly, in fine long words which he had heard other folk use, and which therefore, he thought were fit and proper to use himself; and cried on till his papa and mamma came, and sent off for the Powwow man immediately.  And a very good-natured gentleman and lady they were, though they were heathens; and talked quite pleasantly to Tom about his travels, till the Powwow man arrived, with his thunderbox under his arm.",thank fine long word hear other folk use think fit proper use cry papa mamma come send man good natured gentleman lady heathen talk travel man arrive thunderbox arm 
291,"And a well-fed, ill-favoured gentleman he was, as ever served Her Majesty at Portland.  Tom was a little frightened at first; for he thought it was Grimes.  But he soon saw his mistake:  for Grimes always looked a man in the face; and this fellow never did.  And when he spoke, it was fire and smoke; and when he sneezed, it was squibs and crackers; and when he cried (which he did whenever it paid him), it was boiling pitch; and some of it was sure to stick.",feed ill favour gentleman serve little frighten first think see mistake look man face fellow speak fire smoke sneez squib cracker cry pay boil pitch sure stick 
292,"""Here we are again!"" cried he, like the clown in a pantomime.  ""So you can't feel frightened, my little dear--eh?  I'll do that for you.  I'll make an impression on you!  Yah!  Boo!  Whirroo! Hullabaloo!""",cry clown pantomime feel frighten little dear do make impression 
293,"And he rattled, thumped, brandished his thunder-box, yelled, shouted, raved, roared, stamped, and danced corrobory like any black fellow; and then he touched a spring in the thunderbox, and out popped turnip-ghosts and magic-lanthorns and pasteboard bogies and spring-heeled Jacks, and sallaballas, with such a horrid din, clatter, clank, roll, rattle, and roar, that the little boy turned up the whites of his eyes, and fainted right away.",rattle thump brandish thunder box yell shout rave roar stamp dance corrobory black fellow touch spring thunderbox pop turnip ghost magic lanthorn pasteboard bogie spring heel jack sallaballas horrid din clatter clank roll rattle roar little boy turn white eye faint 
294,"And at that his poor heathen papa and mamma were as much delighted as if they had found a gold mine; and fell down upon their knees before the Powwow man, and gave him a palanquin with a pole of solid silver and curtains of cloth of gold; and carried him about in it on their own backs:  but as soon as they had taken him up, the pole stuck to their shoulders, and they could not set him down any more, but carried him on willynilly, as Sinbad carried the old man of the sea:  which was a pitiable sight to see; for the father was a very brave officer, and wore two swords and a blue button; and the mother was as pretty a lady as ever had pinched feet like a Chinese.  But you see, they had chosen to do a foolish thing just once too often; so, by the laws of Mrs. Bedonebyasyoudid, they had to go on doing it whether they chose or not, till the coming of the Cocqcigrues.",poor heathen papa mamma delighted find gold fall knee man give palanquin pole solid silver curtain cloth gold carry own back take pole stick shoulder set more carry willynilly carry old man sea pitiable sight see father brave officer wear sword blue button mother lady pinch foot see choose do foolish thing law have go do choose coming 
295,"Ah! don't you wish that some one would go and convert those poor heathens, and teach them not to frighten their little children into fits?",wish one go convert poor heathen teach frighten little child fit 
296,"""Now, then,"" said the Powwow man to Tom, ""wouldn't you like to be frightened, my little dear?  For I can see plainly that you are a very wicked, naughty, graceless, reprobate boy.""",say man like frighten little dear see wicked naughty graceless reprobate boy 
297,"""You're another,"" quoth Tom, very sturdily.  And when the man ran at him, and cried ""Boo!""  Tom ran at him in return, and cried ""Boo!"" likewise, right in his face, and set the little dog upon him; and at his legs the dog went.",quoth man run cry run return cry face set little dog leg dog go 
298,"At which, if you will believe it, the fellow turned tail, thunderbox and all, with a ""Woof!"" like an old sow on the common; and ran for his life, screaming, ""Help! thieves! murder! fire!  He is going to kill me!  I am a ruined man!  He will murder me; and break, burn, and destroy my precious and invaluable thunderbox; and then you will have no more thunder-showers in the land.  Help! help! help!""",believe fellow turn tail thunderbox woof old sow common run life scream help thief murder fire go kill ruin man murder break burn destroy precious invaluable thunderbox have more thunder shower land help help help 
299,"At which the papa and mamma and all the people of Oldwivesfabledom flew at Tom, shouting, ""Oh, the wicked, impudent, hard-hearted, graceless boy!  Beat him, kick him, shoot him, drown him, hang him, burn him!"" and so forth:  but luckily they had nothing to shoot, hang, or burn him with, for the fairies had hid all the killing- tackle out of the way a little while before; so they could only pelt him with stones; and some of the stones went clean through him, and came out the other side.  But he did not mind that a bit; for the holes closed up again as fast as they were made, because he was a water-baby.  However, he was very glad when he was safe out of the country, for the noise there made him all but deaf.",papa mamma person fly shouting wicked impudent hard hearted graceless boy beat kick shoot drown hang burn have shoot hang burn fairy hide killing tackle way little while pelt stone stone go clean come other side mind bit hole close make water baby glad safe country noise make deaf 
300,"Then he came to a very quiet place, called Leaveheavenalone.  And there the sun was drawing water out of the sea to make steam- threads, and the wind was twisting them up to make cloud-patterns, till they had worked between them the loveliest wedding veil of Chantilly lace, and hung it up in their own Crystal Palace for any one to buy who could afford it; while the good old sea never grudged, for she knew they would pay her back honestly.  So the sun span, and the wind wove, and all went well with the great steam- loom; as is likely, considering--and considering--and considering -",come quiet place call sun draw water sea make steam thread wind twist make cloud pattern work loveliest wedding veil lace hang own one buy afford good old sea grudge know pay sun span wind wove go great steam loom likely consider consider consider 
301,"And at last, after innumerable adventures, each more wonderful than the last, he saw before him a huge building, much bigger, and--what is most surprising--a little uglier than a certain new lunatic asylum, but not built quite of the same materials.  None of it, at least--or, indeed, for aught that I ever saw, any part of any other building whatsoever--is cased with nine-inch brick inside and out, and filled up with rubble between the walls, in order that any gentleman who has been confined during Her Majesty's pleasure may be unconfined during his own pleasure, and take a walk in the neighbouring park to improve his spirits, after an hour's light and wholesome labour with his dinner-fork or one of the legs of his iron bedstead.  No.  The walls of this building were built on an entirely different principle, which need not be described, as it has not yet been discovered.",last innumerable adventure wonderful last see huge building big surprising little ugly certain new lunatic asylum build same material least aught see part other building case inch brick fill rubble wall order gentleman confine pleasure unconfine own pleasure take walk neighbour park improve spirit hour light wholesome labour dinner fork leg iron bedstead wall building build different principle describe discover 
302,"Tom walked towards this great building, wondering what it was, and having a strange fancy that he might find Mr. Grimes inside it, till he saw running toward him, and shouting ""Stop!"" three or four people, who, when they came nearer, were nothing else than policemen's truncheons, running along without legs or arms.",walk great building wonder have strange fancy find see run shouting stop person come else policemen truncheon run leg arm 
303,"Tom was not astonished.  He was long past that.  Besides, he had seen the naviculae in the water move nobody knows how, a hundred times, without arms, or legs, or anything to stand in their stead. Neither was he frightened for he had been doing no harm.",astonished long see naviculae water move know time arm leg stand stead frighten do harm 
304,"So he stopped; and, when the foremost truncheon came up and asked his business, he showed Mother Carey's pass; and the truncheon looked at it in the oddest fashion; for he had one eye in the middle of his upper end, so that when he looked at anything, being quite stiff, he had to slope himself, and poke himself, till it was a wonder why he did not tumble over; but, being quite full of the spirit of justice (as all policemen, and their truncheons, ought to be), he was always in a position of stable equilibrium, whichever way he put himself.",stop foremost truncheon come ask business show pass truncheon look oddest fashion have eye middle upper end look stiff have slope poke wonder tumble full spirit justice policemen truncheon position stable equilibrium way put 
305,"""All right--pass on,"" said he at last.  And then he added:  ""I had better go with you, young man.""  And Tom had no objection, for such company was both respectable and safe; so the truncheon coiled its thong neatly round its handle, to prevent tripping itself up--for the thong had got loose in running--and marched on by Tom's side.",right pass say last add good go young man have objection such company respectable safe truncheon coiled thong handle prevent trip thong get loose run march side 
306,"""Why have you no policeman to carry you?"" asked Tom, after a while.",policeman carry ask while 
307,"""Because we are not like those clumsy-made truncheons in the land- world, which cannot go without having a whole man to carry them about.  We do our own work for ourselves; and do it very well, though I say it who should not.""",clumsy make truncheon land world go have whole man carry do own work do say 
308,"""Then why have you a thong to your handle?"" asked Tom.",thong handle ask 
309,"""To hang ourselves up by, of course, when we are off duty.""",hang course duty 
310,"Tom had got his answer, and had no more to say, till they came up to the great iron door of the prison.  And there the truncheon knocked twice, with its own head.",get answer have more say come great iron door prison truncheon knock own head 
311,"A wicket in the door opened, and out looked a tremendous old brass blunderbuss charged up to the muzzle with slugs, who was the porter; and Tom started back a little at the sight of him.",wicket door open look tremendous old brass blunderbuss charge muzzle slug porter start little sight 
312,"""What case is this?"" he asked in a deep voice, out of his broad bell mouth.",case ask deep voice broad bell mouth 
313,"""If you please, sir, it is no case; only a young gentleman from her ladyship, who wants to see Grimes, the master-sweep.""",sir case young gentleman ladyship want see master sweep 
314,"""Grimes?"" said the blunderbuss.  And he pulled in his muzzle, perhaps to look over his prison-lists.",say blunderbuss pull muzzle look prison list 
315,"""Grimes is up chimney No. 345,"" he said from inside.  ""So the young gentleman had better go on to the roof.""",chimney no. say young gentleman good go roof 
316,"Tom looked up at the enormous wall, which seemed at least ninety miles high, and wondered how he should ever get up:  but, when he hinted that to the truncheon, it settled the matter in a moment. For it whisked round, and gave him such a shove behind as sent him up to the roof in no time, with his little dog under his arm.",look enormous wall seem least mile high wonder get hint truncheon settle matter moment whisk give shove send roof time little dog arm 
317,"And there he walked along the leads, till he met another truncheon, and told him his errand.",walk lead meet truncheon tell errand 
318,"""Very good,"" it said.  ""Come along:  but it will be of no use.  He is the most unremorseful, hard-hearted, foul-mouthed fellow I have in charge; and thinks about nothing but beer and pipes, which are not allowed here, of course.""",good say come use unremorseful hard hearted foul mouthed fellow charge think beer pipe allow course 
319,"So they walked along over the leads, and very sooty they were, and Tom thought the chimneys must want sweeping very much.  But he was surprised to see that the soot did not stick to his feet, or dirty them in the least.  Neither did the live coals, which were lying about in plenty, burn him; for, being a water-baby, his radical humours were of a moist and cold nature, as you may read at large in Lemnius, Cardan, Van Helmont, and other gentlemen, who knew as much as they could, and no man can know more.",walk lead sooty think chimney want sweep surprise see soot stick foot dirty least do live coal lie plenty burn water baby radical humour moist cold nature read large other gentleman know man know more 
320,"And at last they came to chimney No. 345.  Out of the top of it, his head and shoulders just showing, stuck poor Mr. Grimes, so sooty, and bleared, and ugly, that Tom could hardly bear to look at him.  And in his mouth was a pipe; but it was not a-light; though he was pulling at it with all his might.",last come chimney no. top head shoulder show stick poor sooty blear ugly bear look mouth pipe light pull 
321,"""Attention, Mr. Grimes,"" said the truncheon; ""here is a gentleman come to see you.""",attention say truncheon gentleman come see 
322,"But Mr. Grimes only said bad words; and kept grumbling, ""My pipe won't draw.  My pipe won't draw.""",say bad word keep grumble pipe draw pipe draw 
323,"""Keep a civil tongue, and attend!"" said the truncheon; and popped up just like Punch, hitting Grimes such a crack over the head with itself, that his brains rattled inside like a dried walnut in its shell.  He tried to get his hands out, and rub the place:  but he could not, for they were stuck fast in the chimney.  Now he was forced to attend.",keep civil tongue attend say truncheon pop hit crack head brain rattle dry walnut shell try get hand rub place stick chimney force attend 
324,"""Hey!"" he said, ""why, it's Tom!  I suppose you have come here to laugh at me, you spiteful little atomy?""",say suppose come laugh spiteful little atomy 
325,"Tom assured him he had not, but only wanted to help him.",assure want help 
326,"""I don't want anything except beer, and that I can't get; and a light to this bothering pipe, and that I can't get either.""",want beer get light bother pipe get 
327,"""I'll get you one,"" said Tom; and he took up a live coal (there were plenty lying about) and put it to Grimes' pipe:  but it went out instantly.",get say take live coal be plenty lie put pipe go 
328,"""It's no use,"" said the truncheon, leaning itself up against the chimney and looking on.  ""I tell you, it is no use.  His heart is so cold that it freezes everything that comes near him.  You will see that presently, plain enough.""",use say truncheon lean chimney look tell use heart cold freeze come see plain 
329,"""Oh, of course, it's my fault.  Everything's always my fault,"" said Grimes.  ""Now don't go to hit me again"" (for the truncheon started upright, and looked very wicked); ""you know, if my arms were only free, you daren't hit me then.""",course fault fault say go hit truncheon start look wicked know arm free hit 
330,"The truncheon leant back against the chimney, and took no notice of the personal insult, like a well-trained policeman as it was, though he was ready enough to avenge any transgression against morality or order.",truncheon lean chimney take notice personal insult train policeman ready avenge transgression morality order 
331,"""But can't I help you in any other way?  Can't I help you to get out of this chimney?"" said Tom.",help other way help get chimney say 
332,"""No,"" interposed the truncheon; ""he has come to the place where everybody must help themselves; and he will find it out, I hope, before he has done with me.""",interpose truncheon come place help find hope do 
333,"""Oh, yes,"" said Grimes, ""of course it's me.  Did I ask to be brought here into the prison?  Did I ask to be set to sweep your foul chimneys?  Did I ask to have lighted straw put under me to make me go up?  Did I ask to stick fast in the very first chimney of all, because it was so shamefully clogged up with soot?  Did I ask to stay here--I don't know how long--a hundred years, I do believe, and never get my pipe, nor my beer, nor nothing fit for a beast, let alone a man?""",say course ask bring prison ask set sweep foul chimney ask have light straw put make go ask stick very first chimney clogge soot ask stay know year believe get pipe beer fit beast let alone man 
334,"""No,"" answered a solemn voice behind.  ""No more did Tom, when you behaved to him in the very same way.""",answer solemn voice behave very same way 
335,"It was Mrs. Bedonebyasyoudid.  And, when the truncheon saw her, it started bolt upright--Attention!--and made such a low bow, that if it had not been full of the spirit of justice, it must have tumbled on its end, and probably hurt its one eye.  And Tom made his bow too.",truncheon see start bolt upright attention make low bow full spirit justice tumble end hurt eye make bow 
336,"""Oh, ma'am,"" he said, ""don't think about me; that's all past and gone, and good times and bad times and all times pass over.  But may not I help poor Mr. Grimes?  Mayn't I try and get some of these bricks away, that he may move his arms?""",say think past gone good time bad time time pass help poor try get brick move arm 
337,"""You may try, of course,"" she said.",try course say 
338,So Tom pulled and tugged at the bricks:  but he could not move one. And then he tried to wipe Mr. Grimes' face:  but the soot would not come off.,pull tug brick move try wipe face soot come 
339,"""Oh, dear!"" he said.  ""I have come all this way, through all these terrible places, to help you, and now I am of no use at all.""",dear say come way terrible place help use 
340,"""You had best leave me alone,"" said Grimes; ""you are a good-natured forgiving little chap, and that's truth; but you'd best be off. The hail's coming on soon, and it will beat the eyes out of your little head.""",have good leave say good natured forgive little chap truth hail come beat eye little head 
341,"""What hail?""",hail 
342,"""Why, hail that falls every evening here; and, till it comes close to me, it's like so much warm rain:  but then it turns to hail over my head, and knocks me about like small shot.""",hail fall evening come much warm rain turn hail head knock small shot 
343,"""That hail will never come any more,"" said the strange lady.  ""I have told you before what it was.  It was your mother's tears, those which she shed when she prayed for you by her bedside; but your cold heart froze it into hail.  But she is gone to heaven now, and will weep no more for her graceless son.""",hail come more say strange lady tell mother tear shed pray bedside cold heart frize hail go heaven weep more graceless son 
344,Then Grimes was silent awhile; and then he looked very sad.,silent look sad 
345,"""So my old mother's gone, and I never there to speak to her!  Ah! a good woman she was, and might have been a happy one, in her little school there in Vendale, if it hadn't been for me and my bad ways.""",old mother gone speak good woman happy one little school bad way 
346,"""Did she keep the school in Vendale?"" asked Tom.  And then he told Grimes all the story of his going to her house, and how she could not abide the sight of a chimney-sweep, and then how kind she was, and how he turned into a water-baby.",keep school ask tell story go house abide sight chimney sweep kind turn water baby 
347,"""Ah!"" said Grimes, ""good reason she had to hate the sight of a chimney-sweep.  I ran away from her and took up with the sweeps, and never let her know where I was, nor sent her a penny to help her, and now it's too late--too late!"" said Mr. Grimes.",say good reason have hate sight chimney sweep run take sweep let know send penny help late late say 
348,"And he began crying and blubbering like a great baby, till his pipe dropped out of his mouth, and broke all to bits.",begin cry blubber great baby pipe drop mouth break bit 
