id,paragraph,tokens
152,"""You must do without me, as most people have to do, for nine hundred and ninety-nine thousandths of their lives; and look at the dog instead; for he knows the way well enough, and will not forget it.  Besides, you may meet some very queer-tempered people there, who will not let you pass without this passport of mine, which you must hang round your neck and take care of; and, of course, as the dog will always go behind you, you must go the whole way backward.""",do most person have do thousandths life look dog know way forget meet queer temper person let pass passport hang neck take care course dog go go whole way 
153,"""Backward!"" cried Tom.  ""Then I shall not be able to see my way.""",cry able see way 
154,"""On the contrary, if you look forward, you will not see a step before you, and be certain to go wrong; but, if you look behind you, and watch carefully whatever you have passed, and especially keep your eye on the dog, who goes by instinct, and therefore can't go wrong, then you will know what is coming next, as plainly as if you saw it in a looking-glass.""",contrary look see step certain go wrong look watch pass keep eye dog go instinct go wrong know come see look glass 
155,"Tom was very much astonished:  but he obeyed her, for he had learnt always to believe what the fairies told him.",astonished obey learn believe fairy tell 
156,"""So it is, my dear child,"" said Mother Carey; ""and I will tell you a story, which will show you that I am perfectly right, as it is my custom to be.",dear child say tell story show right custom 
157,"""Once on a time, there were two brothers.  One was called Prometheus, because he always looked before him, and boasted that he was wise beforehand.  The other was called Epimetheus, because he always looked behind him, and did not boast at all; but said humbly, like the Irishman, that he had sooner prophesy after the event.",time be brother call look boast wise other call look boast say have soon prophesy event 
158,"""Well, Prometheus was a very clever fellow, of course, and invented all sorts of wonderful things.  But, unfortunately, when they were set to work, to work was just what they would not do:  wherefore very little has come of them, and very little is left of them; and now nobody knows what they were, save a few archaeological old gentlemen who scratch in queer corners, and find little there save Ptinum Furem, Blaptem Mortisagam, Acarum Horridum, and Tineam Laciniarum.",clever fellow course invent sort wonderful thing set work work do little come little leave know save few archaeological old gentleman scratch queer corner find little save 
159,"""But Epimetheus was a very slow fellow, certainly, and went among men for a clod, and a muff, and a milksop, and a slowcoach, and a bloke, and a boodle, and so forth.  And very little he did, for many years:  but what he did, he never had to do over again.",slow fellow go man clod muff milksop slowcoach bloke boodle little many year have do 
160,"""And what happened at last?  There came to the two brothers the most beautiful creature that ever was seen, Pandora by name; which means, All the gifts of the Gods.  But because she had a strange box in her hand, this fanciful, forecasting, suspicious, prudential, theoretical, deductive, prophesying Prometheus, who was always settling what was going to happen, would have nothing to do with pretty Pandora and her box.",happen last come brother beautiful creature see name mean gift god have strange box hand fanciful forecasting suspicious prudential theoretical deductive prophesying settle go happen have do pretty box 
161,"""But Epimetheus took her and it, as he took everything that came; and married her for better for worse, as every man ought, whenever he has even the chance of a good wife.  And they opened the box between them, of course, to see what was inside:  for, else, of what possible use could it have been to them?",take take come marry good bad man have chance good wife open box course see else possible use 
162,"""And out flew all the ills which flesh is heir to; all the children of the four great bogies, Self-will, Ignorance, Fear, and Dirt--for instance:",fly ill flesh heir child great bogie self instance 
163," Measles,        Famines, Monks,          Quacks, Scarlatina,     Unpaid bills, Idols,          Tight stays, Hooping-coughs, Potatoes, Popes,          Bad Wine, Wars,           Despots, Peacemongers,   Demagogues, And, worst of all, Naughty Boys and Girls.",measle famine monk quack scarlatina unpaid bill idol tight stay hooping cough potatoe pope bad wine war despot peacemonger demagogues bad naughty boy girl 
164," But one thing remained at the bottom of the box, and that was, Hope.",thing remain bottom box hope 
165,"""So Epimetheus got a great deal of trouble, as most men do in this world:  but he got the three best things in the world into the bargain--a good wife, and experience, and hope:  while Prometheus had just as much trouble, and a great deal more (as you will hear), of his own making; with nothing beside, save fancies spun out of his own brain, as a spider spins her web out of her stomach.",get great deal trouble most man do world get good thing world bargain good wife experience hope have much trouble great deal more hear own making save fancy spun own brain spider spin web stomach 
166,"""And Prometheus kept on looking before him so far ahead, that as he was running about with a box of lucifers (which were the only useful things he ever invented, and do as much harm as good), he trod on his own nose, and tumbled down (as most deductive philosophers do), whereby he set the Thames on fire; and they have hardly put it out again yet.  So he had to be chained to the top of a mountain, with a vulture by him to give him a peck whenever he stirred, lest he should turn the whole world upside down with his prophecies and his theories.",keep look run box lucifer only useful thing invent do much harm good trod own nose tumble most deductive philosopher set fire put have chain top mountain vulture give peck stirr turn whole world prophecy theory 
167,"""But stupid old Epimetheus went working and grubbing on, with the help of his wife Pandora, always looking behind him to see what had happened, till he really learnt to know now and then what would happen next; and understood so well which side his bread was buttered, and which way the cat jumped, that he began to make things which would work, and go on working, too; to till and drain the ground, and to make looms, and ships, and railroads, and steam ploughs, and electric telegraphs, and all the things which you see in the Great Exhibition; and to foretell famine, and bad weather, and the price of stocks and (what is hardest of all) the next vagary of the great idol Whirligig, which some call Public Opinion; till at last he grew as rich as a Jew, and as fat as a farmer, and people thought twice before they meddled with him, but only once before they asked him to help them; for, because he earned his money well, he could afford to spend it well likewise.",stupid old go work grubb help wife look see happen learn know happen understand side bread butter way cat jump begin make thing work go work till drain ground make loom ship railroad steam plough electric telegraph thing see great foretell famine bad weather price stock hard next vagary great idol call public last grow rich jew fat farmer person think meddle ask help earn money afford spend 
168,"""And his children are the men of science, who get good lasting work done in the world; but the children of Prometheus are the fanatics, and the theorists, and the bigots, and the bores, and the noisy windy people, who go telling silly folk what will happen, instead of looking to see what has happened already.""",child man science get good last work do world child fanatics theorist bigot bore noisy windy person go tell silly folk happen look see happen 
169,"Now, was not Mother Carey's a wonderful story?  And, I am happy to say, Tom believed it every word.",wonderful story happy say believe word 
170,"For so it happened to Tom likewise.  He was very sorely tried; for though, by keeping the dog to heels (or rather to toes, for he had to walk backward), he could see pretty well which way the dog was hunting, yet it was much slower work to go backwards than to go forwards.  But, what was more trying still, no sooner had he got out of Peacepool, than there came running to him all the conjurors, fortune-tellers, astrologers, prophesiers, projectors, prestigiators, as many as were in those parts (and there are too many of them everywhere), Old Mother Shipton on her broomstick, with Merlin, Thomas the Rhymer, Gerbertus, Rabanus Maurus, Nostradamus, Zadkiel, Raphael, Moore, Old Nixon, and a good many in black coats and white ties who might have known better, considering in what century they were born, all bawling and screaming at him, ""Look a-head, only look a-head; and we will show you what man never saw before, and right away to the end of the world!""",happen try keep dog heel toe have walk see way dog hunt slow work go go forward try get come run conjuror fortune teller astrologer prophesier projector prestigiator many part be many old broomstick old good many black coat white tie know good consider century bear bawl scream look head look head show man see end world 
171,"But I am proud to say that, though Tom had not been to Cambridge-- for, if he had, he would have certainly been senior wrangler--he was such a little dogged, hard, gnarly, foursquare brick of an English boy, that he never turned his head round once all the way from Peacepool to the Other-end-of-Nowhere:  but kept his eye on the dog, and let him pick out the scent, hot or cold, straight or crooked, wet or dry, up hill or down dale; by which means he never made a single mistake, and saw all the wonderful and hitherto by- no-mortal-man-imagined things, which it is my duty to relate to you in the next chapter.",proud say have senior wrangler little dogged hard gnarly foursquare brick english boy turn head way other end keep eye dog let pick scent hot cold straight crooked wet dry hill dale mean make single mistake see wonderful hitherto mortal man imagine thing duty relate next chapter 
172,,
173,CHAPTER VIII AND LAST.,last 
174,,
175,"""Come to me, O ye children! For I hear you at your play; And the questions that perplexed me Have vanished quite away.",come child hear play question perplex vanish 
176,"""Ye open the Eastern windows, That look towards the sun, Where thoughts are singing swallows, And the brooks of morning run.",open eastern window look sun thought sing swallow brook morning run 
177,* * * * *,
178,"""For what are all our contrivings And the wisdom of our books, When compared with your caresses, And the gladness of your looks?",contriving wisdom book compare caresse gladness look 
179,"""Ye are better than all the ballads That ever were sung or said; For ye are living poems, And all the rest are dead.""",good ballad sung say live poem rest dead 
180,LONGFELLOW.,
181," Here begins the never-to-be-too-much-studied account of the nine- hundred-and-ninety-ninth part of the wonderful things which Tom saw on his journey to the Other-end-of-Nowhere; which all good little children are requested to read; that, if ever they get to the Other-end-of-Nowhere, as they may very probably do, they may not burst out laughing, or try to run away, or do any other silly vulgar thing which may offend Mrs. Bedonebyasyoudid.",begin study account ninth part wonderful thing see journey other end good little child request read get other end do burst laugh try run do other silly vulgar thing offend 
182,"Now, as soon as Tom had left Peacepool, he came to the white lap of the great sea-mother, ten thousand fathoms deep; where she makes world-pap all day long, for the steam-giants to knead, and the fire-giants to bake, till it has risen and hardened into mountain- loaves and island-cakes.",leave come white lap great sea mother fathom deep make world pap day steam giant knead fire giant bake rise harden mountain loaf island cake 
183,"And there Tom was very near being kneaded up in the world-pap, and turned into a fossil water-baby; which would have astonished the Geological Society of New Zealand some hundreds of thousands of years hence.",near knead world pap turn fossil water baby astonished geological new hundred thousand year 
184,"For, as he walked along in the silence of the sea-twilight, on the soft white ocean floor, he was aware of a hissing, and a roaring, and a thumping, and a pumping, as of all the steam-engines in the world at once.  And, when he came near, the water grew boiling-hot; not that that hurt him in the least:  but it also grew as foul as gruel; and every moment he stumbled over dead shells, and fish, and sharks, and seals, and whales, which had been killed by the hot water.",walk silence sea twilight soft white ocean floor aware hissing roaring thumping pump steam engine world come water grow boil hot hurt least grow gruel moment stumble dead shell fish shark seal whale kill hot water 
185,"And at last he came to the great sea-serpent himself, lying dead at the bottom; and as he was too thick to scramble over, Tom had to walk round him three-quarters of a mile and more, which put him out of his path sadly; and, when he had got round, he came to the place called Stop.  And there he stopped, and just in time.",last come great sea serpent lie dead bottom thick scramble have walk quarter mile more put path get come place call stop stop time 
186,"For he was on the edge of a vast hole in the bottom of the sea, up which was rushing and roaring clear steam enough to work all the engines in the world at once; so clear, indeed, that it was quite light at moments; and Tom could see almost up to the top of the water above, and down below into the pit for nobody knows how far.",edge vast hole bottom sea rush roar clear steam work engine world clear light moment see top water pit know 
187,"But, as soon as he bent his head over the edge, he got such a rap on the nose from pebbles, that he jumped back again; for the steam, as it rushed up, rasped away the sides of the hole, and hurled it up into the sea in a shower of mud and gravel and ashes; and then it spread all around, and sank again, and covered in the dead fish so fast, that before Tom had stood there five minutes he was buried in silt up to his ankles, and began to be afraid that he should have been buried alive.",bend head edge get rap nose pebble jump steam rush rasp side hole hurl sea shower mud gravel ash spread sink cover dead fish stand minute bury silt ankle begin afraid bury alive 
188,"And perhaps he would have been, but that while he was thinking, the whole piece of ground on which he stood was torn off and blown upwards, and away flew Tom a mile up through the sea, wondering what was coming next.",think whole piece ground stand tear blow fly mile sea wonder come 
189,At last he stopped--thump! and found himself tight in the legs of the most wonderful bogy which he had ever seen.,last stop thump find tight leg wonderful bogy see 
190,"It had I don't know how many wings, as big as the sails of a windmill, and spread out in a ring like them; and with them it hovered over the steam which rushed up, as a ball hovers over the top of a fountain.  And for every wing above it had a leg below, with a claw like a comb at the tip, and a nostril at the root; and in the middle it had no stomach and one eye; and as for its mouth, that was all on one side, as the madreporiform tubercle in a star- fish is.  Well, it was a very strange beast; but no stranger than some dozens which you may see.",have know many wing big sail windmill spread ring hover steam rush ball hover top fountain wing have leg claw comb tip nostril root middle have stomach eye mouth side madreporiform tubercle star- fish strange beast stranger dozen see 
191,"""What do you want here,"" it cried quite peevishly, ""getting in my way?"" and it tried to drop Tom:  but he held on tight to its claws, thinking himself safer where he was.",want cry get way try drop hold tight claw think safe 
192,"So Tom told him who he was, and what his errand was.  And the thing winked its one eye, and sneered:",tell errand thing wink eye sneer 
193,"""I am too old to be taken in in that way.  You are come after gold- -I know you are.""",old take way come gold know 
194,"""Gold!  What is gold?""  And really Tom did not know; but the suspicious old bogy would not believe him.",gold gold know suspicious old bogy believe 
195,"But after a while Tom began to understand a little.  For, as the vapours came up out of the hole, the bogy smelt them with his nostrils, and combed them and sorted them with his combs; and then, when they steamed up through them against his wings, they were changed into showers and streams of metal.  From one wing fell gold-dust, and from another silver, and from another copper, and from another tin, and from another lead, and so on, and sank into the soft mud, into veins and cracks, and hardened there.  Whereby it comes to pass that the rocks are full of metal.",while begin understand little vapour come hole bogy smell nostril comb sort comb steam wing change shower stream metal wing fall gold dust silver copper tin lead sink soft mud vein crack harden come pass rock full metal 
196,"But, all of a sudden, somebody shut off the steam below, and the hole was left empty in an instant:  and then down rushed the water into the hole, in such a whirlpool that the bogy spun round and round as fast as a teetotum.  But that was all in his day's work, like a fair fall with the hounds; so all he did was to say to Tom -",shut steam hole leave empty instant rush water hole whirlpool bogy spun teetotum day work fair fall hound do say 
197,"""Now is your time, youngster, to get down, if you are in earnest, which I don't believe.""",time youngster get earnest believe 
198,"""You'll soon see,"" said Tom; and away he went, as bold as Baron Munchausen, and shot down the rushing cataract like a salmon at Ballisodare.",see say go bold shoot rush cataract salmon 
199,"And, when he got to the bottom, he swam till he was washed on shore safe upon the Other-end-of-Nowhere; and he found it, to his surprise, as most other people do, much more like This-End-of- Somewhere than he had been in the habit of expecting",get bottom swim wash shore safe other end find surprise most other person end habit expect 
200,"And first he went through Waste-paper-land, where all the stupid books lie in heaps, up hill and down dale, like leaves in a winter wood; and there he saw people digging and grubbing among them, to make worse books out of bad ones, and thrashing chaff to save the dust of it; and a very good trade they drove thereby, especially among children.",go paper land stupid book lie heap hill dale leave winter wood see person digg grubb make bad book bad one thrash chaff save dust good trade drive child 
201,"Then he went by the sea of slops, to the mountain of messes, and the territory of tuck, where the ground was very sticky, for it was all made of bad toffee (not Everton toffee, of course), and full of deep cracks and holes choked with wind-fallen fruit, and green goose-berries, and sloes, and crabs, and whinberries, and hips and haws, and all the nasty things which little children will eat, if they can get them.  But the fairies hide them out of the way in that country as fast as they can, and very hard work they have, and of very little use it is.  For as fast as they hide away the old trash, foolish and wicked people make fresh trash full of lime and poisonous paints, and actually go and steal receipts out of old Madame Science's big book to invent poisons for little children, and sell them at wakes and fairs and tuck-shops.  Very well.  Let them go on.  Dr. Letheby and Dr. Hassall cannot catch them, though they are setting traps for them all day long.  But the Fairy with the birch-rod will catch them all in time, and make them begin at one corner of their shops, and eat their way out at the other:  by which time they will have got such stomach-aches as will cure them of poisoning little children.",go sea slop mountain messe territory tuck ground sticky make bad toffee toffee course full deep crack hole choke wind fall fruit green goose berries sloe crab whinberry hip haw nasty thing little child eat get fairy hide way country hard work have little use hide old trash foolish wicked person make fresh trash full lime poisonous paint go steal receipt old big book invent poison little child sell wake fair tuck shop let go catch set trap day birch rod catch time make begin corner shop eat way other time get such stomach ache cure poisoning little child 
202,"Next he saw all the little people in the world, writing all the little books in the world, about all the other little people in the world; probably because they had no great people to write about: and if the names of the books were not Squeeky, nor the Pump- lighter, nor the Narrow Narrow World, nor the Hills of the Chattermuch, nor the Children's Twaddeday, why then they were something else.  And, all the rest of the little people in the world read the books, and thought themselves each as good as the President; and perhaps they were right, for every one knows his own business best.  But Tom thought he would sooner have a jolly good fairy tale, about Jack the Giant-killer or Beauty and the Beast, which taught him something that he didn't know already.",see little person world write little book world other little person world have great person write name book squeeky light narrow narrow else rest little person world read book think good right one know own business good think have jolly good fairy tale killer teach know 
203,"And next he came to the centre of Creation (the hub, they call it there), which lies in latitude 42.21 degrees south, and longitude 108.56 degrees east.",come centre hub call lie latitude degree longitude degree 
204,"And there he found all the wise people instructing mankind in the science of spirit-rapping, while their house was burning over their heads:  and when Tom told them of the fire, they held an indignation meeting forthwith, and unanimously determined to hang Tom's dog for coming into their country with gunpowder in his mouth.  Tom couldn't help saying that though they did fancy they had carried all the wit away with them out of Lincolnshire two hundred years ago, yet if they had had one such Lincolnshire nobleman among them as good old Lord Yarborough, he would have called for the fire-engines before he hanged other people's dogs. But it was of no use, and the dog was hanged:  and Tom couldn't even have his carcase; for they had abolished the have-his-carcase act in that country, for fear lest when rogues fell out, honest men should come by their own.  And so they would have succeeded perfectly, as they always do, only that (as they also always do) they failed in one little particular, viz. that the dog would not die, being a water-dog, but bit their fingers so abominably that they were forced to let him go, and Tom likewise, as British subjects.  Whereon they recommenced rapping for the spirits of their fathers; and very much astonished the poor old spirits were when they came, and saw how, according to the laws of Mrs. Bedonebyasyoudid, their descendants had weakened their constitution by hard living.",find wise person instruct mankind science spirit rapping house burn head tell fire hold indignation meeting determine hang dog come country gunpowder mouth help say fancy carry wit year have such nobleman good old call fire engine hang other person dog use dog hang have carcase abolish have carcase act country fear rogue fall honest man come own succeed do do fail little particular viz dog die water dog bite finger force let go british subject recommence rapp spirit father astonished poor old spirit come see accord law descendant weaken constitution hard living 
205,"Then came Tom to the Island of Polupragmosyne (which some call Rogues' Harbour; but they are wrong; for that is in the middle of Bramshill Bushes, and the county police have cleared it out long ago).  There every one knows his neighbour's business better than his own; and a very noisy place it is, as might be expected, considering that all the inhabitants are ex officio on the wrong side of the house in the ""Parliament of Man, and the Federation of the World;"" and are always making wry mouths, and crying that the fairies' grapes were sour.",come call wrong middle county police clear one know neighbour business good own noisy place expect consider inhabitant officio wrong side house make wry mouth cry fairy grape sour 
206,"There Tom saw ploughs drawing horses, nails driving hammers, birds' nests taking boys, books making authors, bulls keeping china-shops, monkeys shaving cats, dead dogs drilling live lions, blind brigadiers shelfed as principals of colleges, play-actors not in the least shelfed as popular preachers; and, in short, every one set to do something which he had not learnt, because in what he had learnt, or pretended to learn, he had failed.",see plough draw horse nail drive hammer bird nest take boy book make author bull keep china shop monkey shave cat dead dog drill live lion blind brigadier shelf principal college play actor least shelfed popular preacher short one set do learn learn pretend learn fail 
