id,paragraph,tokens
1,CHAPTER VII.,
2,,
3,"""And Nature, the old Nurse, took The child upon her knee, Saying, 'Here is a story book Thy father hath written for thee.",old take child knee say story book father write 
4,"""'Come wander with me,' she said, 'Into regions yet untrod, And read what is still unread In the Manuscripts of God.'",come wander say region read unread 
5,"""And he wandered away and away With Nature, the dear old Nurse, Who sang to him night and day The rhymes of the universe.""",wander dear old sing night day rhyme universe 
6,LONGFELLOW.,
7," ""Now,"" said Tom, ""I am ready be off, if it's to the world's end.""",say ready world end 
8,"""Ah!"" said the fairy, ""that is a brave, good boy.  But you must go farther than the world's end, if you want to find Mr. Grimes; for he is at the Other-end-of-Nowhere.  You must go to Shiny Wall, and through the white gate that never was opened; and then you will come to Peacepool, and Mother Carey's Haven, where the good whales go when they die.  And there Mother Carey will tell you the way to the Other-end-of-Nowhere, and there you will find Mr. Grimes.""",say fairy brave good boy go world end want find other end go shiny white gate open come good whale go die tell way other end find 
9,"""Oh, dear!"" said Tom.  ""But I do not know my way to Shiny Wall, or where it is at all.""",dear say know way shiny 
10,"""Little boys must take the trouble to find out things for themselves, or they will never grow to be men; so that you must ask all the beasts in the sea and the birds in the air, and if you have been good to them, some of them will tell you the way to Shiny Wall.""",little boy take trouble find thing grow man ask beast sea bird air good tell way shiny 
11,"""Well,"" said Tom, ""it will be a long journey, so I had better start at once.  Good-bye, Miss Ellie; you know I am getting a big boy, and I must go out and see the world.""",say long journey good start good know get big boy go see world 
12,"""I know you must,"" said Ellie; ""but you will not forget me, Tom.  I shall wait here till you come.""",know say forget wait come 
13,"And she shook hands with him, and bade him good-bye.  Tom longed very much again to kiss her; but he thought it would not be respectful, considering she was a lady born; so he promised not to forget her:  but his little whirl-about of a head was so full of the notion of going out to see the world, that it forgot her in five minutes:  however, though his head forgot her, I am glad to say his heart did not.",shake hand bid good bye long kiss think respectful consider lady bear promise forget little whirl head full notion go see world forget minute head forget glad say heart 
14,"So he asked all the beasts in the sea, and all the birds in the air, but none of them knew the way to Shiny Wall.  For why?  He was still too far down south.",ask beast sea bird air know way shiny 
15,"Then he met a ship, far larger than he had ever seen--a gallant ocean-steamer, with a long cloud of smoke trailing behind; and he wondered how she went on without sails, and swam up to her to see. A school of dolphins were running races round and round her, going three feet for her one, and Tom asked them the way to Shiny Wall: but they did not know.  Then he tried to find out how she moved, and at last he saw her screw, and was so delighted with it that he played under her quarter all day, till he nearly had his nose knocked off by the fans, and thought it time to move.  Then he watched the sailors upon deck, and the ladies, with their bonnets and parasols:  but none of them could see him, because their eyes were not opened,--as, indeed, most people's eyes are not.",meet ship large see gallant ocean steamer long cloud smoke trail wonder go sail swim see school dolphin run race go foot ask way shiny know try find move last see screw delighted play quarter day have nose knock fan think time move watch sailor deck lady bonnet parasol see eye open most person eye 
16,"At last there came out into the quarter-gallery a very pretty lady, in deep black widow's weeds, and in her arms a baby.  She leaned over the quarter-gallery, and looked back and back toward England far away; and as she looked she sang:",last come quarter gallery pretty lady deep black widow weed arm baby learn quarter gallery look look sing 
17, I.,
18,"""Soft soft wind, from out the sweet south sliding, Waft thy silver cloud-webs athwart the summer sea; Thin thin threads of mist on dewy fingers twining Weave a veil of dappled gauze to shade my babe and me.",soft soft wind sweet south slide waft silver cloud web athwart summer sea thin thin thread mist dewy finger twin weave veil dappled gauze shade babe 
19,II.,
20,"""Deep deep Love, within thine own abyss abiding, Pour Thyself abroad, O Lord, on earth and air and sea; Worn weary hearts within Thy holy temple hiding, Shield from sorrow, sin, and shame my helpless babe and me.""",deep deep own abyss abide earth air sea worn weary heart holy temple hide sorrow sin shame helpless babe 
21," Her voice was so soft and low, and the music of the air so sweet, that Tom could have listened to it all day.  But as she held the baby over the gallery rail, to show it the dolphins leaping and the water gurgling in the ship's wake, lo! and behold, the baby saw Tom.",voice soft low music air sweet listen day hold baby gallery rail show dolphin leap water gurgle ship wake baby see 
22,"He was quite sure of that for when their eyes met, the baby smiled and held out his hands; and Tom smiled and held out his hands too; and the baby kicked and leaped, as if it wanted to jump overboard to him.",sure eye meet baby smile hold hand smile hold hand baby kick leap want jump 
23,"""What do you see, my darling?"" said the lady; and her eyes followed the baby's till she too caught sight of Tom, swimming about among the foam-beads below.",see darling say lady eye follow baby catch sight swim foam bead 
24,"She gave a little shriek and start; and then she said, quite quietly, ""Babies in the sea?  Well, perhaps it is the happiest place for them;"" and waved her hand to Tom, and cried, ""Wait a little, darling, only a little:  and perhaps we shall go with you and be at rest.""",give little shriek start say baby sea happy place wave hand cry wait little darling little go rest 
25,"And at that an old nurse, all in black, came out and talked to her, and drew her in.  And Tom turned away northward, sad and wondering; and watched the great steamer slide away into the dusk, and the lights on board peep out one by one, and die out again, and the long bar of smoke fade away into the evening mist, till all was out of sight.",old nurse black come talk draw turn sad wonder watch great steamer slide dusk light board peep die long bar smoke fade evening mist sight 
26,"And he swam northward again, day after day, till at last he met the King of the Herrings, with a curry-comb growing out of his nose, and a sprat in his mouth for a cigar, and asked him the way to Shiny Wall; so he bolted his sprat head foremost, and said:",swim day day last meet curry comb grow nose sprat mouth cigar ask way shiny bolt sprat head say 
27,"""If I were you, young Gentleman, I should go to the Allalonestone, and ask the last of the Gairfowl.  She is of a very ancient clan, very nearly as ancient as my own; and knows a good deal which these modern upstarts don't, as ladies of old houses are likely to do.""",young go ask last ancient clan ancient own know good deal modern upstart lady old house likely do 
28,"Tom asked his way to her, and the King of the Herrings told him very kindly, for he was a courteous old gentleman of the old school, though he was horribly ugly, and strangely bedizened too, like the old dandies who lounge in the club-house windows.",ask way tell courteous old gentleman old school ugly bedizen old dandy lounge club house window 
29,"But just as Tom had thanked him and set off, he called after him: ""Hi!  I say, can you fly?""",thank set call say fly 
30,"""I never tried,"" says Tom.  ""Why?""",try say 
31,"""Because, if you can, I should advise you to say nothing to the old lady about it.  There; take a hint.  Good-bye.""",advise say old lady take hint good bye 
32,"And away Tom went for seven days and seven nights due north-west, till he came to a great codbank, the like of which he never saw before.  The great cod lay below in tens of thousands, and gobbled shell-fish all day long; and the blue sharks roved above in hundreds, and gobbled them when they came up.  So they ate, and ate, and ate each other, as they had done since the making of the world; for no man had come here yet to catch them, and find out how rich old Mother Carey is.",go day night due come great codbank like see great cod lay ten thousand gobble shell fish day blue shark rove hundred gobble come eat eat eat other do making world man come catch find rich old 
33,"And there he saw the last of the Gairfowl, standing up on the Allalonestones all alone.  And a very grand old lady she was, full three feet high, and bolt upright, like some old Highland chieftainess.  She had on a black velvet gown, and a white pinner and apron, and a very high bridge to her nose (which is a sure mark of high breeding), and a large pair of white spectacles on it, which made her look rather odd:  but it was the ancient fashion of her house.",see last stand grand old lady full foot high bolt old chieftainess have black velvet gown white pinner apron high bridge nose sure mark high breeding large pair white spectacle make look odd ancient fashion house 
34,"And instead of wings, she had two little feathery arms, with which she fanned herself, and complained of the dreadful heat; and she kept on crooning an old song to herself, which she learnt when she was a little baby-bird, long ago -",wing have little feathery arm fann complain dreadful heat keep croon old song learn little baby bird long 
35," ""Two little birds they sat on a stone, One swam away, and then there was one, With a fal-lal-la-lady.",little bird sit stone swim be fal lady 
36,"""The other swam after, and then there was none, And so the poor stone was left all alone; With a fal-lal-la-lady.""",other swim be poor stone leave alone fal lal lady 
37," It was ""flew"" away, properly, and not ""swam"" away:  but, as she could not fly, she had a right to alter it.  However, it was a very fit song for her to sing, because she was a lady herself.",fly swim fly have right alter fit song sing lady 
38,"Tom came up to her very humbly, and made his bow; and the first thing she said was -",come make bow first thing say 
39,"""Have you wings?  Can you fly?""",wing fly 
40,"""Oh dear, no, ma'am; I should not think of such thing,"" said cunning little Tom.",dear think such thing say cunn little 
41,"""Then I shall have great pleasure in talking to you, my dear.  It is quite refreshing nowadays to see anything without wings.  They must all have wings, forsooth, now, every new upstart sort of bird, and fly.  What can they want with flying, and raising themselves above their proper station in life?  In the days of my ancestors no birds ever thought of having wings, and did very well without; and now they all laugh at me because I keep to the good old fashion. Why, the very marrocks and dovekies have got wings, the vulgar creatures, and poor little ones enough they are; and my own cousins too, the razor-bills, who are gentlefolk born, and ought to know better than to ape their inferiors.""",have great pleasure talk dear refresh see wing have wing forsooth new upstart sort bird fly want fly raise proper station life day ancestor bird think have wing do laugh keep good old fashion very marrock doveky get wing vulgar creature poor little one own cousin razor bill gentlefolk bear know good ape inferior 
42,"And so she was running on, while Tom tried to get in a word edgeways; and at last he did, when the old lady got out of breath, and began fanning herself again; and then he asked if she knew the way to Shiny Wall.",run try get word edgeway last old lady get breath begin fann ask know way shiny 
43,"""Shiny Wall?  Who should know better than I?  We all came from Shiny Wall, thousands of years ago, when it was decently cold, and the climate was fit for gentlefolk; but now, what with the heat, and what with these vulgar-winged things who fly up and down and eat everything, so that gentlepeople's hunting is all spoilt, and one really cannot get one's living, or hardly venture off the rock for fear of being flown against by some creature that would not have dared to come within a mile of one a thousand years ago--what was I saying?  Why, we have quite gone down in the world, my dear, and have nothing left but our honour.  And I am the last of my family.  A friend of mine and I came and settled on this rock when we were young, to be out of the way of low people.  Once we were a great nation, and spread over all the Northern Isles.  But men shot us so, and knocked us on the head, and took our eggs--why, if you will believe it, they say that on the coast of Labrador the sailors used to lay a plank from the rock on board the thing called their ship, and drive us along the plank by hundreds, till we tumbled down into the ship's waist in heaps; and then, I suppose, they ate us, the nasty fellows!  Well--but--what was I saying?  At last, there were none of us left, except on the old Gairfowlskerry, just off the Iceland coast, up which no man could climb.  Even there we had no peace; for one day, when I was quite a young girl, the land rocked, and the sea boiled, and the sky grew dark, and all the air was filled with smoke and dust, and down tumbled the old Gairfowlskerry into the sea.  The dovekies and marrocks, of course, all flew away; but we were too proud to do that.  Some of us were dashed to pieces, and some drowned; and those who were left got away to Eldey, and the dovekies tell me they are all dead now, and that another Gairfowlskerry has risen out of the sea close to the old one, but that it is such a poor flat place that it is not safe to live on:  and so here I am left alone.""",shiny wall know good come shiny thousand year cold climate fit gentlefolk heat vulgar winged thing fly eat gentlepeople hunting spoil get living venture rock fear fly creature dare come mile year say go world dear have leave honour last family friend come settle rock young way low person great nation spread northern man shoot knock head take egg believe say coast sailor use lay plank rock board thing call ship drive plank hundred tumble ship waist heap suppose eat nasty fellow say last be leave old coast man climb have peace day young girl land rock sea boil sky grow dark air fill smoke dust tumble old sea doveky marrock course fly proud do dash piece drown leave get doveky tell dead rise sea old one poor flat place safe live leave alone 
44,"This was the Gairfowl's story, and, strange as it may seem, it is every word of it true.",story strange seem word true 
45,"""If you only had had wings!"" said Tom; ""then you might all have flown away too.""",have wing say fly 
46,"""Yes, young gentleman:  and if people are not gentleman and ladies, and forget that noblesse oblige, they will find it as easy to get on in the world as other people who don't care what they do.  Why, if I had not recollected that noblesse oblige, I should not have been all alone now.""  And the poor old lady sighed.",young gentleman person gentleman lady forget noblesse oblige find easy get world other person care do recollect noblesse oblige alone poor old lady sigh 
47,"""How was that, ma'am?""",
48,"""Why, my dear, a gentleman came hither with me, and after we had been here some time, he wanted to marry--in fact, he actually proposed to me.  Well, I can't blame him; I was young, and very handsome then, I don't deny:  but you see, I could not hear of such a thing, because he was my deceased sister's husband, you see?""",dear gentleman come time want marry fact propose blame young handsome deny see hear thing decease sister husband see 
49,"""Of course not, ma'am,"" said Tom; though, of course, he knew nothing about it.  ""She was very much diseased, I suppose?""",course say course know diseased suppose 
50,"""You do not understand me, my dear.  I mean, that being a lady, and with right and honourable feelings, as our house always has had, I felt it my duty to snub him, and howk him, and peck him continually, to keep him at his proper distance; and, to tell the truth, I once pecked him a little too hard, poor fellow, and he tumbled backwards off the rock, and--really, it was very unfortunate, but it was not my fault--a shark coming by saw him flapping, and snapped him up. And since then I have lived all alone -",understand dear mean lady right honourable feeling house have feel duty snub howk peck keep proper distance tell truth peck little hard poor fellow tumble rock unfortunate fault shark come see flap snap live 
51, 'With a fal-lal-la-lady.',lady 
52," And soon I shall be gone, my little dear, and nobody will miss me; and then the poor stone will be left all alone.""",gone little dear miss poor stone leave alone 
53,"""But, please, which is the way to Shiny Wall?"" said Tom.",way shiny say 
54,"""Oh, you must go, my little dear--you must go.  Let me see--I am sure--that is--really, my poor old brains are getting quite puzzled.  Do you know, my little dear, I am afraid, if you want to know, you must ask some of these vulgar birds about, for I have quite forgotten.""",go little dear go let see sure poor old brain get puzzled know little dear afraid want know ask vulgar bird forget 
55,"And the poor old Gairfowl began to cry tears of pure oil; and Tom was quite sorry for her; and for himself too, for he was at his wit's end whom to ask.",poor old begin cry tear pure oil sorry wit end ask 
56,"But by there came a flock of petrels, who are Mother Carey's own chickens; and Tom thought them much prettier than Lady Gairfowl, and so perhaps they were; for Mother Carey had had a great deal of fresh experience between the time that she invented the Gairfowl and the time that she invented them.  They flitted along like a flock of black swallows, and hopped and skipped from wave to wave, lifting up their little feet behind them so daintily, and whistling to each other so tenderly, that Tom fell in love with them at once, and called them to know the way to Shiny Wall.",come flock petrel own chicken think pretty have great deal fresh experience time invent time invent flite flock black swallow hopp skip wave wave lift little foot whistle other fall love call know way shiny 
57,"""Shiny Wall?  Do you want Shiny Wall?  Then come with us, and we will show you.  We are Mother Carey's own chickens, and she sends us out over all the seas, to show the good birds the way home.""",shiny wall want shiny come show own chicken send sea show good bird way 
58,"Tom was delighted, and swam off to them, after he had made his bow to the Gairfowl.  But she would not return his bow:  but held herself bolt upright, and wept tears of oil as she sang:",delight swim make bow return bow hold bolt goot tear oil sing 
59," ""And so the poor stone was left all alone; With a fal-lal-la-lady.""",poor stone leave alone fal lady 
60," But she was wrong there; for the stone was not left all alone:  and the next time that Tom goes by it, he will see a sight worth seeing.",wrong stone leave alone next time go see sight worth see 
61,"The old Gairfowl is gone already:  but there are better things come in her place; and when Tom comes he will see the fishing-smacks anchored there in hundreds, from Scotland, and from Ireland, and from the Orkneys, and the Shetlands, and from all the Northern ports, full of the children of the old Norse Vikings, the masters of the sea.  And the men will be hauling in the great cod by thousands, till their hands are sore from the lines; and they will be making cod-liver oil and guano, and salting down the fish; and there will be a man-of-war steamer there to protect them, and a lighthouse to show them the way; and you and I, perhaps, shall go some day to the Allalonestone to the great summer sea-fair, and dredge strange creatures such as man never saw before; and we shall hear the sailors boast that it is not the worst jewel in Queen Victoria's crown, for there are eighty miles of codbank, and food for all the poor folk in the land.  That is what Tom will see, and perhaps you and I shall see it too.  And then we shall not be sorry because we cannot get a Gairfowl to stuff, much less find gairfowl enough to drive them into stone pens and slaughter them, as the old Norsemen did, or drive them on board along a plank till the ship was victualled with them, as the old English and French rovers used to do, of whom dear old Hakluyt tells:  but we shall remember what Mr. Tennyson says:  how",old gone be good thing come place come see fishing smack anchore hundred northern port full child old master sea man haul great cod thousand hand sore line make cod-liver oil guano salt fish be man war steamer protect lighthouse show way go day great summer sea fair dredge strange creature such man see hear sailor boast bad jewel crown be mile codbank food poor folk land see see sorry get stuff find gairfowl drive stone pen slaughter old drive board plank ship victuall old english french rover use do dear old tell remember say 
62," ""The old order changeth, giving place to the new, And God fulfils himself in many ways.""",old order changeth give place new fulfil many way 
63," And now Tom was all agog to start for Shiny Wall; but the petrels said no.  They must go first to Allfowlsness, and wait there for the great gathering of all the sea-birds, before they start for their summer breeding-places far away in the Northern Isles; and there they would be sure to find some birds which were going to Shiny Wall:  but where Allfowlsness was, he must promise never to tell, lest men should go there and shoot the birds, and stuff them, and put them into stupid museums, instead of leaving them to play and breed and work in Mother Carey's water-garden, where they ought to be.",agog start shiny petrel say go wait great gathering sea bird start summer breeding place northern sure find bird go shiny promise tell man go shoot bird stuff put stupid museum leave play breed work water garden 
64,"So where Allfowlsness is nobody must know; and all that is to be said about it is, that Tom waited there many days; and as he waited, he saw a very curious sight.  On the rabbit burrows on the shore there gathered hundreds and hundreds of hoodie-crows, such as you see in Cambridgeshire.  And they made such a noise, that Tom came on shore and went up to see what was the matter.",know say wait many day wait see curious sight rabbit burrow shore gather hundred hundred hoodie crow such see make noise come shore go see matter 
65,"And there he found them holding their great caucus, which they hold every year in the North; and all their stump-orators were speechifying; and for a tribune, the speaker stood on an old sheep's skull.",find hold great caucus hold year stump orator speechify tribune speaker stand old sheep skull 
66,"And they cawed and cawed, and boasted of all the clever things they had done; how many lambs' eyes they had picked out, and how many dead bullocks they had eaten, and how many young grouse they had swallowed whole, and how many grouse-eggs they had flown away with, stuck on the point of their bills, which is the hoodie-crow's particularly clever feat, of which he is as proud as a gipsy is of doing the hokany-baro; and what that is, I won't tell you.",caw caw boast clever thing do many lamb eye pick many dead bullock eat many young grouse swallow whole many grouse egg fly stuck point bill hoodie crow clever feat proud gipsy do hokany baro tell 
67,"And at last they brought out the prettiest, neatest young lady-crow that ever was seen, and set her in the middle, and all began abusing and vilifying, and rating, and bullyragging at her, because she had stolen no grouse-eggs, and had actually dared to say that she would not steal any.  So she was to be tried publicly by their laws (for the hoodies always try some offenders in their great yearly parliament).  And there she stood in the middle, in her black gown and gray hood, looking as meek and as neat as a Quakeress, and they all bawled at her at once -",last bring prettiest neatest young lady crow see set middle begin abuse vilify rating bullyragg steal grouse egg dare say steal try law hoody try offender great yearly parliament stand middle black gown gray hood look meek neat bawl 
68,And it was in vain that she pleaded -,vain plead 
69," That she did not like grouse-eggs; That she could get her living very well without them; That she was afraid to eat them, for fear of the gamekeepers; That she had not the heart to eat them, because the grouse were such pretty, kind, jolly birds; And a dozen reasons more.",like grouse egg get living afraid eat fear gamekeeper have heart eat grouse such pretty kind jolly bird reason more 
70," For all the other scaul-crows set upon her, and pecked her to death there and then, before Tom could come to help her; and then flew away, very proud of what they had done.",other scaul crow set peck death come help fly proud do 
71,"Now, was not this a scandalous transaction?",scandalous transaction 
72,"But they are true republicans, these hoodies, who do every one just what he likes, and make other people do so too; so that, for any freedom of speech, thought, or action, which is allowed among them, they might as well be American citizens of the new school.",true hoody do one like make other person do freedom speech thought action allow american citizen new school 
