id,paragraph,tokens
79,"Packing the basket was not quite such pleasant work as unpacking’ the basket. It never is. But the Mole was bent on enjoying everything, and although just when he had got the basket packed and strapped up tightly he saw a plate staring up at him from the grass, and when the job had been done again the Rat pointed out a fork which anybody ought to have seen, and last of all, behold! the mustard pot, which he had been sitting on without knowing it--still, somehow, the thing got finished at last, without much loss of temper.",pack basket such pleasant work unpack basket bend enjoy get basket pack strapp see plate stare grass job do point fork see last behold mustard pot sit know thing finish last much loss temper 
80,"The afternoon sun was getting low as the Rat sculled gently homewards in a dreamy mood, murmuring poetry-things over to himself, and not paying much attention to Mole. But the Mole was very full of lunch, and self-satisfaction, and pride, and already quite at home in a boat (so he thought) and was getting a bit restless besides: and presently he said, ‘Ratty! Please, _I_ want to row, now!’",afternoon sun get low scull homeward dreamy mood murmure poetry thing pay much attention full lunch self satisfaction pride home boat think get bit restless say want row 
81,"The Rat shook his head with a smile. ‘Not yet, my young friend,’ he said--‘wait till you’ve had a few lessons. It’s not so easy as it looks.’",shake head smile young friend say wait have few lesson easy look 
82,"The Mole was quiet for a minute or two. But he began to feel more and more jealous of Rat, sculling so strongly and so easily along, and his pride began to whisper that he could do it every bit as well. He jumped up and seized the sculls, so suddenly, that the Rat, who was gazing out over the water and saying more poetry-things to himself, was taken by surprise and fell backwards off his seat with his legs in the air for the second time, while the triumphant Mole took his place and grabbed the sculls with entire confidence.",quiet minute begin feel jealous scull pride begin whisper do bit jump seize scull gaze water say more poetry thing take surprise fall seat leg air second time triumphant take place grab scull entire confidence 
83,"‘Stop it, you SILLY ass!’ cried the Rat, from the bottom of the boat. ‘You can’t do it! You’ll have us over!’",stop silly ass cry bottom boat do have 
84,"The Mole flung his sculls back with a flourish, and made a great dig at the water. He missed the surface altogether, his legs flew up above his head, and he found himself lying on the top of the prostrate Rat. Greatly alarmed, he made a grab at the side of the boat, and the next moment--Sploosh!",flung scull flourish make great dig water miss surface leg fly head find lie top prostrate alarm make grab side boat next moment 
85,"Over went the boat, and he found himself struggling in the river.",go boat find struggle river 
86,"O my, how cold the water was, and O, how VERY wet it felt. How it sang in his ears as he went down, down, down! How bright and welcome the sun looked as he rose to the surface coughing and spluttering! How black was his despair when he felt himself sinking again! Then a firm paw gripped him by the back of his neck. It was the Rat, and he was evidently laughing--the Mole could FEEL him laughing, right down his arm and through his paw, and so into his--the Mole’s--neck.",cold water wet feel sing ear go bright welcome sun look rise surface cough splutter black despair feel sink firm paw grip back neck laugh feel laugh arm paw neck 
87,"The Rat got hold of a scull and shoved it under the Mole’s arm; then he did the same by the other side of him and, swimming behind, propelled the helpless animal to shore, hauled him out, and set him down on the bank, a squashy, pulpy lump of misery.",get hold scull shove arm do same other side swim propel helpless animal shore haul set bank squashy pulpy lump misery 
88,"When the Rat had rubbed him down a bit, and wrung some of the wet out of him, he said, ‘Now, then, old fellow! Trot up and down the towing-path as hard as you can, till you’re warm and dry again, while I dive for the luncheon-basket.’",rub bit wrung wet say old fellow treot towing path warm dry dive luncheon basket 
89,"So the dismal Mole, wet without and ashamed within, trotted about till he was fairly dry, while the Rat plunged into the water again, recovered the boat, righted her and made her fast, fetched his floating property to shore by degrees, and finally dived successfully for the luncheon-basket and struggled to land with it.",dismal wet ashamed trotet dry plunge water recover boat right make fetched float property shore degree dive luncheon basket struggle land 
90,"When all was ready for a start once more, the Mole, limp and dejected, took his seat in the stern of the boat; and as they set off, he said in a low voice, broken with emotion, ‘Ratty, my generous friend! I am very sorry indeed for my foolish and ungrateful conduct. My heart quite fails me when I think how I might have lost that beautiful luncheon-basket. Indeed, I have been a complete ass, and I know it. Will you overlook it this once and forgive me, and let things go on as before?’",ready start more limp deject take seat stern boat set say low voice break emotion generous friend sorry foolish ungrateful conduct heart fail think lose beautiful luncheon basket complete ass know overlook forgive let thing go 
91,"‘That’s all right, bless you!’ responded the Rat cheerily. ‘What’s a little wet to a Water Rat? I’m more in the water than out of it most days. Don’t you think any more about it; and, look here! I really think you had better come and stop with me for a little time. It’s very plain and rough, you know--not like Toad’s house at all--but you haven’t seen that yet; still, I can make you comfortable. And I’ll teach you to row, and to swim, and you’ll soon be as handy on the water as any of us.’",right bless respond little wet water rat water most day think more look think have good come stop little time plain rough know house see make comfortable teach row swim handy water 
92,"The Mole was so touched by his kind manner of speaking that he could find no voice to answer him; and he had to brush away a tear or two with the back of his paw. But the Rat kindly looked in another direction, and presently the Mole’s spirits revived again, and he was even able to give some straight back-talk to a couple of moorhens who were sniggering to each other about his bedraggled appearance.",touch kind manner speak find voice answer have brush tear back paw look direction spirit revive able give straight talk couple moorhen snigger other bedraggled appearance 
93,"When they got home, the Rat made a bright fire in the parlour, and planted the Mole in an arm-chair in front of it, having fetched down a dressing-gown and slippers for him, and told him river stories till supper-time. Very thrilling stories they were, too, to an earth-dwelling animal like Mole. Stories about weirs, and sudden floods, and leaping pike, and steamers that flung hard bottles--at least bottles were certainly flung, and FROM steamers, so presumably BY them; and about herons, and how particular they were whom they spoke to; and about adventures down drains, and night-fishings with Otter, or excursions far a-field with Badger. Supper was a most cheerful meal; but very shortly afterwards a terribly sleepy Mole had to be escorted upstairs by his considerate host, to the best bedroom, where he soon laid his head on his pillow in great peace and contentment, knowing that his new-found friend the River was lapping the sill of his window.",get make bright fire parlour plant arm chair front fetched dress gown slipper tell river story supper time thrilling story earth dwelling animal story weir sudden flood leap pike steamer flung hard bottle least bottle flung from steamer heron particular speak adventure drain night fishing excursion field supper cheerful meal sleepy have escort considerate host good bedroom lay head pillow great peace contentment know new find friend lap sill window 
94,"This day was only the first of many similar ones for the emancipated Mole, each of them longer and full of interest as the ripening summer moved onward. He learnt to swim and to row, and entered into the joy of running water; and with his ear to the reed-stems he caught, at intervals, something of what the wind went whispering so constantly among them.",day first many similar one emancipate long full interest ripening summer move learn swim row enter joy run water ear reed stem catch interval wind go whisper 
95,,
96, ,
