id,paragraph,tokens
48,"The Badger simply beamed on him. ‘That’s exactly what I say,’ he replied. ‘There’s no security, or peace and tranquillity, except underground. And then, if your ideas get larger and you want to expand--why, a dig and a scrape, and there you are! If you feel your house is a bit too big, you stop up a hole or two, and there you are again! No builders, no tradesmen, no remarks passed on you by fellows looking over your wall, and, above all, no WEATHER. Look at Rat, now. A couple of feet of flood water, and he’s got to move into hired lodgings; uncomfortable, inconveniently situated, and horribly expensive. Take Toad. I say nothing against Toad Hall; quite the best house in these parts, AS a house. But supposing a fire breaks out--where’s Toad? Supposing tiles are blown off, or walls sink or crack, or windows get broken--where’s Toad? Supposing the rooms are draughty--I HATE a draught myself--where’s Toad? No, up and out of doors is good enough to roam about and get one’s living in; but underground to come back to at last--that’s my idea of HOME.’",beam say reply be security peace tranquillity underground idea get large want expand dig scrape feel house bit big stop hole builder tradesmen remark pass fellow look wall weather look couple foot flood water get move hire lodging uncomfortable situate expensive take say good house part house suppose fire break suppose tile blow wall sink crack window break suppose room draughty hate draught door good roam get live underground come last idea 
49,"The Mole assented heartily; and the Badger in consequence got very friendly with him. ‘When lunch is over,’ he said, ‘I’ll take you all round this little place of mine. I can see you’ll appreciate it. You understand what domestic architecture ought to be, you do.’",assent consequence get friendly lunch say take little place see appreciate understand domestic architecture 
50,"After luncheon, accordingly, when the other two had settled themselves into the chimney-corner and had started a heated argument on the subject of EELS, the Badger lighted a lantern and bade the Mole follow him. Crossing the hall, they passed down one of the principal tunnels, and the wavering light of the lantern gave glimpses on either side of rooms both large and small, some mere cupboards, others nearly as broad and imposing as Toad’s dining-hall. A narrow passage at right angles led them into another corridor, and here the same thing was repeated. The Mole was staggered at the size, the extent, the ramifications of it all; at the length of the dim passages, the solid vaultings of the crammed store-chambers, the masonry everywhere, the pillars, the arches, the pavements. ‘How on earth, Badger,’ he said at last, ‘did you ever find time and strength to do all this? It’s astonishing!’",luncheon other settle chimney corner start heat argument subject light lantern bid follow cross hall pass principal tunnel waver light lantern give glimpse side room large small mere cupboard other broad imposing dining hall narrow passage right angle lead corridor same thing repeat stagger size extent ramification length dim passage solid vaulting cramm store chamber masonry pillar arche pavement earth say last find time strength do astonish 
51,"‘It WOULD be astonishing indeed,’ said the Badger simply, ‘if I HAD done it. But as a matter of fact I did none of it--only cleaned out the passages and chambers, as far as I had need of them. There’s lots more of it, all round about. I see you don’t understand, and I must explain it to you. Well, very long ago, on the spot where the Wild Wood waves now, before ever it had planted itself and grown up to what it now is, there was a city--a city of people, you know. Here, where we are standing, they lived, and walked, and talked, and slept, and carried on their business. Here they stabled their horses and feasted, from here they rode out to fight or drove out to trade. They were a powerful people, and rich, and great builders. They built to last, for they thought their city would last for ever.’",astonish say do matter fact do clean passage chamber need be lot more see understand explain spot wild wave plant grow be city city person know stand live walk talk sleep carry business stabl horse feast ride fight drive trade powerful person rich great builder build last think city last 
52,‘But what has become of them all?’ asked the Mole.,become ask 
53,"‘Who can tell?’ said the Badger. ‘People come--they stay for a while, they flourish, they build--and they go. It is their way. But we remain. There were badgers here, I’ve been told, long before that same city ever came to be. And now there are badgers here again. We are an enduring lot, and we may move out for a time, but we wait, and are patient, and back we come. And so it will ever be.’",tell say person come stay while flourish build go way remain be badger tell same city come be badger endure lot move time wait patient come 
54,"‘Well, and when they went at last, those people?’ said the Mole.",go last person say 
55,"‘When they went,’ continued the Badger, ‘the strong winds and persistent rains took the matter in hand, patiently, ceaselessly, year after year. Perhaps we badgers too, in our small way, helped a little--who knows? It was all down, down, down, gradually--ruin and levelling and disappearance. Then it was all up, up, up, gradually, as seeds grew to saplings, and saplings to forest trees, and bramble and fern came creeping in to help. Leaf-mould rose and obliterated, streams in their winter freshets brought sand and soil to clog and to cover, and in course of time our home was ready for us again, and we moved in. Up above us, on the surface, the same thing happened. Animals arrived, liked the look of the place, took up their quarters, settled down, spread, and flourished. They didn’t bother themselves about the past--they never do; they’re too busy. The place was a bit humpy and hillocky, naturally, and full of holes; but that was rather an advantage. And they don’t bother about the future, either--the future when perhaps the people will move in again--for a time--as may very well be. The Wild Wood is pretty well populated by now; with all the usual lot, good, bad, and indifferent--I name no names. It takes all sorts to make a world. But I fancy you know something about them yourself by this time.’",go continue strong wind persistent rain take matter hand year year badger small way help little know ruin levelling disappearance seed grow sapling sapling forest tree bramble fern come creep help leaf mould rise obliterate stream winter freshet bring sand soil clog cover course time home ready move surface same thing happen animal arrive like look place take quarter settle spread flourish bother past busy place bit humpy hillocky full hole advantage bother future future person move time wild populate usual lot good bad indifferent name name take sort make world fancy know time 
56,"‘I do indeed,’ said the Mole, with a slight shiver.",say slight shiver 
57,"‘Well, well,’ said the Badger, patting him on the shoulder, ‘it was your first experience of them, you see. They’re not so bad really; and we must all live and let live. But I’ll pass the word around to-morrow, and I think you’ll have no further trouble. Any friend of MINE walks where he likes in this country, or I’ll know the reason why!’",say pat shoulder first experience see bad live let live pass word think have further trouble friend walk like country know reason 
58,"When they got back to the kitchen again, they found the Rat walking up and down, very restless. The underground atmosphere was oppressing him and getting on his nerves, and he seemed really to be afraid that the river would run away if he wasn’t there to look after it. So he had his overcoat on, and his pistols thrust into his belt again. ‘Come along, Mole,’ he said anxiously, as soon as he caught sight of them. ‘We must get off while it’s daylight. Don’t want to spend another night in the Wild Wood again.’",get kitchen find walk restless underground atmosphere oppress get nerve seem afraid river run look have overcoat pistol thrust belt come say catch sight get daylight want spend night wild 
59,"‘It’ll be all right, my fine fellow,’ said the Otter. ‘I’m coming along with you, and I know every path blindfold; and if there’s a head that needs to be punched, you can confidently rely upon me to punch it.’",right fine fellow say come know path blindfold be head need punch rely punch 
60,"‘You really needn’t fret, Ratty,’ added the Badger placidly. ‘My passages run further than you think, and I’ve bolt-holes to the edge of the wood in several directions, though I don’t care for everybody to know about them. When you really have to go, you shall leave by one of my short cuts. Meantime, make yourself easy, and sit down again.’",fret add passage run think bolt hole edge wood several direction care know have go leave short cut make easy sit 
61,"The Rat was nevertheless still anxious to be off and attend to his river, so the Badger, taking up his lantern again, led the way along a damp and airless tunnel that wound and dipped, part vaulted, part hewn through solid rock, for a weary distance that seemed to be miles. At last daylight began to show itself confusedly through tangled growth overhanging the mouth of the passage; and the Badger, bidding them a hasty good-bye, pushed them hurriedly through the opening, made everything look as natural as possible again, with creepers, brushwood, and dead leaves, and retreated.",anxious attend river take lantern lead way damp airless tunnel wind dip part vault part hewn solid rock weary distance seem mile last daylight begin show tangle growth overhang mouth passage bid hasty good bye push opening make look natural possible creeper brushwood dead leave retreat 
62,"They found themselves standing on the very edge of the Wild Wood. Rocks and brambles and tree-roots behind them, confusedly heaped and tangled; in front, a great space of quiet fields, hemmed by lines of hedges black on the snow, and, far ahead, a glint of the familiar old river, while the wintry sun hung red and low on the horizon. The Otter, as knowing all the paths, took charge of the party, and they trailed out on a bee-line for a distant stile. Pausing there a moment and looking back, they saw the whole mass of the Wild Wood, dense, menacing, compact, grimly set in vast white surroundings; simultaneously they turned and made swiftly for home, for firelight and the familiar things it played on, for the voice, sounding cheerily outside their window, of the river that they knew and trusted in all its moods, that never made them afraid with any amazement.",find stand very edge wild rock bramble tree root heap tangle front great space quiet field hemm line hedge black snow glint familiar old river wintry sun hang red low horizon know path take charge party trail bee line distant stile pause moment look see whole mass wild dense menace compact set vast white surroundings turn make home firelight familiar thing play voice sound window river know trust mood make afraid amazement 
63,"As he hurried along, eagerly anticipating the moment when he would be at home again among the things he knew and liked, the Mole saw clearly that he was an animal of tilled field and hedge-row, linked to the ploughed furrow, the frequented pasture, the lane of evening lingerings, the cultivated garden-plot. For others the asperities, the stubborn endurance, or the clash of actual conflict, that went with Nature in the rough; he must be wise, must keep to the pleasant places in which his lines were laid and which held adventure enough, in their way, to last for a lifetime.",hurry anticipate moment home thing know like see animal till field hedge row link plough furrow frequent pasture lane evening lingering cultivate garden plot other asperity stubborn endurance clash actual conflict go rough wise keep pleasant place line lay hold adventure way last lifetime 
64,,
65, ,
